      4 62            1.025494    76.23.247.139         128.119.245.93        dsatp    TCP      dsatp > commplex-link [SYN] Seq=0 Win=65535 Len=0 MSS=1460 SACK_PERM=1
      6 60            1.040172    76.23.247.139         128.119.245.93        dsatp    TCP      dsatp > commplex-link [ACK] Seq=1 Ack=1 Win=65535 Len=0
      7 78            1.042416    76.23.247.139         128.119.245.93        dsatp    TCP      dsatp > commplex-link [PSH, ACK] Seq=1 Ack=1 Win=65535 Len=24
      8 1514          1.043791    76.23.247.139         128.119.245.93        dsatp    TCP      dsatp > commplex-link [ACK] Seq=25 Ack=1 Win=65535 Len=1460
     11 1514          1.065855    76.23.247.139         128.119.245.93        dsatp    TCP      dsatp > commplex-link [ACK] Seq=1485 Ack=1 Win=65535 Len=1460
     12 1514          1.066031    76.23.247.139         128.119.245.93        dsatp    TCP      dsatp > commplex-link [ACK] Seq=2945 Ack=1 Win=65535 Len=1460
     13 1514          1.066155    76.23.247.139         128.119.245.93        dsatp    TCP      dsatp > commplex-link [ACK] Seq=4405 Ack=1 Win=65535 Len=1460
     14 1514          1.066295    76.23.247.139         128.119.245.93        dsatp    TCP      dsatp > commplex-link [ACK] Seq=5865 Ack=1 Win=65535 Len=1460
     20 1514          1.084501    76.23.247.139         128.119.245.93        dsatp    TCP      dsatp > commplex-link [PSH, ACK] Seq=7325 Ack=1 Win=65535 Len=1460
     21 1514          1.084745    76.23.247.139         128.119.245.93        dsatp    TCP      dsatp > commplex-link [ACK] Seq=8785 Ack=1 Win=65535 Len=1460
     22 1514          1.084868    76.23.247.139         128.119.245.93        dsatp    TCP      dsatp > commplex-link [ACK] Seq=10245 Ack=1 Win=65535 Len=1460
     23 1514          1.085114    76.23.247.139         128.119.245.93        dsatp    TCP      dsatp > commplex-link [ACK] Seq=11705 Ack=1 Win=65535 Len=1460
     24 1514          1.085239    76.23.247.139         128.119.245.93        dsatp    TCP      dsatp > commplex-link [ACK] Seq=13165 Ack=1 Win=65535 Len=1460
     25 1514          1.085391    76.23.247.139         128.119.245.93        dsatp    TCP      dsatp > commplex-link [ACK] Seq=14625 Ack=1 Win=65535 Len=1460
     26 1514          1.085489    76.23.247.139         128.119.245.93        dsatp    TCP      dsatp > commplex-link [PSH, ACK] Seq=16085 Ack=1 Win=65535 Len=1460
     27 1514          1.085612    76.23.247.139         128.119.245.93        dsatp    TCP      dsatp > commplex-link [ACK] Seq=17545 Ack=1 Win=65535 Len=1460
     30 1514          1.101796    76.23.247.139         128.119.245.93        dsatp    TCP      dsatp > commplex-link [ACK] Seq=19005 Ack=1 Win=65535 Len=1460
     31 1514          1.102006    76.23.247.139         128.119.245.93        dsatp    TCP      dsatp > commplex-link [ACK] Seq=20465 Ack=1 Win=65535 Len=1460
     32 1514          1.102129    76.23.247.139         128.119.245.93        dsatp    TCP      dsatp > commplex-link [ACK] Seq=21925 Ack=1 Win=65535 Len=1460
     33 1270          1.102229    76.23.247.139         128.119.245.93        dsatp    TCP      dsatp > commplex-link [PSH, ACK] Seq=23385 Ack=1 Win=65535 Len=1216
     39 1514          1.109791    76.23.247.139         128.119.245.93        dsatp    TCP      dsatp > commplex-link [ACK] Seq=24601 Ack=1 Win=65535 Len=1460
     40 1514          1.110041    76.23.247.139         128.119.245.93        dsatp    TCP      dsatp > commplex-link [ACK] Seq=26061 Ack=1 Win=65535 Len=1460
     41 1514          1.110166    76.23.247.139         128.119.245.93        dsatp    TCP      dsatp > commplex-link [ACK] Seq=27521 Ack=1 Win=65535 Len=1460
     42 1514          1.110329    76.23.247.139         128.119.245.93        dsatp    TCP      dsatp > commplex-link [ACK] Seq=28981 Ack=1 Win=65535 Len=1460
     43 1514          1.110490    76.23.247.139         128.119.245.93        dsatp    TCP      dsatp > commplex-link [ACK] Seq=30441 Ack=1 Win=65535 Len=1460
     44 946           1.110568    76.23.247.139         128.119.245.93        dsatp    TCP      dsatp > commplex-link [PSH, ACK] Seq=31901 Ack=1 Win=65535 Len=892
     45 1514          1.111146    76.23.247.139         128.119.245.93        dsatp    TCP      dsatp > commplex-link [ACK] Seq=32793 Ack=1 Win=65535 Len=1460
     46 1514          1.111339    76.23.247.139         128.119.245.93        dsatp    TCP      dsatp > commplex-link [ACK] Seq=34253 Ack=1 Win=65535 Len=1460
     47 1514          1.111455    76.23.247.139         128.119.245.93        dsatp    TCP      dsatp > commplex-link [ACK] Seq=35713 Ack=1 Win=65535 Len=1460
     48 1514          1.111683    76.23.247.139         128.119.245.93        dsatp    TCP      dsatp > commplex-link [ACK] Seq=37173 Ack=1 Win=65535 Len=1460
     50 1514          1.125734    76.23.247.139         128.119.245.93        dsatp    TCP      dsatp > commplex-link [ACK] Seq=38633 Ack=1 Win=65535 Len=1460
     51 946           1.125814    76.23.247.139         128.119.245.93        dsatp    TCP      dsatp > commplex-link [PSH, ACK] Seq=40093 Ack=1 Win=65535 Len=892
     57 1514          1.131095    76.23.247.139         128.119.245.93        dsatp    TCP      dsatp > commplex-link [ACK] Seq=40985 Ack=1 Win=65535 Len=1460
     58 1514          1.131341    76.23.247.139         128.119.245.93        dsatp    TCP      dsatp > commplex-link [ACK] Seq=42445 Ack=1 Win=65535 Len=1460
     59 1514          1.131464    76.23.247.139         128.119.245.93        dsatp    TCP      dsatp > commplex-link [ACK] Seq=43905 Ack=1 Win=65535 Len=1460
     60 1514          1.131647    76.23.247.139         128.119.245.93        dsatp    TCP      dsatp > commplex-link [ACK] Seq=45365 Ack=1 Win=65535 Len=1460
     61 1514          1.131770    76.23.247.139         128.119.245.93        dsatp    TCP      dsatp > commplex-link [ACK] Seq=46825 Ack=1 Win=65535 Len=1460
     62 946           1.131850    76.23.247.139         128.119.245.93        dsatp    TCP      dsatp > commplex-link [PSH, ACK] Seq=48285 Ack=1 Win=65535 Len=892
     68 1514          1.145766    76.23.247.139         128.119.245.93        dsatp    TCP      dsatp > commplex-link [ACK] Seq=49177 Ack=1 Win=65535 Len=1460
     69 1514          1.146010    76.23.247.139         128.119.245.93        dsatp    TCP      dsatp > commplex-link [ACK] Seq=50637 Ack=1 Win=65535 Len=1460
     70 1514          1.146133    76.23.247.139         128.119.245.93        dsatp    TCP      dsatp > commplex-link [ACK] Seq=52097 Ack=1 Win=65535 Len=1460
     71 1514          1.146256    76.23.247.139         128.119.245.93        dsatp    TCP      dsatp > commplex-link [ACK] Seq=53557 Ack=1 Win=65535 Len=1460
     72 1514          1.146379    76.23.247.139         128.119.245.93        dsatp    TCP      dsatp > commplex-link [ACK] Seq=55017 Ack=1 Win=65535 Len=1460
     73 946           1.146457    76.23.247.139         128.119.245.93        dsatp    TCP      dsatp > commplex-link [PSH, ACK] Seq=56477 Ack=1 Win=65535 Len=892
     80 1514          1.173711    76.23.247.139         128.119.245.93        dsatp    TCP      dsatp > commplex-link [ACK] Seq=57369 Ack=1 Win=65535 Len=1460
     81 1514          1.174038    76.23.247.139         128.119.245.93        dsatp    TCP      dsatp > commplex-link [ACK] Seq=58829 Ack=1 Win=65535 Len=1460
     82 1514          1.174162    76.23.247.139         128.119.245.93        dsatp    TCP      dsatp > commplex-link [ACK] Seq=60289 Ack=1 Win=65535 Len=1460
     83 1514          1.174288    76.23.247.139         128.119.245.93        dsatp    TCP      dsatp > commplex-link [ACK] Seq=61749 Ack=1 Win=65535 Len=1460
     84 1514          1.174408    76.23.247.139         128.119.245.93        dsatp    TCP      dsatp > commplex-link [ACK] Seq=63209 Ack=1 Win=65535 Len=1460
     85 946           1.174484    76.23.247.139         128.119.245.93        dsatp    TCP      dsatp > commplex-link [PSH, ACK] Seq=64669 Ack=1 Win=65535 Len=892
     88 1514          1.193674    76.23.247.139         128.119.245.93        dsatp    TCP      dsatp > commplex-link [ACK] Seq=65561 Ack=1 Win=65535 Len=1460
     89 1514          1.193919    76.23.247.139         128.119.245.93        dsatp    TCP      dsatp > commplex-link [ACK] Seq=67021 Ack=1 Win=65535 Len=1460
     90 1514          1.194055    76.23.247.139         128.119.245.93        dsatp    TCP      dsatp > commplex-link [ACK] Seq=68481 Ack=1 Win=65535 Len=1460
     91 1514          1.194259    76.23.247.139         128.119.245.93        dsatp    TCP      dsatp > commplex-link [ACK] Seq=69941 Ack=1 Win=65535 Len=1460
     92 1514          1.194382    76.23.247.139         128.119.245.93        dsatp    TCP      dsatp > commplex-link [ACK] Seq=71401 Ack=1 Win=65535 Len=1460
     93 946           1.194460    76.23.247.139         128.119.245.93        dsatp    TCP      dsatp > commplex-link [PSH, ACK] Seq=72861 Ack=1 Win=65535 Len=892
     97 1514          1.214966    76.23.247.139         128.119.245.93        dsatp    TCP      dsatp > commplex-link [ACK] Seq=73753 Ack=1 Win=65535 Len=1460
     98 1514          1.215215    76.23.247.139         128.119.245.93        dsatp    TCP      dsatp > commplex-link [ACK] Seq=75213 Ack=1 Win=65535 Len=1460
     99 1514          1.215338    76.23.247.139         128.119.245.93        dsatp    TCP      dsatp > commplex-link [ACK] Seq=76673 Ack=1 Win=65535 Len=1460
    100 1514          1.215476    76.23.247.139         128.119.245.93        dsatp    TCP      dsatp > commplex-link [ACK] Seq=78133 Ack=1 Win=65535 Len=1460
    101 1514          1.215609    76.23.247.139         128.119.245.93        dsatp    TCP      dsatp > commplex-link [ACK] Seq=79593 Ack=1 Win=65535 Len=1460
    102 946           1.215687    76.23.247.139         128.119.245.93        dsatp    TCP      dsatp > commplex-link [PSH, ACK] Seq=81053 Ack=1 Win=65535 Len=892
    105 1514          1.228271    76.23.247.139         128.119.245.93        dsatp    TCP      dsatp > commplex-link [ACK] Seq=81945 Ack=1 Win=65535 Len=1460
    106 1514          1.228516    76.23.247.139         128.119.245.93        dsatp    TCP      dsatp > commplex-link [ACK] Seq=83405 Ack=1 Win=65535 Len=1460
    107 1514          1.228639    76.23.247.139         128.119.245.93        dsatp    TCP      dsatp > commplex-link [ACK] Seq=84865 Ack=1 Win=65535 Len=1460
    108 1514          1.228776    76.23.247.139         128.119.245.93        dsatp    TCP      dsatp > commplex-link [ACK] Seq=86325 Ack=1 Win=65535 Len=1460
    109 1514          1.228900    76.23.247.139         128.119.245.93        dsatp    TCP      dsatp > commplex-link [ACK] Seq=87785 Ack=1 Win=65535 Len=1460
    110 946           1.228978    76.23.247.139         128.119.245.93        dsatp    TCP      dsatp > commplex-link [PSH, ACK] Seq=89245 Ack=1 Win=65535 Len=892
    114 1514          1.242921    76.23.247.139         128.119.245.93        dsatp    TCP      dsatp > commplex-link [ACK] Seq=90137 Ack=1 Win=65535 Len=1460
    115 1514          1.243168    76.23.247.139         128.119.245.93        dsatp    TCP      dsatp > commplex-link [ACK] Seq=91597 Ack=1 Win=65535 Len=1460
    116 1514          1.243291    76.23.247.139         128.119.245.93        dsatp    TCP      dsatp > commplex-link [ACK] Seq=93057 Ack=1 Win=65535 Len=1460
    117 1514          1.243424    76.23.247.139         128.119.245.93        dsatp    TCP      dsatp > commplex-link [ACK] Seq=94517 Ack=1 Win=65535 Len=1460
    118 1514          1.243547    76.23.247.139         128.119.245.93        dsatp    TCP      dsatp > commplex-link [ACK] Seq=95977 Ack=1 Win=65535 Len=1460
    119 946           1.243615    76.23.247.139         128.119.245.93        dsatp    TCP      dsatp > commplex-link [PSH, ACK] Seq=97437 Ack=1 Win=65535 Len=892
    125 1514          1.273646    76.23.247.139         128.119.245.93        dsatp    TCP      dsatp > commplex-link [ACK] Seq=98329 Ack=1 Win=65535 Len=1460
    126 1514          1.273905    76.23.247.139         128.119.245.93        dsatp    TCP      dsatp > commplex-link [ACK] Seq=99789 Ack=1 Win=65535 Len=1460
    127 1514          1.274029    76.23.247.139         128.119.245.93        dsatp    TCP      dsatp > commplex-link [ACK] Seq=101249 Ack=1 Win=65535 Len=1460
    128 1514          1.274298    76.23.247.139         128.119.245.93        dsatp    TCP      dsatp > commplex-link [ACK] Seq=102709 Ack=1 Win=65535 Len=1460
    129 1514          1.274421    76.23.247.139         128.119.245.93        dsatp    TCP      dsatp > commplex-link [ACK] Seq=104169 Ack=1 Win=65535 Len=1460
    130 946           1.274500    76.23.247.139         128.119.245.93        dsatp    TCP      dsatp > commplex-link [PSH, ACK] Seq=105629 Ack=1 Win=65535 Len=892
    133 1514          1.290858    76.23.247.139         128.119.245.93        dsatp    TCP      dsatp > commplex-link [ACK] Seq=106521 Ack=1 Win=65535 Len=1460
    134 1514          1.291103    76.23.247.139         128.119.245.93        dsatp    TCP      dsatp > commplex-link [ACK] Seq=107981 Ack=1 Win=65535 Len=1460
    135 1514          1.291228    76.23.247.139         128.119.245.93        dsatp    TCP      dsatp > commplex-link [ACK] Seq=109441 Ack=1 Win=65535 Len=1460
    136 1514          1.291365    76.23.247.139         128.119.245.93        dsatp    TCP      dsatp > commplex-link [ACK] Seq=110901 Ack=1 Win=65535 Len=1460
    137 1514          1.291488    76.23.247.139         128.119.245.93        dsatp    TCP      dsatp > commplex-link [ACK] Seq=112361 Ack=1 Win=65535 Len=1460
    138 946           1.291558    76.23.247.139         128.119.245.93        dsatp    TCP      dsatp > commplex-link [PSH, ACK] Seq=113821 Ack=1 Win=65535 Len=892
    142 1514          1.305496    76.23.247.139         128.119.245.93        dsatp    TCP      dsatp > commplex-link [ACK] Seq=114713 Ack=1 Win=65535 Len=1460
    143 1514          1.305750    76.23.247.139         128.119.245.93        dsatp    TCP      dsatp > commplex-link [ACK] Seq=116173 Ack=1 Win=65535 Len=1460
    144 1514          1.305873    76.23.247.139         128.119.245.93        dsatp    TCP      dsatp > commplex-link [ACK] Seq=117633 Ack=1 Win=65535 Len=1460
    145 1514          1.306011    76.23.247.139         128.119.245.93        dsatp    TCP      dsatp > commplex-link [ACK] Seq=119093 Ack=1 Win=65535 Len=1460
    146 1514          1.306146    76.23.247.139         128.119.245.93        dsatp    TCP      dsatp > commplex-link [ACK] Seq=120553 Ack=1 Win=65535 Len=1460
    147 946           1.306214    76.23.247.139         128.119.245.93        dsatp    TCP      dsatp > commplex-link [PSH, ACK] Seq=122013 Ack=1 Win=65535 Len=892
    153 1514          1.329476    76.23.247.139         128.119.245.93        dsatp    TCP      dsatp > commplex-link [ACK] Seq=122905 Ack=1 Win=65535 Len=1460
    154 1514          1.329721    76.23.247.139         128.119.245.93        dsatp    TCP      dsatp > commplex-link [ACK] Seq=124365 Ack=1 Win=65535 Len=1460
    155 1514          1.329844    76.23.247.139         128.119.245.93        dsatp    TCP      dsatp > commplex-link [ACK] Seq=125825 Ack=1 Win=65535 Len=1460
    156 1514          1.329965    76.23.247.139         128.119.245.93        dsatp    TCP      dsatp > commplex-link [ACK] Seq=127285 Ack=1 Win=65535 Len=1460
    157 1514          1.330088    76.23.247.139         128.119.245.93        dsatp    TCP      dsatp > commplex-link [ACK] Seq=128745 Ack=1 Win=65535 Len=1460
    158 946           1.330167    76.23.247.139         128.119.245.93        dsatp    TCP      dsatp > commplex-link [PSH, ACK] Seq=130205 Ack=1 Win=65535 Len=892
    163 1514          1.346778    76.23.247.139         128.119.245.93        dsatp    TCP      dsatp > commplex-link [ACK] Seq=131097 Ack=1 Win=65535 Len=1460
    164 1514          1.347026    76.23.247.139         128.119.245.93        dsatp    TCP      dsatp > commplex-link [ACK] Seq=132557 Ack=1 Win=65535 Len=1460
    165 1514          1.347149    76.23.247.139         128.119.245.93        dsatp    TCP      dsatp > commplex-link [ACK] Seq=134017 Ack=1 Win=65535 Len=1460
    166 1514          1.347276    76.23.247.139         128.119.245.93        dsatp    TCP      dsatp > commplex-link [ACK] Seq=135477 Ack=1 Win=65535 Len=1460
    167 1514          1.347400    76.23.247.139         128.119.245.93        dsatp    TCP      dsatp > commplex-link [ACK] Seq=136937 Ack=1 Win=65535 Len=1460
    168 946           1.347478    76.23.247.139         128.119.245.93        dsatp    TCP      dsatp > commplex-link [PSH, ACK] Seq=138397 Ack=1 Win=65535 Len=892
    173 1514          1.376057    76.23.247.139         128.119.245.93        dsatp    TCP      dsatp > commplex-link [ACK] Seq=139289 Ack=1 Win=65535 Len=1460
    175 1514          1.376397    76.23.247.139         128.119.245.93        dsatp    TCP      dsatp > commplex-link [ACK] Seq=140749 Ack=1 Win=65535 Len=1460
    176 1514          1.376507    76.23.247.139         128.119.245.93        dsatp    TCP      dsatp > commplex-link [ACK] Seq=142209 Ack=1 Win=65535 Len=1460
    177 1514          1.376625    76.23.247.139         128.119.245.93        dsatp    TCP      dsatp > commplex-link [ACK] Seq=143669 Ack=1 Win=65535 Len=1460
    178 1514          1.376748    76.23.247.139         128.119.245.93        dsatp    TCP      dsatp > commplex-link [ACK] Seq=145129 Ack=1 Win=65535 Len=1460
    179 946           1.376827    76.23.247.139         128.119.245.93        dsatp    TCP      dsatp > commplex-link [PSH, ACK] Seq=146589 Ack=1 Win=65535 Len=892
    181 1514          1.388158    76.23.247.139         128.119.245.93        dsatp    TCP      dsatp > commplex-link [ACK] Seq=147481 Ack=1 Win=65535 Len=1460
    182 1514          1.388280    76.23.247.139         128.119.245.93        dsatp    TCP      dsatp > commplex-link [ACK] Seq=148941 Ack=1 Win=65535 Len=1460
    183 1514          1.388401    76.23.247.139         128.119.245.93        dsatp    TCP      dsatp > commplex-link [ACK] Seq=150401 Ack=1 Win=65535 Len=1460
    184 1514          1.388561    76.23.247.139         128.119.245.93        dsatp    TCP      dsatp > commplex-link [ACK] Seq=151861 Ack=1 Win=65535 Len=1460
    185 1514          1.388686    76.23.247.139         128.119.245.93        dsatp    TCP      dsatp > commplex-link [ACK] Seq=153321 Ack=1 Win=65535 Len=1460
    186 946           1.388767    76.23.247.139         128.119.245.93        dsatp    TCP      dsatp > commplex-link [PSH, ACK] Seq=154781 Ack=1 Win=65535 Len=892
    190 1514          1.402696    76.23.247.139         128.119.245.93        dsatp    TCP      dsatp > commplex-link [ACK] Seq=155673 Ack=1 Win=65535 Len=1460
    191 1514          1.402936    76.23.247.139         128.119.245.93        dsatp    TCP      dsatp > commplex-link [ACK] Seq=157133 Ack=1 Win=65535 Len=1460
    192 1514          1.403059    76.23.247.139         128.119.245.93        dsatp    TCP      dsatp > commplex-link [ACK] Seq=158593 Ack=1 Win=65535 Len=1460
    193 1514          1.403215    76.23.247.139         128.119.245.93        dsatp    TCP      dsatp > commplex-link [ACK] Seq=160053 Ack=1 Win=65535 Len=1460
    194 1514          1.403338    76.23.247.139         128.119.245.93        dsatp    TCP      dsatp > commplex-link [ACK] Seq=161513 Ack=1 Win=65535 Len=1460
    195 946           1.403418    76.23.247.139         128.119.245.93        dsatp    TCP      dsatp > commplex-link [PSH, ACK] Seq=162973 Ack=1 Win=65535 Len=892
    200 1514          1.425309    76.23.247.139         128.119.245.93        dsatp    TCP      dsatp > commplex-link [ACK] Seq=163865 Ack=1 Win=65535 Len=1460
    201 1514          1.425553    76.23.247.139         128.119.245.93        dsatp    TCP      dsatp > commplex-link [ACK] Seq=165325 Ack=1 Win=65535 Len=1460
    202 1514          1.425680    76.23.247.139         128.119.245.93        dsatp    TCP      dsatp > commplex-link [ACK] Seq=166785 Ack=1 Win=65535 Len=1460
    203 1514          1.425826    76.23.247.139         128.119.245.93        dsatp    TCP      dsatp > commplex-link [ACK] Seq=168245 Ack=1 Win=65535 Len=1460
    204 1514          1.425951    76.23.247.139         128.119.245.93        dsatp    TCP      dsatp > commplex-link [ACK] Seq=169705 Ack=1 Win=65535 Len=1460
    205 946           1.426029    76.23.247.139         128.119.245.93        dsatp    TCP      dsatp > commplex-link [PSH, ACK] Seq=171165 Ack=1 Win=65535 Len=892
    210 1514          1.438623    76.23.247.139         128.119.245.93        dsatp    TCP      dsatp > commplex-link [ACK] Seq=172057 Ack=1 Win=65535 Len=1460
    211 1514          1.438870    76.23.247.139         128.119.245.93        dsatp    TCP      dsatp > commplex-link [ACK] Seq=173517 Ack=1 Win=65535 Len=1460
    212 1514          1.438993    76.23.247.139         128.119.245.93        dsatp    TCP      dsatp > commplex-link [ACK] Seq=174977 Ack=1 Win=65535 Len=1460
    213 1514          1.439136    76.23.247.139         128.119.245.93        dsatp    TCP      dsatp > commplex-link [ACK] Seq=176437 Ack=1 Win=65535 Len=1460
    214 1514          1.439259    76.23.247.139         128.119.245.93        dsatp    TCP      dsatp > commplex-link [ACK] Seq=177897 Ack=1 Win=65535 Len=1460
    215 946           1.439338    76.23.247.139         128.119.245.93        dsatp    TCP      dsatp > commplex-link [PSH, ACK] Seq=179357 Ack=1 Win=65535 Len=892
    218 1514          1.455901    76.23.247.139         128.119.245.93        dsatp    TCP      dsatp > commplex-link [ACK] Seq=180249 Ack=1 Win=65535 Len=1460
    219 1514          1.456146    76.23.247.139         128.119.245.93        dsatp    TCP      dsatp > commplex-link [ACK] Seq=181709 Ack=1 Win=65535 Len=1460
    220 1514          1.456275    76.23.247.139         128.119.245.93        dsatp    TCP      dsatp > commplex-link [ACK] Seq=183169 Ack=1 Win=65535 Len=1460
    221 1514          1.456410    76.23.247.139         128.119.245.93        dsatp    TCP      dsatp > commplex-link [ACK] Seq=184629 Ack=1 Win=65535 Len=1460
    222 1514          1.456535    76.23.247.139         128.119.245.93        dsatp    TCP      dsatp > commplex-link [ACK] Seq=186089 Ack=1 Win=65535 Len=1460
    223 946           1.456614    76.23.247.139         128.119.245.93        dsatp    TCP      dsatp > commplex-link [PSH, ACK] Seq=187549 Ack=1 Win=65535 Len=892
    229 1514          1.478547    76.23.247.139         128.119.245.93        dsatp    TCP      dsatp > commplex-link [ACK] Seq=188441 Ack=1 Win=65535 Len=1460
    230 1514          1.478794    76.23.247.139         128.119.245.93        dsatp    TCP      dsatp > commplex-link [ACK] Seq=189901 Ack=1 Win=65535 Len=1460
    231 1514          1.478917    76.23.247.139         128.119.245.93        dsatp    TCP      dsatp > commplex-link [ACK] Seq=191361 Ack=1 Win=65535 Len=1460
    232 1514          1.479072    76.23.247.139         128.119.245.93        dsatp    TCP      dsatp > commplex-link [ACK] Seq=192821 Ack=1 Win=65535 Len=1460
    233 1514          1.479195    76.23.247.139         128.119.245.93        dsatp    TCP      dsatp > commplex-link [ACK] Seq=194281 Ack=1 Win=65535 Len=1460
    234 946           1.479274    76.23.247.139         128.119.245.93        dsatp    TCP      dsatp > commplex-link [PSH, ACK] Seq=195741 Ack=1 Win=65535 Len=892
    240 1514          1.494542    76.23.247.139         128.119.245.93        dsatp    TCP      dsatp > commplex-link [ACK] Seq=196633 Ack=1 Win=65535 Len=1460
    241 1514          1.494786    76.23.247.139         128.119.245.93        dsatp    TCP      dsatp > commplex-link [ACK] Seq=198093 Ack=1 Win=65535 Len=1460
    242 1514          1.494909    76.23.247.139         128.119.245.93        dsatp    TCP      dsatp > commplex-link [ACK] Seq=199553 Ack=1 Win=65535 Len=1460
    243 1514          1.495032    76.23.247.139         128.119.245.93        dsatp    TCP      dsatp > commplex-link [ACK] Seq=201013 Ack=1 Win=65535 Len=1460
    244 1514          1.495155    76.23.247.139         128.119.245.93        dsatp    TCP      dsatp > commplex-link [ACK] Seq=202473 Ack=1 Win=65535 Len=1460
    245 946           1.495235    76.23.247.139         128.119.245.93        dsatp    TCP      dsatp > commplex-link [PSH, ACK] Seq=203933 Ack=1 Win=65535 Len=892
    251 1514          1.511853    76.23.247.139         128.119.245.93        dsatp    TCP      dsatp > commplex-link [ACK] Seq=204825 Ack=1 Win=65535 Len=1460
    252 1514          1.512094    76.23.247.139         128.119.245.93        dsatp    TCP      dsatp > commplex-link [ACK] Seq=206285 Ack=1 Win=65535 Len=1460
    253 1514          1.512217    76.23.247.139         128.119.245.93        dsatp    TCP      dsatp > commplex-link [ACK] Seq=207745 Ack=1 Win=65535 Len=1460
    254 1514          1.512361    76.23.247.139         128.119.245.93        dsatp    TCP      dsatp > commplex-link [ACK] Seq=209205 Ack=1 Win=65535 Len=1460
    255 1514          1.512486    76.23.247.139         128.119.245.93        dsatp    TCP      dsatp > commplex-link [ACK] Seq=210665 Ack=1 Win=65535 Len=1460
    256 946           1.512564    76.23.247.139         128.119.245.93        dsatp    TCP      dsatp > commplex-link [PSH, ACK] Seq=212125 Ack=1 Win=65535 Len=892
    262 1514          1.525162    76.23.247.139         128.119.245.93        dsatp    TCP      dsatp > commplex-link [ACK] Seq=213017 Ack=1 Win=65535 Len=1460
    263 1514          1.525409    76.23.247.139         128.119.245.93        dsatp    TCP      dsatp > commplex-link [ACK] Seq=214477 Ack=1 Win=65535 Len=1460
    264 1514          1.525533    76.23.247.139         128.119.245.93        dsatp    TCP      dsatp > commplex-link [ACK] Seq=215937 Ack=1 Win=65535 Len=1460
    265 1514          1.525664    76.23.247.139         128.119.245.93        dsatp    TCP      dsatp > commplex-link [ACK] Seq=217397 Ack=1 Win=65535 Len=1460
    266 1514          1.525787    76.23.247.139         128.119.245.93        dsatp    TCP      dsatp > commplex-link [ACK] Seq=218857 Ack=1 Win=65535 Len=1460
    267 946           1.525865    76.23.247.139         128.119.245.93        dsatp    TCP      dsatp > commplex-link [PSH, ACK] Seq=220317 Ack=1 Win=65535 Len=892
    274 1514          1.541131    76.23.247.139         128.119.245.93        dsatp    TCP      dsatp > commplex-link [ACK] Seq=221209 Ack=1 Win=65535 Len=1460
    275 1514          1.541378    76.23.247.139         128.119.245.93        dsatp    TCP      dsatp > commplex-link [ACK] Seq=222669 Ack=1 Win=65535 Len=1460
    276 1514          1.541501    76.23.247.139         128.119.245.93        dsatp    TCP      dsatp > commplex-link [ACK] Seq=224129 Ack=1 Win=65535 Len=1460
    277 1514          1.541690    76.23.247.139         128.119.245.93        dsatp    TCP      dsatp > commplex-link [ACK] Seq=225589 Ack=1 Win=65535 Len=1460
    278 1514          1.541813    76.23.247.139         128.119.245.93        dsatp    TCP      dsatp > commplex-link [ACK] Seq=227049 Ack=1 Win=65535 Len=1460
    279 946           1.541892    76.23.247.139         128.119.245.93        dsatp    TCP      dsatp > commplex-link [PSH, ACK] Seq=228509 Ack=1 Win=65535 Len=892
    287 1514          1.567759    76.23.247.139         128.119.245.93        dsatp    TCP      dsatp > commplex-link [ACK] Seq=229401 Ack=1 Win=65535 Len=1460
    288 1514          1.568006    76.23.247.139         128.119.245.93        dsatp    TCP      dsatp > commplex-link [ACK] Seq=230861 Ack=1 Win=65535 Len=1460
    289 1514          1.568150    76.23.247.139         128.119.245.93        dsatp    TCP      dsatp > commplex-link [ACK] Seq=232321 Ack=1 Win=65535 Len=1460
    290 1514          1.568398    76.23.247.139         128.119.245.93        dsatp    TCP      dsatp > commplex-link [ACK] Seq=233781 Ack=1 Win=65535 Len=1460
    291 1514          1.568521    76.23.247.139         128.119.245.93        dsatp    TCP      dsatp > commplex-link [ACK] Seq=235241 Ack=1 Win=65535 Len=1460
    292 946           1.568600    76.23.247.139         128.119.245.93        dsatp    TCP      dsatp > commplex-link [PSH, ACK] Seq=236701 Ack=1 Win=65535 Len=892
    294 1514          1.583847    76.23.247.139         128.119.245.93        dsatp    TCP      dsatp > commplex-link [ACK] Seq=237593 Ack=1 Win=65535 Len=1460
    295 1514          1.583969    76.23.247.139         128.119.245.93        dsatp    TCP      dsatp > commplex-link [ACK] Seq=239053 Ack=1 Win=65535 Len=1460
    296 1514          1.584092    76.23.247.139         128.119.245.93        dsatp    TCP      dsatp > commplex-link [ACK] Seq=240513 Ack=1 Win=65535 Len=1460
    297 1514          1.584252    76.23.247.139         128.119.245.93        dsatp    TCP      dsatp > commplex-link [ACK] Seq=241973 Ack=1 Win=65535 Len=1460
    298 1514          1.584379    76.23.247.139         128.119.245.93        dsatp    TCP      dsatp > commplex-link [ACK] Seq=243433 Ack=1 Win=65535 Len=1460
    299 946           1.584460    76.23.247.139         128.119.245.93        dsatp    TCP      dsatp > commplex-link [PSH, ACK] Seq=244893 Ack=1 Win=65535 Len=892
    304 1514          1.603695    76.23.247.139         128.119.245.93        dsatp    TCP      dsatp > commplex-link [ACK] Seq=245785 Ack=1 Win=65535 Len=1460
    305 1514          1.603962    76.23.247.139         128.119.245.93        dsatp    TCP      dsatp > commplex-link [ACK] Seq=247245 Ack=1 Win=65535 Len=1460
    306 1514          1.604070    76.23.247.139         128.119.245.93        dsatp    TCP      dsatp > commplex-link [ACK] Seq=248705 Ack=1 Win=65535 Len=1460
    307 1514          1.604208    76.23.247.139         128.119.245.93        dsatp    TCP      dsatp > commplex-link [ACK] Seq=250165 Ack=1 Win=65535 Len=1460
    308 1514          1.604333    76.23.247.139         128.119.245.93        dsatp    TCP      dsatp > commplex-link [ACK] Seq=251625 Ack=1 Win=65535 Len=1460
    309 946           1.604411    76.23.247.139         128.119.245.93        dsatp    TCP      dsatp > commplex-link [PSH, ACK] Seq=253085 Ack=1 Win=65535 Len=892
    312 1514          1.615681    76.23.247.139         128.119.245.93        dsatp    TCP      dsatp > commplex-link [ACK] Seq=253977 Ack=1 Win=65535 Len=1460
    313 1514          1.615921    76.23.247.139         128.119.245.93        dsatp    TCP      dsatp > commplex-link [ACK] Seq=255437 Ack=1 Win=65535 Len=1460
    314 1514          1.616044    76.23.247.139         128.119.245.93        dsatp    TCP      dsatp > commplex-link [ACK] Seq=256897 Ack=1 Win=65535 Len=1460
    315 1514          1.616187    76.23.247.139         128.119.245.93        dsatp    TCP      dsatp > commplex-link [ACK] Seq=258357 Ack=1 Win=65535 Len=1460
    316 1514          1.616311    76.23.247.139         128.119.245.93        dsatp    TCP      dsatp > commplex-link [ACK] Seq=259817 Ack=1 Win=65535 Len=1460
    317 946           1.616389    76.23.247.139         128.119.245.93        dsatp    TCP      dsatp > commplex-link [PSH, ACK] Seq=261277 Ack=1 Win=65535 Len=892
    321 1514          1.631769    76.23.247.139         128.119.245.93        dsatp    TCP      dsatp > commplex-link [ACK] Seq=262169 Ack=1 Win=65535 Len=1460
    322 1514          1.631975    76.23.247.139         128.119.245.93        dsatp    TCP      dsatp > commplex-link [ACK] Seq=263629 Ack=1 Win=65535 Len=1460
    323 1514          1.632097    76.23.247.139         128.119.245.93        dsatp    TCP      dsatp > commplex-link [ACK] Seq=265089 Ack=1 Win=65535 Len=1460
    324 1514          1.632221    76.23.247.139         128.119.245.93        dsatp    TCP      dsatp > commplex-link [ACK] Seq=266549 Ack=1 Win=65535 Len=1460
    325 1514          1.632340    76.23.247.139         128.119.245.93        dsatp    TCP      dsatp > commplex-link [ACK] Seq=268009 Ack=1 Win=65535 Len=1460
    326 946           1.632420    76.23.247.139         128.119.245.93        dsatp    TCP      dsatp > commplex-link [PSH, ACK] Seq=269469 Ack=1 Win=65535 Len=892
    332 1514          1.656964    76.23.247.139         128.119.245.93        dsatp    TCP      dsatp > commplex-link [ACK] Seq=270361 Ack=1 Win=65535 Len=1460
    333 1514          1.657209    76.23.247.139         128.119.245.93        dsatp    TCP      dsatp > commplex-link [ACK] Seq=271821 Ack=1 Win=65535 Len=1460
    334 1514          1.657346    76.23.247.139         128.119.245.93        dsatp    TCP      dsatp > commplex-link [ACK] Seq=273281 Ack=1 Win=65535 Len=1460
    335 1514          1.657475    76.23.247.139         128.119.245.93        dsatp    TCP      dsatp > commplex-link [ACK] Seq=274741 Ack=1 Win=65535 Len=1460
    336 1514          1.657598    76.23.247.139         128.119.245.93        dsatp    TCP      dsatp > commplex-link [ACK] Seq=276201 Ack=1 Win=65535 Len=1460
    337 946           1.657679    76.23.247.139         128.119.245.93        dsatp    TCP      dsatp > commplex-link [PSH, ACK] Seq=277661 Ack=1 Win=65535 Len=892
    342 1514          1.674274    76.23.247.139         128.119.245.93        dsatp    TCP      dsatp > commplex-link [ACK] Seq=278553 Ack=1 Win=65535 Len=1460
    343 1514          1.674504    76.23.247.139         128.119.245.93        dsatp    TCP      dsatp > commplex-link [ACK] Seq=280013 Ack=1 Win=65535 Len=1460
    344 1514          1.674627    76.23.247.139         128.119.245.93        dsatp    TCP      dsatp > commplex-link [ACK] Seq=281473 Ack=1 Win=65535 Len=1460
    345 1514          1.674762    76.23.247.139         128.119.245.93        dsatp    TCP      dsatp > commplex-link [ACK] Seq=282933 Ack=1 Win=65535 Len=1460
    346 1514          1.674889    76.23.247.139         128.119.245.93        dsatp    TCP      dsatp > commplex-link [ACK] Seq=284393 Ack=1 Win=65535 Len=1460
    347 946           1.674968    76.23.247.139         128.119.245.93        dsatp    TCP      dsatp > commplex-link [PSH, ACK] Seq=285853 Ack=1 Win=65535 Len=892
    351 1514          1.683571    76.23.247.139         128.119.245.93        dsatp    TCP      dsatp > commplex-link [ACK] Seq=286745 Ack=1 Win=65535 Len=1460
    352 1514          1.683824    76.23.247.139         128.119.245.93        dsatp    TCP      dsatp > commplex-link [ACK] Seq=288205 Ack=1 Win=65535 Len=1460
    353 1514          1.683951    76.23.247.139         128.119.245.93        dsatp    TCP      dsatp > commplex-link [ACK] Seq=289665 Ack=1 Win=65535 Len=1460
    354 1514          1.684101    76.23.247.139         128.119.245.93        dsatp    TCP      dsatp > commplex-link [ACK] Seq=291125 Ack=1 Win=65535 Len=1460
    355 1514          1.684236    76.23.247.139         128.119.245.93        dsatp    TCP      dsatp > commplex-link [ACK] Seq=292585 Ack=1 Win=65535 Len=1460
    356 946           1.684310    76.23.247.139         128.119.245.93        dsatp    TCP      dsatp > commplex-link [PSH, ACK] Seq=294045 Ack=1 Win=65535 Len=892
    359 1514          1.706212    76.23.247.139         128.119.245.93        dsatp    TCP      dsatp > commplex-link [ACK] Seq=294937 Ack=1 Win=65535 Len=1460
    360 1514          1.706455    76.23.247.139         128.119.245.93        dsatp    TCP      dsatp > commplex-link [ACK] Seq=296397 Ack=1 Win=65535 Len=1460
    361 1514          1.706578    76.23.247.139         128.119.245.93        dsatp    TCP      dsatp > commplex-link [ACK] Seq=297857 Ack=1 Win=65535 Len=1460
    362 1514          1.706713    76.23.247.139         128.119.245.93        dsatp    TCP      dsatp > commplex-link [ACK] Seq=299317 Ack=1 Win=65535 Len=1460
    363 1514          1.706836    76.23.247.139         128.119.245.93        dsatp    TCP      dsatp > commplex-link [ACK] Seq=300777 Ack=1 Win=65535 Len=1460
    364 946           1.706916    76.23.247.139         128.119.245.93        dsatp    TCP      dsatp > commplex-link [PSH, ACK] Seq=302237 Ack=1 Win=65535 Len=892
    370 1514          1.731618    76.23.247.139         128.119.245.93        dsatp    TCP      dsatp > commplex-link [ACK] Seq=303129 Ack=1 Win=65535 Len=1460
    371 1514          1.731818    76.23.247.139         128.119.245.93        dsatp    TCP      dsatp > commplex-link [ACK] Seq=304589 Ack=1 Win=65535 Len=1460
    372 1514          1.731956    76.23.247.139         128.119.245.93        dsatp    TCP      dsatp > commplex-link [ACK] Seq=306049 Ack=1 Win=65535 Len=1460
    373 1514          1.732089    76.23.247.139         128.119.245.93        dsatp    TCP      dsatp > commplex-link [ACK] Seq=307509 Ack=1 Win=65535 Len=1460
    374 1514          1.732265    76.23.247.139         128.119.245.93        dsatp    TCP      dsatp > commplex-link [ACK] Seq=308969 Ack=1 Win=65535 Len=1460
    375 946           1.732335    76.23.247.139         128.119.245.93        dsatp    TCP      dsatp > commplex-link [PSH, ACK] Seq=310429 Ack=1 Win=65535 Len=892
    378 1514          1.748796    76.23.247.139         128.119.245.93        dsatp    TCP      dsatp > commplex-link [ACK] Seq=311321 Ack=1 Win=65535 Len=1460
    379 1514          1.749043    76.23.247.139         128.119.245.93        dsatp    TCP      dsatp > commplex-link [ACK] Seq=312781 Ack=1 Win=65535 Len=1460
    380 1514          1.749166    76.23.247.139         128.119.245.93        dsatp    TCP      dsatp > commplex-link [ACK] Seq=314241 Ack=1 Win=65535 Len=1460
    381 1514          1.749317    76.23.247.139         128.119.245.93        dsatp    TCP      dsatp > commplex-link [ACK] Seq=315701 Ack=1 Win=65535 Len=1460
    382 1514          1.749441    76.23.247.139         128.119.245.93        dsatp    TCP      dsatp > commplex-link [ACK] Seq=317161 Ack=1 Win=65535 Len=1460
    383 946           1.749511    76.23.247.139         128.119.245.93        dsatp    TCP      dsatp > commplex-link [PSH, ACK] Seq=318621 Ack=1 Win=65535 Len=892
    387 1514          1.760780    76.23.247.139         128.119.245.93        dsatp    TCP      dsatp > commplex-link [ACK] Seq=319513 Ack=1 Win=65535 Len=1460
    388 1514          1.761028    76.23.247.139         128.119.245.93        dsatp    TCP      dsatp > commplex-link [ACK] Seq=320973 Ack=1 Win=65535 Len=1460
    389 1514          1.761151    76.23.247.139         128.119.245.93        dsatp    TCP      dsatp > commplex-link [ACK] Seq=322433 Ack=1 Win=65535 Len=1460
    390 1514          1.761286    76.23.247.139         128.119.245.93        dsatp    TCP      dsatp > commplex-link [ACK] Seq=323893 Ack=1 Win=65535 Len=1460
    391 1514          1.761408    76.23.247.139         128.119.245.93        dsatp    TCP      dsatp > commplex-link [ACK] Seq=325353 Ack=1 Win=65535 Len=1460
    392 946           1.761479    76.23.247.139         128.119.245.93        dsatp    TCP      dsatp > commplex-link [PSH, ACK] Seq=326813 Ack=1 Win=65535 Len=892
    395 1514          1.776775    76.23.247.139         128.119.245.93        dsatp    TCP      dsatp > commplex-link [ACK] Seq=327705 Ack=1 Win=65535 Len=1460
    396 1514          1.777017    76.23.247.139         128.119.245.93        dsatp    TCP      dsatp > commplex-link [ACK] Seq=329165 Ack=1 Win=65535 Len=1460
    397 1514          1.777142    76.23.247.139         128.119.245.93        dsatp    TCP      dsatp > commplex-link [ACK] Seq=330625 Ack=1 Win=65535 Len=1460
    398 1514          1.777272    76.23.247.139         128.119.245.93        dsatp    TCP      dsatp > commplex-link [ACK] Seq=332085 Ack=1 Win=65535 Len=1460
    399 1514          1.777397    76.23.247.139         128.119.245.93        dsatp    TCP      dsatp > commplex-link [ACK] Seq=333545 Ack=1 Win=65535 Len=1460
    400 946           1.777465    76.23.247.139         128.119.245.93        dsatp    TCP      dsatp > commplex-link [PSH, ACK] Seq=335005 Ack=1 Win=65535 Len=892
    405 1514          1.814042    76.23.247.139         128.119.245.93        dsatp    TCP      dsatp > commplex-link [ACK] Seq=335897 Ack=1 Win=65535 Len=1460
