      3 62            0.225422    76.23.247.139         128.119.245.93        newheights TCP      newheights > commplex-link [SYN] Seq=0 Win=65535 Len=0 MSS=1460 SACK_PERM=1
      5 60            0.244592    76.23.247.139         128.119.245.93        newheights TCP      newheights > commplex-link [ACK] Seq=1 Ack=1 Win=65535 Len=0
      6 78            0.246743    76.23.247.139         128.119.245.93        newheights TCP      newheights > commplex-link [PSH, ACK] Seq=1 Ack=1 Win=65535 Len=24
      7 1514          0.248147    76.23.247.139         128.119.245.93        newheights TCP      newheights > commplex-link [ACK] Seq=25 Ack=1 Win=65535 Len=1460
      9 1514          0.263568    76.23.247.139         128.119.245.93        newheights TCP      newheights > commplex-link [ACK] Seq=1485 Ack=1 Win=65535 Len=1460
     10 1514          0.263757    76.23.247.139         128.119.245.93        newheights TCP      newheights > commplex-link [ACK] Seq=2945 Ack=1 Win=65535 Len=1460
     13 1514          0.267540    76.23.247.139         128.119.245.93        newheights TCP      newheights > commplex-link [ACK] Seq=4405 Ack=1 Win=65535 Len=1460
     14 1514          0.267724    76.23.247.139         128.119.245.93        newheights TCP      newheights > commplex-link [ACK] Seq=5865 Ack=1 Win=65535 Len=1460
     17 1514          0.280882    76.23.247.139         128.119.245.93        newheights TCP      newheights > commplex-link [PSH, ACK] Seq=7325 Ack=1 Win=65535 Len=1460
     18 1514          0.281077    76.23.247.139         128.119.245.93        newheights TCP      newheights > commplex-link [ACK] Seq=8785 Ack=1 Win=65535 Len=1460
     19 1514          0.281193    76.23.247.139         128.119.245.93        newheights TCP      newheights > commplex-link [ACK] Seq=10245 Ack=1 Win=65535 Len=1460
     20 1514          0.281333    76.23.247.139         128.119.245.93        newheights TCP      newheights > commplex-link [ACK] Seq=11705 Ack=1 Win=65535 Len=1460
     22 1514          0.286162    76.23.247.139         128.119.245.93        newheights TCP      newheights > commplex-link [ACK] Seq=13165 Ack=1 Win=65535 Len=1460
     23 1514          0.286353    76.23.247.139         128.119.245.93        newheights TCP      newheights > commplex-link [ACK] Seq=14625 Ack=1 Win=65535 Len=1460
     25 1514          0.288837    76.23.247.139         128.119.245.93        newheights TCP      newheights > commplex-link [PSH, ACK] Seq=16085 Ack=1 Win=65535 Len=1460
     26 1514          0.289036    76.23.247.139         128.119.245.93        newheights TCP      newheights > commplex-link [ACK] Seq=17545 Ack=1 Win=65535 Len=1460
     29 1514          0.298189    76.23.247.139         128.119.245.93        newheights TCP      newheights > commplex-link [ACK] Seq=19005 Ack=1 Win=65535 Len=1460
     30 1514          0.298371    76.23.247.139         128.119.245.93        newheights TCP      newheights > commplex-link [ACK] Seq=20465 Ack=1 Win=65535 Len=1460
     31 1514          0.298490    76.23.247.139         128.119.245.93        newheights TCP      newheights > commplex-link [ACK] Seq=21925 Ack=1 Win=65535 Len=1460
     32 1270          0.298594    76.23.247.139         128.119.245.93        newheights TCP      newheights > commplex-link [PSH, ACK] Seq=23385 Ack=1 Win=65535 Len=1216
     38 1514          0.308855    76.23.247.139         128.119.245.93        newheights TCP      newheights > commplex-link [ACK] Seq=24601 Ack=1 Win=65535 Len=1460
     39 1514          0.309104    76.23.247.139         128.119.245.93        newheights TCP      newheights > commplex-link [ACK] Seq=26061 Ack=1 Win=65535 Len=1460
     40 1514          0.309227    76.23.247.139         128.119.245.93        newheights TCP      newheights > commplex-link [ACK] Seq=27521 Ack=1 Win=65535 Len=1460
     41 1514          0.309352    76.23.247.139         128.119.245.93        newheights TCP      newheights > commplex-link [ACK] Seq=28981 Ack=1 Win=65535 Len=1460
     42 1514          0.309473    76.23.247.139         128.119.245.93        newheights TCP      newheights > commplex-link [ACK] Seq=30441 Ack=1 Win=65535 Len=1460
     43 946           0.309545    76.23.247.139         128.119.245.93        newheights TCP      newheights > commplex-link [PSH, ACK] Seq=31901 Ack=1 Win=65535 Len=892
     44 1514          0.310299    76.23.247.139         128.119.245.93        newheights TCP      newheights > commplex-link [ACK] Seq=32793 Ack=1 Win=65535 Len=1460
     45 1514          0.310515    76.23.247.139         128.119.245.93        newheights TCP      newheights > commplex-link [ACK] Seq=34253 Ack=1 Win=65535 Len=1460
     46 1514          0.310637    76.23.247.139         128.119.245.93        newheights TCP      newheights > commplex-link [ACK] Seq=35713 Ack=1 Win=65535 Len=1460
     47 1514          0.310781    76.23.247.139         128.119.245.93        newheights TCP      newheights > commplex-link [ACK] Seq=37173 Ack=1 Win=65535 Len=1460
     49 1514          0.326130    76.23.247.139         128.119.245.93        newheights TCP      newheights > commplex-link [ACK] Seq=38633 Ack=1 Win=65535 Len=1460
     50 946           0.326195    76.23.247.139         128.119.245.93        newheights TCP      newheights > commplex-link [PSH, ACK] Seq=40093 Ack=1 Win=65535 Len=892
     56 1514          0.331636    76.23.247.139         128.119.245.93        newheights TCP      newheights > commplex-link [ACK] Seq=40985 Ack=1 Win=65535 Len=1460
     57 1514          0.331838    76.23.247.139         128.119.245.93        newheights TCP      newheights > commplex-link [ACK] Seq=42445 Ack=1 Win=65535 Len=1460
     58 1514          0.331961    76.23.247.139         128.119.245.93        newheights TCP      newheights > commplex-link [ACK] Seq=43905 Ack=1 Win=65535 Len=1460
     59 1514          0.332080    76.23.247.139         128.119.245.93        newheights TCP      newheights > commplex-link [ACK] Seq=45365 Ack=1 Win=65535 Len=1460
     60 1514          0.332203    76.23.247.139         128.119.245.93        newheights TCP      newheights > commplex-link [ACK] Seq=46825 Ack=1 Win=65535 Len=1460
     61 946           0.332273    76.23.247.139         128.119.245.93        newheights TCP      newheights > commplex-link [PSH, ACK] Seq=48285 Ack=1 Win=65535 Len=892
     67 1514          0.343485    76.23.247.139         128.119.245.93        newheights TCP      newheights > commplex-link [ACK] Seq=49177 Ack=1 Win=65535 Len=1460
     68 1514          0.343732    76.23.247.139         128.119.245.93        newheights TCP      newheights > commplex-link [ACK] Seq=50637 Ack=1 Win=65535 Len=1460
     69 1514          0.343856    76.23.247.139         128.119.245.93        newheights TCP      newheights > commplex-link [ACK] Seq=52097 Ack=1 Win=65535 Len=1460
     70 1514          0.343979    76.23.247.139         128.119.245.93        newheights TCP      newheights > commplex-link [ACK] Seq=53557 Ack=1 Win=65535 Len=1460
     71 1514          0.344102    76.23.247.139         128.119.245.93        newheights TCP      newheights > commplex-link [ACK] Seq=55017 Ack=1 Win=65535 Len=1460
     72 946           0.344172    76.23.247.139         128.119.245.93        newheights TCP      newheights > commplex-link [PSH, ACK] Seq=56477 Ack=1 Win=65535 Len=892
     79 1514          0.370101    76.23.247.139         128.119.245.93        newheights TCP      newheights > commplex-link [ACK] Seq=57369 Ack=1 Win=65535 Len=1460
     80 1514          0.370355    76.23.247.139         128.119.245.93        newheights TCP      newheights > commplex-link [ACK] Seq=58829 Ack=1 Win=65535 Len=1460
     81 1514          0.370477    76.23.247.139         128.119.245.93        newheights TCP      newheights > commplex-link [ACK] Seq=60289 Ack=1 Win=65535 Len=1460
     82 1514          0.370643    76.23.247.139         128.119.245.93        newheights TCP      newheights > commplex-link [ACK] Seq=61749 Ack=1 Win=65535 Len=1460
     83 1514          0.370775    76.23.247.139         128.119.245.93        newheights TCP      newheights > commplex-link [ACK] Seq=63209 Ack=1 Win=65535 Len=1460
     84 946           0.370843    76.23.247.139         128.119.245.93        newheights TCP      newheights > commplex-link [PSH, ACK] Seq=64669 Ack=1 Win=65535 Len=892
     87 1514          0.386071    76.23.247.139         128.119.245.93        newheights TCP      newheights > commplex-link [ACK] Seq=65561 Ack=1 Win=65535 Len=1460
     88 1514          0.386312    76.23.247.139         128.119.245.93        newheights TCP      newheights > commplex-link [ACK] Seq=67021 Ack=1 Win=65535 Len=1460
     89 1514          0.386437    76.23.247.139         128.119.245.93        newheights TCP      newheights > commplex-link [ACK] Seq=68481 Ack=1 Win=65535 Len=1460
     90 1514          0.386689    76.23.247.139         128.119.245.93        newheights TCP      newheights > commplex-link [ACK] Seq=69941 Ack=1 Win=65535 Len=1460
     91 1514          0.386812    76.23.247.139         128.119.245.93        newheights TCP      newheights > commplex-link [ACK] Seq=71401 Ack=1 Win=65535 Len=1460
     92 946           0.386882    76.23.247.139         128.119.245.93        newheights TCP      newheights > commplex-link [PSH, ACK] Seq=72861 Ack=1 Win=65535 Len=892
     96 1514          0.399383    76.23.247.139         128.119.245.93        newheights TCP      newheights > commplex-link [ACK] Seq=73753 Ack=1 Win=65535 Len=1460
     97 1514          0.399625    76.23.247.139         128.119.245.93        newheights TCP      newheights > commplex-link [ACK] Seq=75213 Ack=1 Win=65535 Len=1460
     98 1514          0.399748    76.23.247.139         128.119.245.93        newheights TCP      newheights > commplex-link [ACK] Seq=76673 Ack=1 Win=65535 Len=1460
     99 1514          0.399879    76.23.247.139         128.119.245.93        newheights TCP      newheights > commplex-link [ACK] Seq=78133 Ack=1 Win=65535 Len=1460
    100 1514          0.400007    76.23.247.139         128.119.245.93        newheights TCP      newheights > commplex-link [ACK] Seq=79593 Ack=1 Win=65535 Len=1460
    101 946           0.400074    76.23.247.139         128.119.245.93        newheights TCP      newheights > commplex-link [PSH, ACK] Seq=81053 Ack=1 Win=65535 Len=892
    104 1514          0.420689    76.23.247.139         128.119.245.93        newheights TCP      newheights > commplex-link [ACK] Seq=81945 Ack=1 Win=65535 Len=1460
    105 1514          0.420931    76.23.247.139         128.119.245.93        newheights TCP      newheights > commplex-link [ACK] Seq=83405 Ack=1 Win=65535 Len=1460
    106 1514          0.421054    76.23.247.139         128.119.245.93        newheights TCP      newheights > commplex-link [ACK] Seq=84865 Ack=1 Win=65535 Len=1460
    107 1514          0.421190    76.23.247.139         128.119.245.93        newheights TCP      newheights > commplex-link [ACK] Seq=86325 Ack=1 Win=65535 Len=1460
    108 1514          0.421328    76.23.247.139         128.119.245.93        newheights TCP      newheights > commplex-link [ACK] Seq=87785 Ack=1 Win=65535 Len=1460
    109 946           0.421385    76.23.247.139         128.119.245.93        newheights TCP      newheights > commplex-link [PSH, ACK] Seq=89245 Ack=1 Win=65535 Len=892
    114 1514          0.444762    76.23.247.139         128.119.245.93        newheights TCP      newheights > commplex-link [ACK] Seq=90137 Ack=1 Win=65535 Len=1460
    115 1514          0.444981    76.23.247.139         128.119.245.93        newheights TCP      newheights > commplex-link [ACK] Seq=91597 Ack=1 Win=65535 Len=1460
    116 1514          0.445098    76.23.247.139         128.119.245.93        newheights TCP      newheights > commplex-link [ACK] Seq=93057 Ack=1 Win=65535 Len=1460
    117 1514          0.445223    76.23.247.139         128.119.245.93        newheights TCP      newheights > commplex-link [ACK] Seq=94517 Ack=1 Win=65535 Len=1460
    118 1514          0.445343    76.23.247.139         128.119.245.93        newheights TCP      newheights > commplex-link [ACK] Seq=95977 Ack=1 Win=65535 Len=1460
    119 946           0.445412    76.23.247.139         128.119.245.93        newheights TCP      newheights > commplex-link [PSH, ACK] Seq=97437 Ack=1 Win=65535 Len=892
    123 1514          0.456701    76.23.247.139         128.119.245.93        newheights TCP      newheights > commplex-link [ACK] Seq=98329 Ack=1 Win=65535 Len=1460
    124 1514          0.456935    76.23.247.139         128.119.245.93        newheights TCP      newheights > commplex-link [ACK] Seq=99789 Ack=1 Win=65535 Len=1460
    125 1514          0.457068    76.23.247.139         128.119.245.93        newheights TCP      newheights > commplex-link [ACK] Seq=101249 Ack=1 Win=65535 Len=1460
    126 1514          0.457203    76.23.247.139         128.119.245.93        newheights TCP      newheights > commplex-link [ACK] Seq=102709 Ack=1 Win=65535 Len=1460
    127 1514          0.457336    76.23.247.139         128.119.245.93        newheights TCP      newheights > commplex-link [ACK] Seq=104169 Ack=1 Win=65535 Len=1460
    128 946           0.457396    76.23.247.139         128.119.245.93        newheights TCP      newheights > commplex-link [PSH, ACK] Seq=105629 Ack=1 Win=65535 Len=892
    131 1514          0.480588    76.23.247.139         128.119.245.93        newheights TCP      newheights > commplex-link [ACK] Seq=106521 Ack=1 Win=65535 Len=1460
    132 1514          0.480838    76.23.247.139         128.119.245.93        newheights TCP      newheights > commplex-link [ACK] Seq=107981 Ack=1 Win=65535 Len=1460
    133 1514          0.480961    76.23.247.139         128.119.245.93        newheights TCP      newheights > commplex-link [ACK] Seq=109441 Ack=1 Win=65535 Len=1460
    134 1514          0.481097    76.23.247.139         128.119.245.93        newheights TCP      newheights > commplex-link [ACK] Seq=110901 Ack=1 Win=65535 Len=1460
    135 1514          0.481220    76.23.247.139         128.119.245.93        newheights TCP      newheights > commplex-link [ACK] Seq=112361 Ack=1 Win=65535 Len=1460
    136 946           0.481290    76.23.247.139         128.119.245.93        newheights TCP      newheights > commplex-link [PSH, ACK] Seq=113821 Ack=1 Win=65535 Len=892
    142 1514          0.501954    76.23.247.139         128.119.245.93        newheights TCP      newheights > commplex-link [ACK] Seq=114713 Ack=1 Win=65535 Len=1460
    143 1514          0.502207    76.23.247.139         128.119.245.93        newheights TCP      newheights > commplex-link [ACK] Seq=116173 Ack=1 Win=65535 Len=1460
    144 1514          0.502334    76.23.247.139         128.119.245.93        newheights TCP      newheights > commplex-link [ACK] Seq=117633 Ack=1 Win=65535 Len=1460
    145 1514          0.502478    76.23.247.139         128.119.245.93        newheights TCP      newheights > commplex-link [ACK] Seq=119093 Ack=1 Win=65535 Len=1460
    146 1514          0.502613    76.23.247.139         128.119.245.93        newheights TCP      newheights > commplex-link [ACK] Seq=120553 Ack=1 Win=65535 Len=1460
    147 946           0.502676    76.23.247.139         128.119.245.93        newheights TCP      newheights > commplex-link [PSH, ACK] Seq=122013 Ack=1 Win=65535 Len=892
    153 1514          0.517921    76.23.247.139         128.119.245.93        newheights TCP      newheights > commplex-link [ACK] Seq=122905 Ack=1 Win=65535 Len=1460
    154 1514          0.518159    76.23.247.139         128.119.245.93        newheights TCP      newheights > commplex-link [ACK] Seq=124365 Ack=1 Win=65535 Len=1460
    155 1514          0.518281    76.23.247.139         128.119.245.93        newheights TCP      newheights > commplex-link [ACK] Seq=125825 Ack=1 Win=65535 Len=1460
    156 1514          0.518404    76.23.247.139         128.119.245.93        newheights TCP      newheights > commplex-link [ACK] Seq=127285 Ack=1 Win=65535 Len=1460
    157 1514          0.518527    76.23.247.139         128.119.245.93        newheights TCP      newheights > commplex-link [ACK] Seq=128745 Ack=1 Win=65535 Len=1460
    158 946           0.518600    76.23.247.139         128.119.245.93        newheights TCP      newheights > commplex-link [PSH, ACK] Seq=130205 Ack=1 Win=65535 Len=892
    162 1514          0.529839    76.23.247.139         128.119.245.93        newheights TCP      newheights > commplex-link [ACK] Seq=131097 Ack=1 Win=65535 Len=1460
    163 1514          0.530086    76.23.247.139         128.119.245.93        newheights TCP      newheights > commplex-link [ACK] Seq=132557 Ack=1 Win=65535 Len=1460
    164 1514          0.530209    76.23.247.139         128.119.245.93        newheights TCP      newheights > commplex-link [ACK] Seq=134017 Ack=1 Win=65535 Len=1460
    165 1514          0.530332    76.23.247.139         128.119.245.93        newheights TCP      newheights > commplex-link [ACK] Seq=135477 Ack=1 Win=65535 Len=1460
    166 1514          0.530455    76.23.247.139         128.119.245.93        newheights TCP      newheights > commplex-link [ACK] Seq=136937 Ack=1 Win=65535 Len=1460
    167 946           0.530533    76.23.247.139         128.119.245.93        newheights TCP      newheights > commplex-link [PSH, ACK] Seq=138397 Ack=1 Win=65535 Len=892
    174 1514          0.552475    76.23.247.139         128.119.245.93        newheights TCP      newheights > commplex-link [ACK] Seq=139289 Ack=1 Win=65535 Len=1460
    175 1514          0.552735    76.23.247.139         128.119.245.93        newheights TCP      newheights > commplex-link [ACK] Seq=140749 Ack=1 Win=65535 Len=1460
    176 1514          0.552860    76.23.247.139         128.119.245.93        newheights TCP      newheights > commplex-link [ACK] Seq=142209 Ack=1 Win=65535 Len=1460
    177 1514          0.553015    76.23.247.139         128.119.245.93        newheights TCP      newheights > commplex-link [ACK] Seq=143669 Ack=1 Win=65535 Len=1460
    178 1514          0.553182    76.23.247.139         128.119.245.93        newheights TCP      newheights > commplex-link [ACK] Seq=145129 Ack=1 Win=65535 Len=1460
    179 946           0.553251    76.23.247.139         128.119.245.93        newheights TCP      newheights > commplex-link [PSH, ACK] Seq=146589 Ack=1 Win=65535 Len=892
    182 1514          0.568572    76.23.247.139         128.119.245.93        newheights TCP      newheights > commplex-link [ACK] Seq=147481 Ack=1 Win=65535 Len=1460
    183 1514          0.568695    76.23.247.139         128.119.245.93        newheights TCP      newheights > commplex-link [ACK] Seq=148941 Ack=1 Win=65535 Len=1460
    184 1514          0.568818    76.23.247.139         128.119.245.93        newheights TCP      newheights > commplex-link [ACK] Seq=150401 Ack=1 Win=65535 Len=1460
    185 1514          0.568997    76.23.247.139         128.119.245.93        newheights TCP      newheights > commplex-link [ACK] Seq=151861 Ack=1 Win=65535 Len=1460
    186 1514          0.569121    76.23.247.139         128.119.245.93        newheights TCP      newheights > commplex-link [ACK] Seq=153321 Ack=1 Win=65535 Len=1460
    187 946           0.569189    76.23.247.139         128.119.245.93        newheights TCP      newheights > commplex-link [PSH, ACK] Seq=154781 Ack=1 Win=65535 Len=892
    191 1514          0.591081    76.23.247.139         128.119.245.93        newheights TCP      newheights > commplex-link [ACK] Seq=155673 Ack=1 Win=65535 Len=1460
    192 1514          0.591424    76.23.247.139         128.119.245.93        newheights TCP      newheights > commplex-link [ACK] Seq=157133 Ack=1 Win=65535 Len=1460
    193 1514          0.591547    76.23.247.139         128.119.245.93        newheights TCP      newheights > commplex-link [ACK] Seq=158593 Ack=1 Win=65535 Len=1460
    194 1514          0.591670    76.23.247.139         128.119.245.93        newheights TCP      newheights > commplex-link [ACK] Seq=160053 Ack=1 Win=65535 Len=1460
    195 1514          0.591793    76.23.247.139         128.119.245.93        newheights TCP      newheights > commplex-link [ACK] Seq=161513 Ack=1 Win=65535 Len=1460
    196 946           0.591865    76.23.247.139         128.119.245.93        newheights TCP      newheights > commplex-link [PSH, ACK] Seq=162973 Ack=1 Win=65535 Len=892
    199 1514          0.604401    76.23.247.139         128.119.245.93        newheights TCP      newheights > commplex-link [ACK] Seq=163865 Ack=1 Win=65535 Len=1460
    200 1514          0.604717    76.23.247.139         128.119.245.93        newheights TCP      newheights > commplex-link [ACK] Seq=165325 Ack=1 Win=65535 Len=1460
    201 1514          0.604840    76.23.247.139         128.119.245.93        newheights TCP      newheights > commplex-link [ACK] Seq=166785 Ack=1 Win=65535 Len=1460
    202 1514          0.604963    76.23.247.139         128.119.245.93        newheights TCP      newheights > commplex-link [ACK] Seq=168245 Ack=1 Win=65535 Len=1460
    203 1514          0.605086    76.23.247.139         128.119.245.93        newheights TCP      newheights > commplex-link [ACK] Seq=169705 Ack=1 Win=65535 Len=1460
    204 946           0.605156    76.23.247.139         128.119.245.93        newheights TCP      newheights > commplex-link [PSH, ACK] Seq=171165 Ack=1 Win=65535 Len=892
    208 1514          0.617706    76.23.247.139         128.119.245.93        newheights TCP      newheights > commplex-link [ACK] Seq=172057 Ack=1 Win=65535 Len=1460
    209 1514          0.617954    76.23.247.139         128.119.245.93        newheights TCP      newheights > commplex-link [ACK] Seq=173517 Ack=1 Win=65535 Len=1460
    210 1514          0.618075    76.23.247.139         128.119.245.93        newheights TCP      newheights > commplex-link [ACK] Seq=174977 Ack=1 Win=65535 Len=1460
    211 1514          0.618217    76.23.247.139         128.119.245.93        newheights TCP      newheights > commplex-link [ACK] Seq=176437 Ack=1 Win=65535 Len=1460
    212 1514          0.618340    76.23.247.139         128.119.245.93        newheights TCP      newheights > commplex-link [ACK] Seq=177897 Ack=1 Win=65535 Len=1460
    213 946           0.618410    76.23.247.139         128.119.245.93        newheights TCP      newheights > commplex-link [PSH, ACK] Seq=179357 Ack=1 Win=65535 Len=892
    219 1514          0.645666    76.23.247.139         128.119.245.93        newheights TCP      newheights > commplex-link [ACK] Seq=180249 Ack=1 Win=65535 Len=1460
    220 1514          0.645991    76.23.247.139         128.119.245.93        newheights TCP      newheights > commplex-link [ACK] Seq=181709 Ack=1 Win=65535 Len=1460
    221 1514          0.646114    76.23.247.139         128.119.245.93        newheights TCP      newheights > commplex-link [ACK] Seq=183169 Ack=1 Win=65535 Len=1460
    222 1514          0.646237    76.23.247.139         128.119.245.93        newheights TCP      newheights > commplex-link [ACK] Seq=184629 Ack=1 Win=65535 Len=1460
    223 1514          0.646359    76.23.247.139         128.119.245.93        newheights TCP      newheights > commplex-link [ACK] Seq=186089 Ack=1 Win=65535 Len=1460
    224 946           0.646430    76.23.247.139         128.119.245.93        newheights TCP      newheights > commplex-link [PSH, ACK] Seq=187549 Ack=1 Win=65535 Len=892
    230 1514          0.660326    76.23.247.139         128.119.245.93        newheights TCP      newheights > commplex-link [ACK] Seq=188441 Ack=1 Win=65535 Len=1460
    231 1514          0.660572    76.23.247.139         128.119.245.93        newheights TCP      newheights > commplex-link [ACK] Seq=189901 Ack=1 Win=65535 Len=1460
    232 1514          0.660714    76.23.247.139         128.119.245.93        newheights TCP      newheights > commplex-link [ACK] Seq=191361 Ack=1 Win=65535 Len=1460
    233 1514          0.660949    76.23.247.139         128.119.245.93        newheights TCP      newheights > commplex-link [ACK] Seq=192821 Ack=1 Win=65535 Len=1460
    234 1514          0.661072    76.23.247.139         128.119.245.93        newheights TCP      newheights > commplex-link [ACK] Seq=194281 Ack=1 Win=65535 Len=1460
    235 946           0.661140    76.23.247.139         128.119.245.93        newheights TCP      newheights > commplex-link [PSH, ACK] Seq=195741 Ack=1 Win=65535 Len=892
    241 1514          0.680266    76.23.247.139         128.119.245.93        newheights TCP      newheights > commplex-link [ACK] Seq=196633 Ack=1 Win=65535 Len=1460
    242 1514          0.680523    76.23.247.139         128.119.245.93        newheights TCP      newheights > commplex-link [ACK] Seq=198093 Ack=1 Win=65535 Len=1460
    243 1514          0.680633    76.23.247.139         128.119.245.93        newheights TCP      newheights > commplex-link [ACK] Seq=199553 Ack=1 Win=65535 Len=1460
    244 1514          0.680773    76.23.247.139         128.119.245.93        newheights TCP      newheights > commplex-link [ACK] Seq=201013 Ack=1 Win=65535 Len=1460
    245 1514          0.680896    76.23.247.139         128.119.245.93        newheights TCP      newheights > commplex-link [ACK] Seq=202473 Ack=1 Win=65535 Len=1460
    246 946           0.680975    76.23.247.139         128.119.245.93        newheights TCP      newheights > commplex-link [PSH, ACK] Seq=203933 Ack=1 Win=65535 Len=892
    252 1514          0.693589    76.23.247.139         128.119.245.93        newheights TCP      newheights > commplex-link [ACK] Seq=204825 Ack=1 Win=65535 Len=1460
    253 1514          0.693920    76.23.247.139         128.119.245.93        newheights TCP      newheights > commplex-link [ACK] Seq=206285 Ack=1 Win=65535 Len=1460
    254 1514          0.694043    76.23.247.139         128.119.245.93        newheights TCP      newheights > commplex-link [ACK] Seq=207745 Ack=1 Win=65535 Len=1460
    255 1514          0.694166    76.23.247.139         128.119.245.93        newheights TCP      newheights > commplex-link [ACK] Seq=209205 Ack=1 Win=65535 Len=1460
    256 1514          0.694291    76.23.247.139         128.119.245.93        newheights TCP      newheights > commplex-link [ACK] Seq=210665 Ack=1 Win=65535 Len=1460
    257 946           0.694359    76.23.247.139         128.119.245.93        newheights TCP      newheights > commplex-link [PSH, ACK] Seq=212125 Ack=1 Win=65535 Len=892
    261 1514          0.705690    76.23.247.139         128.119.245.93        newheights TCP      newheights > commplex-link [ACK] Seq=213017 Ack=1 Win=65535 Len=1460
    262 1514          0.705892    76.23.247.139         128.119.245.93        newheights TCP      newheights > commplex-link [ACK] Seq=214477 Ack=1 Win=65535 Len=1460
    263 1514          0.706006    76.23.247.139         128.119.245.93        newheights TCP      newheights > commplex-link [ACK] Seq=215937 Ack=1 Win=65535 Len=1460
    264 1514          0.706139    76.23.247.139         128.119.245.93        newheights TCP      newheights > commplex-link [ACK] Seq=217397 Ack=1 Win=65535 Len=1460
    265 1514          0.706262    76.23.247.139         128.119.245.93        newheights TCP      newheights > commplex-link [ACK] Seq=218857 Ack=1 Win=65535 Len=1460
    266 946           0.706330    76.23.247.139         128.119.245.93        newheights TCP      newheights > commplex-link [PSH, ACK] Seq=220317 Ack=1 Win=65535 Len=892
    272 1514          0.738877    76.23.247.139         128.119.245.93        newheights TCP      newheights > commplex-link [ACK] Seq=221209 Ack=1 Win=65535 Len=1460
    273 1514          0.739124    76.23.247.139         128.119.245.93        newheights TCP      newheights > commplex-link [ACK] Seq=222669 Ack=1 Win=65535 Len=1460
    274 1514          0.739248    76.23.247.139         128.119.245.93        newheights TCP      newheights > commplex-link [ACK] Seq=224129 Ack=1 Win=65535 Len=1460
    275 1514          0.739395    76.23.247.139         128.119.245.93        newheights TCP      newheights > commplex-link [ACK] Seq=225589 Ack=1 Win=65535 Len=1460
    276 1514          0.739518    76.23.247.139         128.119.245.93        newheights TCP      newheights > commplex-link [ACK] Seq=227049 Ack=1 Win=65535 Len=1460
    277 946           0.739587    76.23.247.139         128.119.245.93        newheights TCP      newheights > commplex-link [PSH, ACK] Seq=228509 Ack=1 Win=65535 Len=892
    280 1514          0.749506    76.23.247.139         128.119.245.93        newheights TCP      newheights > commplex-link [ACK] Seq=229401 Ack=1 Win=65535 Len=1460
    281 1514          0.749754    76.23.247.139         128.119.245.93        newheights TCP      newheights > commplex-link [ACK] Seq=230861 Ack=1 Win=65535 Len=1460
    282 1514          0.749865    76.23.247.139         128.119.245.93        newheights TCP      newheights > commplex-link [ACK] Seq=232321 Ack=1 Win=65535 Len=1460
    283 1514          0.750015    76.23.247.139         128.119.245.93        newheights TCP      newheights > commplex-link [ACK] Seq=233781 Ack=1 Win=65535 Len=1460
    284 1514          0.750140    76.23.247.139         128.119.245.93        newheights TCP      newheights > commplex-link [ACK] Seq=235241 Ack=1 Win=65535 Len=1460
    285 946           0.750207    76.23.247.139         128.119.245.93        newheights TCP      newheights > commplex-link [PSH, ACK] Seq=236701 Ack=1 Win=65535 Len=892
    288 1514          0.762824    76.23.247.139         128.119.245.93        newheights TCP      newheights > commplex-link [ACK] Seq=237593 Ack=1 Win=65535 Len=1460
    289 1514          0.763070    76.23.247.139         128.119.245.93        newheights TCP      newheights > commplex-link [ACK] Seq=239053 Ack=1 Win=65535 Len=1460
    290 1514          0.763197    76.23.247.139         128.119.245.93        newheights TCP      newheights > commplex-link [ACK] Seq=240513 Ack=1 Win=65535 Len=1460
    291 1514          0.763323    76.23.247.139         128.119.245.93        newheights TCP      newheights > commplex-link [ACK] Seq=241973 Ack=1 Win=65535 Len=1460
    292 1514          0.763446    76.23.247.139         128.119.245.93        newheights TCP      newheights > commplex-link [ACK] Seq=243433 Ack=1 Win=65535 Len=1460
    293 946           0.763515    76.23.247.139         128.119.245.93        newheights TCP      newheights > commplex-link [PSH, ACK] Seq=244893 Ack=1 Win=65535 Len=892
    299 1514          0.788115    76.23.247.139         128.119.245.93        newheights TCP      newheights > commplex-link [ACK] Seq=245785 Ack=1 Win=65535 Len=1460
    300 1514          0.788361    76.23.247.139         128.119.245.93        newheights TCP      newheights > commplex-link [ACK] Seq=247245 Ack=1 Win=65535 Len=1460
    301 1514          0.788484    76.23.247.139         128.119.245.93        newheights TCP      newheights > commplex-link [ACK] Seq=248705 Ack=1 Win=65535 Len=1460
    302 1514          0.788626    76.23.247.139         128.119.245.93        newheights TCP      newheights > commplex-link [ACK] Seq=250165 Ack=1 Win=65535 Len=1460
    303 1514          0.788751    76.23.247.139         128.119.245.93        newheights TCP      newheights > commplex-link [ACK] Seq=251625 Ack=1 Win=65535 Len=1460
    304 946           0.788819    76.23.247.139         128.119.245.93        newheights TCP      newheights > commplex-link [PSH, ACK] Seq=253085 Ack=1 Win=65535 Len=892
    307 1514          0.802758    76.23.247.139         128.119.245.93        newheights TCP      newheights > commplex-link [ACK] Seq=253977 Ack=1 Win=65535 Len=1460
    308 1514          0.802999    76.23.247.139         128.119.245.93        newheights TCP      newheights > commplex-link [ACK] Seq=255437 Ack=1 Win=65535 Len=1460
    309 1514          0.803122    76.23.247.139         128.119.245.93        newheights TCP      newheights > commplex-link [ACK] Seq=256897 Ack=1 Win=65535 Len=1460
    310 1514          0.803273    76.23.247.139         128.119.245.93        newheights TCP      newheights > commplex-link [ACK] Seq=258357 Ack=1 Win=65535 Len=1460
    311 1514          0.803396    76.23.247.139         128.119.245.93        newheights TCP      newheights > commplex-link [ACK] Seq=259817 Ack=1 Win=65535 Len=1460
    312 946           0.803463    76.23.247.139         128.119.245.93        newheights TCP      newheights > commplex-link [PSH, ACK] Seq=261277 Ack=1 Win=65535 Len=892
    316 1514          0.817383    76.23.247.139         128.119.245.93        newheights TCP      newheights > commplex-link [ACK] Seq=262169 Ack=1 Win=65535 Len=1460
    317 1514          0.817652    76.23.247.139         128.119.245.93        newheights TCP      newheights > commplex-link [ACK] Seq=263629 Ack=1 Win=65535 Len=1460
    318 1514          0.817774    76.23.247.139         128.119.245.93        newheights TCP      newheights > commplex-link [ACK] Seq=265089 Ack=1 Win=65535 Len=1460
    319 1514          0.817920    76.23.247.139         128.119.245.93        newheights TCP      newheights > commplex-link [ACK] Seq=266549 Ack=1 Win=65535 Len=1460
    320 1514          0.818051    76.23.247.139         128.119.245.93        newheights TCP      newheights > commplex-link [ACK] Seq=268009 Ack=1 Win=65535 Len=1460
    321 946           0.818120    76.23.247.139         128.119.245.93        newheights TCP      newheights > commplex-link [PSH, ACK] Seq=269469 Ack=1 Win=65535 Len=892
    324 1514          0.833372    76.23.247.139         128.119.245.93        newheights TCP      newheights > commplex-link [ACK] Seq=270361 Ack=1 Win=65535 Len=1460
    325 1514          0.833620    76.23.247.139         128.119.245.93        newheights TCP      newheights > commplex-link [ACK] Seq=271821 Ack=1 Win=65535 Len=1460
    326 1514          0.833764    76.23.247.139         128.119.245.93        newheights TCP      newheights > commplex-link [ACK] Seq=273281 Ack=1 Win=65535 Len=1460
    327 1514          0.833904    76.23.247.139         128.119.245.93        newheights TCP      newheights > commplex-link [ACK] Seq=274741 Ack=1 Win=65535 Len=1460
    328 1514          0.834011    76.23.247.139         128.119.245.93        newheights TCP      newheights > commplex-link [ACK] Seq=276201 Ack=1 Win=65535 Len=1460
    329 946           0.834078    76.23.247.139         128.119.245.93        newheights TCP      newheights > commplex-link [PSH, ACK] Seq=277661 Ack=1 Win=65535 Len=892
    333 1514          0.850697    76.23.247.139         128.119.245.93        newheights TCP      newheights > commplex-link [ACK] Seq=278553 Ack=1 Win=65535 Len=1460
    334 1514          0.850940    76.23.247.139         128.119.245.93        newheights TCP      newheights > commplex-link [ACK] Seq=280013 Ack=1 Win=65535 Len=1460
    335 1514          0.851063    76.23.247.139         128.119.245.93        newheights TCP      newheights > commplex-link [ACK] Seq=281473 Ack=1 Win=65535 Len=1460
    336 1514          0.851202    76.23.247.139         128.119.245.93        newheights TCP      newheights > commplex-link [ACK] Seq=282933 Ack=1 Win=65535 Len=1460
    337 1514          0.851325    76.23.247.139         128.119.245.93        newheights TCP      newheights > commplex-link [ACK] Seq=284393 Ack=1 Win=65535 Len=1460
    338 946           0.851392    76.23.247.139         128.119.245.93        newheights TCP      newheights > commplex-link [PSH, ACK] Seq=285853 Ack=1 Win=65535 Len=892
    349 1514          0.881313    76.23.247.139         128.119.245.93        newheights TCP      newheights > commplex-link [ACK] Seq=286745 Ack=1 Win=65535 Len=1460
    350 1514          0.881662    76.23.247.139         128.119.245.93        newheights TCP      newheights > commplex-link [ACK] Seq=288205 Ack=1 Win=65535 Len=1460
    351 1514          0.881786    76.23.247.139         128.119.245.93        newheights TCP      newheights > commplex-link [ACK] Seq=289665 Ack=1 Win=65535 Len=1460
    352 1514          0.881910    76.23.247.139         128.119.245.93        newheights TCP      newheights > commplex-link [ACK] Seq=291125 Ack=1 Win=65535 Len=1460
    353 1514          0.882028    76.23.247.139         128.119.245.93        newheights TCP      newheights > commplex-link [ACK] Seq=292585 Ack=1 Win=65535 Len=1460
    354 946           0.882096    76.23.247.139         128.119.245.93        newheights TCP      newheights > commplex-link [PSH, ACK] Seq=294045 Ack=1 Win=65535 Len=892
    360 1514          0.891954    76.23.247.139         128.119.245.93        newheights TCP      newheights > commplex-link [ACK] Seq=294937 Ack=1 Win=65535 Len=1460
    361 1514          0.892214    76.23.247.139         128.119.245.93        newheights TCP      newheights > commplex-link [ACK] Seq=296397 Ack=1 Win=65535 Len=1460
    362 1514          0.892337    76.23.247.139         128.119.245.93        newheights TCP      newheights > commplex-link [ACK] Seq=297857 Ack=1 Win=65535 Len=1460
    363 1514          0.892518    76.23.247.139         128.119.245.93        newheights TCP      newheights > commplex-link [ACK] Seq=299317 Ack=1 Win=65535 Len=1460
    364 1514          0.892683    76.23.247.139         128.119.245.93        newheights TCP      newheights > commplex-link [ACK] Seq=300777 Ack=1 Win=65535 Len=1460
    365 946           0.892751    76.23.247.139         128.119.245.93        newheights TCP      newheights > commplex-link [PSH, ACK] Seq=302237 Ack=1 Win=65535 Len=892
    369 1514          0.907388    76.23.247.139         128.119.245.93        newheights TCP      newheights > commplex-link [ACK] Seq=303129 Ack=1 Win=65535 Len=1460
    370 1514          0.907634    76.23.247.139         128.119.245.93        newheights TCP      newheights > commplex-link [ACK] Seq=304589 Ack=1 Win=65535 Len=1460
    371 1514          0.907757    76.23.247.139         128.119.245.93        newheights TCP      newheights > commplex-link [ACK] Seq=306049 Ack=1 Win=65535 Len=1460
    372 1514          0.907895    76.23.247.139         128.119.245.93        newheights TCP      newheights > commplex-link [ACK] Seq=307509 Ack=1 Win=65535 Len=1460
    373 1514          0.908020    76.23.247.139         128.119.245.93        newheights TCP      newheights > commplex-link [ACK] Seq=308969 Ack=1 Win=65535 Len=1460
    374 946           0.908088    76.23.247.139         128.119.245.93        newheights TCP      newheights > commplex-link [PSH, ACK] Seq=310429 Ack=1 Win=65535 Len=892
    381 1514          0.932670    76.23.247.139         128.119.245.93        newheights TCP      newheights > commplex-link [ACK] Seq=311321 Ack=1 Win=65535 Len=1460
    382 1514          0.932916    76.23.247.139         128.119.245.93        newheights TCP      newheights > commplex-link [ACK] Seq=312781 Ack=1 Win=65535 Len=1460
    383 1514          0.933039    76.23.247.139         128.119.245.93        newheights TCP      newheights > commplex-link [ACK] Seq=314241 Ack=1 Win=65535 Len=1460
    384 1514          0.933179    76.23.247.139         128.119.245.93        newheights TCP      newheights > commplex-link [ACK] Seq=315701 Ack=1 Win=65535 Len=1460
    385 1514          0.933302    76.23.247.139         128.119.245.93        newheights TCP      newheights > commplex-link [ACK] Seq=317161 Ack=1 Win=65535 Len=1460
    386 946           0.933381    76.23.247.139         128.119.245.93        newheights TCP      newheights > commplex-link [PSH, ACK] Seq=318621 Ack=1 Win=65535 Len=892
    389 1514          0.943317    76.23.247.139         128.119.245.93        newheights TCP      newheights > commplex-link [ACK] Seq=319513 Ack=1 Win=65535 Len=1460
    390 1514          0.943565    76.23.247.139         128.119.245.93        newheights TCP      newheights > commplex-link [ACK] Seq=320973 Ack=1 Win=65535 Len=1460
    391 1514          0.943687    76.23.247.139         128.119.245.93        newheights TCP      newheights > commplex-link [ACK] Seq=322433 Ack=1 Win=65535 Len=1460
