      4 62            0.625836    76.23.247.139         128.119.245.93        hsl-storm TCP      hsl-storm > commplex-link [SYN] Seq=0 Win=65535 Len=0 MSS=1460 SACK_PERM=1
      6 60            0.641601    76.23.247.139         128.119.245.93        hsl-storm TCP      hsl-storm > commplex-link [ACK] Seq=1 Ack=1 Win=65535 Len=0
      7 78            0.643830    76.23.247.139         128.119.245.93        hsl-storm TCP      hsl-storm > commplex-link [PSH, ACK] Seq=1 Ack=1 Win=65535 Len=24
      8 1514          0.645206    76.23.247.139         128.119.245.93        hsl-storm TCP      hsl-storm > commplex-link [ACK] Seq=25 Ack=1 Win=65535 Len=1460
     10 1514          0.661929    76.23.247.139         128.119.245.93        hsl-storm TCP      hsl-storm > commplex-link [ACK] Seq=1485 Ack=1 Win=65535 Len=1460
     11 1514          0.662109    76.23.247.139         128.119.245.93        hsl-storm TCP      hsl-storm > commplex-link [ACK] Seq=2945 Ack=1 Win=65535 Len=1460
     13 1514          0.665911    76.23.247.139         128.119.245.93        hsl-storm TCP      hsl-storm > commplex-link [ACK] Seq=4405 Ack=1 Win=65535 Len=1460
     14 1514          0.666103    76.23.247.139         128.119.245.93        hsl-storm TCP      hsl-storm > commplex-link [ACK] Seq=5865 Ack=1 Win=65535 Len=1460
     17 1514          0.679273    76.23.247.139         128.119.245.93        hsl-storm TCP      hsl-storm > commplex-link [PSH, ACK] Seq=7325 Ack=1 Win=65535 Len=1460
     18 1514          0.679473    76.23.247.139         128.119.245.93        hsl-storm TCP      hsl-storm > commplex-link [ACK] Seq=8785 Ack=1 Win=65535 Len=1460
     19 1514          0.679594    76.23.247.139         128.119.245.93        hsl-storm TCP      hsl-storm > commplex-link [ACK] Seq=10245 Ack=1 Win=65535 Len=1460
     20 1514          0.679740    76.23.247.139         128.119.245.93        hsl-storm TCP      hsl-storm > commplex-link [ACK] Seq=11705 Ack=1 Win=65535 Len=1460
     23 1514          0.685904    76.23.247.139         128.119.245.93        hsl-storm TCP      hsl-storm > commplex-link [ACK] Seq=13165 Ack=1 Win=65535 Len=1460
     24 1514          0.686116    76.23.247.139         128.119.245.93        hsl-storm TCP      hsl-storm > commplex-link [ACK] Seq=14625 Ack=1 Win=65535 Len=1460
     25 1514          0.686234    76.23.247.139         128.119.245.93        hsl-storm TCP      hsl-storm > commplex-link [PSH, ACK] Seq=16085 Ack=1 Win=65535 Len=1460
     26 1514          0.686376    76.23.247.139         128.119.245.93        hsl-storm TCP      hsl-storm > commplex-link [ACK] Seq=17545 Ack=1 Win=65535 Len=1460
     29 1514          0.705887    76.23.247.139         128.119.245.93        hsl-storm TCP      hsl-storm > commplex-link [ACK] Seq=19005 Ack=1 Win=65535 Len=1460
     30 1514          0.706056    76.23.247.139         128.119.245.93        hsl-storm TCP      hsl-storm > commplex-link [ACK] Seq=20465 Ack=1 Win=65535 Len=1460
     31 1514          0.706186    76.23.247.139         128.119.245.93        hsl-storm TCP      hsl-storm > commplex-link [ACK] Seq=21925 Ack=1 Win=65535 Len=1460
     32 1270          0.706291    76.23.247.139         128.119.245.93        hsl-storm TCP      hsl-storm > commplex-link [PSH, ACK] Seq=23385 Ack=1 Win=65535 Len=1216
     37 1514          0.709870    76.23.247.139         128.119.245.93        hsl-storm TCP      hsl-storm > commplex-link [ACK] Seq=24601 Ack=1 Win=65535 Len=1460
     38 1514          0.710092    76.23.247.139         128.119.245.93        hsl-storm TCP      hsl-storm > commplex-link [ACK] Seq=26061 Ack=1 Win=65535 Len=1460
     39 1514          0.710215    76.23.247.139         128.119.245.93        hsl-storm TCP      hsl-storm > commplex-link [ACK] Seq=27521 Ack=1 Win=65535 Len=1460
     40 1514          0.710491    76.23.247.139         128.119.245.93        hsl-storm TCP      hsl-storm > commplex-link [ACK] Seq=28981 Ack=1 Win=65535 Len=1460
     42 1514          0.711214    76.23.247.139         128.119.245.93        hsl-storm TCP      hsl-storm > commplex-link [ACK] Seq=30441 Ack=1 Win=65535 Len=1460
     43 946           0.711294    76.23.247.139         128.119.245.93        hsl-storm TCP      hsl-storm > commplex-link [PSH, ACK] Seq=31901 Ack=1 Win=65535 Len=892
     44 1514          0.712567    76.23.247.139         128.119.245.93        hsl-storm TCP      hsl-storm > commplex-link [ACK] Seq=32793 Ack=1 Win=65535 Len=1460
     45 1514          0.712757    76.23.247.139         128.119.245.93        hsl-storm TCP      hsl-storm > commplex-link [ACK] Seq=34253 Ack=1 Win=65535 Len=1460
     46 1514          0.712891    76.23.247.139         128.119.245.93        hsl-storm TCP      hsl-storm > commplex-link [ACK] Seq=35713 Ack=1 Win=65535 Len=1460
     47 1514          0.713028    76.23.247.139         128.119.245.93        hsl-storm TCP      hsl-storm > commplex-link [ACK] Seq=37173 Ack=1 Win=65535 Len=1460
     49 1514          0.724505    76.23.247.139         128.119.245.93        hsl-storm TCP      hsl-storm > commplex-link [ACK] Seq=38633 Ack=1 Win=65535 Len=1460
     50 946           0.724597    76.23.247.139         128.119.245.93        hsl-storm TCP      hsl-storm > commplex-link [PSH, ACK] Seq=40093 Ack=1 Win=65535 Len=892
     56 1514          0.729871    76.23.247.139         128.119.245.93        hsl-storm TCP      hsl-storm > commplex-link [ACK] Seq=40985 Ack=1 Win=65535 Len=1460
     57 1514          0.730113    76.23.247.139         128.119.245.93        hsl-storm TCP      hsl-storm > commplex-link [ACK] Seq=42445 Ack=1 Win=65535 Len=1460
     58 1514          0.730238    76.23.247.139         128.119.245.93        hsl-storm TCP      hsl-storm > commplex-link [ACK] Seq=43905 Ack=1 Win=65535 Len=1460
     59 1514          0.730386    76.23.247.139         128.119.245.93        hsl-storm TCP      hsl-storm > commplex-link [ACK] Seq=45365 Ack=1 Win=65535 Len=1460
     60 1514          0.730509    76.23.247.139         128.119.245.93        hsl-storm TCP      hsl-storm > commplex-link [ACK] Seq=46825 Ack=1 Win=65535 Len=1460
     61 946           0.730589    76.23.247.139         128.119.245.93        hsl-storm TCP      hsl-storm > commplex-link [PSH, ACK] Seq=48285 Ack=1 Win=65535 Len=892
     67 1514          0.748506    76.23.247.139         128.119.245.93        hsl-storm TCP      hsl-storm > commplex-link [ACK] Seq=49177 Ack=1 Win=65535 Len=1460
     68 1514          0.748748    76.23.247.139         128.119.245.93        hsl-storm TCP      hsl-storm > commplex-link [ACK] Seq=50637 Ack=1 Win=65535 Len=1460
     69 1514          0.748871    76.23.247.139         128.119.245.93        hsl-storm TCP      hsl-storm > commplex-link [ACK] Seq=52097 Ack=1 Win=65535 Len=1460
     70 1514          0.749057    76.23.247.139         128.119.245.93        hsl-storm TCP      hsl-storm > commplex-link [ACK] Seq=53557 Ack=1 Win=65535 Len=1460
     71 1514          0.749176    76.23.247.139         128.119.245.93        hsl-storm TCP      hsl-storm > commplex-link [ACK] Seq=55017 Ack=1 Win=65535 Len=1460
     72 946           0.749247    76.23.247.139         128.119.245.93        hsl-storm TCP      hsl-storm > commplex-link [PSH, ACK] Seq=56477 Ack=1 Win=65535 Len=892
     79 1514          0.773999    76.23.247.139         128.119.245.93        hsl-storm TCP      hsl-storm > commplex-link [ACK] Seq=57369 Ack=1 Win=65535 Len=1460
     80 1514          0.774128    76.23.247.139         128.119.245.93        hsl-storm TCP      hsl-storm > commplex-link [ACK] Seq=58829 Ack=1 Win=65535 Len=1460
     81 1514          0.774251    76.23.247.139         128.119.245.93        hsl-storm TCP      hsl-storm > commplex-link [ACK] Seq=60289 Ack=1 Win=65535 Len=1460
     82 1514          0.774400    76.23.247.139         128.119.245.93        hsl-storm TCP      hsl-storm > commplex-link [ACK] Seq=61749 Ack=1 Win=65535 Len=1460
     83 1514          0.774589    76.23.247.139         128.119.245.93        hsl-storm TCP      hsl-storm > commplex-link [ACK] Seq=63209 Ack=1 Win=65535 Len=1460
     84 946           0.774667    76.23.247.139         128.119.245.93        hsl-storm TCP      hsl-storm > commplex-link [PSH, ACK] Seq=64669 Ack=1 Win=65535 Len=892
     87 1514          0.787232    76.23.247.139         128.119.245.93        hsl-storm TCP      hsl-storm > commplex-link [ACK] Seq=65561 Ack=1 Win=65535 Len=1460
     88 1514          0.787442    76.23.247.139         128.119.245.93        hsl-storm TCP      hsl-storm > commplex-link [ACK] Seq=67021 Ack=1 Win=65535 Len=1460
     89 1514          0.787565    76.23.247.139         128.119.245.93        hsl-storm TCP      hsl-storm > commplex-link [ACK] Seq=68481 Ack=1 Win=65535 Len=1460
     90 1514          0.787687    76.23.247.139         128.119.245.93        hsl-storm TCP      hsl-storm > commplex-link [ACK] Seq=69941 Ack=1 Win=65535 Len=1460
     91 1514          0.787807    76.23.247.139         128.119.245.93        hsl-storm TCP      hsl-storm > commplex-link [ACK] Seq=71401 Ack=1 Win=65535 Len=1460
     92 946           0.787886    76.23.247.139         128.119.245.93        hsl-storm TCP      hsl-storm > commplex-link [PSH, ACK] Seq=72861 Ack=1 Win=65535 Len=892
     95 1514          0.817723    76.23.247.139         128.119.245.93        hsl-storm TCP      hsl-storm > commplex-link [ACK] Seq=73753 Ack=1 Win=65535 Len=1460
     96 1514          0.817974    76.23.247.139         128.119.245.93        hsl-storm TCP      hsl-storm > commplex-link [ACK] Seq=75213 Ack=1 Win=65535 Len=1460
     97 1514          0.818097    76.23.247.139         128.119.245.93        hsl-storm TCP      hsl-storm > commplex-link [ACK] Seq=76673 Ack=1 Win=65535 Len=1460
     98 1514          0.818241    76.23.247.139         128.119.245.93        hsl-storm TCP      hsl-storm > commplex-link [ACK] Seq=78133 Ack=1 Win=65535 Len=1460
     99 1514          0.818360    76.23.247.139         128.119.245.93        hsl-storm TCP      hsl-storm > commplex-link [ACK] Seq=79593 Ack=1 Win=65535 Len=1460
    100 946           0.818440    76.23.247.139         128.119.245.93        hsl-storm TCP      hsl-storm > commplex-link [PSH, ACK] Seq=81053 Ack=1 Win=65535 Len=892
    106 1514          0.852350    76.23.247.139         128.119.245.93        hsl-storm TCP      hsl-storm > commplex-link [ACK] Seq=81945 Ack=1 Win=65535 Len=1460
    107 1514          0.852592    76.23.247.139         128.119.245.93        hsl-storm TCP      hsl-storm > commplex-link [ACK] Seq=83405 Ack=1 Win=65535 Len=1460
    108 1514          0.852720    76.23.247.139         128.119.245.93        hsl-storm TCP      hsl-storm > commplex-link [ACK] Seq=84865 Ack=1 Win=65535 Len=1460
    109 1514          0.852861    76.23.247.139         128.119.245.93        hsl-storm TCP      hsl-storm > commplex-link [ACK] Seq=86325 Ack=1 Win=65535 Len=1460
    110 1514          0.852983    76.23.247.139         128.119.245.93        hsl-storm TCP      hsl-storm > commplex-link [ACK] Seq=87785 Ack=1 Win=65535 Len=1460
    111 946           0.853064    76.23.247.139         128.119.245.93        hsl-storm TCP      hsl-storm > commplex-link [PSH, ACK] Seq=89245 Ack=1 Win=65535 Len=892
    113 1514          0.861652    76.23.247.139         128.119.245.93        hsl-storm TCP      hsl-storm > commplex-link [ACK] Seq=90137 Ack=1 Win=65535 Len=1460
    114 1514          0.861901    76.23.247.139         128.119.245.93        hsl-storm TCP      hsl-storm > commplex-link [ACK] Seq=91597 Ack=1 Win=65535 Len=1460
    115 1514          0.862025    76.23.247.139         128.119.245.93        hsl-storm TCP      hsl-storm > commplex-link [ACK] Seq=93057 Ack=1 Win=65535 Len=1460
    116 1514          0.862167    76.23.247.139         128.119.245.93        hsl-storm TCP      hsl-storm > commplex-link [ACK] Seq=94517 Ack=1 Win=65535 Len=1460
    117 1514          0.862299    76.23.247.139         128.119.245.93        hsl-storm TCP      hsl-storm > commplex-link [ACK] Seq=95977 Ack=1 Win=65535 Len=1460
    118 946           0.862366    76.23.247.139         128.119.245.93        hsl-storm TCP      hsl-storm > commplex-link [PSH, ACK] Seq=97437 Ack=1 Win=65535 Len=892
    122 1514          0.879096    76.23.247.139         128.119.245.93        hsl-storm TCP      hsl-storm > commplex-link [ACK] Seq=98329 Ack=1 Win=65535 Len=1460
    123 1514          0.879302    76.23.247.139         128.119.245.93        hsl-storm TCP      hsl-storm > commplex-link [ACK] Seq=99789 Ack=1 Win=65535 Len=1460
    124 1514          0.879425    76.23.247.139         128.119.245.93        hsl-storm TCP      hsl-storm > commplex-link [ACK] Seq=101249 Ack=1 Win=65535 Len=1460
    125 1514          0.879544    76.23.247.139         128.119.245.93        hsl-storm TCP      hsl-storm > commplex-link [ACK] Seq=102709 Ack=1 Win=65535 Len=1460
    126 1514          0.879667    76.23.247.139         128.119.245.93        hsl-storm TCP      hsl-storm > commplex-link [ACK] Seq=104169 Ack=1 Win=65535 Len=1460
    127 946           0.879747    76.23.247.139         128.119.245.93        hsl-storm TCP      hsl-storm > commplex-link [PSH, ACK] Seq=105629 Ack=1 Win=65535 Len=892
    132 1514          0.905583    76.23.247.139         128.119.245.93        hsl-storm TCP      hsl-storm > commplex-link [ACK] Seq=106521 Ack=1 Win=65535 Len=1460
    133 1514          0.905833    76.23.247.139         128.119.245.93        hsl-storm TCP      hsl-storm > commplex-link [ACK] Seq=107981 Ack=1 Win=65535 Len=1460
    134 1514          0.905956    76.23.247.139         128.119.245.93        hsl-storm TCP      hsl-storm > commplex-link [ACK] Seq=109441 Ack=1 Win=65535 Len=1460
    135 1514          0.906100    76.23.247.139         128.119.245.93        hsl-storm TCP      hsl-storm > commplex-link [ACK] Seq=110901 Ack=1 Win=65535 Len=1460
    136 1514          0.906223    76.23.247.139         128.119.245.93        hsl-storm TCP      hsl-storm > commplex-link [ACK] Seq=112361 Ack=1 Win=65535 Len=1460
    137 946           0.906291    76.23.247.139         128.119.245.93        hsl-storm TCP      hsl-storm > commplex-link [PSH, ACK] Seq=113821 Ack=1 Win=65535 Len=892
    144 1514          0.916239    76.23.247.139         128.119.245.93        hsl-storm TCP      hsl-storm > commplex-link [ACK] Seq=114713 Ack=1 Win=65535 Len=1460
    145 1514          0.916485    76.23.247.139         128.119.245.93        hsl-storm TCP      hsl-storm > commplex-link [ACK] Seq=116173 Ack=1 Win=65535 Len=1460
    146 1514          0.916625    76.23.247.139         128.119.245.93        hsl-storm TCP      hsl-storm > commplex-link [ACK] Seq=117633 Ack=1 Win=65535 Len=1460
    147 1514          0.916866    76.23.247.139         128.119.245.93        hsl-storm TCP      hsl-storm > commplex-link [ACK] Seq=119093 Ack=1 Win=65535 Len=1460
    148 1514          0.916989    76.23.247.139         128.119.245.93        hsl-storm TCP      hsl-storm > commplex-link [ACK] Seq=120553 Ack=1 Win=65535 Len=1460
    149 946           0.917070    76.23.247.139         128.119.245.93        hsl-storm TCP      hsl-storm > commplex-link [PSH, ACK] Seq=122013 Ack=1 Win=65535 Len=892
    153 1514          0.930885    76.23.247.139         128.119.245.93        hsl-storm TCP      hsl-storm > commplex-link [ACK] Seq=122905 Ack=1 Win=65535 Len=1460
    154 1514          0.931133    76.23.247.139         128.119.245.93        hsl-storm TCP      hsl-storm > commplex-link [ACK] Seq=124365 Ack=1 Win=65535 Len=1460
    155 1514          0.931268    76.23.247.139         128.119.245.93        hsl-storm TCP      hsl-storm > commplex-link [ACK] Seq=125825 Ack=1 Win=65535 Len=1460
    156 1514          0.931396    76.23.247.139         128.119.245.93        hsl-storm TCP      hsl-storm > commplex-link [ACK] Seq=127285 Ack=1 Win=65535 Len=1460
    157 1514          0.931519    76.23.247.139         128.119.245.93        hsl-storm TCP      hsl-storm > commplex-link [ACK] Seq=128745 Ack=1 Win=65535 Len=1460
    158 946           0.931598    76.23.247.139         128.119.245.93        hsl-storm TCP      hsl-storm > commplex-link [PSH, ACK] Seq=130205 Ack=1 Win=65535 Len=892
    163 1514          0.958839    76.23.247.139         128.119.245.93        hsl-storm TCP      hsl-storm > commplex-link [ACK] Seq=131097 Ack=1 Win=65535 Len=1460
    164 1514          0.959164    76.23.247.139         128.119.245.93        hsl-storm TCP      hsl-storm > commplex-link [ACK] Seq=132557 Ack=1 Win=65535 Len=1460
    165 1514          0.959283    76.23.247.139         128.119.245.93        hsl-storm TCP      hsl-storm > commplex-link [ACK] Seq=134017 Ack=1 Win=65535 Len=1460
    166 1514          0.959406    76.23.247.139         128.119.245.93        hsl-storm TCP      hsl-storm > commplex-link [ACK] Seq=135477 Ack=1 Win=65535 Len=1460
    167 1514          0.959529    76.23.247.139         128.119.245.93        hsl-storm TCP      hsl-storm > commplex-link [ACK] Seq=136937 Ack=1 Win=65535 Len=1460
    168 946           0.959609    76.23.247.139         128.119.245.93        hsl-storm TCP      hsl-storm > commplex-link [PSH, ACK] Seq=138397 Ack=1 Win=65535 Len=892
    172 1514          0.970815    76.23.247.139         128.119.245.93        hsl-storm TCP      hsl-storm > commplex-link [ACK] Seq=139289 Ack=1 Win=65535 Len=1460
    173 1514          0.971059    76.23.247.139         128.119.245.93        hsl-storm TCP      hsl-storm > commplex-link [ACK] Seq=140749 Ack=1 Win=65535 Len=1460
    174 1514          0.971185    76.23.247.139         128.119.245.93        hsl-storm TCP      hsl-storm > commplex-link [ACK] Seq=142209 Ack=1 Win=65535 Len=1460
    175 1514          0.971322    76.23.247.139         128.119.245.93        hsl-storm TCP      hsl-storm > commplex-link [ACK] Seq=143669 Ack=1 Win=65535 Len=1460
    176 1514          0.971445    76.23.247.139         128.119.245.93        hsl-storm TCP      hsl-storm > commplex-link [ACK] Seq=145129 Ack=1 Win=65535 Len=1460
    177 946           0.971524    76.23.247.139         128.119.245.93        hsl-storm TCP      hsl-storm > commplex-link [PSH, ACK] Seq=146589 Ack=1 Win=65535 Len=892
    180 1514          0.988106    76.23.247.139         128.119.245.93        hsl-storm TCP      hsl-storm > commplex-link [ACK] Seq=147481 Ack=1 Win=65535 Len=1460
    181 1514          0.988357    76.23.247.139         128.119.245.93        hsl-storm TCP      hsl-storm > commplex-link [ACK] Seq=148941 Ack=1 Win=65535 Len=1460
    182 1514          0.988476    76.23.247.139         128.119.245.93        hsl-storm TCP      hsl-storm > commplex-link [ACK] Seq=150401 Ack=1 Win=65535 Len=1460
    183 1514          0.988607    76.23.247.139         128.119.245.93        hsl-storm TCP      hsl-storm > commplex-link [ACK] Seq=151861 Ack=1 Win=65535 Len=1460
    184 1514          0.988730    76.23.247.139         128.119.245.93        hsl-storm TCP      hsl-storm > commplex-link [ACK] Seq=153321 Ack=1 Win=65535 Len=1460
    185 946           0.988810    76.23.247.139         128.119.245.93        hsl-storm TCP      hsl-storm > commplex-link [PSH, ACK] Seq=154781 Ack=1 Win=65535 Len=892
    191 1514          1.009417    76.23.247.139         128.119.245.93        hsl-storm TCP      hsl-storm > commplex-link [ACK] Seq=155673 Ack=1 Win=65535 Len=1460
    192 1514          1.009664    76.23.247.139         128.119.245.93        hsl-storm TCP      hsl-storm > commplex-link [ACK] Seq=157133 Ack=1 Win=65535 Len=1460
    193 1514          1.009792    76.23.247.139         128.119.245.93        hsl-storm TCP      hsl-storm > commplex-link [ACK] Seq=158593 Ack=1 Win=65535 Len=1460
    194 1514          1.009931    76.23.247.139         128.119.245.93        hsl-storm TCP      hsl-storm > commplex-link [ACK] Seq=160053 Ack=1 Win=65535 Len=1460
    195 1514          1.010054    76.23.247.139         128.119.245.93        hsl-storm TCP      hsl-storm > commplex-link [ACK] Seq=161513 Ack=1 Win=65535 Len=1460
    196 946           1.010132    76.23.247.139         128.119.245.93        hsl-storm TCP      hsl-storm > commplex-link [PSH, ACK] Seq=162973 Ack=1 Win=65535 Len=892
    198 1514          1.021419    76.23.247.139         128.119.245.93        hsl-storm TCP      hsl-storm > commplex-link [ACK] Seq=163865 Ack=1 Win=65535 Len=1460
    199 1514          1.021652    76.23.247.139         128.119.245.93        hsl-storm TCP      hsl-storm > commplex-link [ACK] Seq=165325 Ack=1 Win=65535 Len=1460
    200 1514          1.021775    76.23.247.139         128.119.245.93        hsl-storm TCP      hsl-storm > commplex-link [ACK] Seq=166785 Ack=1 Win=65535 Len=1460
    201 1514          1.021911    76.23.247.139         128.119.245.93        hsl-storm TCP      hsl-storm > commplex-link [ACK] Seq=168245 Ack=1 Win=65535 Len=1460
    202 1514          1.022033    76.23.247.139         128.119.245.93        hsl-storm TCP      hsl-storm > commplex-link [ACK] Seq=169705 Ack=1 Win=65535 Len=1460
    203 946           1.022105    76.23.247.139         128.119.245.93        hsl-storm TCP      hsl-storm > commplex-link [PSH, ACK] Seq=171165 Ack=1 Win=65535 Len=892
    207 1514          1.040050    76.23.247.139         128.119.245.93        hsl-storm TCP      hsl-storm > commplex-link [ACK] Seq=172057 Ack=1 Win=65535 Len=1460
    208 1514          1.040289    76.23.247.139         128.119.245.93        hsl-storm TCP      hsl-storm > commplex-link [ACK] Seq=173517 Ack=1 Win=65535 Len=1460
    209 1514          1.040412    76.23.247.139         128.119.245.93        hsl-storm TCP      hsl-storm > commplex-link [ACK] Seq=174977 Ack=1 Win=65535 Len=1460
    210 1514          1.040545    76.23.247.139         128.119.245.93        hsl-storm TCP      hsl-storm > commplex-link [ACK] Seq=176437 Ack=1 Win=65535 Len=1460
    211 1514          1.040668    76.23.247.139         128.119.245.93        hsl-storm TCP      hsl-storm > commplex-link [ACK] Seq=177897 Ack=1 Win=65535 Len=1460
    212 946           1.040739    76.23.247.139         128.119.245.93        hsl-storm TCP      hsl-storm > commplex-link [PSH, ACK] Seq=179357 Ack=1 Win=65535 Len=892
    217 1514          1.064009    76.23.247.139         128.119.245.93        hsl-storm TCP      hsl-storm > commplex-link [ACK] Seq=180249 Ack=1 Win=65535 Len=1460
    218 1514          1.064255    76.23.247.139         128.119.245.93        hsl-storm TCP      hsl-storm > commplex-link [ACK] Seq=181709 Ack=1 Win=65535 Len=1460
    219 1514          1.064394    76.23.247.139         128.119.245.93        hsl-storm TCP      hsl-storm > commplex-link [ACK] Seq=183169 Ack=1 Win=65535 Len=1460
    220 1514          1.064576    76.23.247.139         128.119.245.93        hsl-storm TCP      hsl-storm > commplex-link [ACK] Seq=184629 Ack=1 Win=65535 Len=1460
    221 1514          1.064699    76.23.247.139         128.119.245.93        hsl-storm TCP      hsl-storm > commplex-link [ACK] Seq=186089 Ack=1 Win=65535 Len=1460
    222 946           1.064770    76.23.247.139         128.119.245.93        hsl-storm TCP      hsl-storm > commplex-link [PSH, ACK] Seq=187549 Ack=1 Win=65535 Len=892
    227 1514          1.075995    76.23.247.139         128.119.245.93        hsl-storm TCP      hsl-storm > commplex-link [ACK] Seq=188441 Ack=1 Win=65535 Len=1460
    228 1514          1.076241    76.23.247.139         128.119.245.93        hsl-storm TCP      hsl-storm > commplex-link [ACK] Seq=189901 Ack=1 Win=65535 Len=1460
    229 1514          1.076381    76.23.247.139         128.119.245.93        hsl-storm TCP      hsl-storm > commplex-link [ACK] Seq=191361 Ack=1 Win=65535 Len=1460
    230 1514          1.076573    76.23.247.139         128.119.245.93        hsl-storm TCP      hsl-storm > commplex-link [ACK] Seq=192821 Ack=1 Win=65535 Len=1460
    231 1514          1.076698    76.23.247.139         128.119.245.93        hsl-storm TCP      hsl-storm > commplex-link [ACK] Seq=194281 Ack=1 Win=65535 Len=1460
    232 946           1.076766    76.23.247.139         128.119.245.93        hsl-storm TCP      hsl-storm > commplex-link [PSH, ACK] Seq=195741 Ack=1 Win=65535 Len=892
    238 1514          1.094629    76.23.247.139         128.119.245.93        hsl-storm TCP      hsl-storm > commplex-link [ACK] Seq=196633 Ack=1 Win=65535 Len=1460
    239 1514          1.094874    76.23.247.139         128.119.245.93        hsl-storm TCP      hsl-storm > commplex-link [ACK] Seq=198093 Ack=1 Win=65535 Len=1460
    240 1514          1.094999    76.23.247.139         128.119.245.93        hsl-storm TCP      hsl-storm > commplex-link [ACK] Seq=199553 Ack=1 Win=65535 Len=1460
    241 1514          1.095128    76.23.247.139         128.119.245.93        hsl-storm TCP      hsl-storm > commplex-link [ACK] Seq=201013 Ack=1 Win=65535 Len=1460
    242 1514          1.095253    76.23.247.139         128.119.245.93        hsl-storm TCP      hsl-storm > commplex-link [ACK] Seq=202473 Ack=1 Win=65535 Len=1460
    243 946           1.095321    76.23.247.139         128.119.245.93        hsl-storm TCP      hsl-storm > commplex-link [PSH, ACK] Seq=203933 Ack=1 Win=65535 Len=892
    254 1514          1.119921    76.23.247.139         128.119.245.93        hsl-storm TCP      hsl-storm > commplex-link [ACK] Seq=204825 Ack=1 Win=65535 Len=1460
    255 1514          1.120181    76.23.247.139         128.119.245.93        hsl-storm TCP      hsl-storm > commplex-link [ACK] Seq=206285 Ack=1 Win=65535 Len=1460
    256 1514          1.120306    76.23.247.139         128.119.245.93        hsl-storm TCP      hsl-storm > commplex-link [ACK] Seq=207745 Ack=1 Win=65535 Len=1460
    257 1514          1.120555    76.23.247.139         128.119.245.93        hsl-storm TCP      hsl-storm > commplex-link [ACK] Seq=209205 Ack=1 Win=65535 Len=1460
    258 1514          1.120678    76.23.247.139         128.119.245.93        hsl-storm TCP      hsl-storm > commplex-link [ACK] Seq=210665 Ack=1 Win=65535 Len=1460
    259 946           1.120749    76.23.247.139         128.119.245.93        hsl-storm TCP      hsl-storm > commplex-link [PSH, ACK] Seq=212125 Ack=1 Win=65535 Len=892
    264 1514          1.134568    76.23.247.139         128.119.245.93        hsl-storm TCP      hsl-storm > commplex-link [ACK] Seq=213017 Ack=1 Win=65535 Len=1460
    265 1514          1.134807    76.23.247.139         128.119.245.93        hsl-storm TCP      hsl-storm > commplex-link [ACK] Seq=214477 Ack=1 Win=65535 Len=1460
    266 1514          1.134930    76.23.247.139         128.119.245.93        hsl-storm TCP      hsl-storm > commplex-link [ACK] Seq=215937 Ack=1 Win=65535 Len=1460
    267 1514          1.135059    76.23.247.139         128.119.245.93        hsl-storm TCP      hsl-storm > commplex-link [ACK] Seq=217397 Ack=1 Win=65535 Len=1460
    268 1514          1.135184    76.23.247.139         128.119.245.93        hsl-storm TCP      hsl-storm > commplex-link [ACK] Seq=218857 Ack=1 Win=65535 Len=1460
    269 946           1.135261    76.23.247.139         128.119.245.93        hsl-storm TCP      hsl-storm > commplex-link [PSH, ACK] Seq=220317 Ack=1 Win=65535 Len=892
    273 1514          1.147882    76.23.247.139         128.119.245.93        hsl-storm TCP      hsl-storm > commplex-link [ACK] Seq=221209 Ack=1 Win=65535 Len=1460
    274 1514          1.148127    76.23.247.139         128.119.245.93        hsl-storm TCP      hsl-storm > commplex-link [ACK] Seq=222669 Ack=1 Win=65535 Len=1460
    275 1514          1.148250    76.23.247.139         128.119.245.93        hsl-storm TCP      hsl-storm > commplex-link [ACK] Seq=224129 Ack=1 Win=65535 Len=1460
    276 1514          1.148378    76.23.247.139         128.119.245.93        hsl-storm TCP      hsl-storm > commplex-link [ACK] Seq=225589 Ack=1 Win=65535 Len=1460
    277 1514          1.148501    76.23.247.139         128.119.245.93        hsl-storm TCP      hsl-storm > commplex-link [ACK] Seq=227049 Ack=1 Win=65535 Len=1460
    278 946           1.148569    76.23.247.139         128.119.245.93        hsl-storm TCP      hsl-storm > commplex-link [PSH, ACK] Seq=228509 Ack=1 Win=65535 Len=892
    281 1514          1.165174    76.23.247.139         128.119.245.93        hsl-storm TCP      hsl-storm > commplex-link [ACK] Seq=229401 Ack=1 Win=65535 Len=1460
    282 1514          1.165422    76.23.247.139         128.119.245.93        hsl-storm TCP      hsl-storm > commplex-link [ACK] Seq=230861 Ack=1 Win=65535 Len=1460
    283 1514          1.165545    76.23.247.139         128.119.245.93        hsl-storm TCP      hsl-storm > commplex-link [ACK] Seq=232321 Ack=1 Win=65535 Len=1460
    284 1514          1.165704    76.23.247.139         128.119.245.93        hsl-storm TCP      hsl-storm > commplex-link [ACK] Seq=233781 Ack=1 Win=65535 Len=1460
    285 1514          1.165827    76.23.247.139         128.119.245.93        hsl-storm TCP      hsl-storm > commplex-link [ACK] Seq=235241 Ack=1 Win=65535 Len=1460
    286 946           1.165905    76.23.247.139         128.119.245.93        hsl-storm TCP      hsl-storm > commplex-link [PSH, ACK] Seq=236701 Ack=1 Win=65535 Len=892
    292 1514          1.189270    76.23.247.139         128.119.245.93        hsl-storm TCP      hsl-storm > commplex-link [ACK] Seq=237593 Ack=1 Win=65535 Len=1460
    293 1514          1.189511    76.23.247.139         128.119.245.93        hsl-storm TCP      hsl-storm > commplex-link [ACK] Seq=239053 Ack=1 Win=65535 Len=1460
    294 1514          1.189633    76.23.247.139         128.119.245.93        hsl-storm TCP      hsl-storm > commplex-link [ACK] Seq=240513 Ack=1 Win=65535 Len=1460
    295 1514          1.189785    76.23.247.139         128.119.245.93        hsl-storm TCP      hsl-storm > commplex-link [ACK] Seq=241973 Ack=1 Win=65535 Len=1460
    296 1514          1.189908    76.23.247.139         128.119.245.93        hsl-storm TCP      hsl-storm > commplex-link [ACK] Seq=243433 Ack=1 Win=65535 Len=1460
    297 946           1.189980    76.23.247.139         128.119.245.93        hsl-storm TCP      hsl-storm > commplex-link [PSH, ACK] Seq=244893 Ack=1 Win=65535 Len=892
    299 1514          1.203776    76.23.247.139         128.119.245.93        hsl-storm TCP      hsl-storm > commplex-link [ACK] Seq=245785 Ack=1 Win=65535 Len=1460
    300 1514          1.204022    76.23.247.139         128.119.245.93        hsl-storm TCP      hsl-storm > commplex-link [ACK] Seq=247245 Ack=1 Win=65535 Len=1460
    301 1514          1.204145    76.23.247.139         128.119.245.93        hsl-storm TCP      hsl-storm > commplex-link [ACK] Seq=248705 Ack=1 Win=65535 Len=1460
    302 1514          1.204282    76.23.247.139         128.119.245.93        hsl-storm TCP      hsl-storm > commplex-link [ACK] Seq=250165 Ack=1 Win=65535 Len=1460
    303 1514          1.204405    76.23.247.139         128.119.245.93        hsl-storm TCP      hsl-storm > commplex-link [ACK] Seq=251625 Ack=1 Win=65535 Len=1460
    304 946           1.204482    76.23.247.139         128.119.245.93        hsl-storm TCP      hsl-storm > commplex-link [PSH, ACK] Seq=253085 Ack=1 Win=65535 Len=892
    309 1514          1.217106    76.23.247.139         128.119.245.93        hsl-storm TCP      hsl-storm > commplex-link [ACK] Seq=253977 Ack=1 Win=65535 Len=1460
    310 1514          1.217350    76.23.247.139         128.119.245.93        hsl-storm TCP      hsl-storm > commplex-link [ACK] Seq=255437 Ack=1 Win=65535 Len=1460
    311 1514          1.217474    76.23.247.139         128.119.245.93        hsl-storm TCP      hsl-storm > commplex-link [ACK] Seq=256897 Ack=1 Win=65535 Len=1460
    312 1514          1.217601    76.23.247.139         128.119.245.93        hsl-storm TCP      hsl-storm > commplex-link [ACK] Seq=258357 Ack=1 Win=65535 Len=1460
    313 1514          1.217726    76.23.247.139         128.119.245.93        hsl-storm TCP      hsl-storm > commplex-link [ACK] Seq=259817 Ack=1 Win=65535 Len=1460
    314 946           1.217794    76.23.247.139         128.119.245.93        hsl-storm TCP      hsl-storm > commplex-link [PSH, ACK] Seq=261277 Ack=1 Win=65535 Len=892
    317 1514          1.234407    76.23.247.139         128.119.245.93        hsl-storm TCP      hsl-storm > commplex-link [ACK] Seq=262169 Ack=1 Win=65535 Len=1460
    318 1514          1.234660    76.23.247.139         128.119.245.93        hsl-storm TCP      hsl-storm > commplex-link [ACK] Seq=263629 Ack=1 Win=65535 Len=1460
    319 1514          1.234784    76.23.247.139         128.119.245.93        hsl-storm TCP      hsl-storm > commplex-link [ACK] Seq=265089 Ack=1 Win=65535 Len=1460
    320 1514          1.234923    76.23.247.139         128.119.245.93        hsl-storm TCP      hsl-storm > commplex-link [ACK] Seq=266549 Ack=1 Win=65535 Len=1460
    321 1514          1.235046    76.23.247.139         128.119.245.93        hsl-storm TCP      hsl-storm > commplex-link [ACK] Seq=268009 Ack=1 Win=65535 Len=1460
    322 946           1.235125    76.23.247.139         128.119.245.93        hsl-storm TCP      hsl-storm > commplex-link [PSH, ACK] Seq=269469 Ack=1 Win=65535 Len=892
    327 1514          1.259700    76.23.247.139         128.119.245.93        hsl-storm TCP      hsl-storm > commplex-link [ACK] Seq=270361 Ack=1 Win=65535 Len=1460
    328 1514          1.259954    76.23.247.139         128.119.245.93        hsl-storm TCP      hsl-storm > commplex-link [ACK] Seq=271821 Ack=1 Win=65535 Len=1460
    329 1514          1.260077    76.23.247.139         128.119.245.93        hsl-storm TCP      hsl-storm > commplex-link [ACK] Seq=273281 Ack=1 Win=65535 Len=1460
    330 1514          1.260281    76.23.247.139         128.119.245.93        hsl-storm TCP      hsl-storm > commplex-link [ACK] Seq=274741 Ack=1 Win=65535 Len=1460
    331 1514          1.260407    76.23.247.139         128.119.245.93        hsl-storm TCP      hsl-storm > commplex-link [ACK] Seq=276201 Ack=1 Win=65535 Len=1460
    332 946           1.260479    76.23.247.139         128.119.245.93        hsl-storm TCP      hsl-storm > commplex-link [PSH, ACK] Seq=277661 Ack=1 Win=65535 Len=892
    338 1514          1.275679    76.23.247.139         128.119.245.93        hsl-storm TCP      hsl-storm > commplex-link [ACK] Seq=278553 Ack=1 Win=65535 Len=1460
    339 1514          1.275936    76.23.247.139         128.119.245.93        hsl-storm TCP      hsl-storm > commplex-link [ACK] Seq=280013 Ack=1 Win=65535 Len=1460
    340 1514          1.276058    76.23.247.139         128.119.245.93        hsl-storm TCP      hsl-storm > commplex-link [ACK] Seq=281473 Ack=1 Win=65535 Len=1460
    341 1514          1.276248    76.23.247.139         128.119.245.93        hsl-storm TCP      hsl-storm > commplex-link [ACK] Seq=282933 Ack=1 Win=65535 Len=1460
    342 1514          1.276387    76.23.247.139         128.119.245.93        hsl-storm TCP      hsl-storm > commplex-link [ACK] Seq=284393 Ack=1 Win=65535 Len=1460
    343 946           1.276452    76.23.247.139         128.119.245.93        hsl-storm TCP      hsl-storm > commplex-link [PSH, ACK] Seq=285853 Ack=1 Win=65535 Len=892
    350 1514          1.299648    76.23.247.139         128.119.245.93        hsl-storm TCP      hsl-storm > commplex-link [ACK] Seq=286745 Ack=1 Win=65535 Len=1460
    351 1514          1.299907    76.23.247.139         128.119.245.93        hsl-storm TCP      hsl-storm > commplex-link [ACK] Seq=288205 Ack=1 Win=65535 Len=1460
    352 1514          1.300032    76.23.247.139         128.119.245.93        hsl-storm TCP      hsl-storm > commplex-link [ACK] Seq=289665 Ack=1 Win=65535 Len=1460
    353 1514          1.300161    76.23.247.139         128.119.245.93        hsl-storm TCP      hsl-storm > commplex-link [ACK] Seq=291125 Ack=1 Win=65535 Len=1460
    354 1514          1.300324    76.23.247.139         128.119.245.93        hsl-storm TCP      hsl-storm > commplex-link [ACK] Seq=292585 Ack=1 Win=65535 Len=1460
    355 946           1.300398    76.23.247.139         128.119.245.93        hsl-storm TCP      hsl-storm > commplex-link [PSH, ACK] Seq=294045 Ack=1 Win=65535 Len=892
    359 1514          1.311624    76.23.247.139         128.119.245.93        hsl-storm TCP      hsl-storm > commplex-link [ACK] Seq=294937 Ack=1 Win=65535 Len=1460
    360 1514          1.311869    76.23.247.139         128.119.245.93        hsl-storm TCP      hsl-storm > commplex-link [ACK] Seq=296397 Ack=1 Win=65535 Len=1460
    361 1514          1.311994    76.23.247.139         128.119.245.93        hsl-storm TCP      hsl-storm > commplex-link [ACK] Seq=297857 Ack=1 Win=65535 Len=1460
    362 1514          1.312134    76.23.247.139         128.119.245.93        hsl-storm TCP      hsl-storm > commplex-link [ACK] Seq=299317 Ack=1 Win=65535 Len=1460
    363 1514          1.312259    76.23.247.139         128.119.245.93        hsl-storm TCP      hsl-storm > commplex-link [ACK] Seq=300777 Ack=1 Win=65535 Len=1460
    364 946           1.312338    76.23.247.139         128.119.245.93        hsl-storm TCP      hsl-storm > commplex-link [PSH, ACK] Seq=302237 Ack=1 Win=65535 Len=892
    368 1514          1.327596    76.23.247.139         128.119.245.93        hsl-storm TCP      hsl-storm > commplex-link [ACK] Seq=303129 Ack=1 Win=65535 Len=1460
    369 1514          1.327842    76.23.247.139         128.119.245.93        hsl-storm TCP      hsl-storm > commplex-link [ACK] Seq=304589 Ack=1 Win=65535 Len=1460
    370 1514          1.327967    76.23.247.139         128.119.245.93        hsl-storm TCP      hsl-storm > commplex-link [ACK] Seq=306049 Ack=1 Win=65535 Len=1460
    371 1514          1.328106    76.23.247.139         128.119.245.93        hsl-storm TCP      hsl-storm > commplex-link [ACK] Seq=307509 Ack=1 Win=65535 Len=1460
    372 1514          1.328230    76.23.247.139         128.119.245.93        hsl-storm TCP      hsl-storm > commplex-link [ACK] Seq=308969 Ack=1 Win=65535 Len=1460
    373 946           1.328309    76.23.247.139         128.119.245.93        hsl-storm TCP      hsl-storm > commplex-link [PSH, ACK] Seq=310429 Ack=1 Win=65535 Len=892
    379 1514          1.352895    76.23.247.139         128.119.245.93        hsl-storm TCP      hsl-storm > commplex-link [ACK] Seq=311321 Ack=1 Win=65535 Len=1460
    380 1514          1.353141    76.23.247.139         128.119.245.93        hsl-storm TCP      hsl-storm > commplex-link [ACK] Seq=312781 Ack=1 Win=65535 Len=1460
    381 1514          1.353281    76.23.247.139         128.119.245.93        hsl-storm TCP      hsl-storm > commplex-link [ACK] Seq=314241 Ack=1 Win=65535 Len=1460
    382 1514          1.353484    76.23.247.139         128.119.245.93        hsl-storm TCP      hsl-storm > commplex-link [ACK] Seq=315701 Ack=1 Win=65535 Len=1460
    383 1514          1.353609    76.23.247.139         128.119.245.93        hsl-storm TCP      hsl-storm > commplex-link [ACK] Seq=317161 Ack=1 Win=65535 Len=1460
    384 946           1.353688    76.23.247.139         128.119.245.93        hsl-storm TCP      hsl-storm > commplex-link [PSH, ACK] Seq=318621 Ack=1 Win=65535 Len=892
    387 1514          1.368853    76.23.247.139         128.119.245.93        hsl-storm TCP      hsl-storm > commplex-link [ACK] Seq=319513 Ack=1 Win=65535 Len=1460
    388 1514          1.369161    76.23.247.139         128.119.245.93        hsl-storm TCP      hsl-storm > commplex-link [ACK] Seq=320973 Ack=1 Win=65535 Len=1460
    389 1514          1.369296    76.23.247.139         128.119.245.93        hsl-storm TCP      hsl-storm > commplex-link [ACK] Seq=322433 Ack=1 Win=65535 Len=1460
    390 1514          1.369419    76.23.247.139         128.119.245.93        hsl-storm TCP      hsl-storm > commplex-link [ACK] Seq=323893 Ack=1 Win=65535 Len=1460
    391 1514          1.369544    76.23.247.139         128.119.245.93        hsl-storm TCP      hsl-storm > commplex-link [ACK] Seq=325353 Ack=1 Win=65535 Len=1460
