      1 62            0.000000    76.23.247.139         128.119.245.93        ergolight TCP      ergolight > commplex-link [SYN] Seq=0 Win=65535 Len=0 MSS=1460 SACK_PERM=1
      3 60            0.015954    76.23.247.139         128.119.245.93        ergolight TCP      ergolight > commplex-link [ACK] Seq=1 Ack=1 Win=65535 Len=0
      4 78            0.018181    76.23.247.139         128.119.245.93        ergolight TCP      ergolight > commplex-link [PSH, ACK] Seq=1 Ack=1 Win=65535 Len=24
      5 1514          0.019540    76.23.247.139         128.119.245.93        ergolight TCP      ergolight > commplex-link [ACK] Seq=25 Ack=1 Win=65535 Len=1460
      7 1514          0.036287    76.23.247.139         128.119.245.93        ergolight TCP      ergolight > commplex-link [ACK] Seq=1485 Ack=1 Win=65535 Len=1460
      8 1514          0.036481    76.23.247.139         128.119.245.93        ergolight TCP      ergolight > commplex-link [ACK] Seq=2945 Ack=1 Win=65535 Len=1460
     10 1514          0.042926    76.23.247.139         128.119.245.93        ergolight TCP      ergolight > commplex-link [ACK] Seq=4405 Ack=1 Win=65535 Len=1460
     11 1514          0.043122    76.23.247.139         128.119.245.93        ergolight TCP      ergolight > commplex-link [ACK] Seq=5865 Ack=1 Win=65535 Len=1460
     14 1514          0.052289    76.23.247.139         128.119.245.93        ergolight TCP      ergolight > commplex-link [PSH, ACK] Seq=7325 Ack=1 Win=65535 Len=1460
     15 1514          0.052491    76.23.247.139         128.119.245.93        ergolight TCP      ergolight > commplex-link [ACK] Seq=8785 Ack=1 Win=65535 Len=1460
     16 1514          0.052620    76.23.247.139         128.119.245.93        ergolight TCP      ergolight > commplex-link [ACK] Seq=10245 Ack=1 Win=65535 Len=1460
     17 1514          0.052768    76.23.247.139         128.119.245.93        ergolight TCP      ergolight > commplex-link [ACK] Seq=11705 Ack=1 Win=65535 Len=1460
     20 1514          0.060264    76.23.247.139         128.119.245.93        ergolight TCP      ergolight > commplex-link [ACK] Seq=13165 Ack=1 Win=65535 Len=1460
     21 1514          0.060461    76.23.247.139         128.119.245.93        ergolight TCP      ergolight > commplex-link [ACK] Seq=14625 Ack=1 Win=65535 Len=1460
     22 1514          0.060574    76.23.247.139         128.119.245.93        ergolight TCP      ergolight > commplex-link [PSH, ACK] Seq=16085 Ack=1 Win=65535 Len=1460
     23 1514          0.060720    76.23.247.139         128.119.245.93        ergolight TCP      ergolight > commplex-link [ACK] Seq=17545 Ack=1 Win=65535 Len=1460
     26 1514          0.068257    76.23.247.139         128.119.245.93        ergolight TCP      ergolight > commplex-link [ACK] Seq=19005 Ack=1 Win=65535 Len=1460
     27 1514          0.068451    76.23.247.139         128.119.245.93        ergolight TCP      ergolight > commplex-link [ACK] Seq=20465 Ack=1 Win=65535 Len=1460
     28 1514          0.068574    76.23.247.139         128.119.245.93        ergolight TCP      ergolight > commplex-link [ACK] Seq=21925 Ack=1 Win=65535 Len=1460
     29 1270          0.068679    76.23.247.139         128.119.245.93        ergolight TCP      ergolight > commplex-link [PSH, ACK] Seq=23385 Ack=1 Win=65535 Len=1216
     32 1514          0.077562    76.23.247.139         128.119.245.93        ergolight TCP      ergolight > commplex-link [ACK] Seq=24601 Ack=1 Win=65535 Len=1460
     34 1514          0.077822    76.23.247.139         128.119.245.93        ergolight TCP      ergolight > commplex-link [ACK] Seq=26061 Ack=1 Win=65535 Len=1460
     37 1514          0.078983    76.23.247.139         128.119.245.93        ergolight TCP      ergolight > commplex-link [ACK] Seq=27521 Ack=1 Win=65535 Len=1460
     38 1514          0.079104    76.23.247.139         128.119.245.93        ergolight TCP      ergolight > commplex-link [ACK] Seq=28981 Ack=1 Win=65535 Len=1460
     39 1514          0.079269    76.23.247.139         128.119.245.93        ergolight TCP      ergolight > commplex-link [ACK] Seq=30441 Ack=1 Win=65535 Len=1460
     40 946           0.079344    76.23.247.139         128.119.245.93        ergolight TCP      ergolight > commplex-link [PSH, ACK] Seq=31901 Ack=1 Win=65535 Len=892
     41 1514          0.080389    76.23.247.139         128.119.245.93        ergolight TCP      ergolight > commplex-link [ACK] Seq=32793 Ack=1 Win=65535 Len=1460
     42 1514          0.080621    76.23.247.139         128.119.245.93        ergolight TCP      ergolight > commplex-link [ACK] Seq=34253 Ack=1 Win=65535 Len=1460
     43 1514          0.080744    76.23.247.139         128.119.245.93        ergolight TCP      ergolight > commplex-link [ACK] Seq=35713 Ack=1 Win=65535 Len=1460
     44 1514          0.080865    76.23.247.139         128.119.245.93        ergolight TCP      ergolight > commplex-link [ACK] Seq=37173 Ack=1 Win=65535 Len=1460
     46 1514          0.097533    76.23.247.139         128.119.245.93        ergolight TCP      ergolight > commplex-link [ACK] Seq=38633 Ack=1 Win=65535 Len=1460
     47 946           0.097608    76.23.247.139         128.119.245.93        ergolight TCP      ergolight > commplex-link [PSH, ACK] Seq=40093 Ack=1 Win=65535 Len=892
     53 1514          0.105547    76.23.247.139         128.119.245.93        ergolight TCP      ergolight > commplex-link [ACK] Seq=40985 Ack=1 Win=65535 Len=1460
     54 1514          0.105797    76.23.247.139         128.119.245.93        ergolight TCP      ergolight > commplex-link [ACK] Seq=42445 Ack=1 Win=65535 Len=1460
     55 1514          0.105922    76.23.247.139         128.119.245.93        ergolight TCP      ergolight > commplex-link [ACK] Seq=43905 Ack=1 Win=65535 Len=1460
     56 1514          0.106057    76.23.247.139         128.119.245.93        ergolight TCP      ergolight > commplex-link [ACK] Seq=45365 Ack=1 Win=65535 Len=1460
     57 1514          0.106193    76.23.247.139         128.119.245.93        ergolight TCP      ergolight > commplex-link [ACK] Seq=46825 Ack=1 Win=65535 Len=1460
     58 946           0.106260    76.23.247.139         128.119.245.93        ergolight TCP      ergolight > commplex-link [PSH, ACK] Seq=48285 Ack=1 Win=65535 Len=892
     65 1514          0.124193    76.23.247.139         128.119.245.93        ergolight TCP      ergolight > commplex-link [ACK] Seq=49177 Ack=1 Win=65535 Len=1460
     66 1514          0.124438    76.23.247.139         128.119.245.93        ergolight TCP      ergolight > commplex-link [ACK] Seq=50637 Ack=1 Win=65535 Len=1460
     67 1514          0.124561    76.23.247.139         128.119.245.93        ergolight TCP      ergolight > commplex-link [ACK] Seq=52097 Ack=1 Win=65535 Len=1460
     68 1514          0.124699    76.23.247.139         128.119.245.93        ergolight TCP      ergolight > commplex-link [ACK] Seq=53557 Ack=1 Win=65535 Len=1460
     69 1514          0.124813    76.23.247.139         128.119.245.93        ergolight TCP      ergolight > commplex-link [ACK] Seq=55017 Ack=1 Win=65535 Len=1460
     70 946           0.124891    76.23.247.139         128.119.245.93        ergolight TCP      ergolight > commplex-link [PSH, ACK] Seq=56477 Ack=1 Win=65535 Len=892
     77 1514          0.144168    76.23.247.139         128.119.245.93        ergolight TCP      ergolight > commplex-link [ACK] Seq=57369 Ack=1 Win=65535 Len=1460
     78 1514          0.144489    76.23.247.139         128.119.245.93        ergolight TCP      ergolight > commplex-link [ACK] Seq=58829 Ack=1 Win=65535 Len=1460
     79 1514          0.144613    76.23.247.139         128.119.245.93        ergolight TCP      ergolight > commplex-link [ACK] Seq=60289 Ack=1 Win=65535 Len=1460
     80 1514          0.144737    76.23.247.139         128.119.245.93        ergolight TCP      ergolight > commplex-link [ACK] Seq=61749 Ack=1 Win=65535 Len=1460
     81 1514          0.144864    76.23.247.139         128.119.245.93        ergolight TCP      ergolight > commplex-link [ACK] Seq=63209 Ack=1 Win=65535 Len=1460
     82 946           0.144942    76.23.247.139         128.119.245.93        ergolight TCP      ergolight > commplex-link [PSH, ACK] Seq=64669 Ack=1 Win=65535 Len=892
     84 1514          0.160126    76.23.247.139         128.119.245.93        ergolight TCP      ergolight > commplex-link [ACK] Seq=65561 Ack=1 Win=65535 Len=1460
     85 1514          0.160376    76.23.247.139         128.119.245.93        ergolight TCP      ergolight > commplex-link [ACK] Seq=67021 Ack=1 Win=65535 Len=1460
     86 1514          0.160498    76.23.247.139         128.119.245.93        ergolight TCP      ergolight > commplex-link [ACK] Seq=68481 Ack=1 Win=65535 Len=1460
     87 1514          0.160654    76.23.247.139         128.119.245.93        ergolight TCP      ergolight > commplex-link [ACK] Seq=69941 Ack=1 Win=65535 Len=1460
     88 1514          0.160773    76.23.247.139         128.119.245.93        ergolight TCP      ergolight > commplex-link [ACK] Seq=71401 Ack=1 Win=65535 Len=1460
     89 946           0.160851    76.23.247.139         128.119.245.93        ergolight TCP      ergolight > commplex-link [PSH, ACK] Seq=72861 Ack=1 Win=65535 Len=892
     94 1514          0.176115    76.23.247.139         128.119.245.93        ergolight TCP      ergolight > commplex-link [ACK] Seq=73753 Ack=1 Win=65535 Len=1460
     95 1514          0.176361    76.23.247.139         128.119.245.93        ergolight TCP      ergolight > commplex-link [ACK] Seq=75213 Ack=1 Win=65535 Len=1460
     96 1514          0.176514    76.23.247.139         128.119.245.93        ergolight TCP      ergolight > commplex-link [ACK] Seq=76673 Ack=1 Win=65535 Len=1460
     97 1514          0.176692    76.23.247.139         128.119.245.93        ergolight TCP      ergolight > commplex-link [ACK] Seq=78133 Ack=1 Win=65535 Len=1460
     98 1514          0.176815    76.23.247.139         128.119.245.93        ergolight TCP      ergolight > commplex-link [ACK] Seq=79593 Ack=1 Win=65535 Len=1460
     99 946           0.176895    76.23.247.139         128.119.245.93        ergolight TCP      ergolight > commplex-link [PSH, ACK] Seq=81053 Ack=1 Win=65535 Len=892
    102 1514          0.197406    76.23.247.139         128.119.245.93        ergolight TCP      ergolight > commplex-link [ACK] Seq=81945 Ack=1 Win=65535 Len=1460
    103 1514          0.197651    76.23.247.139         128.119.245.93        ergolight TCP      ergolight > commplex-link [ACK] Seq=83405 Ack=1 Win=65535 Len=1460
    104 1514          0.197774    76.23.247.139         128.119.245.93        ergolight TCP      ergolight > commplex-link [ACK] Seq=84865 Ack=1 Win=65535 Len=1460
    105 1514          0.197921    76.23.247.139         128.119.245.93        ergolight TCP      ergolight > commplex-link [ACK] Seq=86325 Ack=1 Win=65535 Len=1460
    106 1514          0.198045    76.23.247.139         128.119.245.93        ergolight TCP      ergolight > commplex-link [ACK] Seq=87785 Ack=1 Win=65535 Len=1460
    107 946           0.198126    76.23.247.139         128.119.245.93        ergolight TCP      ergolight > commplex-link [PSH, ACK] Seq=89245 Ack=1 Win=65535 Len=892
    111 1514          0.208050    76.23.247.139         128.119.245.93        ergolight TCP      ergolight > commplex-link [ACK] Seq=90137 Ack=1 Win=65535 Len=1460
    112 1514          0.208300    76.23.247.139         128.119.245.93        ergolight TCP      ergolight > commplex-link [ACK] Seq=91597 Ack=1 Win=65535 Len=1460
    113 1514          0.208423    76.23.247.139         128.119.245.93        ergolight TCP      ergolight > commplex-link [ACK] Seq=93057 Ack=1 Win=65535 Len=1460
    114 1514          0.208564    76.23.247.139         128.119.245.93        ergolight TCP      ergolight > commplex-link [ACK] Seq=94517 Ack=1 Win=65535 Len=1460
    115 1514          0.208683    76.23.247.139         128.119.245.93        ergolight TCP      ergolight > commplex-link [ACK] Seq=95977 Ack=1 Win=65535 Len=1460
    116 946           0.208761    76.23.247.139         128.119.245.93        ergolight TCP      ergolight > commplex-link [PSH, ACK] Seq=97437 Ack=1 Win=65535 Len=892
    122 1514          0.240032    76.23.247.139         128.119.245.93        ergolight TCP      ergolight > commplex-link [ACK] Seq=98329 Ack=1 Win=65535 Len=1460
    123 1514          0.240275    76.23.247.139         128.119.245.93        ergolight TCP      ergolight > commplex-link [ACK] Seq=99789 Ack=1 Win=65535 Len=1460
    124 1514          0.240398    76.23.247.139         128.119.245.93        ergolight TCP      ergolight > commplex-link [ACK] Seq=101249 Ack=1 Win=65535 Len=1460
    125 1514          0.240550    76.23.247.139         128.119.245.93        ergolight TCP      ergolight > commplex-link [ACK] Seq=102709 Ack=1 Win=65535 Len=1460
    126 1514          0.240673    76.23.247.139         128.119.245.93        ergolight TCP      ergolight > commplex-link [ACK] Seq=104169 Ack=1 Win=65535 Len=1460
    127 946           0.240751    76.23.247.139         128.119.245.93        ergolight TCP      ergolight > commplex-link [PSH, ACK] Seq=105629 Ack=1 Win=65535 Len=892
    129 1514          0.250778    76.23.247.139         128.119.245.93        ergolight TCP      ergolight > commplex-link [ACK] Seq=106521 Ack=1 Win=65535 Len=1460
    130 1514          0.250921    76.23.247.139         128.119.245.93        ergolight TCP      ergolight > commplex-link [ACK] Seq=107981 Ack=1 Win=65535 Len=1460
    131 1514          0.251084    76.23.247.139         128.119.245.93        ergolight TCP      ergolight > commplex-link [ACK] Seq=109441 Ack=1 Win=65535 Len=1460
    133 1514          0.251300    76.23.247.139         128.119.245.93        ergolight TCP      ergolight > commplex-link [ACK] Seq=110901 Ack=1 Win=65535 Len=1460
    134 1514          0.251423    76.23.247.139         128.119.245.93        ergolight TCP      ergolight > commplex-link [ACK] Seq=112361 Ack=1 Win=65535 Len=1460
    135 946           0.251502    76.23.247.139         128.119.245.93        ergolight TCP      ergolight > commplex-link [PSH, ACK] Seq=113821 Ack=1 Win=65535 Len=892
    138 1514          0.266638    76.23.247.139         128.119.245.93        ergolight TCP      ergolight > commplex-link [ACK] Seq=114713 Ack=1 Win=65535 Len=1460
    139 1514          0.266882    76.23.247.139         128.119.245.93        ergolight TCP      ergolight > commplex-link [ACK] Seq=116173 Ack=1 Win=65535 Len=1460
    140 1514          0.267005    76.23.247.139         128.119.245.93        ergolight TCP      ergolight > commplex-link [ACK] Seq=117633 Ack=1 Win=65535 Len=1460
    141 1514          0.267141    76.23.247.139         128.119.245.93        ergolight TCP      ergolight > commplex-link [ACK] Seq=119093 Ack=1 Win=65535 Len=1460
    142 1514          0.267264    76.23.247.139         128.119.245.93        ergolight TCP      ergolight > commplex-link [ACK] Seq=120553 Ack=1 Win=65535 Len=1460
    143 946           0.267336    76.23.247.139         128.119.245.93        ergolight TCP      ergolight > commplex-link [PSH, ACK] Seq=122013 Ack=1 Win=65535 Len=892
    149 1514          0.286596    76.23.247.139         128.119.245.93        ergolight TCP      ergolight > commplex-link [ACK] Seq=122905 Ack=1 Win=65535 Len=1460
    150 1514          0.286871    76.23.247.139         128.119.245.93        ergolight TCP      ergolight > commplex-link [ACK] Seq=124365 Ack=1 Win=65535 Len=1460
    151 1514          0.286984    76.23.247.139         128.119.245.93        ergolight TCP      ergolight > commplex-link [ACK] Seq=125825 Ack=1 Win=65535 Len=1460
    152 1514          0.287244    76.23.247.139         128.119.245.93        ergolight TCP      ergolight > commplex-link [ACK] Seq=127285 Ack=1 Win=65535 Len=1460
    153 1514          0.287368    76.23.247.139         128.119.245.93        ergolight TCP      ergolight > commplex-link [ACK] Seq=128745 Ack=1 Win=65535 Len=1460
    154 946           0.287446    76.23.247.139         128.119.245.93        ergolight TCP      ergolight > commplex-link [PSH, ACK] Seq=130205 Ack=1 Win=65535 Len=892
    160 1514          0.305243    76.23.247.139         128.119.245.93        ergolight TCP      ergolight > commplex-link [ACK] Seq=131097 Ack=1 Win=65535 Len=1460
    161 1514          0.305489    76.23.247.139         128.119.245.93        ergolight TCP      ergolight > commplex-link [ACK] Seq=132557 Ack=1 Win=65535 Len=1460
    162 1514          0.305613    76.23.247.139         128.119.245.93        ergolight TCP      ergolight > commplex-link [ACK] Seq=134017 Ack=1 Win=65535 Len=1460
    163 1514          0.305746    76.23.247.139         128.119.245.93        ergolight TCP      ergolight > commplex-link [ACK] Seq=135477 Ack=1 Win=65535 Len=1460
    164 1514          0.305869    76.23.247.139         128.119.245.93        ergolight TCP      ergolight > commplex-link [ACK] Seq=136937 Ack=1 Win=65535 Len=1460
    165 946           0.305949    76.23.247.139         128.119.245.93        ergolight TCP      ergolight > commplex-link [PSH, ACK] Seq=138397 Ack=1 Win=65535 Len=892
    171 1514          0.314567    76.23.247.139         128.119.245.93        ergolight TCP      ergolight > commplex-link [ACK] Seq=139289 Ack=1 Win=65535 Len=1460
    172 1514          0.314808    76.23.247.139         128.119.245.93        ergolight TCP      ergolight > commplex-link [ACK] Seq=140749 Ack=1 Win=65535 Len=1460
    173 1514          0.314931    76.23.247.139         128.119.245.93        ergolight TCP      ergolight > commplex-link [ACK] Seq=142209 Ack=1 Win=65535 Len=1460
    174 1514          0.315078    76.23.247.139         128.119.245.93        ergolight TCP      ergolight > commplex-link [ACK] Seq=143669 Ack=1 Win=65535 Len=1460
    175 1514          0.315201    76.23.247.139         128.119.245.93        ergolight TCP      ergolight > commplex-link [ACK] Seq=145129 Ack=1 Win=65535 Len=1460
    176 946           0.315279    76.23.247.139         128.119.245.93        ergolight TCP      ergolight > commplex-link [PSH, ACK] Seq=146589 Ack=1 Win=65535 Len=892
    182 1514          0.333200    76.23.247.139         128.119.245.93        ergolight TCP      ergolight > commplex-link [ACK] Seq=147481 Ack=1 Win=65535 Len=1460
    183 1514          0.333448    76.23.247.139         128.119.245.93        ergolight TCP      ergolight > commplex-link [ACK] Seq=148941 Ack=1 Win=65535 Len=1460
    184 1514          0.333570    76.23.247.139         128.119.245.93        ergolight TCP      ergolight > commplex-link [ACK] Seq=150401 Ack=1 Win=65535 Len=1460
    185 1514          0.333709    76.23.247.139         128.119.245.93        ergolight TCP      ergolight > commplex-link [ACK] Seq=151861 Ack=1 Win=65535 Len=1460
    186 1514          0.333832    76.23.247.139         128.119.245.93        ergolight TCP      ergolight > commplex-link [ACK] Seq=153321 Ack=1 Win=65535 Len=1460
    187 946           0.333911    76.23.247.139         128.119.245.93        ergolight TCP      ergolight > commplex-link [PSH, ACK] Seq=154781 Ack=1 Win=65535 Len=892
    192 1514          0.355824    76.23.247.139         128.119.245.93        ergolight TCP      ergolight > commplex-link [ACK] Seq=155673 Ack=1 Win=65535 Len=1460
    193 1514          0.356065    76.23.247.139         128.119.245.93        ergolight TCP      ergolight > commplex-link [ACK] Seq=157133 Ack=1 Win=65535 Len=1460
    194 1514          0.356201    76.23.247.139         128.119.245.93        ergolight TCP      ergolight > commplex-link [ACK] Seq=158593 Ack=1 Win=65535 Len=1460
    195 1514          0.356333    76.23.247.139         128.119.245.93        ergolight TCP      ergolight > commplex-link [ACK] Seq=160053 Ack=1 Win=65535 Len=1460
    196 1514          0.356455    76.23.247.139         128.119.245.93        ergolight TCP      ergolight > commplex-link [ACK] Seq=161513 Ack=1 Win=65535 Len=1460
    197 946           0.356533    76.23.247.139         128.119.245.93        ergolight TCP      ergolight > commplex-link [PSH, ACK] Seq=162973 Ack=1 Win=65535 Len=892
    201 1514          0.373149    76.23.247.139         128.119.245.93        ergolight TCP      ergolight > commplex-link [ACK] Seq=163865 Ack=1 Win=65535 Len=1460
    202 1514          0.373398    76.23.247.139         128.119.245.93        ergolight TCP      ergolight > commplex-link [ACK] Seq=165325 Ack=1 Win=65535 Len=1460
    203 1514          0.373521    76.23.247.139         128.119.245.93        ergolight TCP      ergolight > commplex-link [ACK] Seq=166785 Ack=1 Win=65535 Len=1460
    204 1514          0.373658    76.23.247.139         128.119.245.93        ergolight TCP      ergolight > commplex-link [ACK] Seq=168245 Ack=1 Win=65535 Len=1460
    205 1514          0.373784    76.23.247.139         128.119.245.93        ergolight TCP      ergolight > commplex-link [ACK] Seq=169705 Ack=1 Win=65535 Len=1460
    206 946           0.373857    76.23.247.139         128.119.245.93        ergolight TCP      ergolight > commplex-link [PSH, ACK] Seq=171165 Ack=1 Win=65535 Len=892
    210 1514          0.389238    76.23.247.139         128.119.245.93        ergolight TCP      ergolight > commplex-link [ACK] Seq=172057 Ack=1 Win=65535 Len=1460
    211 1514          0.389361    76.23.247.139         128.119.245.93        ergolight TCP      ergolight > commplex-link [ACK] Seq=173517 Ack=1 Win=65535 Len=1460
    212 1514          0.389473    76.23.247.139         128.119.245.93        ergolight TCP      ergolight > commplex-link [ACK] Seq=174977 Ack=1 Win=65535 Len=1460
    213 1514          0.389596    76.23.247.139         128.119.245.93        ergolight TCP      ergolight > commplex-link [ACK] Seq=176437 Ack=1 Win=65535 Len=1460
    214 1514          0.389776    76.23.247.139         128.119.245.93        ergolight TCP      ergolight > commplex-link [ACK] Seq=177897 Ack=1 Win=65535 Len=1460
    215 946           0.389845    76.23.247.139         128.119.245.93        ergolight TCP      ergolight > commplex-link [PSH, ACK] Seq=179357 Ack=1 Win=65535 Len=892
    218 1514          0.401215    76.23.247.139         128.119.245.93        ergolight TCP      ergolight > commplex-link [ACK] Seq=180249 Ack=1 Win=65535 Len=1460
    219 1514          0.401332    76.23.247.139         128.119.245.93        ergolight TCP      ergolight > commplex-link [ACK] Seq=181709 Ack=1 Win=65535 Len=1460
    220 1514          0.401455    76.23.247.139         128.119.245.93        ergolight TCP      ergolight > commplex-link [ACK] Seq=183169 Ack=1 Win=65535 Len=1460
    221 1514          0.401578    76.23.247.139         128.119.245.93        ergolight TCP      ergolight > commplex-link [ACK] Seq=184629 Ack=1 Win=65535 Len=1460
    222 1514          0.401737    76.23.247.139         128.119.245.93        ergolight TCP      ergolight > commplex-link [ACK] Seq=186089 Ack=1 Win=65535 Len=1460
    223 946           0.401818    76.23.247.139         128.119.245.93        ergolight TCP      ergolight > commplex-link [PSH, ACK] Seq=187549 Ack=1 Win=65535 Len=892
    227 1514          0.418391    76.23.247.139         128.119.245.93        ergolight TCP      ergolight > commplex-link [ACK] Seq=188441 Ack=1 Win=65535 Len=1460
    228 1514          0.418637    76.23.247.139         128.119.245.93        ergolight TCP      ergolight > commplex-link [ACK] Seq=189901 Ack=1 Win=65535 Len=1460
    229 1514          0.418759    76.23.247.139         128.119.245.93        ergolight TCP      ergolight > commplex-link [ACK] Seq=191361 Ack=1 Win=65535 Len=1460
    230 1514          0.418896    76.23.247.139         128.119.245.93        ergolight TCP      ergolight > commplex-link [ACK] Seq=192821 Ack=1 Win=65535 Len=1460
    231 1514          0.419019    76.23.247.139         128.119.245.93        ergolight TCP      ergolight > commplex-link [ACK] Seq=194281 Ack=1 Win=65535 Len=1460
    232 946           0.419097    76.23.247.139         128.119.245.93        ergolight TCP      ergolight > commplex-link [PSH, ACK] Seq=195741 Ack=1 Win=65535 Len=892
    240 1514          0.450351    76.23.247.139         128.119.245.93        ergolight TCP      ergolight > commplex-link [ACK] Seq=196633 Ack=1 Win=65535 Len=1460
    241 1514          0.450612    76.23.247.139         128.119.245.93        ergolight TCP      ergolight > commplex-link [ACK] Seq=198093 Ack=1 Win=65535 Len=1460
    242 1514          0.450735    76.23.247.139         128.119.245.93        ergolight TCP      ergolight > commplex-link [ACK] Seq=199553 Ack=1 Win=65535 Len=1460
    243 1514          0.451057    76.23.247.139         128.119.245.93        ergolight TCP      ergolight > commplex-link [ACK] Seq=201013 Ack=1 Win=65535 Len=1460
    244 1514          0.451181    76.23.247.139         128.119.245.93        ergolight TCP      ergolight > commplex-link [ACK] Seq=202473 Ack=1 Win=65535 Len=1460
    245 946           0.451260    76.23.247.139         128.119.245.93        ergolight TCP      ergolight > commplex-link [PSH, ACK] Seq=203933 Ack=1 Win=65535 Len=892
    251 1514          0.462456    76.23.247.139         128.119.245.93        ergolight TCP      ergolight > commplex-link [ACK] Seq=204825 Ack=1 Win=65535 Len=1460
    252 1514          0.462578    76.23.247.139         128.119.245.93        ergolight TCP      ergolight > commplex-link [ACK] Seq=206285 Ack=1 Win=65535 Len=1460
    253 1514          0.462697    76.23.247.139         128.119.245.93        ergolight TCP      ergolight > commplex-link [ACK] Seq=207745 Ack=1 Win=65535 Len=1460
    254 1514          0.462855    76.23.247.139         128.119.245.93        ergolight TCP      ergolight > commplex-link [ACK] Seq=209205 Ack=1 Win=65535 Len=1460
    255 1514          0.462978    76.23.247.139         128.119.245.93        ergolight TCP      ergolight > commplex-link [ACK] Seq=210665 Ack=1 Win=65535 Len=1460
    256 946           0.463056    76.23.247.139         128.119.245.93        ergolight TCP      ergolight > commplex-link [PSH, ACK] Seq=212125 Ack=1 Win=65535 Len=892
    259 1514          0.480970    76.23.247.139         128.119.245.93        ergolight TCP      ergolight > commplex-link [ACK] Seq=213017 Ack=1 Win=65535 Len=1460
    260 1514          0.481290    76.23.247.139         128.119.245.93        ergolight TCP      ergolight > commplex-link [ACK] Seq=214477 Ack=1 Win=65535 Len=1460
    261 1514          0.481413    76.23.247.139         128.119.245.93        ergolight TCP      ergolight > commplex-link [ACK] Seq=215937 Ack=1 Win=65535 Len=1460
    262 1514          0.481580    76.23.247.139         128.119.245.93        ergolight TCP      ergolight > commplex-link [ACK] Seq=217397 Ack=1 Win=65535 Len=1460
    263 1514          0.481707    76.23.247.139         128.119.245.93        ergolight TCP      ergolight > commplex-link [ACK] Seq=218857 Ack=1 Win=65535 Len=1460
    264 946           0.481786    76.23.247.139         128.119.245.93        ergolight TCP      ergolight > commplex-link [PSH, ACK] Seq=220317 Ack=1 Win=65535 Len=892
    269 1514          0.507599    76.23.247.139         128.119.245.93        ergolight TCP      ergolight > commplex-link [ACK] Seq=221209 Ack=1 Win=65535 Len=1460
    270 1514          0.507844    76.23.247.139         128.119.245.93        ergolight TCP      ergolight > commplex-link [ACK] Seq=222669 Ack=1 Win=65535 Len=1460
    271 1514          0.507984    76.23.247.139         128.119.245.93        ergolight TCP      ergolight > commplex-link [ACK] Seq=224129 Ack=1 Win=65535 Len=1460
    272 1514          0.508176    76.23.247.139         128.119.245.93        ergolight TCP      ergolight > commplex-link [ACK] Seq=225589 Ack=1 Win=65535 Len=1460
    273 1514          0.508304    76.23.247.139         128.119.245.93        ergolight TCP      ergolight > commplex-link [ACK] Seq=227049 Ack=1 Win=65535 Len=1460
    274 946           0.508384    76.23.247.139         128.119.245.93        ergolight TCP      ergolight > commplex-link [PSH, ACK] Seq=228509 Ack=1 Win=65535 Len=892
    278 1514          0.519574    76.23.247.139         128.119.245.93        ergolight TCP      ergolight > commplex-link [ACK] Seq=229401 Ack=1 Win=65535 Len=1460
    279 1514          0.519820    76.23.247.139         128.119.245.93        ergolight TCP      ergolight > commplex-link [ACK] Seq=230861 Ack=1 Win=65535 Len=1460
    280 1514          0.519943    76.23.247.139         128.119.245.93        ergolight TCP      ergolight > commplex-link [ACK] Seq=232321 Ack=1 Win=65535 Len=1460
    281 1514          0.520073    76.23.247.139         128.119.245.93        ergolight TCP      ergolight > commplex-link [ACK] Seq=233781 Ack=1 Win=65535 Len=1460
    282 1514          0.520196    76.23.247.139         128.119.245.93        ergolight TCP      ergolight > commplex-link [ACK] Seq=235241 Ack=1 Win=65535 Len=1460
    283 946           0.520274    76.23.247.139         128.119.245.93        ergolight TCP      ergolight > commplex-link [PSH, ACK] Seq=236701 Ack=1 Win=65535 Len=892
    286 1514          0.532877    76.23.247.139         128.119.245.93        ergolight TCP      ergolight > commplex-link [ACK] Seq=237593 Ack=1 Win=65535 Len=1460
    287 1514          0.533120    76.23.247.139         128.119.245.93        ergolight TCP      ergolight > commplex-link [ACK] Seq=239053 Ack=1 Win=65535 Len=1460
    288 1514          0.533243    76.23.247.139         128.119.245.93        ergolight TCP      ergolight > commplex-link [ACK] Seq=240513 Ack=1 Win=65535 Len=1460
    289 1514          0.533393    76.23.247.139         128.119.245.93        ergolight TCP      ergolight > commplex-link [ACK] Seq=241973 Ack=1 Win=65535 Len=1460
    290 1514          0.533516    76.23.247.139         128.119.245.93        ergolight TCP      ergolight > commplex-link [ACK] Seq=243433 Ack=1 Win=65535 Len=1460
    291 946           0.533594    76.23.247.139         128.119.245.93        ergolight TCP      ergolight > commplex-link [PSH, ACK] Seq=244893 Ack=1 Win=65535 Len=892
    296 1514          0.559507    76.23.247.139         128.119.245.93        ergolight TCP      ergolight > commplex-link [ACK] Seq=245785 Ack=1 Win=65535 Len=1460
    297 1514          0.559757    76.23.247.139         128.119.245.93        ergolight TCP      ergolight > commplex-link [ACK] Seq=247245 Ack=1 Win=65535 Len=1460
    298 1514          0.559882    76.23.247.139         128.119.245.93        ergolight TCP      ergolight > commplex-link [ACK] Seq=248705 Ack=1 Win=65535 Len=1460
    299 1514          0.560072    76.23.247.139         128.119.245.93        ergolight TCP      ergolight > commplex-link [ACK] Seq=250165 Ack=1 Win=65535 Len=1460
    300 1514          0.560207    76.23.247.139         128.119.245.93        ergolight TCP      ergolight > commplex-link [ACK] Seq=251625 Ack=1 Win=65535 Len=1460
    301 946           0.560280    76.23.247.139         128.119.245.93        ergolight TCP      ergolight > commplex-link [PSH, ACK] Seq=253085 Ack=1 Win=65535 Len=892
    305 1514          0.575479    76.23.247.139         128.119.245.93        ergolight TCP      ergolight > commplex-link [ACK] Seq=253977 Ack=1 Win=65535 Len=1460
    306 1514          0.575721    76.23.247.139         128.119.245.93        ergolight TCP      ergolight > commplex-link [ACK] Seq=255437 Ack=1 Win=65535 Len=1460
    307 1514          0.575844    76.23.247.139         128.119.245.93        ergolight TCP      ergolight > commplex-link [ACK] Seq=256897 Ack=1 Win=65535 Len=1460
    308 1514          0.575996    76.23.247.139         128.119.245.93        ergolight TCP      ergolight > commplex-link [ACK] Seq=258357 Ack=1 Win=65535 Len=1460
    309 1514          0.576119    76.23.247.139         128.119.245.93        ergolight TCP      ergolight > commplex-link [ACK] Seq=259817 Ack=1 Win=65535 Len=1460
    310 946           0.576199    76.23.247.139         128.119.245.93        ergolight TCP      ergolight > commplex-link [PSH, ACK] Seq=261277 Ack=1 Win=65535 Len=892
    314 1514          0.586132    76.23.247.139         128.119.245.93        ergolight TCP      ergolight > commplex-link [ACK] Seq=262169 Ack=1 Win=65535 Len=1460
    315 1514          0.586385    76.23.247.139         128.119.245.93        ergolight TCP      ergolight > commplex-link [ACK] Seq=263629 Ack=1 Win=65535 Len=1460
    316 1514          0.586512    76.23.247.139         128.119.245.93        ergolight TCP      ergolight > commplex-link [ACK] Seq=265089 Ack=1 Win=65535 Len=1460
    317 1514          0.586699    76.23.247.139         128.119.245.93        ergolight TCP      ergolight > commplex-link [ACK] Seq=266549 Ack=1 Win=65535 Len=1460
    318 1514          0.586834    76.23.247.139         128.119.245.93        ergolight TCP      ergolight > commplex-link [ACK] Seq=268009 Ack=1 Win=65535 Len=1460
    319 946           0.586909    76.23.247.139         128.119.245.93        ergolight TCP      ergolight > commplex-link [PSH, ACK] Seq=269469 Ack=1 Win=65535 Len=892
    322 1514          0.608765    76.23.247.139         128.119.245.93        ergolight TCP      ergolight > commplex-link [ACK] Seq=270361 Ack=1 Win=65535 Len=1460
    323 1514          0.609009    76.23.247.139         128.119.245.93        ergolight TCP      ergolight > commplex-link [ACK] Seq=271821 Ack=1 Win=65535 Len=1460
    324 1514          0.609144    76.23.247.139         128.119.245.93        ergolight TCP      ergolight > commplex-link [ACK] Seq=273281 Ack=1 Win=65535 Len=1460
    325 1514          0.609272    76.23.247.139         128.119.245.93        ergolight TCP      ergolight > commplex-link [ACK] Seq=274741 Ack=1 Win=65535 Len=1460
    326 1514          0.609395    76.23.247.139         128.119.245.93        ergolight TCP      ergolight > commplex-link [ACK] Seq=276201 Ack=1 Win=65535 Len=1460
    327 946           0.609463    76.23.247.139         128.119.245.93        ergolight TCP      ergolight > commplex-link [PSH, ACK] Seq=277661 Ack=1 Win=65535 Len=892
    331 1514          0.635385    76.23.247.139         128.119.245.93        ergolight TCP      ergolight > commplex-link [ACK] Seq=278553 Ack=1 Win=65535 Len=1460
    333 1514          0.635630    76.23.247.139         128.119.245.93        ergolight TCP      ergolight > commplex-link [ACK] Seq=280013 Ack=1 Win=65535 Len=1460
    334 1514          0.635753    76.23.247.139         128.119.245.93        ergolight TCP      ergolight > commplex-link [ACK] Seq=281473 Ack=1 Win=65535 Len=1460
    335 1514          0.635916    76.23.247.139         128.119.245.93        ergolight TCP      ergolight > commplex-link [ACK] Seq=282933 Ack=1 Win=65535 Len=1460
    336 1514          0.636041    76.23.247.139         128.119.245.93        ergolight TCP      ergolight > commplex-link [ACK] Seq=284393 Ack=1 Win=65535 Len=1460
    337 946           0.636110    76.23.247.139         128.119.245.93        ergolight TCP      ergolight > commplex-link [PSH, ACK] Seq=285853 Ack=1 Win=65535 Len=892
    341 1514          0.648700    76.23.247.139         128.119.245.93        ergolight TCP      ergolight > commplex-link [ACK] Seq=286745 Ack=1 Win=65535 Len=1460
    342 1514          0.648946    76.23.247.139         128.119.245.93        ergolight TCP      ergolight > commplex-link [ACK] Seq=288205 Ack=1 Win=65535 Len=1460
    343 1514          0.649069    76.23.247.139         128.119.245.93        ergolight TCP      ergolight > commplex-link [ACK] Seq=289665 Ack=1 Win=65535 Len=1460
    344 1514          0.649214    76.23.247.139         128.119.245.93        ergolight TCP      ergolight > commplex-link [ACK] Seq=291125 Ack=1 Win=65535 Len=1460
    345 1514          0.649332    76.23.247.139         128.119.245.93        ergolight TCP      ergolight > commplex-link [ACK] Seq=292585 Ack=1 Win=65535 Len=1460
    346 946           0.649410    76.23.247.139         128.119.245.93        ergolight TCP      ergolight > commplex-link [PSH, ACK] Seq=294045 Ack=1 Win=65535 Len=892
    350 1514          0.664676    76.23.247.139         128.119.245.93        ergolight TCP      ergolight > commplex-link [ACK] Seq=294937 Ack=1 Win=65535 Len=1460
    351 1514          0.664923    76.23.247.139         128.119.245.93        ergolight TCP      ergolight > commplex-link [ACK] Seq=296397 Ack=1 Win=65535 Len=1460
    352 1514          0.665047    76.23.247.139         128.119.245.93        ergolight TCP      ergolight > commplex-link [ACK] Seq=297857 Ack=1 Win=65535 Len=1460
    353 1514          0.665183    76.23.247.139         128.119.245.93        ergolight TCP      ergolight > commplex-link [ACK] Seq=299317 Ack=1 Win=65535 Len=1460
    354 1514          0.665306    76.23.247.139         128.119.245.93        ergolight TCP      ergolight > commplex-link [ACK] Seq=300777 Ack=1 Win=65535 Len=1460
    355 946           0.665384    76.23.247.139         128.119.245.93        ergolight TCP      ergolight > commplex-link [PSH, ACK] Seq=302237 Ack=1 Win=65535 Len=892
    363 1514          0.683319    76.23.247.139         128.119.245.93        ergolight TCP      ergolight > commplex-link [ACK] Seq=303129 Ack=1 Win=65535 Len=1460
    364 1514          0.683567    76.23.247.139         128.119.245.93        ergolight TCP      ergolight > commplex-link [ACK] Seq=304589 Ack=1 Win=65535 Len=1460
    365 1514          0.683701    76.23.247.139         128.119.245.93        ergolight TCP      ergolight > commplex-link [ACK] Seq=306049 Ack=1 Win=65535 Len=1460
    366 1514          0.683895    76.23.247.139         128.119.245.93        ergolight TCP      ergolight > commplex-link [ACK] Seq=307509 Ack=1 Win=65535 Len=1460
    367 1514          0.684018    76.23.247.139         128.119.245.93        ergolight TCP      ergolight > commplex-link [ACK] Seq=308969 Ack=1 Win=65535 Len=1460
    368 946           0.684087    76.23.247.139         128.119.245.93        ergolight TCP      ergolight > commplex-link [PSH, ACK] Seq=310429 Ack=1 Win=65535 Len=892
    375 1514          0.697949    76.23.247.139         128.119.245.93        ergolight TCP      ergolight > commplex-link [ACK] Seq=311321 Ack=1 Win=65535 Len=1460
    378 1514          0.698197    76.23.247.139         128.119.245.93        ergolight TCP      ergolight > commplex-link [ACK] Seq=312781 Ack=1 Win=65535 Len=1460
    379 1514          0.698320    76.23.247.139         128.119.245.93        ergolight TCP      ergolight > commplex-link [ACK] Seq=314241 Ack=1 Win=65535 Len=1460
    380 1514          0.698496    76.23.247.139         128.119.245.93        ergolight TCP      ergolight > commplex-link [ACK] Seq=315701 Ack=1 Win=65535 Len=1460
    381 1514          0.698621    76.23.247.139         128.119.245.93        ergolight TCP      ergolight > commplex-link [ACK] Seq=317161 Ack=1 Win=65535 Len=1460
    382 946           0.698699    76.23.247.139         128.119.245.93        ergolight TCP      ergolight > commplex-link [PSH, ACK] Seq=318621 Ack=1 Win=65535 Len=892
    387 1514          0.717924    76.23.247.139         128.119.245.93        ergolight TCP      ergolight > commplex-link [ACK] Seq=319513 Ack=1 Win=65535 Len=1460
    388 1514          0.718172    76.23.247.139         128.119.245.93        ergolight TCP      ergolight > commplex-link [ACK] Seq=320973 Ack=1 Win=65535 Len=1460
    389 1514          0.718294    76.23.247.139         128.119.245.93        ergolight TCP      ergolight > commplex-link [ACK] Seq=322433 Ack=1 Win=65535 Len=1460
    390 1514          0.718429    76.23.247.139         128.119.245.93        ergolight TCP      ergolight > commplex-link [ACK] Seq=323893 Ack=1 Win=65535 Len=1460
    391 1514          0.718552    76.23.247.139         128.119.245.93        ergolight TCP      ergolight > commplex-link [ACK] Seq=325353 Ack=1 Win=65535 Len=1460
