      4 62            1.299202    76.23.247.139         128.119.245.93        kdm      TCP      kdm > commplex-link [SYN] Seq=0 Win=65535 Len=0 MSS=1460 SACK_PERM=1
      6 60            1.314804    76.23.247.139         128.119.245.93        kdm      TCP      kdm > commplex-link [ACK] Seq=1 Ack=1 Win=65535 Len=0
      7 78            1.316904    76.23.247.139         128.119.245.93        kdm      TCP      kdm > commplex-link [PSH, ACK] Seq=1 Ack=1 Win=65535 Len=24
      8 1514          1.318266    76.23.247.139         128.119.245.93        kdm      TCP      kdm > commplex-link [ACK] Seq=25 Ack=1 Win=65535 Len=1460
     10 1514          1.335238    76.23.247.139         128.119.245.93        kdm      TCP      kdm > commplex-link [ACK] Seq=1485 Ack=1 Win=65535 Len=1460
     11 1514          1.335449    76.23.247.139         128.119.245.93        kdm      TCP      kdm > commplex-link [ACK] Seq=2945 Ack=1 Win=65535 Len=1460
     13 1514          1.340397    76.23.247.139         128.119.245.93        kdm      TCP      kdm > commplex-link [ACK] Seq=4405 Ack=1 Win=65535 Len=1460
     14 1514          1.340592    76.23.247.139         128.119.245.93        kdm      TCP      kdm > commplex-link [ACK] Seq=5865 Ack=1 Win=65535 Len=1460
     17 1514          1.351079    76.23.247.139         128.119.245.93        kdm      TCP      kdm > commplex-link [PSH, ACK] Seq=7325 Ack=1 Win=65535 Len=1460
     18 1514          1.351283    76.23.247.139         128.119.245.93        kdm      TCP      kdm > commplex-link [ACK] Seq=8785 Ack=1 Win=65535 Len=1460
     19 1514          1.351392    76.23.247.139         128.119.245.93        kdm      TCP      kdm > commplex-link [ACK] Seq=10245 Ack=1 Win=65535 Len=1460
     20 1514          1.351542    76.23.247.139         128.119.245.93        kdm      TCP      kdm > commplex-link [ACK] Seq=11705 Ack=1 Win=65535 Len=1460
     23 1514          1.357721    76.23.247.139         128.119.245.93        kdm      TCP      kdm > commplex-link [ACK] Seq=13165 Ack=1 Win=65535 Len=1460
     24 1514          1.357946    76.23.247.139         128.119.245.93        kdm      TCP      kdm > commplex-link [ACK] Seq=14625 Ack=1 Win=65535 Len=1460
     25 1514          1.358082    76.23.247.139         128.119.245.93        kdm      TCP      kdm > commplex-link [PSH, ACK] Seq=16085 Ack=1 Win=65535 Len=1460
     26 1514          1.358215    76.23.247.139         128.119.245.93        kdm      TCP      kdm > commplex-link [ACK] Seq=17545 Ack=1 Win=65535 Len=1460
     29 1514          1.368444    76.23.247.139         128.119.245.93        kdm      TCP      kdm > commplex-link [ACK] Seq=19005 Ack=1 Win=65535 Len=1460
     30 1514          1.368637    76.23.247.139         128.119.245.93        kdm      TCP      kdm > commplex-link [ACK] Seq=20465 Ack=1 Win=65535 Len=1460
     31 1514          1.368752    76.23.247.139         128.119.245.93        kdm      TCP      kdm > commplex-link [ACK] Seq=21925 Ack=1 Win=65535 Len=1460
     32 1514          1.368891    76.23.247.139         128.119.245.93        kdm      TCP      kdm > commplex-link [PSH, ACK] Seq=23385 Ack=1 Win=65535 Len=1460
     35 1514          1.372323    76.23.247.139         128.119.245.93        kdm      TCP      kdm > commplex-link [ACK] Seq=24845 Ack=1 Win=65535 Len=1460
     36 1514          1.372520    76.23.247.139         128.119.245.93        kdm      TCP      kdm > commplex-link [ACK] Seq=26305 Ack=1 Win=65535 Len=1460
     37 1514          1.373654    76.23.247.139         128.119.245.93        kdm      TCP      kdm > commplex-link [ACK] Seq=27765 Ack=1 Win=65535 Len=1460
     38 1514          1.373883    76.23.247.139         128.119.245.93        kdm      TCP      kdm > commplex-link [ACK] Seq=29225 Ack=1 Win=65535 Len=1460
     41 1514          1.377652    76.23.247.139         128.119.245.93        kdm      TCP      kdm > commplex-link [ACK] Seq=30685 Ack=1 Win=65535 Len=1460
     42 702           1.377710    76.23.247.139         128.119.245.93        kdm      TCP      kdm > commplex-link [PSH, ACK] Seq=32145 Ack=1 Win=65535 Len=648
     45 1514          1.380379    76.23.247.139         128.119.245.93        kdm      TCP      kdm > commplex-link [ACK] Seq=32793 Ack=1 Win=65535 Len=1460
     46 1514          1.380622    76.23.247.139         128.119.245.93        kdm      TCP      kdm > commplex-link [ACK] Seq=34253 Ack=1 Win=65535 Len=1460
     47 1514          1.380744    76.23.247.139         128.119.245.93        kdm      TCP      kdm > commplex-link [ACK] Seq=35713 Ack=1 Win=65535 Len=1460
     48 1514          1.380886    76.23.247.139         128.119.245.93        kdm      TCP      kdm > commplex-link [ACK] Seq=37173 Ack=1 Win=65535 Len=1460
     49 1514          1.381014    76.23.247.139         128.119.245.93        kdm      TCP      kdm > commplex-link [ACK] Seq=38633 Ack=1 Win=65535 Len=1460
     50 946           1.381092    76.23.247.139         128.119.245.93        kdm      TCP      kdm > commplex-link [PSH, ACK] Seq=40093 Ack=1 Win=65535 Len=892
     55 1514          1.388453    76.23.247.139         128.119.245.93        kdm      TCP      kdm > commplex-link [ACK] Seq=40985 Ack=1 Win=65535 Len=1460
     56 1514          1.388697    76.23.247.139         128.119.245.93        kdm      TCP      kdm > commplex-link [ACK] Seq=42445 Ack=1 Win=65535 Len=1460
     57 1514          1.388820    76.23.247.139         128.119.245.93        kdm      TCP      kdm > commplex-link [ACK] Seq=43905 Ack=1 Win=65535 Len=1460
     58 1514          1.388960    76.23.247.139         128.119.245.93        kdm      TCP      kdm > commplex-link [ACK] Seq=45365 Ack=1 Win=65535 Len=1460
     59 1514          1.389084    76.23.247.139         128.119.245.93        kdm      TCP      kdm > commplex-link [ACK] Seq=46825 Ack=1 Win=65535 Len=1460
     60 946           1.389164    76.23.247.139         128.119.245.93        kdm      TCP      kdm > commplex-link [PSH, ACK] Seq=48285 Ack=1 Win=65535 Len=892
     68 1514          1.412400    76.23.247.139         128.119.245.93        kdm      TCP      kdm > commplex-link [ACK] Seq=49177 Ack=1 Win=65535 Len=1460
     69 1514          1.412652    76.23.247.139         128.119.245.93        kdm      TCP      kdm > commplex-link [ACK] Seq=50637 Ack=1 Win=65535 Len=1460
     70 1514          1.412782    76.23.247.139         128.119.245.93        kdm      TCP      kdm > commplex-link [ACK] Seq=52097 Ack=1 Win=65535 Len=1460
     71 1514          1.412917    76.23.247.139         128.119.245.93        kdm      TCP      kdm > commplex-link [ACK] Seq=53557 Ack=1 Win=65535 Len=1460
     72 1514          1.413041    76.23.247.139         128.119.245.93        kdm      TCP      kdm > commplex-link [ACK] Seq=55017 Ack=1 Win=65535 Len=1460
     73 946           1.413115    76.23.247.139         128.119.245.93        kdm      TCP      kdm > commplex-link [PSH, ACK] Seq=56477 Ack=1 Win=65535 Len=892
     77 1514          1.422968    76.23.247.139         128.119.245.93        kdm      TCP      kdm > commplex-link [ACK] Seq=57369 Ack=1 Win=65535 Len=1460
     78 1514          1.423235    76.23.247.139         128.119.245.93        kdm      TCP      kdm > commplex-link [ACK] Seq=58829 Ack=1 Win=65535 Len=1460
     79 1514          1.423348    76.23.247.139         128.119.245.93        kdm      TCP      kdm > commplex-link [ACK] Seq=60289 Ack=1 Win=65535 Len=1460
     80 1514          1.423480    76.23.247.139         128.119.245.93        kdm      TCP      kdm > commplex-link [ACK] Seq=61749 Ack=1 Win=65535 Len=1460
     81 1514          1.423599    76.23.247.139         128.119.245.93        kdm      TCP      kdm > commplex-link [ACK] Seq=63209 Ack=1 Win=65535 Len=1460
     82 946           1.423676    76.23.247.139         128.119.245.93        kdm      TCP      kdm > commplex-link [PSH, ACK] Seq=64669 Ack=1 Win=65535 Len=892
     87 1514          1.457554    76.23.247.139         128.119.245.93        kdm      TCP      kdm > commplex-link [ACK] Seq=65561 Ack=1 Win=65535 Len=1460
     88 1514          1.457798    76.23.247.139         128.119.245.93        kdm      TCP      kdm > commplex-link [ACK] Seq=67021 Ack=1 Win=65535 Len=1460
     89 1514          1.457922    76.23.247.139         128.119.245.93        kdm      TCP      kdm > commplex-link [ACK] Seq=68481 Ack=1 Win=65535 Len=1460
     90 1514          1.458066    76.23.247.139         128.119.245.93        kdm      TCP      kdm > commplex-link [ACK] Seq=69941 Ack=1 Win=65535 Len=1460
     91 1514          1.458191    76.23.247.139         128.119.245.93        kdm      TCP      kdm > commplex-link [ACK] Seq=71401 Ack=1 Win=65535 Len=1460
     92 946           1.458266    76.23.247.139         128.119.245.93        kdm      TCP      kdm > commplex-link [PSH, ACK] Seq=72861 Ack=1 Win=65535 Len=892
     95 1514          1.473647    76.23.247.139         128.119.245.93        kdm      TCP      kdm > commplex-link [ACK] Seq=73753 Ack=1 Win=65535 Len=1460
     96 1514          1.473780    76.23.247.139         128.119.245.93        kdm      TCP      kdm > commplex-link [ACK] Seq=75213 Ack=1 Win=65535 Len=1460
     97 1514          1.473905    76.23.247.139         128.119.245.93        kdm      TCP      kdm > commplex-link [ACK] Seq=76673 Ack=1 Win=65535 Len=1460
     99 1514          1.474052    76.23.247.139         128.119.245.93        kdm      TCP      kdm > commplex-link [ACK] Seq=78133 Ack=1 Win=65535 Len=1460
    100 1514          1.474176    76.23.247.139         128.119.245.93        kdm      TCP      kdm > commplex-link [ACK] Seq=79593 Ack=1 Win=65535 Len=1460
    101 946           1.474258    76.23.247.139         128.119.245.93        kdm      TCP      kdm > commplex-link [PSH, ACK] Seq=81053 Ack=1 Win=65535 Len=892
    105 1514          1.496155    76.23.247.139         128.119.245.93        kdm      TCP      kdm > commplex-link [ACK] Seq=81945 Ack=1 Win=65535 Len=1460
    106 1514          1.496399    76.23.247.139         128.119.245.93        kdm      TCP      kdm > commplex-link [ACK] Seq=83405 Ack=1 Win=65535 Len=1460
    107 1514          1.496522    76.23.247.139         128.119.245.93        kdm      TCP      kdm > commplex-link [ACK] Seq=84865 Ack=1 Win=65535 Len=1460
    108 1514          1.496666    76.23.247.139         128.119.245.93        kdm      TCP      kdm > commplex-link [ACK] Seq=86325 Ack=1 Win=65535 Len=1460
    109 1514          1.496794    76.23.247.139         128.119.245.93        kdm      TCP      kdm > commplex-link [ACK] Seq=87785 Ack=1 Win=65535 Len=1460
    110 946           1.496872    76.23.247.139         128.119.245.93        kdm      TCP      kdm > commplex-link [PSH, ACK] Seq=89245 Ack=1 Win=65535 Len=892
    113 1514          1.508167    76.23.247.139         128.119.245.93        kdm      TCP      kdm > commplex-link [ACK] Seq=90137 Ack=1 Win=65535 Len=1460
    114 1514          1.508415    76.23.247.139         128.119.245.93        kdm      TCP      kdm > commplex-link [ACK] Seq=91597 Ack=1 Win=65535 Len=1460
    115 1514          1.508527    76.23.247.139         128.119.245.93        kdm      TCP      kdm > commplex-link [ACK] Seq=93057 Ack=1 Win=65535 Len=1460
    116 1514          1.508667    76.23.247.139         128.119.245.93        kdm      TCP      kdm > commplex-link [ACK] Seq=94517 Ack=1 Win=65535 Len=1460
    117 1514          1.508800    76.23.247.139         128.119.245.93        kdm      TCP      kdm > commplex-link [ACK] Seq=95977 Ack=1 Win=65535 Len=1460
    118 946           1.508878    76.23.247.139         128.119.245.93        kdm      TCP      kdm > commplex-link [PSH, ACK] Seq=97437 Ack=1 Win=65535 Len=892
    122 1514          1.529475    76.23.247.139         128.119.245.93        kdm      TCP      kdm > commplex-link [ACK] Seq=98329 Ack=1 Win=65535 Len=1460
    123 1514          1.529727    76.23.247.139         128.119.245.93        kdm      TCP      kdm > commplex-link [ACK] Seq=99789 Ack=1 Win=65535 Len=1460
    124 1514          1.529850    76.23.247.139         128.119.245.93        kdm      TCP      kdm > commplex-link [ACK] Seq=101249 Ack=1 Win=65535 Len=1460
    125 1514          1.529993    76.23.247.139         128.119.245.93        kdm      TCP      kdm > commplex-link [ACK] Seq=102709 Ack=1 Win=65535 Len=1460
    126 1514          1.530108    76.23.247.139         128.119.245.93        kdm      TCP      kdm > commplex-link [ACK] Seq=104169 Ack=1 Win=65535 Len=1460
    127 946           1.530184    76.23.247.139         128.119.245.93        kdm      TCP      kdm > commplex-link [PSH, ACK] Seq=105629 Ack=1 Win=65535 Len=892
    131 1514          1.554763    76.23.247.139         128.119.245.93        kdm      TCP      kdm > commplex-link [ACK] Seq=106521 Ack=1 Win=65535 Len=1460
    132 1514          1.555002    76.23.247.139         128.119.245.93        kdm      TCP      kdm > commplex-link [ACK] Seq=107981 Ack=1 Win=65535 Len=1460
    133 1514          1.555125    76.23.247.139         128.119.245.93        kdm      TCP      kdm > commplex-link [ACK] Seq=109441 Ack=1 Win=65535 Len=1460
    134 1514          1.555325    76.23.247.139         128.119.245.93        kdm      TCP      kdm > commplex-link [ACK] Seq=110901 Ack=1 Win=65535 Len=1460
    135 1514          1.555442    76.23.247.139         128.119.245.93        kdm      TCP      kdm > commplex-link [ACK] Seq=112361 Ack=1 Win=65535 Len=1460
    136 946           1.555518    76.23.247.139         128.119.245.93        kdm      TCP      kdm > commplex-link [PSH, ACK] Seq=113821 Ack=1 Win=65535 Len=892
    141 1514          1.568060    76.23.247.139         128.119.245.93        kdm      TCP      kdm > commplex-link [ACK] Seq=114713 Ack=1 Win=65535 Len=1460
    142 1514          1.568315    76.23.247.139         128.119.245.93        kdm      TCP      kdm > commplex-link [ACK] Seq=116173 Ack=1 Win=65535 Len=1460
    143 1514          1.568446    76.23.247.139         128.119.245.93        kdm      TCP      kdm > commplex-link [ACK] Seq=117633 Ack=1 Win=65535 Len=1460
    144 1514          1.568599    76.23.247.139         128.119.245.93        kdm      TCP      kdm > commplex-link [ACK] Seq=119093 Ack=1 Win=65535 Len=1460
    145 1514          1.568726    76.23.247.139         128.119.245.93        kdm      TCP      kdm > commplex-link [ACK] Seq=120553 Ack=1 Win=65535 Len=1460
    146 946           1.568802    76.23.247.139         128.119.245.93        kdm      TCP      kdm > commplex-link [PSH, ACK] Seq=122013 Ack=1 Win=65535 Len=892
    149 1514          1.585453    76.23.247.139         128.119.245.93        kdm      TCP      kdm > commplex-link [ACK] Seq=122905 Ack=1 Win=65535 Len=1460
    150 1514          1.585708    76.23.247.139         128.119.245.93        kdm      TCP      kdm > commplex-link [ACK] Seq=124365 Ack=1 Win=65535 Len=1460
    151 1514          1.585826    76.23.247.139         128.119.245.93        kdm      TCP      kdm > commplex-link [ACK] Seq=125825 Ack=1 Win=65535 Len=1460
    152 1514          1.585990    76.23.247.139         128.119.245.93        kdm      TCP      kdm > commplex-link [ACK] Seq=127285 Ack=1 Win=65535 Len=1460
    153 1514          1.586114    76.23.247.139         128.119.245.93        kdm      TCP      kdm > commplex-link [ACK] Seq=128745 Ack=1 Win=65535 Len=1460
    154 946           1.586191    76.23.247.139         128.119.245.93        kdm      TCP      kdm > commplex-link [PSH, ACK] Seq=130205 Ack=1 Win=65535 Len=892
    161 1514          1.602804    76.23.247.139         128.119.245.93        kdm      TCP      kdm > commplex-link [ACK] Seq=131097 Ack=1 Win=65535 Len=1460
    162 1514          1.603048    76.23.247.139         128.119.245.93        kdm      TCP      kdm > commplex-link [ACK] Seq=132557 Ack=1 Win=65535 Len=1460
    163 1514          1.603209    76.23.247.139         128.119.245.93        kdm      TCP      kdm > commplex-link [ACK] Seq=134017 Ack=1 Win=65535 Len=1460
    164 1514          1.603471    76.23.247.139         128.119.245.93        kdm      TCP      kdm > commplex-link [ACK] Seq=135477 Ack=1 Win=65535 Len=1460
    165 1514          1.603595    76.23.247.139         128.119.245.93        kdm      TCP      kdm > commplex-link [ACK] Seq=136937 Ack=1 Win=65535 Len=1460
    166 946           1.603672    76.23.247.139         128.119.245.93        kdm      TCP      kdm > commplex-link [PSH, ACK] Seq=138397 Ack=1 Win=65535 Len=892
    174 1514          1.621330    76.23.247.139         128.119.245.93        kdm      TCP      kdm > commplex-link [ACK] Seq=139289 Ack=1 Win=65535 Len=1460
    175 1514          1.621574    76.23.247.139         128.119.245.93        kdm      TCP      kdm > commplex-link [ACK] Seq=140749 Ack=1 Win=65535 Len=1460
    176 1514          1.621695    76.23.247.139         128.119.245.93        kdm      TCP      kdm > commplex-link [ACK] Seq=142209 Ack=1 Win=65535 Len=1460
    177 1514          1.621837    76.23.247.139         128.119.245.93        kdm      TCP      kdm > commplex-link [ACK] Seq=143669 Ack=1 Win=65535 Len=1460
    178 1514          1.621962    76.23.247.139         128.119.245.93        kdm      TCP      kdm > commplex-link [ACK] Seq=145129 Ack=1 Win=65535 Len=1460
    179 946           1.622037    76.23.247.139         128.119.245.93        kdm      TCP      kdm > commplex-link [PSH, ACK] Seq=146589 Ack=1 Win=65535 Len=892
    185 1514          1.631990    76.23.247.139         128.119.245.93        kdm      TCP      kdm > commplex-link [ACK] Seq=147481 Ack=1 Win=65535 Len=1460
    186 1514          1.632328    76.23.247.139         128.119.245.93        kdm      TCP      kdm > commplex-link [ACK] Seq=148941 Ack=1 Win=65535 Len=1460
    187 1514          1.632453    76.23.247.139         128.119.245.93        kdm      TCP      kdm > commplex-link [ACK] Seq=150401 Ack=1 Win=65535 Len=1460
    188 1514          1.632572    76.23.247.139         128.119.245.93        kdm      TCP      kdm > commplex-link [ACK] Seq=151861 Ack=1 Win=65535 Len=1460
    189 1514          1.632696    76.23.247.139         128.119.245.93        kdm      TCP      kdm > commplex-link [ACK] Seq=153321 Ack=1 Win=65535 Len=1460
    190 946           1.632772    76.23.247.139         128.119.245.93        kdm      TCP      kdm > commplex-link [PSH, ACK] Seq=154781 Ack=1 Win=65535 Len=892
    194 1514          1.647951    76.23.247.139         128.119.245.93        kdm      TCP      kdm > commplex-link [ACK] Seq=155673 Ack=1 Win=65535 Len=1460
    195 1514          1.648202    76.23.247.139         128.119.245.93        kdm      TCP      kdm > commplex-link [ACK] Seq=157133 Ack=1 Win=65535 Len=1460
    196 1514          1.648321    76.23.247.139         128.119.245.93        kdm      TCP      kdm > commplex-link [ACK] Seq=158593 Ack=1 Win=65535 Len=1460
    197 1514          1.648455    76.23.247.139         128.119.245.93        kdm      TCP      kdm > commplex-link [ACK] Seq=160053 Ack=1 Win=65535 Len=1460
    198 1514          1.648582    76.23.247.139         128.119.245.93        kdm      TCP      kdm > commplex-link [ACK] Seq=161513 Ack=1 Win=65535 Len=1460
    199 946           1.648658    76.23.247.139         128.119.245.93        kdm      TCP      kdm > commplex-link [PSH, ACK] Seq=162973 Ack=1 Win=65535 Len=892
    206 1514          1.671922    76.23.247.139         128.119.245.93        kdm      TCP      kdm > commplex-link [ACK] Seq=163865 Ack=1 Win=65535 Len=1460
    207 1514          1.672170    76.23.247.139         128.119.245.93        kdm      TCP      kdm > commplex-link [ACK] Seq=165325 Ack=1 Win=65535 Len=1460
    208 1514          1.672306    76.23.247.139         128.119.245.93        kdm      TCP      kdm > commplex-link [ACK] Seq=166785 Ack=1 Win=65535 Len=1460
    209 1514          1.672506    76.23.247.139         128.119.245.93        kdm      TCP      kdm > commplex-link [ACK] Seq=168245 Ack=1 Win=65535 Len=1460
    210 1514          1.672630    76.23.247.139         128.119.245.93        kdm      TCP      kdm > commplex-link [ACK] Seq=169705 Ack=1 Win=65535 Len=1460
    211 946           1.672708    76.23.247.139         128.119.245.93        kdm      TCP      kdm > commplex-link [PSH, ACK] Seq=171165 Ack=1 Win=65535 Len=892
    214 1514          1.687878    76.23.247.139         128.119.245.93        kdm      TCP      kdm > commplex-link [ACK] Seq=172057 Ack=1 Win=65535 Len=1460
    215 1514          1.688128    76.23.247.139         128.119.245.93        kdm      TCP      kdm > commplex-link [ACK] Seq=173517 Ack=1 Win=65535 Len=1460
    216 1514          1.688251    76.23.247.139         128.119.245.93        kdm      TCP      kdm > commplex-link [ACK] Seq=174977 Ack=1 Win=65535 Len=1460
    217 1514          1.688397    76.23.247.139         128.119.245.93        kdm      TCP      kdm > commplex-link [ACK] Seq=176437 Ack=1 Win=65535 Len=1460
    218 1514          1.688517    76.23.247.139         128.119.245.93        kdm      TCP      kdm > commplex-link [ACK] Seq=177897 Ack=1 Win=65535 Len=1460
    219 946           1.688593    76.23.247.139         128.119.245.93        kdm      TCP      kdm > commplex-link [PSH, ACK] Seq=179357 Ack=1 Win=65535 Len=892
    222 1514          1.705313    76.23.247.139         128.119.245.93        kdm      TCP      kdm > commplex-link [ACK] Seq=180249 Ack=1 Win=65535 Len=1460
    223 1514          1.705518    76.23.247.139         128.119.245.93        kdm      TCP      kdm > commplex-link [ACK] Seq=181709 Ack=1 Win=65535 Len=1460
    224 1514          1.705641    76.23.247.139         128.119.245.93        kdm      TCP      kdm > commplex-link [ACK] Seq=183169 Ack=1 Win=65535 Len=1460
    225 1514          1.705762    76.23.247.139         128.119.245.93        kdm      TCP      kdm > commplex-link [ACK] Seq=184629 Ack=1 Win=65535 Len=1460
    226 1514          1.705877    76.23.247.139         128.119.245.93        kdm      TCP      kdm > commplex-link [ACK] Seq=186089 Ack=1 Win=65535 Len=1460
    227 946           1.705963    76.23.247.139         128.119.245.93        kdm      TCP      kdm > commplex-link [PSH, ACK] Seq=187549 Ack=1 Win=65535 Len=892
    231 1514          1.715967    76.23.247.139         128.119.245.93        kdm      TCP      kdm > commplex-link [ACK] Seq=188441 Ack=1 Win=65535 Len=1460
    232 1514          1.716089    76.23.247.139         128.119.245.93        kdm      TCP      kdm > commplex-link [ACK] Seq=189901 Ack=1 Win=65535 Len=1460
    233 1514          1.716207    76.23.247.139         128.119.245.93        kdm      TCP      kdm > commplex-link [ACK] Seq=191361 Ack=1 Win=65535 Len=1460
    234 1514          1.716371    76.23.247.139         128.119.245.93        kdm      TCP      kdm > commplex-link [ACK] Seq=192821 Ack=1 Win=65535 Len=1460
    235 1514          1.716499    76.23.247.139         128.119.245.93        kdm      TCP      kdm > commplex-link [ACK] Seq=194281 Ack=1 Win=65535 Len=1460
    236 946           1.716586    76.23.247.139         128.119.245.93        kdm      TCP      kdm > commplex-link [PSH, ACK] Seq=195741 Ack=1 Win=65535 Len=892
    240 1514          1.737141    76.23.247.139         128.119.245.93        kdm      TCP      kdm > commplex-link [ACK] Seq=196633 Ack=1 Win=65535 Len=1460
    241 1514          1.737383    76.23.247.139         128.119.245.93        kdm      TCP      kdm > commplex-link [ACK] Seq=198093 Ack=1 Win=65535 Len=1460
    242 1514          1.737506    76.23.247.139         128.119.245.93        kdm      TCP      kdm > commplex-link [ACK] Seq=199553 Ack=1 Win=65535 Len=1460
    243 1514          1.737650    76.23.247.139         128.119.245.93        kdm      TCP      kdm > commplex-link [ACK] Seq=201013 Ack=1 Win=65535 Len=1460
    244 1514          1.737774    76.23.247.139         128.119.245.93        kdm      TCP      kdm > commplex-link [ACK] Seq=202473 Ack=1 Win=65535 Len=1460
    245 946           1.737850    76.23.247.139         128.119.245.93        kdm      TCP      kdm > commplex-link [PSH, ACK] Seq=203933 Ack=1 Win=65535 Len=892
    254 1514          1.762428    76.23.247.139         128.119.245.93        kdm      TCP      kdm > commplex-link [ACK] Seq=204825 Ack=1 Win=65535 Len=1460
    255 1514          1.762682    76.23.247.139         128.119.245.93        kdm      TCP      kdm > commplex-link [ACK] Seq=206285 Ack=1 Win=65535 Len=1460
    256 1514          1.762809    76.23.247.139         128.119.245.93        kdm      TCP      kdm > commplex-link [ACK] Seq=207745 Ack=1 Win=65535 Len=1460
    257 1514          1.763020    76.23.247.139         128.119.245.93        kdm      TCP      kdm > commplex-link [ACK] Seq=209205 Ack=1 Win=65535 Len=1460
    258 1514          1.763145    76.23.247.139         128.119.245.93        kdm      TCP      kdm > commplex-link [ACK] Seq=210665 Ack=1 Win=65535 Len=1460
    259 946           1.763222    76.23.247.139         128.119.245.93        kdm      TCP      kdm > commplex-link [PSH, ACK] Seq=212125 Ack=1 Win=65535 Len=892
    264 1514          1.779858    76.23.247.139         128.119.245.93        kdm      TCP      kdm > commplex-link [ACK] Seq=213017 Ack=1 Win=65535 Len=1460
    265 1514          1.779981    76.23.247.139         128.119.245.93        kdm      TCP      kdm > commplex-link [ACK] Seq=214477 Ack=1 Win=65535 Len=1460
    266 1514          1.780144    76.23.247.139         128.119.245.93        kdm      TCP      kdm > commplex-link [ACK] Seq=215937 Ack=1 Win=65535 Len=1460
    267 1514          1.780267    76.23.247.139         128.119.245.93        kdm      TCP      kdm > commplex-link [ACK] Seq=217397 Ack=1 Win=65535 Len=1460
    268 1514          1.780387    76.23.247.139         128.119.245.93        kdm      TCP      kdm > commplex-link [ACK] Seq=218857 Ack=1 Win=65535 Len=1460
    269 946           1.780463    76.23.247.139         128.119.245.93        kdm      TCP      kdm > commplex-link [PSH, ACK] Seq=220317 Ack=1 Win=65535 Len=892
    273 1514          1.795737    76.23.247.139         128.119.245.93        kdm      TCP      kdm > commplex-link [ACK] Seq=221209 Ack=1 Win=65535 Len=1460
    274 1514          1.796058    76.23.247.139         128.119.245.93        kdm      TCP      kdm > commplex-link [ACK] Seq=222669 Ack=1 Win=65535 Len=1460
    275 1514          1.796182    76.23.247.139         128.119.245.93        kdm      TCP      kdm > commplex-link [ACK] Seq=224129 Ack=1 Win=65535 Len=1460
    276 1514          1.796306    76.23.247.139         128.119.245.93        kdm      TCP      kdm > commplex-link [ACK] Seq=225589 Ack=1 Win=65535 Len=1460
    277 1514          1.796433    76.23.247.139         128.119.245.93        kdm      TCP      kdm > commplex-link [ACK] Seq=227049 Ack=1 Win=65535 Len=1460
    278 946           1.796510    76.23.247.139         128.119.245.93        kdm      TCP      kdm > commplex-link [PSH, ACK] Seq=228509 Ack=1 Win=65535 Len=892
    281 1514          1.814352    76.23.247.139         128.119.245.93        kdm      TCP      kdm > commplex-link [ACK] Seq=229401 Ack=1 Win=65535 Len=1460
    282 1514          1.814595    76.23.247.139         128.119.245.93        kdm      TCP      kdm > commplex-link [ACK] Seq=230861 Ack=1 Win=65535 Len=1460
    283 1514          1.814720    76.23.247.139         128.119.245.93        kdm      TCP      kdm > commplex-link [ACK] Seq=232321 Ack=1 Win=65535 Len=1460
    284 1514          1.814873    76.23.247.139         128.119.245.93        kdm      TCP      kdm > commplex-link [ACK] Seq=233781 Ack=1 Win=65535 Len=1460
    285 1514          1.814999    76.23.247.139         128.119.245.93        kdm      TCP      kdm > commplex-link [ACK] Seq=235241 Ack=1 Win=65535 Len=1460
    286 946           1.815074    76.23.247.139         128.119.245.93        kdm      TCP      kdm > commplex-link [PSH, ACK] Seq=236701 Ack=1 Win=65535 Len=892
    290 1514          1.830329    76.23.247.139         128.119.245.93        kdm      TCP      kdm > commplex-link [ACK] Seq=237593 Ack=1 Win=65535 Len=1460
    291 1514          1.830576    76.23.247.139         128.119.245.93        kdm      TCP      kdm > commplex-link [ACK] Seq=239053 Ack=1 Win=65535 Len=1460
    292 1514          1.830699    76.23.247.139         128.119.245.93        kdm      TCP      kdm > commplex-link [ACK] Seq=240513 Ack=1 Win=65535 Len=1460
    293 1514          1.830834    76.23.247.139         128.119.245.93        kdm      TCP      kdm > commplex-link [ACK] Seq=241973 Ack=1 Win=65535 Len=1460
    294 1514          1.830958    76.23.247.139         128.119.245.93        kdm      TCP      kdm > commplex-link [ACK] Seq=243433 Ack=1 Win=65535 Len=1460
    295 946           1.831036    76.23.247.139         128.119.245.93        kdm      TCP      kdm > commplex-link [PSH, ACK] Seq=244893 Ack=1 Win=65535 Len=892
    300 1514          1.859615    76.23.247.139         128.119.245.93        kdm      TCP      kdm > commplex-link [ACK] Seq=245785 Ack=1 Win=65535 Len=1460
    301 1514          1.859861    76.23.247.139         128.119.245.93        kdm      TCP      kdm > commplex-link [ACK] Seq=247245 Ack=1 Win=65535 Len=1460
    302 1514          1.859975    76.23.247.139         128.119.245.93        kdm      TCP      kdm > commplex-link [ACK] Seq=248705 Ack=1 Win=65535 Len=1460
    303 1514          1.860130    76.23.247.139         128.119.245.93        kdm      TCP      kdm > commplex-link [ACK] Seq=250165 Ack=1 Win=65535 Len=1460
    304 1514          1.860244    76.23.247.139         128.119.245.93        kdm      TCP      kdm > commplex-link [ACK] Seq=251625 Ack=1 Win=65535 Len=1460
    305 946           1.860321    76.23.247.139         128.119.245.93        kdm      TCP      kdm > commplex-link [PSH, ACK] Seq=253085 Ack=1 Win=65535 Len=892
    309 1514          1.871594    76.23.247.139         128.119.245.93        kdm      TCP      kdm > commplex-link [ACK] Seq=253977 Ack=1 Win=65535 Len=1460
    310 1514          1.871839    76.23.247.139         128.119.245.93        kdm      TCP      kdm > commplex-link [ACK] Seq=255437 Ack=1 Win=65535 Len=1460
    311 1514          1.871967    76.23.247.139         128.119.245.93        kdm      TCP      kdm > commplex-link [ACK] Seq=256897 Ack=1 Win=65535 Len=1460
    312 1514          1.872102    76.23.247.139         128.119.245.93        kdm      TCP      kdm > commplex-link [ACK] Seq=258357 Ack=1 Win=65535 Len=1460
    313 1514          1.872226    76.23.247.139         128.119.245.93        kdm      TCP      kdm > commplex-link [ACK] Seq=259817 Ack=1 Win=65535 Len=1460
    314 946           1.872302    76.23.247.139         128.119.245.93        kdm      TCP      kdm > commplex-link [PSH, ACK] Seq=261277 Ack=1 Win=65535 Len=892
    317 1514          1.886238    76.23.247.139         128.119.245.93        kdm      TCP      kdm > commplex-link [ACK] Seq=262169 Ack=1 Win=65535 Len=1460
    318 1514          1.886479    76.23.247.139         128.119.245.93        kdm      TCP      kdm > commplex-link [ACK] Seq=263629 Ack=1 Win=65535 Len=1460
    319 1514          1.886602    76.23.247.139         128.119.245.93        kdm      TCP      kdm > commplex-link [ACK] Seq=265089 Ack=1 Win=65535 Len=1460
    320 1514          1.886752    76.23.247.139         128.119.245.93        kdm      TCP      kdm > commplex-link [ACK] Seq=266549 Ack=1 Win=65535 Len=1460
    321 1514          1.886890    76.23.247.139         128.119.245.93        kdm      TCP      kdm > commplex-link [ACK] Seq=268009 Ack=1 Win=65535 Len=1460
    322 946           1.886958    76.23.247.139         128.119.245.93        kdm      TCP      kdm > commplex-link [PSH, ACK] Seq=269469 Ack=1 Win=65535 Len=892
    327 1514          1.918185    76.23.247.139         128.119.245.93        kdm      TCP      kdm > commplex-link [ACK] Seq=270361 Ack=1 Win=65535 Len=1460
    328 1514          1.918440    76.23.247.139         128.119.245.93        kdm      TCP      kdm > commplex-link [ACK] Seq=271821 Ack=1 Win=65535 Len=1460
    329 1514          1.918566    76.23.247.139         128.119.245.93        kdm      TCP      kdm > commplex-link [ACK] Seq=273281 Ack=1 Win=65535 Len=1460
    330 1514          1.918766    76.23.247.139         128.119.245.93        kdm      TCP      kdm > commplex-link [ACK] Seq=274741 Ack=1 Win=65535 Len=1460
    331 1514          1.918889    76.23.247.139         128.119.245.93        kdm      TCP      kdm > commplex-link [ACK] Seq=276201 Ack=1 Win=65535 Len=1460
    332 946           1.918964    76.23.247.139         128.119.245.93        kdm      TCP      kdm > commplex-link [PSH, ACK] Seq=277661 Ack=1 Win=65535 Len=892
    336 1514          1.930167    76.23.247.139         128.119.245.93        kdm      TCP      kdm > commplex-link [ACK] Seq=278553 Ack=1 Win=65535 Len=1460
    337 1514          1.930413    76.23.247.139         128.119.245.93        kdm      TCP      kdm > commplex-link [ACK] Seq=280013 Ack=1 Win=65535 Len=1460
    338 1514          1.930535    76.23.247.139         128.119.245.93        kdm      TCP      kdm > commplex-link [ACK] Seq=281473 Ack=1 Win=65535 Len=1460
    339 1514          1.930682    76.23.247.139         128.119.245.93        kdm      TCP      kdm > commplex-link [ACK] Seq=282933 Ack=1 Win=65535 Len=1460
    340 1514          1.930807    76.23.247.139         128.119.245.93        kdm      TCP      kdm > commplex-link [ACK] Seq=284393 Ack=1 Win=65535 Len=1460
    341 946           1.930882    76.23.247.139         128.119.245.93        kdm      TCP      kdm > commplex-link [PSH, ACK] Seq=285853 Ack=1 Win=65535 Len=892
    344 1514          1.942149    76.23.247.139         128.119.245.93        kdm      TCP      kdm > commplex-link [ACK] Seq=286745 Ack=1 Win=65535 Len=1460
    345 1514          1.942392    76.23.247.139         128.119.245.93        kdm      TCP      kdm > commplex-link [ACK] Seq=288205 Ack=1 Win=65535 Len=1460
    346 1514          1.942515    76.23.247.139         128.119.245.93        kdm      TCP      kdm > commplex-link [ACK] Seq=289665 Ack=1 Win=65535 Len=1460
    347 1514          1.942657    76.23.247.139         128.119.245.93        kdm      TCP      kdm > commplex-link [ACK] Seq=291125 Ack=1 Win=65535 Len=1460
    348 1514          1.942784    76.23.247.139         128.119.245.93        kdm      TCP      kdm > commplex-link [ACK] Seq=292585 Ack=1 Win=65535 Len=1460
    349 946           1.942863    76.23.247.139         128.119.245.93        kdm      TCP      kdm > commplex-link [PSH, ACK] Seq=294045 Ack=1 Win=65535 Len=892
    359 1514          1.970136    76.23.247.139         128.119.245.93        kdm      TCP      kdm > commplex-link [ACK] Seq=294937 Ack=1 Win=65535 Len=1460
    360 1514          1.970385    76.23.247.139         128.119.245.93        kdm      TCP      kdm > commplex-link [ACK] Seq=296397 Ack=1 Win=65535 Len=1460
    361 1514          1.970510    76.23.247.139         128.119.245.93        kdm      TCP      kdm > commplex-link [ACK] Seq=297857 Ack=1 Win=65535 Len=1460
    362 1514          1.970664    76.23.247.139         128.119.245.93        kdm      TCP      kdm > commplex-link [ACK] Seq=299317 Ack=1 Win=65535 Len=1460
    363 1514          1.970797    76.23.247.139         128.119.245.93        kdm      TCP      kdm > commplex-link [ACK] Seq=300777 Ack=1 Win=65535 Len=1460
    364 946           1.970873    76.23.247.139         128.119.245.93        kdm      TCP      kdm > commplex-link [PSH, ACK] Seq=302237 Ack=1 Win=65535 Len=892
    371 1514          1.983585    76.23.247.139         128.119.245.93        kdm      TCP      kdm > commplex-link [ACK] Seq=303129 Ack=1 Win=65535 Len=1460
    372 1514          1.983826    76.23.247.139         128.119.245.93        kdm      TCP      kdm > commplex-link [ACK] Seq=304589 Ack=1 Win=65535 Len=1460
    373 1514          1.983949    76.23.247.139         128.119.245.93        kdm      TCP      kdm > commplex-link [ACK] Seq=306049 Ack=1 Win=65535 Len=1460
    374 1514          1.984085    76.23.247.139         128.119.245.93        kdm      TCP      kdm > commplex-link [ACK] Seq=307509 Ack=1 Win=65535 Len=1460
    375 1514          1.984187    76.23.247.139         128.119.245.93        kdm      TCP      kdm > commplex-link [ACK] Seq=308969 Ack=1 Win=65535 Len=1460
    376 946           1.984273    76.23.247.139         128.119.245.93        kdm      TCP      kdm > commplex-link [PSH, ACK] Seq=310429 Ack=1 Win=65535 Len=892
    381 1514          1.994096    76.23.247.139         128.119.245.93        kdm      TCP      kdm > commplex-link [ACK] Seq=311321 Ack=1 Win=65535 Len=1460
    382 1514          1.994333    76.23.247.139         128.119.245.93        kdm      TCP      kdm > commplex-link [ACK] Seq=312781 Ack=1 Win=65535 Len=1460
    383 1514          1.994455    76.23.247.139         128.119.245.93        kdm      TCP      kdm > commplex-link [ACK] Seq=314241 Ack=1 Win=65535 Len=1460
    384 1514          1.994596    76.23.247.139         128.119.245.93        kdm      TCP      kdm > commplex-link [ACK] Seq=315701 Ack=1 Win=65535 Len=1460
    385 1514          1.994720    76.23.247.139         128.119.245.93        kdm      TCP      kdm > commplex-link [ACK] Seq=317161 Ack=1 Win=65535 Len=1460
    386 946           1.994798    76.23.247.139         128.119.245.93        kdm      TCP      kdm > commplex-link [PSH, ACK] Seq=318621 Ack=1 Win=65535 Len=892
    389 1514          2.010069    76.23.247.139         128.119.245.93        kdm      TCP      kdm > commplex-link [ACK] Seq=319513 Ack=1 Win=65535 Len=1460
    390 1514          2.010316    76.23.247.139         128.119.245.93        kdm      TCP      kdm > commplex-link [ACK] Seq=320973 Ack=1 Win=65535 Len=1460
    391 1514          2.010452    76.23.247.139         128.119.245.93        kdm      TCP      kdm > commplex-link [ACK] Seq=322433 Ack=1 Win=65535 Len=1460
    392 1514          2.010583    76.23.247.139         128.119.245.93        kdm      TCP      kdm > commplex-link [ACK] Seq=323893 Ack=1 Win=65535 Len=1460
    393 1514          2.010698    76.23.247.139         128.119.245.93        kdm      TCP      kdm > commplex-link [ACK] Seq=325353 Ack=1 Win=65535 Len=1460
    394 946           2.010786    76.23.247.139         128.119.245.93        kdm      TCP      kdm > commplex-link [PSH, ACK] Seq=326813 Ack=1 Win=65535 Len=892
    398 1514          2.036779    76.23.247.139         128.119.245.93        kdm      TCP      kdm > commplex-link [ACK] Seq=327705 Ack=1 Win=65535 Len=1460
    399 1514          2.037027    76.23.247.139         128.119.245.93        kdm      TCP      kdm > commplex-link [ACK] Seq=329165 Ack=1 Win=65535 Len=1460
    400 1514          2.037150    76.23.247.139         128.119.245.93        kdm      TCP      kdm > commplex-link [ACK] Seq=330625 Ack=1 Win=65535 Len=1460
    401 1514          2.037288    76.23.247.139         128.119.245.93        kdm      TCP      kdm > commplex-link [ACK] Seq=332085 Ack=1 Win=65535 Len=1460
    402 1514          2.037411    76.23.247.139         128.119.245.93        kdm      TCP      kdm > commplex-link [ACK] Seq=333545 Ack=1 Win=65535 Len=1460
    403 946           2.037488    76.23.247.139         128.119.245.93        kdm      TCP      kdm > commplex-link [PSH, ACK] Seq=335005 Ack=1 Win=65535 Len=892
    407 1514          2.055446    76.23.247.139         128.119.245.93        kdm      TCP      kdm > commplex-link [ACK] Seq=335897 Ack=1 Win=65535 Len=1460
    408 1514          2.055565    76.23.247.139         128.119.245.93        kdm      TCP      kdm > commplex-link [ACK] Seq=337357 Ack=1 Win=65535 Len=1460
    409 1514          2.055688    76.23.247.139         128.119.245.93        kdm      TCP      kdm > commplex-link [ACK] Seq=338817 Ack=1 Win=65535 Len=1460
    410 1514          2.055812    76.23.247.139         128.119.245.93        kdm      TCP      kdm > commplex-link [ACK] Seq=340277 Ack=1 Win=65535 Len=1460
