      6 62            1.215564    76.23.247.139         128.119.245.93        comcam   TCP      comcam > commplex-link [SYN] Seq=0 Win=65535 Len=0 MSS=1460 SACK_PERM=1
      8 60            1.231398    76.23.247.139         128.119.245.93        comcam   TCP      comcam > commplex-link [ACK] Seq=1 Ack=1 Win=65535 Len=0
      9 78            1.233625    76.23.247.139         128.119.245.93        comcam   TCP      comcam > commplex-link [PSH, ACK] Seq=1 Ack=1 Win=65535 Len=24
     10 1514          1.235060    76.23.247.139         128.119.245.93        comcam   TCP      comcam > commplex-link [ACK] Seq=25 Ack=1 Win=65535 Len=1460
     12 1514          1.250409    76.23.247.139         128.119.245.93        comcam   TCP      comcam > commplex-link [ACK] Seq=1485 Ack=1 Win=65535 Len=1460
     13 1514          1.250598    76.23.247.139         128.119.245.93        comcam   TCP      comcam > commplex-link [ACK] Seq=2945 Ack=1 Win=65535 Len=1460
     15 1514          1.255719    76.23.247.139         128.119.245.93        comcam   TCP      comcam > commplex-link [ACK] Seq=4405 Ack=1 Win=65535 Len=1460
     16 1514          1.255914    76.23.247.139         128.119.245.93        comcam   TCP      comcam > commplex-link [ACK] Seq=5865 Ack=1 Win=65535 Len=1460
     19 1514          1.267713    76.23.247.139         128.119.245.93        comcam   TCP      comcam > commplex-link [PSH, ACK] Seq=7325 Ack=1 Win=65535 Len=1460
     20 1514          1.267904    76.23.247.139         128.119.245.93        comcam   TCP      comcam > commplex-link [ACK] Seq=8785 Ack=1 Win=65535 Len=1460
     21 1514          1.268020    76.23.247.139         128.119.245.93        comcam   TCP      comcam > commplex-link [ACK] Seq=10245 Ack=1 Win=65535 Len=1460
     22 1514          1.268168    76.23.247.139         128.119.245.93        comcam   TCP      comcam > commplex-link [ACK] Seq=11705 Ack=1 Win=65535 Len=1460
     25 1514          1.274373    76.23.247.139         128.119.245.93        comcam   TCP      comcam > commplex-link [ACK] Seq=13165 Ack=1 Win=65535 Len=1460
     26 1514          1.274558    76.23.247.139         128.119.245.93        comcam   TCP      comcam > commplex-link [ACK] Seq=14625 Ack=1 Win=65535 Len=1460
     27 1514          1.274684    76.23.247.139         128.119.245.93        comcam   TCP      comcam > commplex-link [PSH, ACK] Seq=16085 Ack=1 Win=65535 Len=1460
     28 1514          1.274825    76.23.247.139         128.119.245.93        comcam   TCP      comcam > commplex-link [ACK] Seq=17545 Ack=1 Win=65535 Len=1460
     33 1514          1.286376    76.23.247.139         128.119.245.93        comcam   TCP      comcam > commplex-link [ACK] Seq=19005 Ack=1 Win=65535 Len=1460
     34 1514          1.286619    76.23.247.139         128.119.245.93        comcam   TCP      comcam > commplex-link [ACK] Seq=20465 Ack=1 Win=65535 Len=1460
     35 1514          1.286743    76.23.247.139         128.119.245.93        comcam   TCP      comcam > commplex-link [ACK] Seq=21925 Ack=1 Win=65535 Len=1460
     36 1514          1.286865    76.23.247.139         128.119.245.93        comcam   TCP      comcam > commplex-link [PSH, ACK] Seq=23385 Ack=1 Win=65535 Len=1460
     37 1514          1.286992    76.23.247.139         128.119.245.93        comcam   TCP      comcam > commplex-link [ACK] Seq=24845 Ack=1 Win=65535 Len=1460
     38 1514          1.287178    76.23.247.139         128.119.245.93        comcam   TCP      comcam > commplex-link [ACK] Seq=26305 Ack=1 Win=65535 Len=1460
     39 1514          1.287301    76.23.247.139         128.119.245.93        comcam   TCP      comcam > commplex-link [ACK] Seq=27765 Ack=1 Win=65535 Len=1460
     40 1514          1.287423    76.23.247.139         128.119.245.93        comcam   TCP      comcam > commplex-link [ACK] Seq=29225 Ack=1 Win=65535 Len=1460
     45 1514          1.295740    76.23.247.139         128.119.245.93        comcam   TCP      comcam > commplex-link [ACK] Seq=30685 Ack=1 Win=65535 Len=1460
     46 702           1.295797    76.23.247.139         128.119.245.93        comcam   TCP      comcam > commplex-link [PSH, ACK] Seq=32145 Ack=1 Win=65535 Len=648
     47 1514          1.295985    76.23.247.139         128.119.245.93        comcam   TCP      comcam > commplex-link [ACK] Seq=32793 Ack=1 Win=65535 Len=1460
     48 1514          1.296113    76.23.247.139         128.119.245.93        comcam   TCP      comcam > commplex-link [ACK] Seq=34253 Ack=1 Win=65535 Len=1460
     49 1514          1.296247    76.23.247.139         128.119.245.93        comcam   TCP      comcam > commplex-link [ACK] Seq=35713 Ack=1 Win=65535 Len=1460
     50 1514          1.296370    76.23.247.139         128.119.245.93        comcam   TCP      comcam > commplex-link [ACK] Seq=37173 Ack=1 Win=65535 Len=1460
     51 1514          1.296999    76.23.247.139         128.119.245.93        comcam   TCP      comcam > commplex-link [ACK] Seq=38633 Ack=1 Win=65535 Len=1460
     52 946           1.297081    76.23.247.139         128.119.245.93        comcam   TCP      comcam > commplex-link [PSH, ACK] Seq=40093 Ack=1 Win=65535 Len=892
     58 1514          1.311687    76.23.247.139         128.119.245.93        comcam   TCP      comcam > commplex-link [ACK] Seq=40985 Ack=1 Win=65535 Len=1460
     59 1514          1.311974    76.23.247.139         128.119.245.93        comcam   TCP      comcam > commplex-link [ACK] Seq=42445 Ack=1 Win=65535 Len=1460
     60 1514          1.312051    76.23.247.139         128.119.245.93        comcam   TCP      comcam > commplex-link [ACK] Seq=43905 Ack=1 Win=65535 Len=1460
     61 1514          1.312173    76.23.247.139         128.119.245.93        comcam   TCP      comcam > commplex-link [ACK] Seq=45365 Ack=1 Win=65535 Len=1460
     62 1514          1.312289    76.23.247.139         128.119.245.93        comcam   TCP      comcam > commplex-link [ACK] Seq=46825 Ack=1 Win=65535 Len=1460
     63 946           1.312376    76.23.247.139         128.119.245.93        comcam   TCP      comcam > commplex-link [PSH, ACK] Seq=48285 Ack=1 Win=65535 Len=892
     69 1514          1.323657    76.23.247.139         128.119.245.93        comcam   TCP      comcam > commplex-link [ACK] Seq=49177 Ack=1 Win=65535 Len=1460
     70 1514          1.323910    76.23.247.139         128.119.245.93        comcam   TCP      comcam > commplex-link [ACK] Seq=50637 Ack=1 Win=65535 Len=1460
     71 1514          1.324033    76.23.247.139         128.119.245.93        comcam   TCP      comcam > commplex-link [ACK] Seq=52097 Ack=1 Win=65535 Len=1460
     72 1514          1.324167    76.23.247.139         128.119.245.93        comcam   TCP      comcam > commplex-link [ACK] Seq=53557 Ack=1 Win=65535 Len=1460
     73 1514          1.324287    76.23.247.139         128.119.245.93        comcam   TCP      comcam > commplex-link [ACK] Seq=55017 Ack=1 Win=65535 Len=1460
     74 946           1.324362    76.23.247.139         128.119.245.93        comcam   TCP      comcam > commplex-link [PSH, ACK] Seq=56477 Ack=1 Win=65535 Len=892
     80 1514          1.348963    76.23.247.139         128.119.245.93        comcam   TCP      comcam > commplex-link [ACK] Seq=57369 Ack=1 Win=65535 Len=1460
     81 1514          1.349284    76.23.247.139         128.119.245.93        comcam   TCP      comcam > commplex-link [ACK] Seq=58829 Ack=1 Win=65535 Len=1460
     82 1514          1.349406    76.23.247.139         128.119.245.93        comcam   TCP      comcam > commplex-link [ACK] Seq=60289 Ack=1 Win=65535 Len=1460
     83 1514          1.349530    76.23.247.139         128.119.245.93        comcam   TCP      comcam > commplex-link [ACK] Seq=61749 Ack=1 Win=65535 Len=1460
     84 1514          1.349654    76.23.247.139         128.119.245.93        comcam   TCP      comcam > commplex-link [ACK] Seq=63209 Ack=1 Win=65535 Len=1460
     85 946           1.349729    76.23.247.139         128.119.245.93        comcam   TCP      comcam > commplex-link [PSH, ACK] Seq=64669 Ack=1 Win=65535 Len=892
     88 1514          1.366277    76.23.247.139         128.119.245.93        comcam   TCP      comcam > commplex-link [ACK] Seq=65561 Ack=1 Win=65535 Len=1460
     89 1514          1.366523    76.23.247.139         128.119.245.93        comcam   TCP      comcam > commplex-link [ACK] Seq=67021 Ack=1 Win=65535 Len=1460
     90 1514          1.366637    76.23.247.139         128.119.245.93        comcam   TCP      comcam > commplex-link [ACK] Seq=68481 Ack=1 Win=65535 Len=1460
     91 1514          1.366782    76.23.247.139         128.119.245.93        comcam   TCP      comcam > commplex-link [ACK] Seq=69941 Ack=1 Win=65535 Len=1460
     92 1514          1.366914    76.23.247.139         128.119.245.93        comcam   TCP      comcam > commplex-link [ACK] Seq=71401 Ack=1 Win=65535 Len=1460
     93 946           1.366990    76.23.247.139         128.119.245.93        comcam   TCP      comcam > commplex-link [PSH, ACK] Seq=72861 Ack=1 Win=65535 Len=892
     98 1514          1.386233    76.23.247.139         128.119.245.93        comcam   TCP      comcam > commplex-link [ACK] Seq=73753 Ack=1 Win=65535 Len=1460
     99 1514          1.386475    76.23.247.139         128.119.245.93        comcam   TCP      comcam > commplex-link [ACK] Seq=75213 Ack=1 Win=65535 Len=1460
    100 1514          1.386597    76.23.247.139         128.119.245.93        comcam   TCP      comcam > commplex-link [ACK] Seq=76673 Ack=1 Win=65535 Len=1460
    101 1514          1.386752    76.23.247.139         128.119.245.93        comcam   TCP      comcam > commplex-link [ACK] Seq=78133 Ack=1 Win=65535 Len=1460
    102 1514          1.386877    76.23.247.139         128.119.245.93        comcam   TCP      comcam > commplex-link [ACK] Seq=79593 Ack=1 Win=65535 Len=1460
    103 946           1.386952    76.23.247.139         128.119.245.93        comcam   TCP      comcam > commplex-link [PSH, ACK] Seq=81053 Ack=1 Win=65535 Len=892
    106 1514          1.396892    76.23.247.139         128.119.245.93        comcam   TCP      comcam > commplex-link [ACK] Seq=81945 Ack=1 Win=65535 Len=1460
    107 1514          1.397120    76.23.247.139         128.119.245.93        comcam   TCP      comcam > commplex-link [ACK] Seq=83405 Ack=1 Win=65535 Len=1460
    108 1514          1.397245    76.23.247.139         128.119.245.93        comcam   TCP      comcam > commplex-link [ACK] Seq=84865 Ack=1 Win=65535 Len=1460
    109 1514          1.397377    76.23.247.139         128.119.245.93        comcam   TCP      comcam > commplex-link [ACK] Seq=86325 Ack=1 Win=65535 Len=1460
    110 1514          1.397501    76.23.247.139         128.119.245.93        comcam   TCP      comcam > commplex-link [ACK] Seq=87785 Ack=1 Win=65535 Len=1460
    111 946           1.397577    76.23.247.139         128.119.245.93        comcam   TCP      comcam > commplex-link [PSH, ACK] Seq=89245 Ack=1 Win=65535 Len=892
    115 1514          1.415645    76.23.247.139         128.119.245.93        comcam   TCP      comcam > commplex-link [ACK] Seq=90137 Ack=1 Win=65535 Len=1460
    116 1514          1.415768    76.23.247.139         128.119.245.93        comcam   TCP      comcam > commplex-link [ACK] Seq=91597 Ack=1 Win=65535 Len=1460
    117 1514          1.415891    76.23.247.139         128.119.245.93        comcam   TCP      comcam > commplex-link [ACK] Seq=93057 Ack=1 Win=65535 Len=1460
    118 1514          1.416060    76.23.247.139         128.119.245.93        comcam   TCP      comcam > commplex-link [ACK] Seq=94517 Ack=1 Win=65535 Len=1460
    119 1514          1.416188    76.23.247.139         128.119.245.93        comcam   TCP      comcam > commplex-link [ACK] Seq=95977 Ack=1 Win=65535 Len=1460
    120 946           1.416264    76.23.247.139         128.119.245.93        comcam   TCP      comcam > commplex-link [PSH, ACK] Seq=97437 Ack=1 Win=65535 Len=892
    124 1514          1.440809    76.23.247.139         128.119.245.93        comcam   TCP      comcam > commplex-link [ACK] Seq=98329 Ack=1 Win=65535 Len=1460
    125 1514          1.441054    76.23.247.139         128.119.245.93        comcam   TCP      comcam > commplex-link [ACK] Seq=99789 Ack=1 Win=65535 Len=1460
    126 1514          1.441174    76.23.247.139         128.119.245.93        comcam   TCP      comcam > commplex-link [ACK] Seq=101249 Ack=1 Win=65535 Len=1460
    127 1514          1.441316    76.23.247.139         128.119.245.93        comcam   TCP      comcam > commplex-link [ACK] Seq=102709 Ack=1 Win=65535 Len=1460
    128 1514          1.441440    76.23.247.139         128.119.245.93        comcam   TCP      comcam > commplex-link [ACK] Seq=104169 Ack=1 Win=65535 Len=1460
    129 946           1.441516    76.23.247.139         128.119.245.93        comcam   TCP      comcam > commplex-link [PSH, ACK] Seq=105629 Ack=1 Win=65535 Len=892
    134 1514          1.458125    76.23.247.139         128.119.245.93        comcam   TCP      comcam > commplex-link [ACK] Seq=106521 Ack=1 Win=65535 Len=1460
    135 1514          1.458455    76.23.247.139         128.119.245.93        comcam   TCP      comcam > commplex-link [ACK] Seq=107981 Ack=1 Win=65535 Len=1460
    136 1514          1.458573    76.23.247.139         128.119.245.93        comcam   TCP      comcam > commplex-link [ACK] Seq=109441 Ack=1 Win=65535 Len=1460
    137 1514          1.458694    76.23.247.139         128.119.245.93        comcam   TCP      comcam > commplex-link [ACK] Seq=110901 Ack=1 Win=65535 Len=1460
    138 1514          1.458818    76.23.247.139         128.119.245.93        comcam   TCP      comcam > commplex-link [ACK] Seq=112361 Ack=1 Win=65535 Len=1460
    139 946           1.458894    76.23.247.139         128.119.245.93        comcam   TCP      comcam > commplex-link [PSH, ACK] Seq=113821 Ack=1 Win=65535 Len=892
    143 1514          1.470097    76.23.247.139         128.119.245.93        comcam   TCP      comcam > commplex-link [ACK] Seq=114713 Ack=1 Win=65535 Len=1460
    144 1514          1.470344    76.23.247.139         128.119.245.93        comcam   TCP      comcam > commplex-link [ACK] Seq=116173 Ack=1 Win=65535 Len=1460
    145 1514          1.470468    76.23.247.139         128.119.245.93        comcam   TCP      comcam > commplex-link [ACK] Seq=117633 Ack=1 Win=65535 Len=1460
    146 1514          1.470598    76.23.247.139         128.119.245.93        comcam   TCP      comcam > commplex-link [ACK] Seq=119093 Ack=1 Win=65535 Len=1460
    147 1514          1.470724    76.23.247.139         128.119.245.93        comcam   TCP      comcam > commplex-link [ACK] Seq=120553 Ack=1 Win=65535 Len=1460
    148 946           1.470800    76.23.247.139         128.119.245.93        comcam   TCP      comcam > commplex-link [PSH, ACK] Seq=122013 Ack=1 Win=65535 Len=892
    153 1514          1.486067    76.23.247.139         128.119.245.93        comcam   TCP      comcam > commplex-link [ACK] Seq=122905 Ack=1 Win=65535 Len=1460
    154 1514          1.486313    76.23.247.139         128.119.245.93        comcam   TCP      comcam > commplex-link [ACK] Seq=124365 Ack=1 Win=65535 Len=1460
    155 1514          1.486438    76.23.247.139         128.119.245.93        comcam   TCP      comcam > commplex-link [ACK] Seq=125825 Ack=1 Win=65535 Len=1460
    156 1514          1.486560    76.23.247.139         128.119.245.93        comcam   TCP      comcam > commplex-link [ACK] Seq=127285 Ack=1 Win=65535 Len=1460
    157 1514          1.486686    76.23.247.139         128.119.245.93        comcam   TCP      comcam > commplex-link [ACK] Seq=128745 Ack=1 Win=65535 Len=1460
    158 946           1.486762    76.23.247.139         128.119.245.93        comcam   TCP      comcam > commplex-link [PSH, ACK] Seq=130205 Ack=1 Win=65535 Len=892
    167 1514          1.510032    76.23.247.139         128.119.245.93        comcam   TCP      comcam > commplex-link [ACK] Seq=131097 Ack=1 Win=65535 Len=1460
    168 1514          1.510286    76.23.247.139         128.119.245.93        comcam   TCP      comcam > commplex-link [ACK] Seq=132557 Ack=1 Win=65535 Len=1460
    169 1514          1.510409    76.23.247.139         128.119.245.93        comcam   TCP      comcam > commplex-link [ACK] Seq=134017 Ack=1 Win=65535 Len=1460
    170 1514          1.510601    76.23.247.139         128.119.245.93        comcam   TCP      comcam > commplex-link [ACK] Seq=135477 Ack=1 Win=65535 Len=1460
    171 1514          1.510725    76.23.247.139         128.119.245.93        comcam   TCP      comcam > commplex-link [ACK] Seq=136937 Ack=1 Win=65535 Len=1460
    172 946           1.510803    76.23.247.139         128.119.245.93        comcam   TCP      comcam > commplex-link [PSH, ACK] Seq=138397 Ack=1 Win=65535 Len=892
    177 1514          1.530005    76.23.247.139         128.119.245.93        comcam   TCP      comcam > commplex-link [ACK] Seq=139289 Ack=1 Win=65535 Len=1460
    178 1514          1.530255    76.23.247.139         128.119.245.93        comcam   TCP      comcam > commplex-link [ACK] Seq=140749 Ack=1 Win=65535 Len=1460
    179 1514          1.530378    76.23.247.139         128.119.245.93        comcam   TCP      comcam > commplex-link [ACK] Seq=142209 Ack=1 Win=65535 Len=1460
    180 1514          1.530518    76.23.247.139         128.119.245.93        comcam   TCP      comcam > commplex-link [ACK] Seq=143669 Ack=1 Win=65535 Len=1460
    181 1514          1.530640    76.23.247.139         128.119.245.93        comcam   TCP      comcam > commplex-link [ACK] Seq=145129 Ack=1 Win=65535 Len=1460
    182 946           1.530716    76.23.247.139         128.119.245.93        comcam   TCP      comcam > commplex-link [PSH, ACK] Seq=146589 Ack=1 Win=65535 Len=892
    186 1514          1.547313    76.23.247.139         128.119.245.93        comcam   TCP      comcam > commplex-link [ACK] Seq=147481 Ack=1 Win=65535 Len=1460
    187 1514          1.547561    76.23.247.139         128.119.245.93        comcam   TCP      comcam > commplex-link [ACK] Seq=148941 Ack=1 Win=65535 Len=1460
    188 1514          1.547684    76.23.247.139         128.119.245.93        comcam   TCP      comcam > commplex-link [ACK] Seq=150401 Ack=1 Win=65535 Len=1460
    189 1514          1.547824    76.23.247.139         128.119.245.93        comcam   TCP      comcam > commplex-link [ACK] Seq=151861 Ack=1 Win=65535 Len=1460
    190 1514          1.547949    76.23.247.139         128.119.245.93        comcam   TCP      comcam > commplex-link [ACK] Seq=153321 Ack=1 Win=65535 Len=1460
    191 946           1.548022    76.23.247.139         128.119.245.93        comcam   TCP      comcam > commplex-link [PSH, ACK] Seq=154781 Ack=1 Win=65535 Len=892
    194 1514          1.560625    76.23.247.139         128.119.245.93        comcam   TCP      comcam > commplex-link [ACK] Seq=155673 Ack=1 Win=65535 Len=1460
    195 1514          1.560875    76.23.247.139         128.119.245.93        comcam   TCP      comcam > commplex-link [ACK] Seq=157133 Ack=1 Win=65535 Len=1460
    196 1514          1.560998    76.23.247.139         128.119.245.93        comcam   TCP      comcam > commplex-link [ACK] Seq=158593 Ack=1 Win=65535 Len=1460
    197 1514          1.561131    76.23.247.139         128.119.245.93        comcam   TCP      comcam > commplex-link [ACK] Seq=160053 Ack=1 Win=65535 Len=1460
    198 1514          1.561255    76.23.247.139         128.119.245.93        comcam   TCP      comcam > commplex-link [ACK] Seq=161513 Ack=1 Win=65535 Len=1460
    199 946           1.561333    76.23.247.139         128.119.245.93        comcam   TCP      comcam > commplex-link [PSH, ACK] Seq=162973 Ack=1 Win=65535 Len=892
    203 1514          1.576594    76.23.247.139         128.119.245.93        comcam   TCP      comcam > commplex-link [ACK] Seq=163865 Ack=1 Win=65535 Len=1460
    204 1514          1.576843    76.23.247.139         128.119.245.93        comcam   TCP      comcam > commplex-link [ACK] Seq=165325 Ack=1 Win=65535 Len=1460
    205 1514          1.576966    76.23.247.139         128.119.245.93        comcam   TCP      comcam > commplex-link [ACK] Seq=166785 Ack=1 Win=65535 Len=1460
    206 1514          1.577106    76.23.247.139         128.119.245.93        comcam   TCP      comcam > commplex-link [ACK] Seq=168245 Ack=1 Win=65535 Len=1460
    207 1514          1.577231    76.23.247.139         128.119.245.93        comcam   TCP      comcam > commplex-link [ACK] Seq=169705 Ack=1 Win=65535 Len=1460
    208 946           1.577306    76.23.247.139         128.119.245.93        comcam   TCP      comcam > commplex-link [PSH, ACK] Seq=171165 Ack=1 Win=65535 Len=892
    213 1514          1.604551    76.23.247.139         128.119.245.93        comcam   TCP      comcam > commplex-link [ACK] Seq=172057 Ack=1 Win=65535 Len=1460
    214 1514          1.604803    76.23.247.139         128.119.245.93        comcam   TCP      comcam > commplex-link [ACK] Seq=173517 Ack=1 Win=65535 Len=1460
    215 1514          1.604933    76.23.247.139         128.119.245.93        comcam   TCP      comcam > commplex-link [ACK] Seq=174977 Ack=1 Win=65535 Len=1460
    216 1514          1.605129    76.23.247.139         128.119.245.93        comcam   TCP      comcam > commplex-link [ACK] Seq=176437 Ack=1 Win=65535 Len=1460
    217 1514          1.605264    76.23.247.139         128.119.245.93        comcam   TCP      comcam > commplex-link [ACK] Seq=177897 Ack=1 Win=65535 Len=1460
    218 946           1.605337    76.23.247.139         128.119.245.93        comcam   TCP      comcam > commplex-link [PSH, ACK] Seq=179357 Ack=1 Win=65535 Len=892
    222 1514          1.617865    76.23.247.139         128.119.245.93        comcam   TCP      comcam > commplex-link [ACK] Seq=180249 Ack=1 Win=65535 Len=1460
    223 1514          1.618111    76.23.247.139         128.119.245.93        comcam   TCP      comcam > commplex-link [ACK] Seq=181709 Ack=1 Win=65535 Len=1460
    224 1514          1.618241    76.23.247.139         128.119.245.93        comcam   TCP      comcam > commplex-link [ACK] Seq=183169 Ack=1 Win=65535 Len=1460
    225 1514          1.618369    76.23.247.139         128.119.245.93        comcam   TCP      comcam > commplex-link [ACK] Seq=184629 Ack=1 Win=65535 Len=1460
    226 1514          1.618494    76.23.247.139         128.119.245.93        comcam   TCP      comcam > commplex-link [ACK] Seq=186089 Ack=1 Win=65535 Len=1460
    227 946           1.618582    76.23.247.139         128.119.245.93        comcam   TCP      comcam > commplex-link [PSH, ACK] Seq=187549 Ack=1 Win=65535 Len=892
    230 1514          1.633846    76.23.247.139         128.119.245.93        comcam   TCP      comcam > commplex-link [ACK] Seq=188441 Ack=1 Win=65535 Len=1460
    231 1514          1.634090    76.23.247.139         128.119.245.93        comcam   TCP      comcam > commplex-link [ACK] Seq=189901 Ack=1 Win=65535 Len=1460
    232 1514          1.634208    76.23.247.139         128.119.245.93        comcam   TCP      comcam > commplex-link [ACK] Seq=191361 Ack=1 Win=65535 Len=1460
    233 1514          1.634346    76.23.247.139         128.119.245.93        comcam   TCP      comcam > commplex-link [ACK] Seq=192821 Ack=1 Win=65535 Len=1460
    234 1514          1.634473    76.23.247.139         128.119.245.93        comcam   TCP      comcam > commplex-link [ACK] Seq=194281 Ack=1 Win=65535 Len=1460
    235 946           1.634552    76.23.247.139         128.119.245.93        comcam   TCP      comcam > commplex-link [PSH, ACK] Seq=195741 Ack=1 Win=65535 Len=892
    246 1514          1.665793    76.23.247.139         128.119.245.93        comcam   TCP      comcam > commplex-link [ACK] Seq=196633 Ack=1 Win=65535 Len=1460
    247 1514          1.666039    76.23.247.139         128.119.245.93        comcam   TCP      comcam > commplex-link [ACK] Seq=198093 Ack=1 Win=65535 Len=1460
    248 1514          1.666168    76.23.247.139         128.119.245.93        comcam   TCP      comcam > commplex-link [ACK] Seq=199553 Ack=1 Win=65535 Len=1460
    249 1514          1.666291    76.23.247.139         128.119.245.93        comcam   TCP      comcam > commplex-link [ACK] Seq=201013 Ack=1 Win=65535 Len=1460
    250 1514          1.666432    76.23.247.139         128.119.245.93        comcam   TCP      comcam > commplex-link [ACK] Seq=202473 Ack=1 Win=65535 Len=1460
    251 946           1.666493    76.23.247.139         128.119.245.93        comcam   TCP      comcam > commplex-link [PSH, ACK] Seq=203933 Ack=1 Win=65535 Len=892
    257 1514          1.681779    76.23.247.139         128.119.245.93        comcam   TCP      comcam > commplex-link [ACK] Seq=204825 Ack=1 Win=65535 Len=1460
    258 1514          1.682019    76.23.247.139         128.119.245.93        comcam   TCP      comcam > commplex-link [ACK] Seq=206285 Ack=1 Win=65535 Len=1460
    259 1514          1.682142    76.23.247.139         128.119.245.93        comcam   TCP      comcam > commplex-link [ACK] Seq=207745 Ack=1 Win=65535 Len=1460
    260 1514          1.682274    76.23.247.139         128.119.245.93        comcam   TCP      comcam > commplex-link [ACK] Seq=209205 Ack=1 Win=65535 Len=1460
    261 1514          1.682398    76.23.247.139         128.119.245.93        comcam   TCP      comcam > commplex-link [ACK] Seq=210665 Ack=1 Win=65535 Len=1460
    262 946           1.682478    76.23.247.139         128.119.245.93        comcam   TCP      comcam > commplex-link [PSH, ACK] Seq=212125 Ack=1 Win=65535 Len=892
    266 1514          1.700404    76.23.247.139         128.119.245.93        comcam   TCP      comcam > commplex-link [ACK] Seq=213017 Ack=1 Win=65535 Len=1460
    267 1514          1.700646    76.23.247.139         128.119.245.93        comcam   TCP      comcam > commplex-link [ACK] Seq=214477 Ack=1 Win=65535 Len=1460
    268 1514          1.700773    76.23.247.139         128.119.245.93        comcam   TCP      comcam > commplex-link [ACK] Seq=215937 Ack=1 Win=65535 Len=1460
    269 1514          1.700904    76.23.247.139         128.119.245.93        comcam   TCP      comcam > commplex-link [ACK] Seq=217397 Ack=1 Win=65535 Len=1460
    270 1514          1.701031    76.23.247.139         128.119.245.93        comcam   TCP      comcam > commplex-link [ACK] Seq=218857 Ack=1 Win=65535 Len=1460
    271 946           1.701106    76.23.247.139         128.119.245.93        comcam   TCP      comcam > commplex-link [PSH, ACK] Seq=220317 Ack=1 Win=65535 Len=892
    274 1514          1.716382    76.23.247.139         128.119.245.93        comcam   TCP      comcam > commplex-link [ACK] Seq=221209 Ack=1 Win=65535 Len=1460
    275 1514          1.716623    76.23.247.139         128.119.245.93        comcam   TCP      comcam > commplex-link [ACK] Seq=222669 Ack=1 Win=65535 Len=1460
    276 1514          1.716748    76.23.247.139         128.119.245.93        comcam   TCP      comcam > commplex-link [ACK] Seq=224129 Ack=1 Win=65535 Len=1460
    277 1514          1.716885    76.23.247.139         128.119.245.93        comcam   TCP      comcam > commplex-link [ACK] Seq=225589 Ack=1 Win=65535 Len=1460
    278 1514          1.717012    76.23.247.139         128.119.245.93        comcam   TCP      comcam > commplex-link [ACK] Seq=227049 Ack=1 Win=65535 Len=1460
    279 946           1.717091    76.23.247.139         128.119.245.93        comcam   TCP      comcam > commplex-link [PSH, ACK] Seq=228509 Ack=1 Win=65535 Len=892
    283 1514          1.728363    76.23.247.139         128.119.245.93        comcam   TCP      comcam > commplex-link [ACK] Seq=229401 Ack=1 Win=65535 Len=1460
    284 1514          1.728609    76.23.247.139         128.119.245.93        comcam   TCP      comcam > commplex-link [ACK] Seq=230861 Ack=1 Win=65535 Len=1460
    285 1514          1.728734    76.23.247.139         128.119.245.93        comcam   TCP      comcam > commplex-link [ACK] Seq=232321 Ack=1 Win=65535 Len=1460
    286 1514          1.728861    76.23.247.139         128.119.245.93        comcam   TCP      comcam > commplex-link [ACK] Seq=233781 Ack=1 Win=65535 Len=1460
    287 1514          1.728975    76.23.247.139         128.119.245.93        comcam   TCP      comcam > commplex-link [ACK] Seq=235241 Ack=1 Win=65535 Len=1460
    288 946           1.729063    76.23.247.139         128.119.245.93        comcam   TCP      comcam > commplex-link [PSH, ACK] Seq=236701 Ack=1 Win=65535 Len=892
    293 1514          1.755117    76.23.247.139         128.119.245.93        comcam   TCP      comcam > commplex-link [ACK] Seq=237593 Ack=1 Win=65535 Len=1460
    295 1514          1.755312    76.23.247.139         128.119.245.93        comcam   TCP      comcam > commplex-link [ACK] Seq=239053 Ack=1 Win=65535 Len=1460
    296 1514          1.755451    76.23.247.139         128.119.245.93        comcam   TCP      comcam > commplex-link [ACK] Seq=240513 Ack=1 Win=65535 Len=1460
    297 1514          1.755574    76.23.247.139         128.119.245.93        comcam   TCP      comcam > commplex-link [ACK] Seq=241973 Ack=1 Win=65535 Len=1460
    298 1514          1.755698    76.23.247.139         128.119.245.93        comcam   TCP      comcam > commplex-link [ACK] Seq=243433 Ack=1 Win=65535 Len=1460
    299 946           1.755776    76.23.247.139         128.119.245.93        comcam   TCP      comcam > commplex-link [PSH, ACK] Seq=244893 Ack=1 Win=65535 Len=892
    302 1514          1.776281    76.23.247.139         128.119.245.93        comcam   TCP      comcam > commplex-link [ACK] Seq=245785 Ack=1 Win=65535 Len=1460
    303 1514          1.776533    76.23.247.139         128.119.245.93        comcam   TCP      comcam > commplex-link [ACK] Seq=247245 Ack=1 Win=65535 Len=1460
    304 1514          1.776655    76.23.247.139         128.119.245.93        comcam   TCP      comcam > commplex-link [ACK] Seq=248705 Ack=1 Win=65535 Len=1460
    305 1514          1.776791    76.23.247.139         128.119.245.93        comcam   TCP      comcam > commplex-link [ACK] Seq=250165 Ack=1 Win=65535 Len=1460
    306 1514          1.776916    76.23.247.139         128.119.245.93        comcam   TCP      comcam > commplex-link [ACK] Seq=251625 Ack=1 Win=65535 Len=1460
    307 946           1.776992    76.23.247.139         128.119.245.93        comcam   TCP      comcam > commplex-link [PSH, ACK] Seq=253085 Ack=1 Win=65535 Len=892
    311 1514          1.785615    76.23.247.139         128.119.245.93        comcam   TCP      comcam > commplex-link [ACK] Seq=253977 Ack=1 Win=65535 Len=1460
    312 1514          1.785935    76.23.247.139         128.119.245.93        comcam   TCP      comcam > commplex-link [ACK] Seq=255437 Ack=1 Win=65535 Len=1460
    313 1514          1.786058    76.23.247.139         128.119.245.93        comcam   TCP      comcam > commplex-link [ACK] Seq=256897 Ack=1 Win=65535 Len=1460
    314 1514          1.786181    76.23.247.139         128.119.245.93        comcam   TCP      comcam > commplex-link [ACK] Seq=258357 Ack=1 Win=65535 Len=1460
    315 1514          1.786307    76.23.247.139         128.119.245.93        comcam   TCP      comcam > commplex-link [ACK] Seq=259817 Ack=1 Win=65535 Len=1460
    316 946           1.786383    76.23.247.139         128.119.245.93        comcam   TCP      comcam > commplex-link [PSH, ACK] Seq=261277 Ack=1 Win=65535 Len=892
    319 1514          1.802911    76.23.247.139         128.119.245.93        comcam   TCP      comcam > commplex-link [ACK] Seq=262169 Ack=1 Win=65535 Len=1460
    320 1514          1.803165    76.23.247.139         128.119.245.93        comcam   TCP      comcam > commplex-link [ACK] Seq=263629 Ack=1 Win=65535 Len=1460
    321 1514          1.803280    76.23.247.139         128.119.245.93        comcam   TCP      comcam > commplex-link [ACK] Seq=265089 Ack=1 Win=65535 Len=1460
    322 1514          1.803420    76.23.247.139         128.119.245.93        comcam   TCP      comcam > commplex-link [ACK] Seq=266549 Ack=1 Win=65535 Len=1460
    323 1514          1.803544    76.23.247.139         128.119.245.93        comcam   TCP      comcam > commplex-link [ACK] Seq=268009 Ack=1 Win=65535 Len=1460
    324 946           1.803620    76.23.247.139         128.119.245.93        comcam   TCP      comcam > commplex-link [PSH, ACK] Seq=269469 Ack=1 Win=65535 Len=892
    330 1514          1.829531    76.23.247.139         128.119.245.93        comcam   TCP      comcam > commplex-link [ACK] Seq=270361 Ack=1 Win=65535 Len=1460
    331 1514          1.829784    76.23.247.139         128.119.245.93        comcam   TCP      comcam > commplex-link [ACK] Seq=271821 Ack=1 Win=65535 Len=1460
    332 1514          1.829920    76.23.247.139         128.119.245.93        comcam   TCP      comcam > commplex-link [ACK] Seq=273281 Ack=1 Win=65535 Len=1460
    333 1514          1.830107    76.23.247.139         128.119.245.93        comcam   TCP      comcam > commplex-link [ACK] Seq=274741 Ack=1 Win=65535 Len=1460
    334 1514          1.830232    76.23.247.139         128.119.245.93        comcam   TCP      comcam > commplex-link [ACK] Seq=276201 Ack=1 Win=65535 Len=1460
    335 946           1.830313    76.23.247.139         128.119.245.93        comcam   TCP      comcam > commplex-link [PSH, ACK] Seq=277661 Ack=1 Win=65535 Len=892
    338 1514          1.844166    76.23.247.139         128.119.245.93        comcam   TCP      comcam > commplex-link [ACK] Seq=278553 Ack=1 Win=65535 Len=1460
    339 1514          1.844408    76.23.247.139         128.119.245.93        comcam   TCP      comcam > commplex-link [ACK] Seq=280013 Ack=1 Win=65535 Len=1460
    340 1514          1.844531    76.23.247.139         128.119.245.93        comcam   TCP      comcam > commplex-link [ACK] Seq=281473 Ack=1 Win=65535 Len=1460
    341 1514          1.844666    76.23.247.139         128.119.245.93        comcam   TCP      comcam > commplex-link [ACK] Seq=282933 Ack=1 Win=65535 Len=1460
    342 1514          1.844789    76.23.247.139         128.119.245.93        comcam   TCP      comcam > commplex-link [ACK] Seq=284393 Ack=1 Win=65535 Len=1460
    343 946           1.844868    76.23.247.139         128.119.245.93        comcam   TCP      comcam > commplex-link [PSH, ACK] Seq=285853 Ack=1 Win=65535 Len=892
    349 1514          1.860157    76.23.247.139         128.119.245.93        comcam   TCP      comcam > commplex-link [ACK] Seq=286745 Ack=1 Win=65535 Len=1460
    350 1514          1.860408    76.23.247.139         128.119.245.93        comcam   TCP      comcam > commplex-link [ACK] Seq=288205 Ack=1 Win=65535 Len=1460
    351 1514          1.860531    76.23.247.139         128.119.245.93        comcam   TCP      comcam > commplex-link [ACK] Seq=289665 Ack=1 Win=65535 Len=1460
    352 1514          1.860654    76.23.247.139         128.119.245.93        comcam   TCP      comcam > commplex-link [ACK] Seq=291125 Ack=1 Win=65535 Len=1460
    353 1514          1.860787    76.23.247.139         128.119.245.93        comcam   TCP      comcam > commplex-link [ACK] Seq=292585 Ack=1 Win=65535 Len=1460
    354 946           1.860856    76.23.247.139         128.119.245.93        comcam   TCP      comcam > commplex-link [PSH, ACK] Seq=294045 Ack=1 Win=65535 Len=892
    360 1514          1.876145    76.23.247.139         128.119.245.93        comcam   TCP      comcam > commplex-link [ACK] Seq=294937 Ack=1 Win=65535 Len=1460
    361 1514          1.876402    76.23.247.139         128.119.245.93        comcam   TCP      comcam > commplex-link [ACK] Seq=296397 Ack=1 Win=65535 Len=1460
    362 1514          1.876513    76.23.247.139         128.119.245.93        comcam   TCP      comcam > commplex-link [ACK] Seq=297857 Ack=1 Win=65535 Len=1460
    363 1514          1.876651    76.23.247.139         128.119.245.93        comcam   TCP      comcam > commplex-link [ACK] Seq=299317 Ack=1 Win=65535 Len=1460
    364 1514          1.876776    76.23.247.139         128.119.245.93        comcam   TCP      comcam > commplex-link [ACK] Seq=300777 Ack=1 Win=65535 Len=1460
    365 946           1.876851    76.23.247.139         128.119.245.93        comcam   TCP      comcam > commplex-link [PSH, ACK] Seq=302237 Ack=1 Win=65535 Len=892
    371 1514          1.888208    76.23.247.139         128.119.245.93        comcam   TCP      comcam > commplex-link [ACK] Seq=303129 Ack=1 Win=65535 Len=1460
    372 1514          1.888450    76.23.247.139         128.119.245.93        comcam   TCP      comcam > commplex-link [ACK] Seq=304589 Ack=1 Win=65535 Len=1460
    373 1514          1.888573    76.23.247.139         128.119.245.93        comcam   TCP      comcam > commplex-link [ACK] Seq=306049 Ack=1 Win=65535 Len=1460
    374 1514          1.888703    76.23.247.139         128.119.245.93        comcam   TCP      comcam > commplex-link [ACK] Seq=307509 Ack=1 Win=65535 Len=1460
    375 1514          1.888832    76.23.247.139         128.119.245.93        comcam   TCP      comcam > commplex-link [ACK] Seq=308969 Ack=1 Win=65535 Len=1460
    376 946           1.888909    76.23.247.139         128.119.245.93        comcam   TCP      comcam > commplex-link [PSH, ACK] Seq=310429 Ack=1 Win=65535 Len=892
    381 1514          1.918725    76.23.247.139         128.119.245.93        comcam   TCP      comcam > commplex-link [ACK] Seq=311321 Ack=1 Win=65535 Len=1460
    382 1514          1.918973    76.23.247.139         128.119.245.93        comcam   TCP      comcam > commplex-link [ACK] Seq=312781 Ack=1 Win=65535 Len=1460
    383 1514          1.919100    76.23.247.139         128.119.245.93        comcam   TCP      comcam > commplex-link [ACK] Seq=314241 Ack=1 Win=65535 Len=1460
    384 1514          1.919231    76.23.247.139         128.119.245.93        comcam   TCP      comcam > commplex-link [ACK] Seq=315701 Ack=1 Win=65535 Len=1460
    385 1514          1.919370    76.23.247.139         128.119.245.93        comcam   TCP      comcam > commplex-link [ACK] Seq=317161 Ack=1 Win=65535 Len=1460
    386 946           1.919436    76.23.247.139         128.119.245.93        comcam   TCP      comcam > commplex-link [PSH, ACK] Seq=318621 Ack=1 Win=65535 Len=892
    391 1514          1.938696    76.23.247.139         128.119.245.93        comcam   TCP      comcam > commplex-link [ACK] Seq=319513 Ack=1 Win=65535 Len=1460
    392 1514          1.938944    76.23.247.139         128.119.245.93        comcam   TCP      comcam > commplex-link [ACK] Seq=320973 Ack=1 Win=65535 Len=1460
    393 1514          1.939067    76.23.247.139         128.119.245.93        comcam   TCP      comcam > commplex-link [ACK] Seq=322433 Ack=1 Win=65535 Len=1460
    394 1514          1.939201    76.23.247.139         128.119.245.93        comcam   TCP      comcam > commplex-link [ACK] Seq=323893 Ack=1 Win=65535 Len=1460
    395 1514          1.939326    76.23.247.139         128.119.245.93        comcam   TCP      comcam > commplex-link [ACK] Seq=325353 Ack=1 Win=65535 Len=1460
    396 946           1.939403    76.23.247.139         128.119.245.93        comcam   TCP      comcam > commplex-link [PSH, ACK] Seq=326813 Ack=1 Win=65535 Len=892
    399 1514          1.953442    76.23.247.139         128.119.245.93        comcam   TCP      comcam > commplex-link [ACK] Seq=327705 Ack=1 Win=65535 Len=1460
    400 1514          1.953687    76.23.247.139         128.119.245.93        comcam   TCP      comcam > commplex-link [ACK] Seq=329165 Ack=1 Win=65535 Len=1460
    401 1514          1.953810    76.23.247.139         128.119.245.93        comcam   TCP      comcam > commplex-link [ACK] Seq=330625 Ack=1 Win=65535 Len=1460
    402 1514          1.953944    76.23.247.139         128.119.245.93        comcam   TCP      comcam > commplex-link [ACK] Seq=332085 Ack=1 Win=65535 Len=1460
    403 1514          1.954058    76.23.247.139         128.119.245.93        comcam   TCP      comcam > commplex-link [ACK] Seq=333545 Ack=1 Win=65535 Len=1460
