      4 62            1.541607    76.23.247.139         128.119.245.93        idonix-metanet TCP      idonix-metanet > commplex-link [SYN] Seq=0 Win=65535 Len=0 MSS=1460 SACK_PERM=1
      6 60            1.557996    76.23.247.139         128.119.245.93        idonix-metanet TCP      idonix-metanet > commplex-link [ACK] Seq=1 Ack=1 Win=65535 Len=0
      7 78            1.560168    76.23.247.139         128.119.245.93        idonix-metanet TCP      idonix-metanet > commplex-link [PSH, ACK] Seq=1 Ack=1 Win=65535 Len=24
      8 1514          1.561540    76.23.247.139         128.119.245.93        idonix-metanet TCP      idonix-metanet > commplex-link [ACK] Seq=25 Ack=1 Win=65535 Len=1460
     10 1514          1.577024    76.23.247.139         128.119.245.93        idonix-metanet TCP      idonix-metanet > commplex-link [ACK] Seq=1485 Ack=1 Win=65535 Len=1460
     11 1514          1.577211    76.23.247.139         128.119.245.93        idonix-metanet TCP      idonix-metanet > commplex-link [ACK] Seq=2945 Ack=1 Win=65535 Len=1460
     13 1514          1.582335    76.23.247.139         128.119.245.93        idonix-metanet TCP      idonix-metanet > commplex-link [ACK] Seq=4405 Ack=1 Win=65535 Len=1460
     14 1514          1.582529    76.23.247.139         128.119.245.93        idonix-metanet TCP      idonix-metanet > commplex-link [ACK] Seq=5865 Ack=1 Win=65535 Len=1460
     17 1514          1.595677    76.23.247.139         128.119.245.93        idonix-metanet TCP      idonix-metanet > commplex-link [PSH, ACK] Seq=7325 Ack=1 Win=65535 Len=1460
     18 1514          1.595868    76.23.247.139         128.119.245.93        idonix-metanet TCP      idonix-metanet > commplex-link [ACK] Seq=8785 Ack=1 Win=65535 Len=1460
     19 1514          1.595982    76.23.247.139         128.119.245.93        idonix-metanet TCP      idonix-metanet > commplex-link [ACK] Seq=10245 Ack=1 Win=65535 Len=1460
     20 1514          1.596131    76.23.247.139         128.119.245.93        idonix-metanet TCP      idonix-metanet > commplex-link [ACK] Seq=11705 Ack=1 Win=65535 Len=1460
     23 1514          1.603645    76.23.247.139         128.119.245.93        idonix-metanet TCP      idonix-metanet > commplex-link [ACK] Seq=13165 Ack=1 Win=65535 Len=1460
     24 1514          1.603986    76.23.247.139         128.119.245.93        idonix-metanet TCP      idonix-metanet > commplex-link [ACK] Seq=14625 Ack=1 Win=65535 Len=1460
     25 1514          1.604110    76.23.247.139         128.119.245.93        idonix-metanet TCP      idonix-metanet > commplex-link [PSH, ACK] Seq=16085 Ack=1 Win=65535 Len=1460
     26 1514          1.604233    76.23.247.139         128.119.245.93        idonix-metanet TCP      idonix-metanet > commplex-link [ACK] Seq=17545 Ack=1 Win=65535 Len=1460
     32 1514          1.612996    76.23.247.139         128.119.245.93        idonix-metanet TCP      idonix-metanet > commplex-link [ACK] Seq=19005 Ack=1 Win=65535 Len=1460
     33 1514          1.613241    76.23.247.139         128.119.245.93        idonix-metanet TCP      idonix-metanet > commplex-link [ACK] Seq=20465 Ack=1 Win=65535 Len=1460
     34 1514          1.613354    76.23.247.139         128.119.245.93        idonix-metanet TCP      idonix-metanet > commplex-link [ACK] Seq=21925 Ack=1 Win=65535 Len=1460
     35 1514          1.613609    76.23.247.139         128.119.245.93        idonix-metanet TCP      idonix-metanet > commplex-link [PSH, ACK] Seq=23385 Ack=1 Win=65535 Len=1460
     36 1514          1.613731    76.23.247.139         128.119.245.93        idonix-metanet TCP      idonix-metanet > commplex-link [ACK] Seq=24845 Ack=1 Win=65535 Len=1460
     37 1514          1.613854    76.23.247.139         128.119.245.93        idonix-metanet TCP      idonix-metanet > commplex-link [ACK] Seq=26305 Ack=1 Win=65535 Len=1460
     38 1514          1.613981    76.23.247.139         128.119.245.93        idonix-metanet TCP      idonix-metanet > commplex-link [ACK] Seq=27765 Ack=1 Win=65535 Len=1460
     39 1514          1.614106    76.23.247.139         128.119.245.93        idonix-metanet TCP      idonix-metanet > commplex-link [ACK] Seq=29225 Ack=1 Win=65535 Len=1460
     41 1514          1.627611    76.23.247.139         128.119.245.93        idonix-metanet TCP      idonix-metanet > commplex-link [ACK] Seq=30685 Ack=1 Win=65535 Len=1460
     42 702           1.627669    76.23.247.139         128.119.245.93        idonix-metanet TCP      idonix-metanet > commplex-link [PSH, ACK] Seq=32145 Ack=1 Win=65535 Len=648
     46 1514          1.630318    76.23.247.139         128.119.245.93        idonix-metanet TCP      idonix-metanet > commplex-link [ACK] Seq=32793 Ack=1 Win=65535 Len=1460
     47 1514          1.630517    76.23.247.139         128.119.245.93        idonix-metanet TCP      idonix-metanet > commplex-link [ACK] Seq=34253 Ack=1 Win=65535 Len=1460
     48 1514          1.630634    76.23.247.139         128.119.245.93        idonix-metanet TCP      idonix-metanet > commplex-link [ACK] Seq=35713 Ack=1 Win=65535 Len=1460
     49 1514          1.630781    76.23.247.139         128.119.245.93        idonix-metanet TCP      idonix-metanet > commplex-link [ACK] Seq=37173 Ack=1 Win=65535 Len=1460
     50 1514          1.631610    76.23.247.139         128.119.245.93        idonix-metanet TCP      idonix-metanet > commplex-link [ACK] Seq=38633 Ack=1 Win=65535 Len=1460
     51 946           1.631686    76.23.247.139         128.119.245.93        idonix-metanet TCP      idonix-metanet > commplex-link [PSH, ACK] Seq=40093 Ack=1 Win=65535 Len=892
     57 1514          1.641083    76.23.247.139         128.119.245.93        idonix-metanet TCP      idonix-metanet > commplex-link [ACK] Seq=40985 Ack=1 Win=65535 Len=1460
     58 1514          1.641290    76.23.247.139         128.119.245.93        idonix-metanet TCP      idonix-metanet > commplex-link [ACK] Seq=42445 Ack=1 Win=65535 Len=1460
     59 1514          1.641412    76.23.247.139         128.119.245.93        idonix-metanet TCP      idonix-metanet > commplex-link [ACK] Seq=43905 Ack=1 Win=65535 Len=1460
     60 1514          1.641535    76.23.247.139         128.119.245.93        idonix-metanet TCP      idonix-metanet > commplex-link [ACK] Seq=45365 Ack=1 Win=65535 Len=1460
     61 1514          1.641661    76.23.247.139         128.119.245.93        idonix-metanet TCP      idonix-metanet > commplex-link [ACK] Seq=46825 Ack=1 Win=65535 Len=1460
     62 946           1.641738    76.23.247.139         128.119.245.93        idonix-metanet TCP      idonix-metanet > commplex-link [PSH, ACK] Seq=48285 Ack=1 Win=65535 Len=892
     70 1514          1.670246    76.23.247.139         128.119.245.93        idonix-metanet TCP      idonix-metanet > commplex-link [ACK] Seq=49177 Ack=1 Win=65535 Len=1460
     71 1514          1.670499    76.23.247.139         128.119.245.93        idonix-metanet TCP      idonix-metanet > commplex-link [ACK] Seq=50637 Ack=1 Win=65535 Len=1460
     72 1514          1.670622    76.23.247.139         128.119.245.93        idonix-metanet TCP      idonix-metanet > commplex-link [ACK] Seq=52097 Ack=1 Win=65535 Len=1460
     73 1514          1.670807    76.23.247.139         128.119.245.93        idonix-metanet TCP      idonix-metanet > commplex-link [ACK] Seq=53557 Ack=1 Win=65535 Len=1460
     74 1514          1.670916    76.23.247.139         128.119.245.93        idonix-metanet TCP      idonix-metanet > commplex-link [ACK] Seq=55017 Ack=1 Win=65535 Len=1460
     75 946           1.671020    76.23.247.139         128.119.245.93        idonix-metanet TCP      idonix-metanet > commplex-link [PSH, ACK] Seq=56477 Ack=1 Win=65535 Len=892
     79 1514          1.687556    76.23.247.139         128.119.245.93        idonix-metanet TCP      idonix-metanet > commplex-link [ACK] Seq=57369 Ack=1 Win=65535 Len=1460
     80 1514          1.687798    76.23.247.139         128.119.245.93        idonix-metanet TCP      idonix-metanet > commplex-link [ACK] Seq=58829 Ack=1 Win=65535 Len=1460
     81 1514          1.687923    76.23.247.139         128.119.245.93        idonix-metanet TCP      idonix-metanet > commplex-link [ACK] Seq=60289 Ack=1 Win=65535 Len=1460
     82 1514          1.688069    76.23.247.139         128.119.245.93        idonix-metanet TCP      idonix-metanet > commplex-link [ACK] Seq=61749 Ack=1 Win=65535 Len=1460
     83 1514          1.688183    76.23.247.139         128.119.245.93        idonix-metanet TCP      idonix-metanet > commplex-link [ACK] Seq=63209 Ack=1 Win=65535 Len=1460
     84 946           1.688274    76.23.247.139         128.119.245.93        idonix-metanet TCP      idonix-metanet > commplex-link [PSH, ACK] Seq=64669 Ack=1 Win=65535 Len=892
     87 1514          1.703614    76.23.247.139         128.119.245.93        idonix-metanet TCP      idonix-metanet > commplex-link [ACK] Seq=65561 Ack=1 Win=65535 Len=1460
     88 1514          1.703865    76.23.247.139         128.119.245.93        idonix-metanet TCP      idonix-metanet > commplex-link [ACK] Seq=67021 Ack=1 Win=65535 Len=1460
     89 1514          1.703988    76.23.247.139         128.119.245.93        idonix-metanet TCP      idonix-metanet > commplex-link [ACK] Seq=68481 Ack=1 Win=65535 Len=1460
     90 1514          1.704123    76.23.247.139         128.119.245.93        idonix-metanet TCP      idonix-metanet > commplex-link [ACK] Seq=69941 Ack=1 Win=65535 Len=1460
     91 1514          1.704252    76.23.247.139         128.119.245.93        idonix-metanet TCP      idonix-metanet > commplex-link [ACK] Seq=71401 Ack=1 Win=65535 Len=1460
     92 946           1.704325    76.23.247.139         128.119.245.93        idonix-metanet TCP      idonix-metanet > commplex-link [PSH, ACK] Seq=72861 Ack=1 Win=65535 Len=892
     96 1514          1.726159    76.23.247.139         128.119.245.93        idonix-metanet TCP      idonix-metanet > commplex-link [ACK] Seq=73753 Ack=1 Win=65535 Len=1460
     97 1514          1.726404    76.23.247.139         128.119.245.93        idonix-metanet TCP      idonix-metanet > commplex-link [ACK] Seq=75213 Ack=1 Win=65535 Len=1460
     98 1514          1.726527    76.23.247.139         128.119.245.93        idonix-metanet TCP      idonix-metanet > commplex-link [ACK] Seq=76673 Ack=1 Win=65535 Len=1460
     99 1514          1.726682    76.23.247.139         128.119.245.93        idonix-metanet TCP      idonix-metanet > commplex-link [ACK] Seq=78133 Ack=1 Win=65535 Len=1460
    100 1514          1.726794    76.23.247.139         128.119.245.93        idonix-metanet TCP      idonix-metanet > commplex-link [ACK] Seq=79593 Ack=1 Win=65535 Len=1460
    101 946           1.726871    76.23.247.139         128.119.245.93        idonix-metanet TCP      idonix-metanet > commplex-link [PSH, ACK] Seq=81053 Ack=1 Win=65535 Len=892
    107 1514          1.756782    76.23.247.139         128.119.245.93        idonix-metanet TCP      idonix-metanet > commplex-link [ACK] Seq=81945 Ack=1 Win=65535 Len=1460
    108 1514          1.757030    76.23.247.139         128.119.245.93        idonix-metanet TCP      idonix-metanet > commplex-link [ACK] Seq=83405 Ack=1 Win=65535 Len=1460
    109 1514          1.757156    76.23.247.139         128.119.245.93        idonix-metanet TCP      idonix-metanet > commplex-link [ACK] Seq=84865 Ack=1 Win=65535 Len=1460
    110 1514          1.757302    76.23.247.139         128.119.245.93        idonix-metanet TCP      idonix-metanet > commplex-link [ACK] Seq=86325 Ack=1 Win=65535 Len=1460
    111 1514          1.757426    76.23.247.139         128.119.245.93        idonix-metanet TCP      idonix-metanet > commplex-link [ACK] Seq=87785 Ack=1 Win=65535 Len=1460
    112 946           1.757502    76.23.247.139         128.119.245.93        idonix-metanet TCP      idonix-metanet > commplex-link [PSH, ACK] Seq=89245 Ack=1 Win=65535 Len=892
    115 1514          1.782075    76.23.247.139         128.119.245.93        idonix-metanet TCP      idonix-metanet > commplex-link [ACK] Seq=90137 Ack=1 Win=65535 Len=1460
    116 1514          1.782316    76.23.247.139         128.119.245.93        idonix-metanet TCP      idonix-metanet > commplex-link [ACK] Seq=91597 Ack=1 Win=65535 Len=1460
    117 1514          1.782439    76.23.247.139         128.119.245.93        idonix-metanet TCP      idonix-metanet > commplex-link [ACK] Seq=93057 Ack=1 Win=65535 Len=1460
    118 1514          1.782591    76.23.247.139         128.119.245.93        idonix-metanet TCP      idonix-metanet > commplex-link [ACK] Seq=94517 Ack=1 Win=65535 Len=1460
    119 1514          1.782725    76.23.247.139         128.119.245.93        idonix-metanet TCP      idonix-metanet > commplex-link [ACK] Seq=95977 Ack=1 Win=65535 Len=1460
    120 946           1.782795    76.23.247.139         128.119.245.93        idonix-metanet TCP      idonix-metanet > commplex-link [PSH, ACK] Seq=97437 Ack=1 Win=65535 Len=892
    124 1514          1.800697    76.23.247.139         128.119.245.93        idonix-metanet TCP      idonix-metanet > commplex-link [ACK] Seq=98329 Ack=1 Win=65535 Len=1460
    125 1514          1.801026    76.23.247.139         128.119.245.93        idonix-metanet TCP      idonix-metanet > commplex-link [ACK] Seq=99789 Ack=1 Win=65535 Len=1460
    126 1514          1.801148    76.23.247.139         128.119.245.93        idonix-metanet TCP      idonix-metanet > commplex-link [ACK] Seq=101249 Ack=1 Win=65535 Len=1460
    127 1514          1.801271    76.23.247.139         128.119.245.93        idonix-metanet TCP      idonix-metanet > commplex-link [ACK] Seq=102709 Ack=1 Win=65535 Len=1460
    128 1514          1.801381    76.23.247.139         128.119.245.93        idonix-metanet TCP      idonix-metanet > commplex-link [ACK] Seq=104169 Ack=1 Win=65535 Len=1460
    129 946           1.801470    76.23.247.139         128.119.245.93        idonix-metanet TCP      idonix-metanet > commplex-link [PSH, ACK] Seq=105629 Ack=1 Win=65535 Len=892
    132 1514          1.814021    76.23.247.139         128.119.245.93        idonix-metanet TCP      idonix-metanet > commplex-link [ACK] Seq=106521 Ack=1 Win=65535 Len=1460
    133 1514          1.814270    76.23.247.139         128.119.245.93        idonix-metanet TCP      idonix-metanet > commplex-link [ACK] Seq=107981 Ack=1 Win=65535 Len=1460
    134 1514          1.814395    76.23.247.139         128.119.245.93        idonix-metanet TCP      idonix-metanet > commplex-link [ACK] Seq=109441 Ack=1 Win=65535 Len=1460
    135 1514          1.814528    76.23.247.139         128.119.245.93        idonix-metanet TCP      idonix-metanet > commplex-link [ACK] Seq=110901 Ack=1 Win=65535 Len=1460
    136 1514          1.814637    76.23.247.139         128.119.245.93        idonix-metanet TCP      idonix-metanet > commplex-link [ACK] Seq=112361 Ack=1 Win=65535 Len=1460
    137 946           1.814726    76.23.247.139         128.119.245.93        idonix-metanet TCP      idonix-metanet > commplex-link [PSH, ACK] Seq=113821 Ack=1 Win=65535 Len=892
    143 1514          1.835324    76.23.247.139         128.119.245.93        idonix-metanet TCP      idonix-metanet > commplex-link [ACK] Seq=114713 Ack=1 Win=65535 Len=1460
    144 1514          1.835572    76.23.247.139         128.119.245.93        idonix-metanet TCP      idonix-metanet > commplex-link [ACK] Seq=116173 Ack=1 Win=65535 Len=1460
    145 1514          1.835695    76.23.247.139         128.119.245.93        idonix-metanet TCP      idonix-metanet > commplex-link [ACK] Seq=117633 Ack=1 Win=65535 Len=1460
    146 1514          1.835834    76.23.247.139         128.119.245.93        idonix-metanet TCP      idonix-metanet > commplex-link [ACK] Seq=119093 Ack=1 Win=65535 Len=1460
    147 1514          1.835944    76.23.247.139         128.119.245.93        idonix-metanet TCP      idonix-metanet > commplex-link [ACK] Seq=120553 Ack=1 Win=65535 Len=1460
    148 946           1.836031    76.23.247.139         128.119.245.93        idonix-metanet TCP      idonix-metanet > commplex-link [PSH, ACK] Seq=122013 Ack=1 Win=65535 Len=892
    156 1514          1.856613    76.23.247.139         128.119.245.93        idonix-metanet TCP      idonix-metanet > commplex-link [ACK] Seq=122905 Ack=1 Win=65535 Len=1460
    157 1514          1.856871    76.23.247.139         128.119.245.93        idonix-metanet TCP      idonix-metanet > commplex-link [ACK] Seq=124365 Ack=1 Win=65535 Len=1460
    158 1514          1.857009    76.23.247.139         128.119.245.93        idonix-metanet TCP      idonix-metanet > commplex-link [ACK] Seq=125825 Ack=1 Win=65535 Len=1460
    159 1514          1.857199    76.23.247.139         128.119.245.93        idonix-metanet TCP      idonix-metanet > commplex-link [ACK] Seq=127285 Ack=1 Win=65535 Len=1460
    160 1514          1.857312    76.23.247.139         128.119.245.93        idonix-metanet TCP      idonix-metanet > commplex-link [ACK] Seq=128745 Ack=1 Win=65535 Len=1460
    161 946           1.857392    76.23.247.139         128.119.245.93        idonix-metanet TCP      idonix-metanet > commplex-link [PSH, ACK] Seq=130205 Ack=1 Win=65535 Len=892
    164 1514          1.872587    76.23.247.139         128.119.245.93        idonix-metanet TCP      idonix-metanet > commplex-link [ACK] Seq=131097 Ack=1 Win=65535 Len=1460
    165 1514          1.872833    76.23.247.139         128.119.245.93        idonix-metanet TCP      idonix-metanet > commplex-link [ACK] Seq=132557 Ack=1 Win=65535 Len=1460
    166 1514          1.872968    76.23.247.139         128.119.245.93        idonix-metanet TCP      idonix-metanet > commplex-link [ACK] Seq=134017 Ack=1 Win=65535 Len=1460
    167 1514          1.873185    76.23.247.139         128.119.245.93        idonix-metanet TCP      idonix-metanet > commplex-link [ACK] Seq=135477 Ack=1 Win=65535 Len=1460
    168 1514          1.873308    76.23.247.139         128.119.245.93        idonix-metanet TCP      idonix-metanet > commplex-link [ACK] Seq=136937 Ack=1 Win=65535 Len=1460
    169 946           1.873385    76.23.247.139         128.119.245.93        idonix-metanet TCP      idonix-metanet > commplex-link [PSH, ACK] Seq=138397 Ack=1 Win=65535 Len=892
    173 1514          1.891240    76.23.247.139         128.119.245.93        idonix-metanet TCP      idonix-metanet > commplex-link [ACK] Seq=139289 Ack=1 Win=65535 Len=1460
    174 1514          1.891492    76.23.247.139         128.119.245.93        idonix-metanet TCP      idonix-metanet > commplex-link [ACK] Seq=140749 Ack=1 Win=65535 Len=1460
    175 1514          1.891615    76.23.247.139         128.119.245.93        idonix-metanet TCP      idonix-metanet > commplex-link [ACK] Seq=142209 Ack=1 Win=65535 Len=1460
    176 1514          1.891771    76.23.247.139         128.119.245.93        idonix-metanet TCP      idonix-metanet > commplex-link [ACK] Seq=143669 Ack=1 Win=65535 Len=1460
    177 1514          1.891885    76.23.247.139         128.119.245.93        idonix-metanet TCP      idonix-metanet > commplex-link [ACK] Seq=145129 Ack=1 Win=65535 Len=1460
    178 946           1.891963    76.23.247.139         128.119.245.93        idonix-metanet TCP      idonix-metanet > commplex-link [PSH, ACK] Seq=146589 Ack=1 Win=65535 Len=892
    181 1514          1.901883    76.23.247.139         128.119.245.93        idonix-metanet TCP      idonix-metanet > commplex-link [ACK] Seq=147481 Ack=1 Win=65535 Len=1460
    182 1514          1.902131    76.23.247.139         128.119.245.93        idonix-metanet TCP      idonix-metanet > commplex-link [ACK] Seq=148941 Ack=1 Win=65535 Len=1460
    183 1514          1.902254    76.23.247.139         128.119.245.93        idonix-metanet TCP      idonix-metanet > commplex-link [ACK] Seq=150401 Ack=1 Win=65535 Len=1460
    184 1514          1.902416    76.23.247.139         128.119.245.93        idonix-metanet TCP      idonix-metanet > commplex-link [ACK] Seq=151861 Ack=1 Win=65535 Len=1460
    185 1514          1.902545    76.23.247.139         128.119.245.93        idonix-metanet TCP      idonix-metanet > commplex-link [ACK] Seq=153321 Ack=1 Win=65535 Len=1460
    186 946           1.902620    76.23.247.139         128.119.245.93        idonix-metanet TCP      idonix-metanet > commplex-link [PSH, ACK] Seq=154781 Ack=1 Win=65535 Len=892
    190 1514          1.917855    76.23.247.139         128.119.245.93        idonix-metanet TCP      idonix-metanet > commplex-link [ACK] Seq=155673 Ack=1 Win=65535 Len=1460
    191 1514          1.918111    76.23.247.139         128.119.245.93        idonix-metanet TCP      idonix-metanet > commplex-link [ACK] Seq=157133 Ack=1 Win=65535 Len=1460
    192 1514          1.918232    76.23.247.139         128.119.245.93        idonix-metanet TCP      idonix-metanet > commplex-link [ACK] Seq=158593 Ack=1 Win=65535 Len=1460
    193 1514          1.918368    76.23.247.139         128.119.245.93        idonix-metanet TCP      idonix-metanet > commplex-link [ACK] Seq=160053 Ack=1 Win=65535 Len=1460
    194 1514          1.918492    76.23.247.139         128.119.245.93        idonix-metanet TCP      idonix-metanet > commplex-link [ACK] Seq=161513 Ack=1 Win=65535 Len=1460
    195 946           1.918568    76.23.247.139         128.119.245.93        idonix-metanet TCP      idonix-metanet > commplex-link [PSH, ACK] Seq=162973 Ack=1 Win=65535 Len=892
    201 1514          1.956465    76.23.247.139         128.119.245.93        idonix-metanet TCP      idonix-metanet > commplex-link [ACK] Seq=163865 Ack=1 Win=65535 Len=1460
    202 1514          1.956720    76.23.247.139         128.119.245.93        idonix-metanet TCP      idonix-metanet > commplex-link [ACK] Seq=165325 Ack=1 Win=65535 Len=1460
    203 1514          1.956839    76.23.247.139         128.119.245.93        idonix-metanet TCP      idonix-metanet > commplex-link [ACK] Seq=166785 Ack=1 Win=65535 Len=1460
    204 1514          1.956984    76.23.247.139         128.119.245.93        idonix-metanet TCP      idonix-metanet > commplex-link [ACK] Seq=168245 Ack=1 Win=65535 Len=1460
    205 1514          1.957096    76.23.247.139         128.119.245.93        idonix-metanet TCP      idonix-metanet > commplex-link [ACK] Seq=169705 Ack=1 Win=65535 Len=1460
    206 946           1.957182    76.23.247.139         128.119.245.93        idonix-metanet TCP      idonix-metanet > commplex-link [PSH, ACK] Seq=171165 Ack=1 Win=65535 Len=892
    209 1514          1.967113    76.23.247.139         128.119.245.93        idonix-metanet TCP      idonix-metanet > commplex-link [ACK] Seq=172057 Ack=1 Win=65535 Len=1460
    210 1514          1.967355    76.23.247.139         128.119.245.93        idonix-metanet TCP      idonix-metanet > commplex-link [ACK] Seq=173517 Ack=1 Win=65535 Len=1460
    211 1514          1.967478    76.23.247.139         128.119.245.93        idonix-metanet TCP      idonix-metanet > commplex-link [ACK] Seq=174977 Ack=1 Win=65535 Len=1460
    212 1514          1.967628    76.23.247.139         128.119.245.93        idonix-metanet TCP      idonix-metanet > commplex-link [ACK] Seq=176437 Ack=1 Win=65535 Len=1460
    213 1514          1.967752    76.23.247.139         128.119.245.93        idonix-metanet TCP      idonix-metanet > commplex-link [ACK] Seq=177897 Ack=1 Win=65535 Len=1460
    214 946           1.967842    76.23.247.139         128.119.245.93        idonix-metanet TCP      idonix-metanet > commplex-link [PSH, ACK] Seq=179357 Ack=1 Win=65535 Len=892
    217 1514          1.979089    76.23.247.139         128.119.245.93        idonix-metanet TCP      idonix-metanet > commplex-link [ACK] Seq=180249 Ack=1 Win=65535 Len=1460
    218 1514          1.979341    76.23.247.139         128.119.245.93        idonix-metanet TCP      idonix-metanet > commplex-link [ACK] Seq=181709 Ack=1 Win=65535 Len=1460
    219 1514          1.979463    76.23.247.139         128.119.245.93        idonix-metanet TCP      idonix-metanet > commplex-link [ACK] Seq=183169 Ack=1 Win=65535 Len=1460
    220 1514          1.979598    76.23.247.139         128.119.245.93        idonix-metanet TCP      idonix-metanet > commplex-link [ACK] Seq=184629 Ack=1 Win=65535 Len=1460
    221 1514          1.979712    76.23.247.139         128.119.245.93        idonix-metanet TCP      idonix-metanet > commplex-link [ACK] Seq=186089 Ack=1 Win=65535 Len=1460
    222 946           1.979798    76.23.247.139         128.119.245.93        idonix-metanet TCP      idonix-metanet > commplex-link [PSH, ACK] Seq=187549 Ack=1 Win=65535 Len=892
    230 1514          2.000406    76.23.247.139         128.119.245.93        idonix-metanet TCP      idonix-metanet > commplex-link [ACK] Seq=188441 Ack=1 Win=65535 Len=1460
    231 1514          2.000730    76.23.247.139         128.119.245.93        idonix-metanet TCP      idonix-metanet > commplex-link [ACK] Seq=189901 Ack=1 Win=65535 Len=1460
    232 1514          2.000861    76.23.247.139         128.119.245.93        idonix-metanet TCP      idonix-metanet > commplex-link [ACK] Seq=191361 Ack=1 Win=65535 Len=1460
    233 1514          2.000984    76.23.247.139         128.119.245.93        idonix-metanet TCP      idonix-metanet > commplex-link [ACK] Seq=192821 Ack=1 Win=65535 Len=1460
    234 1514          2.001111    76.23.247.139         128.119.245.93        idonix-metanet TCP      idonix-metanet > commplex-link [ACK] Seq=194281 Ack=1 Win=65535 Len=1460
    235 946           2.001194    76.23.247.139         128.119.245.93        idonix-metanet TCP      idonix-metanet > commplex-link [PSH, ACK] Seq=195741 Ack=1 Win=65535 Len=892
    241 1514          2.016386    76.23.247.139         128.119.245.93        idonix-metanet TCP      idonix-metanet > commplex-link [ACK] Seq=196633 Ack=1 Win=65535 Len=1460
    242 1514          2.016634    76.23.247.139         128.119.245.93        idonix-metanet TCP      idonix-metanet > commplex-link [ACK] Seq=198093 Ack=1 Win=65535 Len=1460
    243 1514          2.016777    76.23.247.139         128.119.245.93        idonix-metanet TCP      idonix-metanet > commplex-link [ACK] Seq=199553 Ack=1 Win=65535 Len=1460
    244 1514          2.017013    76.23.247.139         128.119.245.93        idonix-metanet TCP      idonix-metanet > commplex-link [ACK] Seq=201013 Ack=1 Win=65535 Len=1460
    245 1514          2.017127    76.23.247.139         128.119.245.93        idonix-metanet TCP      idonix-metanet > commplex-link [ACK] Seq=202473 Ack=1 Win=65535 Len=1460
    246 946           2.017213    76.23.247.139         128.119.245.93        idonix-metanet TCP      idonix-metanet > commplex-link [PSH, ACK] Seq=203933 Ack=1 Win=65535 Len=892
    252 1514          2.032334    76.23.247.139         128.119.245.93        idonix-metanet TCP      idonix-metanet > commplex-link [ACK] Seq=204825 Ack=1 Win=65535 Len=1460
    253 1514          2.032580    76.23.247.139         128.119.245.93        idonix-metanet TCP      idonix-metanet > commplex-link [ACK] Seq=206285 Ack=1 Win=65535 Len=1460
    254 1514          2.032705    76.23.247.139         128.119.245.93        idonix-metanet TCP      idonix-metanet > commplex-link [ACK] Seq=207745 Ack=1 Win=65535 Len=1460
    255 1514          2.032832    76.23.247.139         128.119.245.93        idonix-metanet TCP      idonix-metanet > commplex-link [ACK] Seq=209205 Ack=1 Win=65535 Len=1460
    256 1514          2.032956    76.23.247.139         128.119.245.93        idonix-metanet TCP      idonix-metanet > commplex-link [ACK] Seq=210665 Ack=1 Win=65535 Len=1460
    257 946           2.033034    76.23.247.139         128.119.245.93        idonix-metanet TCP      idonix-metanet > commplex-link [PSH, ACK] Seq=212125 Ack=1 Win=65535 Len=892
    263 1514          2.046987    76.23.247.139         128.119.245.93        idonix-metanet TCP      idonix-metanet > commplex-link [ACK] Seq=213017 Ack=1 Win=65535 Len=1460
    264 1514          2.047233    76.23.247.139         128.119.245.93        idonix-metanet TCP      idonix-metanet > commplex-link [ACK] Seq=214477 Ack=1 Win=65535 Len=1460
    265 1514          2.047355    76.23.247.139         128.119.245.93        idonix-metanet TCP      idonix-metanet > commplex-link [ACK] Seq=215937 Ack=1 Win=65535 Len=1460
    266 1514          2.047490    76.23.247.139         128.119.245.93        idonix-metanet TCP      idonix-metanet > commplex-link [ACK] Seq=217397 Ack=1 Win=65535 Len=1460
    267 1514          2.047618    76.23.247.139         128.119.245.93        idonix-metanet TCP      idonix-metanet > commplex-link [ACK] Seq=218857 Ack=1 Win=65535 Len=1460
    268 946           2.047690    76.23.247.139         128.119.245.93        idonix-metanet TCP      idonix-metanet > commplex-link [PSH, ACK] Seq=220317 Ack=1 Win=65535 Len=892
    275 1514          2.061659    76.23.247.139         128.119.245.93        idonix-metanet TCP      idonix-metanet > commplex-link [ACK] Seq=221209 Ack=1 Win=65535 Len=1460
    276 1514          2.061894    76.23.247.139         128.119.245.93        idonix-metanet TCP      idonix-metanet > commplex-link [ACK] Seq=222669 Ack=1 Win=65535 Len=1460
    277 1514          2.062017    76.23.247.139         128.119.245.93        idonix-metanet TCP      idonix-metanet > commplex-link [ACK] Seq=224129 Ack=1 Win=65535 Len=1460
    278 1514          2.062200    76.23.247.139         128.119.245.93        idonix-metanet TCP      idonix-metanet > commplex-link [ACK] Seq=225589 Ack=1 Win=65535 Len=1460
    279 1514          2.062314    76.23.247.139         128.119.245.93        idonix-metanet TCP      idonix-metanet > commplex-link [ACK] Seq=227049 Ack=1 Win=65535 Len=1460
    280 946           2.062403    76.23.247.139         128.119.245.93        idonix-metanet TCP      idonix-metanet > commplex-link [PSH, ACK] Seq=228509 Ack=1 Win=65535 Len=892
    286 1514          2.093576    76.23.247.139         128.119.245.93        idonix-metanet TCP      idonix-metanet > commplex-link [ACK] Seq=229401 Ack=1 Win=65535 Len=1460
    287 1514          2.093901    76.23.247.139         128.119.245.93        idonix-metanet TCP      idonix-metanet > commplex-link [ACK] Seq=230861 Ack=1 Win=65535 Len=1460
    288 1514          2.094024    76.23.247.139         128.119.245.93        idonix-metanet TCP      idonix-metanet > commplex-link [ACK] Seq=232321 Ack=1 Win=65535 Len=1460
    289 1514          2.094147    76.23.247.139         128.119.245.93        idonix-metanet TCP      idonix-metanet > commplex-link [ACK] Seq=233781 Ack=1 Win=65535 Len=1460
    290 1514          2.094271    76.23.247.139         128.119.245.93        idonix-metanet TCP      idonix-metanet > commplex-link [ACK] Seq=235241 Ack=1 Win=65535 Len=1460
    291 946           2.094348    76.23.247.139         128.119.245.93        idonix-metanet TCP      idonix-metanet > commplex-link [PSH, ACK] Seq=236701 Ack=1 Win=65535 Len=892
    295 1514          2.106895    76.23.247.139         128.119.245.93        idonix-metanet TCP      idonix-metanet > commplex-link [ACK] Seq=237593 Ack=1 Win=65535 Len=1460
    296 1514          2.107139    76.23.247.139         128.119.245.93        idonix-metanet TCP      idonix-metanet > commplex-link [ACK] Seq=239053 Ack=1 Win=65535 Len=1460
    297 1514          2.107261    76.23.247.139         128.119.245.93        idonix-metanet TCP      idonix-metanet > commplex-link [ACK] Seq=240513 Ack=1 Win=65535 Len=1460
    298 1514          2.107475    76.23.247.139         128.119.245.93        idonix-metanet TCP      idonix-metanet > commplex-link [ACK] Seq=241973 Ack=1 Win=65535 Len=1460
    299 1514          2.107588    76.23.247.139         128.119.245.93        idonix-metanet TCP      idonix-metanet > commplex-link [ACK] Seq=243433 Ack=1 Win=65535 Len=1460
    300 946           2.107675    76.23.247.139         128.119.245.93        idonix-metanet TCP      idonix-metanet > commplex-link [PSH, ACK] Seq=244893 Ack=1 Win=65535 Len=892
    303 1514          2.122865    76.23.247.139         128.119.245.93        idonix-metanet TCP      idonix-metanet > commplex-link [ACK] Seq=245785 Ack=1 Win=65535 Len=1460
    304 1514          2.123111    76.23.247.139         128.119.245.93        idonix-metanet TCP      idonix-metanet > commplex-link [ACK] Seq=247245 Ack=1 Win=65535 Len=1460
    305 1514          2.123234    76.23.247.139         128.119.245.93        idonix-metanet TCP      idonix-metanet > commplex-link [ACK] Seq=248705 Ack=1 Win=65535 Len=1460
    306 1514          2.123405    76.23.247.139         128.119.245.93        idonix-metanet TCP      idonix-metanet > commplex-link [ACK] Seq=250165 Ack=1 Win=65535 Len=1460
    307 1514          2.123519    76.23.247.139         128.119.245.93        idonix-metanet TCP      idonix-metanet > commplex-link [ACK] Seq=251625 Ack=1 Win=65535 Len=1460
    308 946           2.123606    76.23.247.139         128.119.245.93        idonix-metanet TCP      idonix-metanet > commplex-link [PSH, ACK] Seq=253085 Ack=1 Win=65535 Len=892
    314 1514          2.146831    76.23.247.139         128.119.245.93        idonix-metanet TCP      idonix-metanet > commplex-link [ACK] Seq=253977 Ack=1 Win=65535 Len=1460
    315 1514          2.147079    76.23.247.139         128.119.245.93        idonix-metanet TCP      idonix-metanet > commplex-link [ACK] Seq=255437 Ack=1 Win=65535 Len=1460
    316 1514          2.147202    76.23.247.139         128.119.245.93        idonix-metanet TCP      idonix-metanet > commplex-link [ACK] Seq=256897 Ack=1 Win=65535 Len=1460
    317 1514          2.147336    76.23.247.139         128.119.245.93        idonix-metanet TCP      idonix-metanet > commplex-link [ACK] Seq=258357 Ack=1 Win=65535 Len=1460
    318 1514          2.147463    76.23.247.139         128.119.245.93        idonix-metanet TCP      idonix-metanet > commplex-link [ACK] Seq=259817 Ack=1 Win=65535 Len=1460
    319 946           2.147538    76.23.247.139         128.119.245.93        idonix-metanet TCP      idonix-metanet > commplex-link [PSH, ACK] Seq=261277 Ack=1 Win=65535 Len=892
    322 1514          2.157481    76.23.247.139         128.119.245.93        idonix-metanet TCP      idonix-metanet > commplex-link [ACK] Seq=262169 Ack=1 Win=65535 Len=1460
    323 1514          2.157724    76.23.247.139         128.119.245.93        idonix-metanet TCP      idonix-metanet > commplex-link [ACK] Seq=263629 Ack=1 Win=65535 Len=1460
    324 1514          2.157847    76.23.247.139         128.119.245.93        idonix-metanet TCP      idonix-metanet > commplex-link [ACK] Seq=265089 Ack=1 Win=65535 Len=1460
    325 1514          2.157996    76.23.247.139         128.119.245.93        idonix-metanet TCP      idonix-metanet > commplex-link [ACK] Seq=266549 Ack=1 Win=65535 Len=1460
    326 1514          2.158113    76.23.247.139         128.119.245.93        idonix-metanet TCP      idonix-metanet > commplex-link [ACK] Seq=268009 Ack=1 Win=65535 Len=1460
    327 946           2.158197    76.23.247.139         128.119.245.93        idonix-metanet TCP      idonix-metanet > commplex-link [PSH, ACK] Seq=269469 Ack=1 Win=65535 Len=892
    331 1514          2.174922    76.23.247.139         128.119.245.93        idonix-metanet TCP      idonix-metanet > commplex-link [ACK] Seq=270361 Ack=1 Win=65535 Len=1460
    332 1514          2.175122    76.23.247.139         128.119.245.93        idonix-metanet TCP      idonix-metanet > commplex-link [ACK] Seq=271821 Ack=1 Win=65535 Len=1460
    333 1514          2.175247    76.23.247.139         128.119.245.93        idonix-metanet TCP      idonix-metanet > commplex-link [ACK] Seq=273281 Ack=1 Win=65535 Len=1460
    334 1514          2.175370    76.23.247.139         128.119.245.93        idonix-metanet TCP      idonix-metanet > commplex-link [ACK] Seq=274741 Ack=1 Win=65535 Len=1460
    335 1514          2.175494    76.23.247.139         128.119.245.93        idonix-metanet TCP      idonix-metanet > commplex-link [ACK] Seq=276201 Ack=1 Win=65535 Len=1460
    336 946           2.175570    76.23.247.139         128.119.245.93        idonix-metanet TCP      idonix-metanet > commplex-link [PSH, ACK] Seq=277661 Ack=1 Win=65535 Len=892
    344 1514          2.198753    76.23.247.139         128.119.245.93        idonix-metanet TCP      idonix-metanet > commplex-link [ACK] Seq=278553 Ack=1 Win=65535 Len=1460
    345 1514          2.198998    76.23.247.139         128.119.245.93        idonix-metanet TCP      idonix-metanet > commplex-link [ACK] Seq=280013 Ack=1 Win=65535 Len=1460
    346 1514          2.199121    76.23.247.139         128.119.245.93        idonix-metanet TCP      idonix-metanet > commplex-link [ACK] Seq=281473 Ack=1 Win=65535 Len=1460
    347 1514          2.199275    76.23.247.139         128.119.245.93        idonix-metanet TCP      idonix-metanet > commplex-link [ACK] Seq=282933 Ack=1 Win=65535 Len=1460
    348 1514          2.199392    76.23.247.139         128.119.245.93        idonix-metanet TCP      idonix-metanet > commplex-link [ACK] Seq=284393 Ack=1 Win=65535 Len=1460
    349 946           2.199479    76.23.247.139         128.119.245.93        idonix-metanet TCP      idonix-metanet > commplex-link [PSH, ACK] Seq=285853 Ack=1 Win=65535 Len=892
    351 1514          2.208085    76.23.247.139         128.119.245.93        idonix-metanet TCP      idonix-metanet > commplex-link [ACK] Seq=286745 Ack=1 Win=65535 Len=1460
    352 1514          2.208331    76.23.247.139         128.119.245.93        idonix-metanet TCP      idonix-metanet > commplex-link [ACK] Seq=288205 Ack=1 Win=65535 Len=1460
    353 1514          2.208454    76.23.247.139         128.119.245.93        idonix-metanet TCP      idonix-metanet > commplex-link [ACK] Seq=289665 Ack=1 Win=65535 Len=1460
    354 1514          2.208608    76.23.247.139         128.119.245.93        idonix-metanet TCP      idonix-metanet > commplex-link [ACK] Seq=291125 Ack=1 Win=65535 Len=1460
    355 1514          2.208721    76.23.247.139         128.119.245.93        idonix-metanet TCP      idonix-metanet > commplex-link [ACK] Seq=292585 Ack=1 Win=65535 Len=1460
    356 946           2.208799    76.23.247.139         128.119.245.93        idonix-metanet TCP      idonix-metanet > commplex-link [PSH, ACK] Seq=294045 Ack=1 Win=65535 Len=892
    360 1514          2.224053    76.23.247.139         128.119.245.93        idonix-metanet TCP      idonix-metanet > commplex-link [ACK] Seq=294937 Ack=1 Win=65535 Len=1460
    361 1514          2.224297    76.23.247.139         128.119.245.93        idonix-metanet TCP      idonix-metanet > commplex-link [ACK] Seq=296397 Ack=1 Win=65535 Len=1460
    362 1514          2.224420    76.23.247.139         128.119.245.93        idonix-metanet TCP      idonix-metanet > commplex-link [ACK] Seq=297857 Ack=1 Win=65535 Len=1460
    363 1514          2.224556    76.23.247.139         128.119.245.93        idonix-metanet TCP      idonix-metanet > commplex-link [ACK] Seq=299317 Ack=1 Win=65535 Len=1460
    364 1514          2.224669    76.23.247.139         128.119.245.93        idonix-metanet TCP      idonix-metanet > commplex-link [ACK] Seq=300777 Ack=1 Win=65535 Len=1460
    365 946           2.224764    76.23.247.139         128.119.245.93        idonix-metanet TCP      idonix-metanet > commplex-link [PSH, ACK] Seq=302237 Ack=1 Win=65535 Len=892
    372 1514          2.248130    76.23.247.139         128.119.245.93        idonix-metanet TCP      idonix-metanet > commplex-link [ACK] Seq=303129 Ack=1 Win=65535 Len=1460
    373 1514          2.248255    76.23.247.139         128.119.245.93        idonix-metanet TCP      idonix-metanet > commplex-link [ACK] Seq=304589 Ack=1 Win=65535 Len=1460
    374 1514          2.248376    76.23.247.139         128.119.245.93        idonix-metanet TCP      idonix-metanet > commplex-link [ACK] Seq=306049 Ack=1 Win=65535 Len=1460
    375 1514          2.248495    76.23.247.139         128.119.245.93        idonix-metanet TCP      idonix-metanet > commplex-link [ACK] Seq=307509 Ack=1 Win=65535 Len=1460
