      2 62            0.494518    76.23.247.139         128.119.245.93        umsp     TCP      umsp > commplex-link [SYN] Seq=0 Win=65535 Len=0 MSS=1460 SACK_PERM=1
      4 60            0.510905    76.23.247.139         128.119.245.93        umsp     TCP      umsp > commplex-link [ACK] Seq=1 Ack=1 Win=65535 Len=0
      5 78            0.513051    76.23.247.139         128.119.245.93        umsp     TCP      umsp > commplex-link [PSH, ACK] Seq=1 Ack=1 Win=65535 Len=24
      6 1514          0.514511    76.23.247.139         128.119.245.93        umsp     TCP      umsp > commplex-link [ACK] Seq=25 Ack=1 Win=65535 Len=1460
      8 1514          0.531227    76.23.247.139         128.119.245.93        umsp     TCP      umsp > commplex-link [ACK] Seq=1485 Ack=1 Win=65535 Len=1460
     10 1514          0.531439    76.23.247.139         128.119.245.93        umsp     TCP      umsp > commplex-link [ACK] Seq=2945 Ack=1 Win=65535 Len=1460
     11 1514          0.532556    76.23.247.139         128.119.245.93        umsp     TCP      umsp > commplex-link [ACK] Seq=4405 Ack=1 Win=65535 Len=1460
     12 1514          0.532748    76.23.247.139         128.119.245.93        umsp     TCP      umsp > commplex-link [ACK] Seq=5865 Ack=1 Win=65535 Len=1460
     15 1514          0.548567    76.23.247.139         128.119.245.93        umsp     TCP      umsp > commplex-link [PSH, ACK] Seq=7325 Ack=1 Win=65535 Len=1460
     16 1514          0.548832    76.23.247.139         128.119.245.93        umsp     TCP      umsp > commplex-link [ACK] Seq=8785 Ack=1 Win=65535 Len=1460
     17 1514          0.548944    76.23.247.139         128.119.245.93        umsp     TCP      umsp > commplex-link [ACK] Seq=10245 Ack=1 Win=65535 Len=1460
     18 1514          0.549153    76.23.247.139         128.119.245.93        umsp     TCP      umsp > commplex-link [ACK] Seq=11705 Ack=1 Win=65535 Len=1460
     21 1514          0.555214    76.23.247.139         128.119.245.93        umsp     TCP      umsp > commplex-link [ACK] Seq=13165 Ack=1 Win=65535 Len=1460
     22 1514          0.555409    76.23.247.139         128.119.245.93        umsp     TCP      umsp > commplex-link [ACK] Seq=14625 Ack=1 Win=65535 Len=1460
     23 1514          0.555518    76.23.247.139         128.119.245.93        umsp     TCP      umsp > commplex-link [PSH, ACK] Seq=16085 Ack=1 Win=65535 Len=1460
     24 1514          0.555662    76.23.247.139         128.119.245.93        umsp     TCP      umsp > commplex-link [ACK] Seq=17545 Ack=1 Win=65535 Len=1460
     27 1514          0.567206    76.23.247.139         128.119.245.93        umsp     TCP      umsp > commplex-link [ACK] Seq=19005 Ack=1 Win=65535 Len=1460
     28 1514          0.567389    76.23.247.139         128.119.245.93        umsp     TCP      umsp > commplex-link [ACK] Seq=20465 Ack=1 Win=65535 Len=1460
     29 1514          0.567508    76.23.247.139         128.119.245.93        umsp     TCP      umsp > commplex-link [ACK] Seq=21925 Ack=1 Win=65535 Len=1460
     30 1514          0.567643    76.23.247.139         128.119.245.93        umsp     TCP      umsp > commplex-link [PSH, ACK] Seq=23385 Ack=1 Win=65535 Len=1460
     33 1514          0.572521    76.23.247.139         128.119.245.93        umsp     TCP      umsp > commplex-link [ACK] Seq=24845 Ack=1 Win=65535 Len=1460
     34 1514          0.572710    76.23.247.139         128.119.245.93        umsp     TCP      umsp > commplex-link [ACK] Seq=26305 Ack=1 Win=65535 Len=1460
     35 1514          0.572824    76.23.247.139         128.119.245.93        umsp     TCP      umsp > commplex-link [ACK] Seq=27765 Ack=1 Win=65535 Len=1460
     36 1514          0.572966    76.23.247.139         128.119.245.93        umsp     TCP      umsp > commplex-link [ACK] Seq=29225 Ack=1 Win=65535 Len=1460
     41 1514          0.576575    76.23.247.139         128.119.245.93        umsp     TCP      umsp > commplex-link [ACK] Seq=30685 Ack=1 Win=65535 Len=1460
     42 702           0.576633    76.23.247.139         128.119.245.93        umsp     TCP      umsp > commplex-link [PSH, ACK] Seq=32145 Ack=1 Win=65535 Len=648
     43 1514          0.577881    76.23.247.139         128.119.245.93        umsp     TCP      umsp > commplex-link [ACK] Seq=32793 Ack=1 Win=65535 Len=1460
     44 1514          0.578123    76.23.247.139         128.119.245.93        umsp     TCP      umsp > commplex-link [ACK] Seq=34253 Ack=1 Win=65535 Len=1460
     45 1514          0.578250    76.23.247.139         128.119.245.93        umsp     TCP      umsp > commplex-link [ACK] Seq=35713 Ack=1 Win=65535 Len=1460
     46 1514          0.578425    76.23.247.139         128.119.245.93        umsp     TCP      umsp > commplex-link [ACK] Seq=37173 Ack=1 Win=65535 Len=1460
     47 1514          0.578538    76.23.247.139         128.119.245.93        umsp     TCP      umsp > commplex-link [ACK] Seq=38633 Ack=1 Win=65535 Len=1460
     48 946           0.578627    76.23.247.139         128.119.245.93        umsp     TCP      umsp > commplex-link [PSH, ACK] Seq=40093 Ack=1 Win=65535 Len=892
     53 1514          0.592528    76.23.247.139         128.119.245.93        umsp     TCP      umsp > commplex-link [ACK] Seq=40985 Ack=1 Win=65535 Len=1460
     54 1514          0.592778    76.23.247.139         128.119.245.93        umsp     TCP      umsp > commplex-link [ACK] Seq=42445 Ack=1 Win=65535 Len=1460
     55 1514          0.592897    76.23.247.139         128.119.245.93        umsp     TCP      umsp > commplex-link [ACK] Seq=43905 Ack=1 Win=65535 Len=1460
     56 1514          0.593016    76.23.247.139         128.119.245.93        umsp     TCP      umsp > commplex-link [ACK] Seq=45365 Ack=1 Win=65535 Len=1460
     57 1514          0.593140    76.23.247.139         128.119.245.93        umsp     TCP      umsp > commplex-link [ACK] Seq=46825 Ack=1 Win=65535 Len=1460
     58 946           0.593218    76.23.247.139         128.119.245.93        umsp     TCP      umsp > commplex-link [PSH, ACK] Seq=48285 Ack=1 Win=65535 Len=892
     67 1514          0.621807    76.23.247.139         128.119.245.93        umsp     TCP      umsp > commplex-link [ACK] Seq=49177 Ack=1 Win=65535 Len=1460
     68 1514          0.622049    76.23.247.139         128.119.245.93        umsp     TCP      umsp > commplex-link [ACK] Seq=50637 Ack=1 Win=65535 Len=1460
     69 1514          0.622176    76.23.247.139         128.119.245.93        umsp     TCP      umsp > commplex-link [ACK] Seq=52097 Ack=1 Win=65535 Len=1460
     70 1514          0.622322    76.23.247.139         128.119.245.93        umsp     TCP      umsp > commplex-link [ACK] Seq=53557 Ack=1 Win=65535 Len=1460
     71 1514          0.622435    76.23.247.139         128.119.245.93        umsp     TCP      umsp > commplex-link [ACK] Seq=55017 Ack=1 Win=65535 Len=1460
     72 946           0.622525    76.23.247.139         128.119.245.93        umsp     TCP      umsp > commplex-link [PSH, ACK] Seq=56477 Ack=1 Win=65535 Len=892
     76 1514          0.633787    76.23.247.139         128.119.245.93        umsp     TCP      umsp > commplex-link [ACK] Seq=57369 Ack=1 Win=65535 Len=1460
     77 1514          0.634027    76.23.247.139         128.119.245.93        umsp     TCP      umsp > commplex-link [ACK] Seq=58829 Ack=1 Win=65535 Len=1460
     78 1514          0.634150    76.23.247.139         128.119.245.93        umsp     TCP      umsp > commplex-link [ACK] Seq=60289 Ack=1 Win=65535 Len=1460
     79 1514          0.634281    76.23.247.139         128.119.245.93        umsp     TCP      umsp > commplex-link [ACK] Seq=61749 Ack=1 Win=65535 Len=1460
     80 1514          0.634422    76.23.247.139         128.119.245.93        umsp     TCP      umsp > commplex-link [ACK] Seq=63209 Ack=1 Win=65535 Len=1460
     81 946           0.634486    76.23.247.139         128.119.245.93        umsp     TCP      umsp > commplex-link [PSH, ACK] Seq=64669 Ack=1 Win=65535 Len=892
     84 1514          0.644437    76.23.247.139         128.119.245.93        umsp     TCP      umsp > commplex-link [ACK] Seq=65561 Ack=1 Win=65535 Len=1460
     85 1514          0.644684    76.23.247.139         128.119.245.93        umsp     TCP      umsp > commplex-link [ACK] Seq=67021 Ack=1 Win=65535 Len=1460
     86 1514          0.644808    76.23.247.139         128.119.245.93        umsp     TCP      umsp > commplex-link [ACK] Seq=68481 Ack=1 Win=65535 Len=1460
     87 1514          0.644935    76.23.247.139         128.119.245.93        umsp     TCP      umsp > commplex-link [ACK] Seq=69941 Ack=1 Win=65535 Len=1460
     88 1514          0.645048    76.23.247.139         128.119.245.93        umsp     TCP      umsp > commplex-link [ACK] Seq=71401 Ack=1 Win=65535 Len=1460
     89 946           0.645138    76.23.247.139         128.119.245.93        umsp     TCP      umsp > commplex-link [PSH, ACK] Seq=72861 Ack=1 Win=65535 Len=892
     95 1514          0.669849    76.23.247.139         128.119.245.93        umsp     TCP      umsp > commplex-link [ACK] Seq=73753 Ack=1 Win=65535 Len=1460
     96 1514          0.669974    76.23.247.139         128.119.245.93        umsp     TCP      umsp > commplex-link [ACK] Seq=75213 Ack=1 Win=65535 Len=1460
     97 1514          0.670097    76.23.247.139         128.119.245.93        umsp     TCP      umsp > commplex-link [ACK] Seq=76673 Ack=1 Win=65535 Len=1460
     98 1514          0.670283    76.23.247.139         128.119.245.93        umsp     TCP      umsp > commplex-link [ACK] Seq=78133 Ack=1 Win=65535 Len=1460
     99 1514          0.670409    76.23.247.139         128.119.245.93        umsp     TCP      umsp > commplex-link [ACK] Seq=79593 Ack=1 Win=65535 Len=1460
    100 946           0.670498    76.23.247.139         128.119.245.93        umsp     TCP      umsp > commplex-link [PSH, ACK] Seq=81053 Ack=1 Win=65535 Len=892
    103 1514          0.691030    76.23.247.139         128.119.245.93        umsp     TCP      umsp > commplex-link [ACK] Seq=81945 Ack=1 Win=65535 Len=1460
    104 1514          0.691272    76.23.247.139         128.119.245.93        umsp     TCP      umsp > commplex-link [ACK] Seq=83405 Ack=1 Win=65535 Len=1460
    105 1514          0.691395    76.23.247.139         128.119.245.93        umsp     TCP      umsp > commplex-link [ACK] Seq=84865 Ack=1 Win=65535 Len=1460
    106 1514          0.691528    76.23.247.139         128.119.245.93        umsp     TCP      umsp > commplex-link [ACK] Seq=86325 Ack=1 Win=65535 Len=1460
    107 1514          0.691641    76.23.247.139         128.119.245.93        umsp     TCP      umsp > commplex-link [ACK] Seq=87785 Ack=1 Win=65535 Len=1460
    108 946           0.691731    76.23.247.139         128.119.245.93        umsp     TCP      umsp > commplex-link [PSH, ACK] Seq=89245 Ack=1 Win=65535 Len=892
    112 1514          0.708334    76.23.247.139         128.119.245.93        umsp     TCP      umsp > commplex-link [ACK] Seq=90137 Ack=1 Win=65535 Len=1460
    113 1514          0.708582    76.23.247.139         128.119.245.93        umsp     TCP      umsp > commplex-link [ACK] Seq=91597 Ack=1 Win=65535 Len=1460
    114 1514          0.708705    76.23.247.139         128.119.245.93        umsp     TCP      umsp > commplex-link [ACK] Seq=93057 Ack=1 Win=65535 Len=1460
    115 1514          0.708955    76.23.247.139         128.119.245.93        umsp     TCP      umsp > commplex-link [ACK] Seq=94517 Ack=1 Win=65535 Len=1460
    116 1514          0.709067    76.23.247.139         128.119.245.93        umsp     TCP      umsp > commplex-link [ACK] Seq=95977 Ack=1 Win=65535 Len=1460
    117 946           0.709143    76.23.247.139         128.119.245.93        umsp     TCP      umsp > commplex-link [PSH, ACK] Seq=97437 Ack=1 Win=65535 Len=892
    120 1514          0.724310    76.23.247.139         128.119.245.93        umsp     TCP      umsp > commplex-link [ACK] Seq=98329 Ack=1 Win=65535 Len=1460
    121 1514          0.724552    76.23.247.139         128.119.245.93        umsp     TCP      umsp > commplex-link [ACK] Seq=99789 Ack=1 Win=65535 Len=1460
    122 1514          0.724677    76.23.247.139         128.119.245.93        umsp     TCP      umsp > commplex-link [ACK] Seq=101249 Ack=1 Win=65535 Len=1460
    123 1514          0.724815    76.23.247.139         128.119.245.93        umsp     TCP      umsp > commplex-link [ACK] Seq=102709 Ack=1 Win=65535 Len=1460
    124 1514          0.724939    76.23.247.139         128.119.245.93        umsp     TCP      umsp > commplex-link [ACK] Seq=104169 Ack=1 Win=65535 Len=1460
    125 946           0.725015    76.23.247.139         128.119.245.93        umsp     TCP      umsp > commplex-link [PSH, ACK] Seq=105629 Ack=1 Win=65535 Len=892
    129 1514          0.744263    76.23.247.139         128.119.245.93        umsp     TCP      umsp > commplex-link [ACK] Seq=106521 Ack=1 Win=65535 Len=1460
    130 1514          0.744511    76.23.247.139         128.119.245.93        umsp     TCP      umsp > commplex-link [ACK] Seq=107981 Ack=1 Win=65535 Len=1460
    131 1514          0.744634    76.23.247.139         128.119.245.93        umsp     TCP      umsp > commplex-link [ACK] Seq=109441 Ack=1 Win=65535 Len=1460
    132 1514          0.744767    76.23.247.139         128.119.245.93        umsp     TCP      umsp > commplex-link [ACK] Seq=110901 Ack=1 Win=65535 Len=1460
    133 1514          0.744890    76.23.247.139         128.119.245.93        umsp     TCP      umsp > commplex-link [ACK] Seq=112361 Ack=1 Win=65535 Len=1460
    134 946           0.744966    76.23.247.139         128.119.245.93        umsp     TCP      umsp > commplex-link [PSH, ACK] Seq=113821 Ack=1 Win=65535 Len=892
    143 1514          0.773571    76.23.247.139         128.119.245.93        umsp     TCP      umsp > commplex-link [ACK] Seq=114713 Ack=1 Win=65535 Len=1460
    144 1514          0.773816    76.23.247.139         128.119.245.93        umsp     TCP      umsp > commplex-link [ACK] Seq=116173 Ack=1 Win=65535 Len=1460
    145 1514          0.773939    76.23.247.139         128.119.245.93        umsp     TCP      umsp > commplex-link [ACK] Seq=117633 Ack=1 Win=65535 Len=1460
    146 1514          0.774077    76.23.247.139         128.119.245.93        umsp     TCP      umsp > commplex-link [ACK] Seq=119093 Ack=1 Win=65535 Len=1460
    147 1514          0.774188    76.23.247.139         128.119.245.93        umsp     TCP      umsp > commplex-link [ACK] Seq=120553 Ack=1 Win=65535 Len=1460
    148 946           0.774273    76.23.247.139         128.119.245.93        umsp     TCP      umsp > commplex-link [PSH, ACK] Seq=122013 Ack=1 Win=65535 Len=892
    151 1514          0.786878    76.23.247.139         128.119.245.93        umsp     TCP      umsp > commplex-link [ACK] Seq=122905 Ack=1 Win=65535 Len=1460
    152 1514          0.787125    76.23.247.139         128.119.245.93        umsp     TCP      umsp > commplex-link [ACK] Seq=124365 Ack=1 Win=65535 Len=1460
    153 1514          0.787248    76.23.247.139         128.119.245.93        umsp     TCP      umsp > commplex-link [ACK] Seq=125825 Ack=1 Win=65535 Len=1460
    154 1514          0.787382    76.23.247.139         128.119.245.93        umsp     TCP      umsp > commplex-link [ACK] Seq=127285 Ack=1 Win=65535 Len=1460
    155 1514          0.787496    76.23.247.139         128.119.245.93        umsp     TCP      umsp > commplex-link [ACK] Seq=128745 Ack=1 Win=65535 Len=1460
    156 946           0.787583    76.23.247.139         128.119.245.93        umsp     TCP      umsp > commplex-link [PSH, ACK] Seq=130205 Ack=1 Win=65535 Len=892
    159 1514          0.802858    76.23.247.139         128.119.245.93        umsp     TCP      umsp > commplex-link [ACK] Seq=131097 Ack=1 Win=65535 Len=1460
    160 1514          0.803100    76.23.247.139         128.119.245.93        umsp     TCP      umsp > commplex-link [ACK] Seq=132557 Ack=1 Win=65535 Len=1460
    161 1514          0.803223    76.23.247.139         128.119.245.93        umsp     TCP      umsp > commplex-link [ACK] Seq=134017 Ack=1 Win=65535 Len=1460
    162 1514          0.803363    76.23.247.139         128.119.245.93        umsp     TCP      umsp > commplex-link [ACK] Seq=135477 Ack=1 Win=65535 Len=1460
    163 1514          0.803476    76.23.247.139         128.119.245.93        umsp     TCP      umsp > commplex-link [ACK] Seq=136937 Ack=1 Win=65535 Len=1460
    164 946           0.803566    76.23.247.139         128.119.245.93        umsp     TCP      umsp > commplex-link [PSH, ACK] Seq=138397 Ack=1 Win=65535 Len=892
    169 1514          0.828151    76.23.247.139         128.119.245.93        umsp     TCP      umsp > commplex-link [ACK] Seq=139289 Ack=1 Win=65535 Len=1460
    171 1514          0.828475    76.23.247.139         128.119.245.93        umsp     TCP      umsp > commplex-link [ACK] Seq=140749 Ack=1 Win=65535 Len=1460
    172 1514          0.828598    76.23.247.139         128.119.245.93        umsp     TCP      umsp > commplex-link [ACK] Seq=142209 Ack=1 Win=65535 Len=1460
    173 1514          0.828721    76.23.247.139         128.119.245.93        umsp     TCP      umsp > commplex-link [ACK] Seq=143669 Ack=1 Win=65535 Len=1460
    174 1514          0.828921    76.23.247.139         128.119.245.93        umsp     TCP      umsp > commplex-link [ACK] Seq=145129 Ack=1 Win=65535 Len=1460
    175 946           0.828996    76.23.247.139         128.119.245.93        umsp     TCP      umsp > commplex-link [PSH, ACK] Seq=146589 Ack=1 Win=65535 Len=892
    178 1514          0.845470    76.23.247.139         128.119.245.93        umsp     TCP      umsp > commplex-link [ACK] Seq=147481 Ack=1 Win=65535 Len=1460
    179 1514          0.845716    76.23.247.139         128.119.245.93        umsp     TCP      umsp > commplex-link [ACK] Seq=148941 Ack=1 Win=65535 Len=1460
    180 1514          0.845841    76.23.247.139         128.119.245.93        umsp     TCP      umsp > commplex-link [ACK] Seq=150401 Ack=1 Win=65535 Len=1460
    181 1514          0.845983    76.23.247.139         128.119.245.93        umsp     TCP      umsp > commplex-link [ACK] Seq=151861 Ack=1 Win=65535 Len=1460
    182 1514          0.846111    76.23.247.139         128.119.245.93        umsp     TCP      umsp > commplex-link [ACK] Seq=153321 Ack=1 Win=65535 Len=1460
    183 946           0.846185    76.23.247.139         128.119.245.93        umsp     TCP      umsp > commplex-link [PSH, ACK] Seq=154781 Ack=1 Win=65535 Len=892
    187 1514          0.862754    76.23.247.139         128.119.245.93        umsp     TCP      umsp > commplex-link [ACK] Seq=155673 Ack=1 Win=65535 Len=1460
    188 1514          0.863002    76.23.247.139         128.119.245.93        umsp     TCP      umsp > commplex-link [ACK] Seq=157133 Ack=1 Win=65535 Len=1460
    189 1514          0.863125    76.23.247.139         128.119.245.93        umsp     TCP      umsp > commplex-link [ACK] Seq=158593 Ack=1 Win=65535 Len=1460
    190 1514          0.863265    76.23.247.139         128.119.245.93        umsp     TCP      umsp > commplex-link [ACK] Seq=160053 Ack=1 Win=65535 Len=1460
    191 1514          0.863388    76.23.247.139         128.119.245.93        umsp     TCP      umsp > commplex-link [ACK] Seq=161513 Ack=1 Win=65535 Len=1460
    192 946           0.863464    76.23.247.139         128.119.245.93        umsp     TCP      umsp > commplex-link [PSH, ACK] Seq=162973 Ack=1 Win=65535 Len=892
    195 1514          0.876078    76.23.247.139         128.119.245.93        umsp     TCP      umsp > commplex-link [ACK] Seq=163865 Ack=1 Win=65535 Len=1460
    196 1514          0.876317    76.23.247.139         128.119.245.93        umsp     TCP      umsp > commplex-link [ACK] Seq=165325 Ack=1 Win=65535 Len=1460
    197 1514          0.876440    76.23.247.139         128.119.245.93        umsp     TCP      umsp > commplex-link [ACK] Seq=166785 Ack=1 Win=65535 Len=1460
    198 1514          0.876575    76.23.247.139         128.119.245.93        umsp     TCP      umsp > commplex-link [ACK] Seq=168245 Ack=1 Win=65535 Len=1460
    199 1514          0.876690    76.23.247.139         128.119.245.93        umsp     TCP      umsp > commplex-link [ACK] Seq=169705 Ack=1 Win=65535 Len=1460
    200 946           0.876777    76.23.247.139         128.119.245.93        umsp     TCP      umsp > commplex-link [PSH, ACK] Seq=171165 Ack=1 Win=65535 Len=892
    205 1514          0.905342    76.23.247.139         128.119.245.93        umsp     TCP      umsp > commplex-link [ACK] Seq=172057 Ack=1 Win=65535 Len=1460
    206 1514          0.905589    76.23.247.139         128.119.245.93        umsp     TCP      umsp > commplex-link [ACK] Seq=173517 Ack=1 Win=65535 Len=1460
    207 1514          0.905711    76.23.247.139         128.119.245.93        umsp     TCP      umsp > commplex-link [ACK] Seq=174977 Ack=1 Win=65535 Len=1460
    208 1514          0.905846    76.23.247.139         128.119.245.93        umsp     TCP      umsp > commplex-link [ACK] Seq=176437 Ack=1 Win=65535 Len=1460
    209 1514          0.905970    76.23.247.139         128.119.245.93        umsp     TCP      umsp > commplex-link [ACK] Seq=177897 Ack=1 Win=65535 Len=1460
    210 946           0.906046    76.23.247.139         128.119.245.93        umsp     TCP      umsp > commplex-link [PSH, ACK] Seq=179357 Ack=1 Win=65535 Len=892
    219 1514          0.918879    76.23.247.139         128.119.245.93        umsp     TCP      umsp > commplex-link [ACK] Seq=180249 Ack=1 Win=65535 Len=1460
    220 1514          0.918999    76.23.247.139         128.119.245.93        umsp     TCP      umsp > commplex-link [ACK] Seq=181709 Ack=1 Win=65535 Len=1460
    221 1514          0.919122    76.23.247.139         128.119.245.93        umsp     TCP      umsp > commplex-link [ACK] Seq=183169 Ack=1 Win=65535 Len=1460
    222 1514          0.919305    76.23.247.139         128.119.245.93        umsp     TCP      umsp > commplex-link [ACK] Seq=184629 Ack=1 Win=65535 Len=1460
    223 1514          0.919429    76.23.247.139         128.119.245.93        umsp     TCP      umsp > commplex-link [ACK] Seq=186089 Ack=1 Win=65535 Len=1460
    224 946           0.919505    76.23.247.139         128.119.245.93        umsp     TCP      umsp > commplex-link [PSH, ACK] Seq=187549 Ack=1 Win=65535 Len=892
    228 1514          0.929331    76.23.247.139         128.119.245.93        umsp     TCP      umsp > commplex-link [ACK] Seq=188441 Ack=1 Win=65535 Len=1460
    229 1514          0.929577    76.23.247.139         128.119.245.93        umsp     TCP      umsp > commplex-link [ACK] Seq=189901 Ack=1 Win=65535 Len=1460
    230 1514          0.929700    76.23.247.139         128.119.245.93        umsp     TCP      umsp > commplex-link [ACK] Seq=191361 Ack=1 Win=65535 Len=1460
    231 1514          0.929849    76.23.247.139         128.119.245.93        umsp     TCP      umsp > commplex-link [ACK] Seq=192821 Ack=1 Win=65535 Len=1460
    232 1514          0.929965    76.23.247.139         128.119.245.93        umsp     TCP      umsp > commplex-link [ACK] Seq=194281 Ack=1 Win=65535 Len=1460
    233 946           0.930052    76.23.247.139         128.119.245.93        umsp     TCP      umsp > commplex-link [PSH, ACK] Seq=195741 Ack=1 Win=65535 Len=892
    242 1514          0.954605    76.23.247.139         128.119.245.93        umsp     TCP      umsp > commplex-link [ACK] Seq=196633 Ack=1 Win=65535 Len=1460
    243 1514          0.954859    76.23.247.139         128.119.245.93        umsp     TCP      umsp > commplex-link [ACK] Seq=198093 Ack=1 Win=65535 Len=1460
    244 1514          0.954982    76.23.247.139         128.119.245.93        umsp     TCP      umsp > commplex-link [ACK] Seq=199553 Ack=1 Win=65535 Len=1460
    245 1514          0.955179    76.23.247.139         128.119.245.93        umsp     TCP      umsp > commplex-link [ACK] Seq=201013 Ack=1 Win=65535 Len=1460
    246 1514          0.955303    76.23.247.139         128.119.245.93        umsp     TCP      umsp > commplex-link [ACK] Seq=202473 Ack=1 Win=65535 Len=1460
    247 946           0.955381    76.23.247.139         128.119.245.93        umsp     TCP      umsp > commplex-link [PSH, ACK] Seq=203933 Ack=1 Win=65535 Len=892
    250 1514          0.967935    76.23.247.139         128.119.245.93        umsp     TCP      umsp > commplex-link [ACK] Seq=204825 Ack=1 Win=65535 Len=1460
    251 1514          0.968166    76.23.247.139         128.119.245.93        umsp     TCP      umsp > commplex-link [ACK] Seq=206285 Ack=1 Win=65535 Len=1460
    252 1514          0.968289    76.23.247.139         128.119.245.93        umsp     TCP      umsp > commplex-link [ACK] Seq=207745 Ack=1 Win=65535 Len=1460
    253 1514          0.968419    76.23.247.139         128.119.245.93        umsp     TCP      umsp > commplex-link [ACK] Seq=209205 Ack=1 Win=65535 Len=1460
    254 1514          0.968544    76.23.247.139         128.119.245.93        umsp     TCP      umsp > commplex-link [ACK] Seq=210665 Ack=1 Win=65535 Len=1460
    255 946           0.968623    76.23.247.139         128.119.245.93        umsp     TCP      umsp > commplex-link [PSH, ACK] Seq=212125 Ack=1 Win=65535 Len=892
    258 1514          0.985240    76.23.247.139         128.119.245.93        umsp     TCP      umsp > commplex-link [ACK] Seq=213017 Ack=1 Win=65535 Len=1460
    259 1514          0.985486    76.23.247.139         128.119.245.93        umsp     TCP      umsp > commplex-link [ACK] Seq=214477 Ack=1 Win=65535 Len=1460
    260 1514          0.985609    76.23.247.139         128.119.245.93        umsp     TCP      umsp > commplex-link [ACK] Seq=215937 Ack=1 Win=65535 Len=1460
    261 1514          0.985745    76.23.247.139         128.119.245.93        umsp     TCP      umsp > commplex-link [ACK] Seq=217397 Ack=1 Win=65535 Len=1460
    262 1514          0.985860    76.23.247.139         128.119.245.93        umsp     TCP      umsp > commplex-link [ACK] Seq=218857 Ack=1 Win=65535 Len=1460
    263 946           0.985946    76.23.247.139         128.119.245.93        umsp     TCP      umsp > commplex-link [PSH, ACK] Seq=220317 Ack=1 Win=65535 Len=892
    270 1514          1.010663    76.23.247.139         128.119.245.93        umsp     TCP      umsp > commplex-link [ACK] Seq=221209 Ack=1 Win=65535 Len=1460
    271 1514          1.010899    76.23.247.139         128.119.245.93        umsp     TCP      umsp > commplex-link [ACK] Seq=222669 Ack=1 Win=65535 Len=1460
    272 1514          1.011023    76.23.247.139         128.119.245.93        umsp     TCP      umsp > commplex-link [ACK] Seq=224129 Ack=1 Win=65535 Len=1460
    273 1514          1.011146    76.23.247.139         128.119.245.93        umsp     TCP      umsp > commplex-link [ACK] Seq=225589 Ack=1 Win=65535 Len=1460
    274 1514          1.011270    76.23.247.139         128.119.245.93        umsp     TCP      umsp > commplex-link [ACK] Seq=227049 Ack=1 Win=65535 Len=1460
    275 946           1.011346    76.23.247.139         128.119.245.93        umsp     TCP      umsp > commplex-link [PSH, ACK] Seq=228509 Ack=1 Win=65535 Len=892
    278 1514          1.027833    76.23.247.139         128.119.245.93        umsp     TCP      umsp > commplex-link [ACK] Seq=229401 Ack=1 Win=65535 Len=1460
    279 1514          1.028081    76.23.247.139         128.119.245.93        umsp     TCP      umsp > commplex-link [ACK] Seq=230861 Ack=1 Win=65535 Len=1460
    280 1514          1.028204    76.23.247.139         128.119.245.93        umsp     TCP      umsp > commplex-link [ACK] Seq=232321 Ack=1 Win=65535 Len=1460
    281 1514          1.028351    76.23.247.139         128.119.245.93        umsp     TCP      umsp > commplex-link [ACK] Seq=233781 Ack=1 Win=65535 Len=1460
    282 1514          1.028454    76.23.247.139         128.119.245.93        umsp     TCP      umsp > commplex-link [ACK] Seq=235241 Ack=1 Win=65535 Len=1460
    283 946           1.028532    76.23.247.139         128.119.245.93        umsp     TCP      umsp > commplex-link [PSH, ACK] Seq=236701 Ack=1 Win=65535 Len=892
    287 1514          1.042487    76.23.247.139         128.119.245.93        umsp     TCP      umsp > commplex-link [ACK] Seq=237593 Ack=1 Win=65535 Len=1460
    288 1514          1.042816    76.23.247.139         128.119.245.93        umsp     TCP      umsp > commplex-link [ACK] Seq=239053 Ack=1 Win=65535 Len=1460
    289 1514          1.042953    76.23.247.139         128.119.245.93        umsp     TCP      umsp > commplex-link [ACK] Seq=240513 Ack=1 Win=65535 Len=1460
    290 1514          1.043058    76.23.247.139         128.119.245.93        umsp     TCP      umsp > commplex-link [ACK] Seq=241973 Ack=1 Win=65535 Len=1460
    291 1514          1.043172    76.23.247.139         128.119.245.93        umsp     TCP      umsp > commplex-link [ACK] Seq=243433 Ack=1 Win=65535 Len=1460
    292 946           1.043261    76.23.247.139         128.119.245.93        umsp     TCP      umsp > commplex-link [PSH, ACK] Seq=244893 Ack=1 Win=65535 Len=892
    295 1514          1.053130    76.23.247.139         128.119.245.93        umsp     TCP      umsp > commplex-link [ACK] Seq=245785 Ack=1 Win=65535 Len=1460
    296 1514          1.053372    76.23.247.139         128.119.245.93        umsp     TCP      umsp > commplex-link [ACK] Seq=247245 Ack=1 Win=65535 Len=1460
    297 1514          1.053497    76.23.247.139         128.119.245.93        umsp     TCP      umsp > commplex-link [ACK] Seq=248705 Ack=1 Win=65535 Len=1460
    298 1514          1.053622    76.23.247.139         128.119.245.93        umsp     TCP      umsp > commplex-link [ACK] Seq=250165 Ack=1 Win=65535 Len=1460
    299 1514          1.053736    76.23.247.139         128.119.245.93        umsp     TCP      umsp > commplex-link [ACK] Seq=251625 Ack=1 Win=65535 Len=1460
    300 946           1.053815    76.23.247.139         128.119.245.93        umsp     TCP      umsp > commplex-link [PSH, ACK] Seq=253085 Ack=1 Win=65535 Len=892
    308 1514          1.081102    76.23.247.139         128.119.245.93        umsp     TCP      umsp > commplex-link [ACK] Seq=253977 Ack=1 Win=65535 Len=1460
    309 1514          1.081438    76.23.247.139         128.119.245.93        umsp     TCP      umsp > commplex-link [ACK] Seq=255437 Ack=1 Win=65535 Len=1460
    310 1514          1.081563    76.23.247.139         128.119.245.93        umsp     TCP      umsp > commplex-link [ACK] Seq=256897 Ack=1 Win=65535 Len=1460
    311 1514          1.081682    76.23.247.139         128.119.245.93        umsp     TCP      umsp > commplex-link [ACK] Seq=258357 Ack=1 Win=65535 Len=1460
    312 1514          1.081806    76.23.247.139         128.119.245.93        umsp     TCP      umsp > commplex-link [ACK] Seq=259817 Ack=1 Win=65535 Len=1460
    313 946           1.081882    76.23.247.139         128.119.245.93        umsp     TCP      umsp > commplex-link [PSH, ACK] Seq=261277 Ack=1 Win=65535 Len=892
    318 1514          1.093074    76.23.247.139         128.119.245.93        umsp     TCP      umsp > commplex-link [ACK] Seq=262169 Ack=1 Win=65535 Len=1460
    319 1514          1.093319    76.23.247.139         128.119.245.93        umsp     TCP      umsp > commplex-link [ACK] Seq=263629 Ack=1 Win=65535 Len=1460
    320 1514          1.093448    76.23.247.139         128.119.245.93        umsp     TCP      umsp > commplex-link [ACK] Seq=265089 Ack=1 Win=65535 Len=1460
    321 1514          1.093585    76.23.247.139         128.119.245.93        umsp     TCP      umsp > commplex-link [ACK] Seq=266549 Ack=1 Win=65535 Len=1460
    322 1514          1.093698    76.23.247.139         128.119.245.93        umsp     TCP      umsp > commplex-link [ACK] Seq=268009 Ack=1 Win=65535 Len=1460
    323 946           1.093782    76.23.247.139         128.119.245.93        umsp     TCP      umsp > commplex-link [PSH, ACK] Seq=269469 Ack=1 Win=65535 Len=892
    328 1514          1.107725    76.23.247.139         128.119.245.93        umsp     TCP      umsp > commplex-link [ACK] Seq=270361 Ack=1 Win=65535 Len=1460
    329 1514          1.107961    76.23.247.139         128.119.245.93        umsp     TCP      umsp > commplex-link [ACK] Seq=271821 Ack=1 Win=65535 Len=1460
    330 1514          1.108084    76.23.247.139         128.119.245.93        umsp     TCP      umsp > commplex-link [ACK] Seq=273281 Ack=1 Win=65535 Len=1460
    331 1514          1.108203    76.23.247.139         128.119.245.93        umsp     TCP      umsp > commplex-link [ACK] Seq=274741 Ack=1 Win=65535 Len=1460
    332 1514          1.108329    76.23.247.139         128.119.245.93        umsp     TCP      umsp > commplex-link [ACK] Seq=276201 Ack=1 Win=65535 Len=1460
    333 946           1.108403    76.23.247.139         128.119.245.93        umsp     TCP      umsp > commplex-link [PSH, ACK] Seq=277661 Ack=1 Win=65535 Len=892
    339 1514          1.134457    76.23.247.139         128.119.245.93        umsp     TCP      umsp > commplex-link [ACK] Seq=278553 Ack=1 Win=65535 Len=1460
    340 1514          1.134582    76.23.247.139         128.119.245.93        umsp     TCP      umsp > commplex-link [ACK] Seq=280013 Ack=1 Win=65535 Len=1460
    341 1514          1.134705    76.23.247.139         128.119.245.93        umsp     TCP      umsp > commplex-link [ACK] Seq=281473 Ack=1 Win=65535 Len=1460
    342 1514          1.134824    76.23.247.139         128.119.245.93        umsp     TCP      umsp > commplex-link [ACK] Seq=282933 Ack=1 Win=65535 Len=1460
    343 1514          1.134973    76.23.247.139         128.119.245.93        umsp     TCP      umsp > commplex-link [ACK] Seq=284393 Ack=1 Win=65535 Len=1460
    344 946           1.135049    76.23.247.139         128.119.245.93        umsp     TCP      umsp > commplex-link [PSH, ACK] Seq=285853 Ack=1 Win=65535 Len=892
    347 1514          1.144983    76.23.247.139         128.119.245.93        umsp     TCP      umsp > commplex-link [ACK] Seq=286745 Ack=1 Win=65535 Len=1460
    348 1514          1.145236    76.23.247.139         128.119.245.93        umsp     TCP      umsp > commplex-link [ACK] Seq=288205 Ack=1 Win=65535 Len=1460
    349 1514          1.145360    76.23.247.139         128.119.245.93        umsp     TCP      umsp > commplex-link [ACK] Seq=289665 Ack=1 Win=65535 Len=1460
    350 1514          1.145561    76.23.247.139         128.119.245.93        umsp     TCP      umsp > commplex-link [ACK] Seq=291125 Ack=1 Win=65535 Len=1460
    351 1514          1.145674    76.23.247.139         128.119.245.93        umsp     TCP      umsp > commplex-link [ACK] Seq=292585 Ack=1 Win=65535 Len=1460
    352 946           1.145765    76.23.247.139         128.119.245.93        umsp     TCP      umsp > commplex-link [PSH, ACK] Seq=294045 Ack=1 Win=65535 Len=892
    356 1514          1.163627    76.23.247.139         128.119.245.93        umsp     TCP      umsp > commplex-link [ACK] Seq=294937 Ack=1 Win=65535 Len=1460
    357 1514          1.163876    76.23.247.139         128.119.245.93        umsp     TCP      umsp > commplex-link [ACK] Seq=296397 Ack=1 Win=65535 Len=1460
    358 1514          1.164002    76.23.247.139         128.119.245.93        umsp     TCP      umsp > commplex-link [ACK] Seq=297857 Ack=1 Win=65535 Len=1460
    359 1514          1.164147    76.23.247.139         128.119.245.93        umsp     TCP      umsp > commplex-link [ACK] Seq=299317 Ack=1 Win=65535 Len=1460
    360 1514          1.164259    76.23.247.139         128.119.245.93        umsp     TCP      umsp > commplex-link [ACK] Seq=300777 Ack=1 Win=65535 Len=1460
    361 946           1.164345    76.23.247.139         128.119.245.93        umsp     TCP      umsp > commplex-link [PSH, ACK] Seq=302237 Ack=1 Win=65535 Len=892
    367 1514          1.185040    76.23.247.139         128.119.245.93        umsp     TCP      umsp > commplex-link [ACK] Seq=303129 Ack=1 Win=65535 Len=1460
    368 1514          1.185164    76.23.247.139         128.119.245.93        umsp     TCP      umsp > commplex-link [ACK] Seq=304589 Ack=1 Win=65535 Len=1460
    369 1514          1.185287    76.23.247.139         128.119.245.93        umsp     TCP      umsp > commplex-link [ACK] Seq=306049 Ack=1 Win=65535 Len=1460
    370 1514          1.185414    76.23.247.139         128.119.245.93        umsp     TCP      umsp > commplex-link [ACK] Seq=307509 Ack=1 Win=65535 Len=1460
    371 1514          1.185548    76.23.247.139         128.119.245.93        umsp     TCP      umsp > commplex-link [ACK] Seq=308969 Ack=1 Win=65535 Len=1460
    372 946           1.185625    76.23.247.139         128.119.245.93        umsp     TCP      umsp > commplex-link [PSH, ACK] Seq=310429 Ack=1 Win=65535 Len=892
    375 1514          1.200900    76.23.247.139         128.119.245.93        umsp     TCP      umsp > commplex-link [ACK] Seq=311321 Ack=1 Win=65535 Len=1460
    376 1514          1.201160    76.23.247.139         128.119.245.93        umsp     TCP      umsp > commplex-link [ACK] Seq=312781 Ack=1 Win=65535 Len=1460
    377 1514          1.201271    76.23.247.139         128.119.245.93        umsp     TCP      umsp > commplex-link [ACK] Seq=314241 Ack=1 Win=65535 Len=1460
    378 1514          1.201409    76.23.247.139         128.119.245.93        umsp     TCP      umsp > commplex-link [ACK] Seq=315701 Ack=1 Win=65535 Len=1460
    379 1514          1.201522    76.23.247.139         128.119.245.93        umsp     TCP      umsp > commplex-link [ACK] Seq=317161 Ack=1 Win=65535 Len=1460
    380 946           1.201611    76.23.247.139         128.119.245.93        umsp     TCP      umsp > commplex-link [PSH, ACK] Seq=318621 Ack=1 Win=65535 Len=892
    384 1514          1.218212    76.23.247.139         128.119.245.93        umsp     TCP      umsp > commplex-link [ACK] Seq=319513 Ack=1 Win=65535 Len=1460
    385 1514          1.218458    76.23.247.139         128.119.245.93        umsp     TCP      umsp > commplex-link [ACK] Seq=320973 Ack=1 Win=65535 Len=1460
    386 1514          1.218600    76.23.247.139         128.119.245.93        umsp     TCP      umsp > commplex-link [ACK] Seq=322433 Ack=1 Win=65535 Len=1460
    387 1514          1.218840    76.23.247.139         128.119.245.93        umsp     TCP      umsp > commplex-link [ACK] Seq=323893 Ack=1 Win=65535 Len=1460
    388 1514          1.218945    76.23.247.139         128.119.245.93        umsp     TCP      umsp > commplex-link [ACK] Seq=325353 Ack=1 Win=65535 Len=1460
    389 946           1.219033    76.23.247.139         128.119.245.93        umsp     TCP      umsp > commplex-link [PSH, ACK] Seq=326813 Ack=1 Win=65535 Len=892
    392 1514          1.228835    76.23.247.139         128.119.245.93        umsp     TCP      umsp > commplex-link [ACK] Seq=327705 Ack=1 Win=65535 Len=1460
    393 1514          1.229080    76.23.247.139         128.119.245.93        umsp     TCP      umsp > commplex-link [ACK] Seq=329165 Ack=1 Win=65535 Len=1460
    394 1514          1.229203    76.23.247.139         128.119.245.93        umsp     TCP      umsp > commplex-link [ACK] Seq=330625 Ack=1 Win=65535 Len=1460
    395 1514          1.229370    76.23.247.139         128.119.245.93        umsp     TCP      umsp > commplex-link [ACK] Seq=332085 Ack=1 Win=65535 Len=1460
    396 1514          1.229493    76.23.247.139         128.119.245.93        umsp     TCP      umsp > commplex-link [ACK] Seq=333545 Ack=1 Win=65535 Len=1460
    397 946           1.229572    76.23.247.139         128.119.245.93        umsp     TCP      umsp > commplex-link [PSH, ACK] Seq=335005 Ack=1 Win=65535 Len=892
    401 1514          1.247495    76.23.247.139         128.119.245.93        umsp     TCP      umsp > commplex-link [ACK] Seq=335897 Ack=1 Win=65535 Len=1460
    402 1514          1.247726    76.23.247.139         128.119.245.93        umsp     TCP      umsp > commplex-link [ACK] Seq=337357 Ack=1 Win=65535 Len=1460
    403 1514          1.247850    76.23.247.139         128.119.245.93        umsp     TCP      umsp > commplex-link [ACK] Seq=338817 Ack=1 Win=65535 Len=1460
