      5 62            2.209608    76.23.247.139         128.119.245.93        bintec-admin TCP      bintec-admin > commplex-link [SYN] Seq=0 Win=65535 Len=0 MSS=1460 SACK_PERM=1
      7 60            2.225854    76.23.247.139         128.119.245.93        bintec-admin TCP      bintec-admin > commplex-link [ACK] Seq=1 Ack=1 Win=65535 Len=0
      8 78            2.228091    76.23.247.139         128.119.245.93        bintec-admin TCP      bintec-admin > commplex-link [PSH, ACK] Seq=1 Ack=1 Win=65535 Len=24
      9 1514          2.229530    76.23.247.139         128.119.245.93        bintec-admin TCP      bintec-admin > commplex-link [ACK] Seq=25 Ack=1 Win=65535 Len=1460
     11 1514          2.246179    76.23.247.139         128.119.245.93        bintec-admin TCP      bintec-admin > commplex-link [ACK] Seq=1485 Ack=1 Win=65535 Len=1460
     12 1514          2.246373    76.23.247.139         128.119.245.93        bintec-admin TCP      bintec-admin > commplex-link [ACK] Seq=2945 Ack=1 Win=65535 Len=1460
     14 1514          2.254157    76.23.247.139         128.119.245.93        bintec-admin TCP      bintec-admin > commplex-link [ACK] Seq=4405 Ack=1 Win=65535 Len=1460
     15 1514          2.254352    76.23.247.139         128.119.245.93        bintec-admin TCP      bintec-admin > commplex-link [ACK] Seq=5865 Ack=1 Win=65535 Len=1460
     18 1514          2.264844    76.23.247.139         128.119.245.93        bintec-admin TCP      bintec-admin > commplex-link [PSH, ACK] Seq=7325 Ack=1 Win=65535 Len=1460
      5 62            2.209608    76.23.247.139         128.119.245.93        bintec-admin TCP      bintec-admin > commplex-link [SYN] Seq=0 Win=65535 Len=0 MSS=1460 SACK_PERM=1
     19 1514          2.265026    76.23.247.139         128.119.245.93        bintec-admin TCP      bintec-admin > commplex-link [ACK] Seq=8785 Ack=1 Win=65535 Len=1460
     20 1514          2.265149    76.23.247.139         128.119.245.93        bintec-admin TCP      bintec-admin > commplex-link [ACK] Seq=10245 Ack=1 Win=65535 Len=1460
     21 1514          2.265299    76.23.247.139         128.119.245.93        bintec-admin TCP      bintec-admin > commplex-link [ACK] Seq=11705 Ack=1 Win=65535 Len=1460
      5 62            2.209608    76.23.247.139         128.119.245.93        bintec-admin TCP      bintec-admin > commplex-link [SYN] Seq=0 Win=65535 Len=0 MSS=1460 SACK_PERM=1	 
     24 1514          2.270154    76.23.247.139         128.119.245.93        bintec-admin TCP      bintec-admin > commplex-link [ACK] Seq=13165 Ack=1 Win=65535 Len=1460
     25 1514          2.270339    76.23.247.139         128.119.245.93        bintec-admin TCP      bintec-admin > commplex-link [ACK] Seq=14625 Ack=1 Win=65535 Len=1460
     26 1514          2.270470    76.23.247.139         128.119.245.93        bintec-admin TCP      bintec-admin > commplex-link [PSH, ACK] Seq=16085 Ack=1 Win=65535 Len=1460
     27 1514          2.270613    76.23.247.139         128.119.245.93        bintec-admin TCP      bintec-admin > commplex-link [ACK] Seq=17545 Ack=1 Win=65535 Len=1460
      5 62            2.209608    76.23.247.139         128.119.245.93        bintec-admin TCP      bintec-admin > commplex-link [SYN] Seq=0 Win=65535 Len=0 MSS=1460 SACK_PERM=1	 
     32 1514          2.282291    76.23.247.139         128.119.245.93        bintec-admin TCP      bintec-admin > commplex-link [ACK] Seq=19005 Ack=1 Win=65535 Len=1460
     33 1514          2.282414    76.23.247.139         128.119.245.93        bintec-admin TCP      bintec-admin > commplex-link [ACK] Seq=20465 Ack=1 Win=65535 Len=1460
     34 1514          2.282593    76.23.247.139         128.119.245.93        bintec-admin TCP      bintec-admin > commplex-link [ACK] Seq=21925 Ack=1 Win=65535 Len=1460
     35 1270          2.282695    76.23.247.139         128.119.245.93        bintec-admin TCP      bintec-admin > commplex-link [PSH, ACK] Seq=23385 Ack=1 Win=65535 Len=1216
     36 1514          2.283471    76.23.247.139         128.119.245.93        bintec-admin TCP      bintec-admin > commplex-link [ACK] Seq=24601 Ack=1 Win=65535 Len=1460
     37 1514          2.283714    76.23.247.139         128.119.245.93        bintec-admin TCP      bintec-admin > commplex-link [ACK] Seq=26061 Ack=1 Win=65535 Len=1460
     38 1514          2.283841    76.23.247.139         128.119.245.93        bintec-admin TCP      bintec-admin > commplex-link [ACK] Seq=27521 Ack=1 Win=65535 Len=1460
     39 1514          2.283987    76.23.247.139         128.119.245.93        bintec-admin TCP      bintec-admin > commplex-link [ACK] Seq=28981 Ack=1 Win=65535 Len=1460
     44 1514          2.296802    76.23.247.139         128.119.245.93        bintec-admin TCP      bintec-admin > commplex-link [ACK] Seq=30441 Ack=1 Win=65535 Len=1460
     45 946           2.296879    76.23.247.139         128.119.245.93        bintec-admin TCP      bintec-admin > commplex-link [PSH, ACK] Seq=31901 Ack=1 Win=65535 Len=892
     46 1514          2.298152    76.23.247.139         128.119.245.93        bintec-admin TCP      bintec-admin > commplex-link [ACK] Seq=32793 Ack=1 Win=65535 Len=1460
     47 1514          2.298400    76.23.247.139         128.119.245.93        bintec-admin TCP      bintec-admin > commplex-link [ACK] Seq=34253 Ack=1 Win=65535 Len=1460
     48 1514          2.298523    76.23.247.139         128.119.245.93        bintec-admin TCP      bintec-admin > commplex-link [ACK] Seq=35713 Ack=1 Win=65535 Len=1460
     49 1514          2.298661    76.23.247.139         128.119.245.93        bintec-admin TCP      bintec-admin > commplex-link [ACK] Seq=37173 Ack=1 Win=65535 Len=1460
     50 1514          2.298785    76.23.247.139         128.119.245.93        bintec-admin TCP      bintec-admin > commplex-link [ACK] Seq=38633 Ack=1 Win=65535 Len=1460
     51 946           2.298861    76.23.247.139         128.119.245.93        bintec-admin TCP      bintec-admin > commplex-link [PSH, ACK] Seq=40093 Ack=1 Win=65535 Len=892
     56 1514          2.311464    76.23.247.139         128.119.245.93        bintec-admin TCP      bintec-admin > commplex-link [ACK] Seq=40985 Ack=1 Win=65535 Len=1460
     57 1514          2.311704    76.23.247.139         128.119.245.93        bintec-admin TCP      bintec-admin > commplex-link [ACK] Seq=42445 Ack=1 Win=65535 Len=1460
     58 1514          2.311827    76.23.247.139         128.119.245.93        bintec-admin TCP      bintec-admin > commplex-link [ACK] Seq=43905 Ack=1 Win=65535 Len=1460
     59 1514          2.312012    76.23.247.139         128.119.245.93        bintec-admin TCP      bintec-admin > commplex-link [ACK] Seq=45365 Ack=1 Win=65535 Len=1460
     60 1514          2.312136    76.23.247.139         128.119.245.93        bintec-admin TCP      bintec-admin > commplex-link [ACK] Seq=46825 Ack=1 Win=65535 Len=1460
     61 946           2.312214    76.23.247.139         128.119.245.93        bintec-admin TCP      bintec-admin > commplex-link [PSH, ACK] Seq=48285 Ack=1 Win=65535 Len=892
     70 1514          2.334106    76.23.247.139         128.119.245.93        bintec-admin TCP      bintec-admin > commplex-link [ACK] Seq=49177 Ack=1 Win=65535 Len=1460
     71 1514          2.334347    76.23.247.139         128.119.245.93        bintec-admin TCP      bintec-admin > commplex-link [ACK] Seq=50637 Ack=1 Win=65535 Len=1460
     72 1514          2.334487    76.23.247.139         128.119.245.93        bintec-admin TCP      bintec-admin > commplex-link [ACK] Seq=52097 Ack=1 Win=65535 Len=1460
     73 1514          2.334735    76.23.247.139         128.119.245.93        bintec-admin TCP      bintec-admin > commplex-link [ACK] Seq=53557 Ack=1 Win=65535 Len=1460
     74 1514          2.334862    76.23.247.139         128.119.245.93        bintec-admin TCP      bintec-admin > commplex-link [ACK] Seq=55017 Ack=1 Win=65535 Len=1460
     75 946           2.334939    76.23.247.139         128.119.245.93        bintec-admin TCP      bintec-admin > commplex-link [PSH, ACK] Seq=56477 Ack=1 Win=65535 Len=892
     79 1514          2.351404    76.23.247.139         128.119.245.93        bintec-admin TCP      bintec-admin > commplex-link [ACK] Seq=57369 Ack=1 Win=65535 Len=1460
     80 1514          2.351646    76.23.247.139         128.119.245.93        bintec-admin TCP      bintec-admin > commplex-link [ACK] Seq=58829 Ack=1 Win=65535 Len=1460
     81 1514          2.351769    76.23.247.139         128.119.245.93        bintec-admin TCP      bintec-admin > commplex-link [ACK] Seq=60289 Ack=1 Win=65535 Len=1460
     82 1514          2.351949    76.23.247.139         128.119.245.93        bintec-admin TCP      bintec-admin > commplex-link [ACK] Seq=61749 Ack=1 Win=65535 Len=1460
     83 1514          2.352073    76.23.247.139         128.119.245.93        bintec-admin TCP      bintec-admin > commplex-link [ACK] Seq=63209 Ack=1 Win=65535 Len=1460
     84 946           2.352161    76.23.247.139         128.119.245.93        bintec-admin TCP      bintec-admin > commplex-link [PSH, ACK] Seq=64669 Ack=1 Win=65535 Len=892
     87 1514          2.366035    76.23.247.139         128.119.245.93        bintec-admin TCP      bintec-admin > commplex-link [ACK] Seq=65561 Ack=1 Win=65535 Len=1460
     88 1514          2.366277    76.23.247.139         128.119.245.93        bintec-admin TCP      bintec-admin > commplex-link [ACK] Seq=67021 Ack=1 Win=65535 Len=1460
     89 1514          2.366400    76.23.247.139         128.119.245.93        bintec-admin TCP      bintec-admin > commplex-link [ACK] Seq=68481 Ack=1 Win=65535 Len=1460
     90 1514          2.366536    76.23.247.139         128.119.245.93        bintec-admin TCP      bintec-admin > commplex-link [ACK] Seq=69941 Ack=1 Win=65535 Len=1460
     91 1514          2.366662    76.23.247.139         128.119.245.93        bintec-admin TCP      bintec-admin > commplex-link [ACK] Seq=71401 Ack=1 Win=65535 Len=1460
     92 946           2.366736    76.23.247.139         128.119.245.93        bintec-admin TCP      bintec-admin > commplex-link [PSH, ACK] Seq=72861 Ack=1 Win=65535 Len=892
     96 1514          2.380689    76.23.247.139         128.119.245.93        bintec-admin TCP      bintec-admin > commplex-link [ACK] Seq=73753 Ack=1 Win=65535 Len=1460
     97 1514          2.380935    76.23.247.139         128.119.245.93        bintec-admin TCP      bintec-admin > commplex-link [ACK] Seq=75213 Ack=1 Win=65535 Len=1460
     98 1514          2.381058    76.23.247.139         128.119.245.93        bintec-admin TCP      bintec-admin > commplex-link [ACK] Seq=76673 Ack=1 Win=65535 Len=1460
     99 1514          2.381185    76.23.247.139         128.119.245.93        bintec-admin TCP      bintec-admin > commplex-link [ACK] Seq=78133 Ack=1 Win=65535 Len=1460
    100 1514          2.381309    76.23.247.139         128.119.245.93        bintec-admin TCP      bintec-admin > commplex-link [ACK] Seq=79593 Ack=1 Win=65535 Len=1460
    101 946           2.381385    76.23.247.139         128.119.245.93        bintec-admin TCP      bintec-admin > commplex-link [PSH, ACK] Seq=81053 Ack=1 Win=65535 Len=892
    105 1514          2.411302    76.23.247.139         128.119.245.93        bintec-admin TCP      bintec-admin > commplex-link [ACK] Seq=81945 Ack=1 Win=65535 Len=1460
    107 1514          2.411549    76.23.247.139         128.119.245.93        bintec-admin TCP      bintec-admin > commplex-link [ACK] Seq=83405 Ack=1 Win=65535 Len=1460
    108 1514          2.411672    76.23.247.139         128.119.245.93        bintec-admin TCP      bintec-admin > commplex-link [ACK] Seq=84865 Ack=1 Win=65535 Len=1460
    109 1514          2.411825    76.23.247.139         128.119.245.93        bintec-admin TCP      bintec-admin > commplex-link [ACK] Seq=86325 Ack=1 Win=65535 Len=1460
    110 1514          2.411949    76.23.247.139         128.119.245.93        bintec-admin TCP      bintec-admin > commplex-link [ACK] Seq=87785 Ack=1 Win=65535 Len=1460
    111 946           2.412025    76.23.247.139         128.119.245.93        bintec-admin TCP      bintec-admin > commplex-link [PSH, ACK] Seq=89245 Ack=1 Win=65535 Len=892
    115 1514          2.429936    76.23.247.139         128.119.245.93        bintec-admin TCP      bintec-admin > commplex-link [ACK] Seq=90137 Ack=1 Win=65535 Len=1460
    116 1514          2.430180    76.23.247.139         128.119.245.93        bintec-admin TCP      bintec-admin > commplex-link [ACK] Seq=91597 Ack=1 Win=65535 Len=1460
    117 1514          2.430303    76.23.247.139         128.119.245.93        bintec-admin TCP      bintec-admin > commplex-link [ACK] Seq=93057 Ack=1 Win=65535 Len=1460
    118 1514          2.430466    76.23.247.139         128.119.245.93        bintec-admin TCP      bintec-admin > commplex-link [ACK] Seq=94517 Ack=1 Win=65535 Len=1460
    119 1514          2.430590    76.23.247.139         128.119.245.93        bintec-admin TCP      bintec-admin > commplex-link [ACK] Seq=95977 Ack=1 Win=65535 Len=1460
    120 946           2.430670    76.23.247.139         128.119.245.93        bintec-admin TCP      bintec-admin > commplex-link [PSH, ACK] Seq=97437 Ack=1 Win=65535 Len=892
    124 1514          2.441917    76.23.247.139         128.119.245.93        bintec-admin TCP      bintec-admin > commplex-link [ACK] Seq=98329 Ack=1 Win=65535 Len=1460
    125 1514          2.442169    76.23.247.139         128.119.245.93        bintec-admin TCP      bintec-admin > commplex-link [ACK] Seq=99789 Ack=1 Win=65535 Len=1460
    126 1514          2.442292    76.23.247.139         128.119.245.93        bintec-admin TCP      bintec-admin > commplex-link [ACK] Seq=101249 Ack=1 Win=65535 Len=1460
    127 1514          2.442453    76.23.247.139         128.119.245.93        bintec-admin TCP      bintec-admin > commplex-link [ACK] Seq=102709 Ack=1 Win=65535 Len=1460
    128 1514          2.442577    76.23.247.139         128.119.245.93        bintec-admin TCP      bintec-admin > commplex-link [ACK] Seq=104169 Ack=1 Win=65535 Len=1460
    129 946           2.442655    76.23.247.139         128.119.245.93        bintec-admin TCP      bintec-admin > commplex-link [PSH, ACK] Seq=105629 Ack=1 Win=65535 Len=892
    132 1514          2.457899    76.23.247.139         128.119.245.93        bintec-admin TCP      bintec-admin > commplex-link [ACK] Seq=106521 Ack=1 Win=65535 Len=1460
    133 1514          2.458141    76.23.247.139         128.119.245.93        bintec-admin TCP      bintec-admin > commplex-link [ACK] Seq=107981 Ack=1 Win=65535 Len=1460
    134 1514          2.458263    76.23.247.139         128.119.245.93        bintec-admin TCP      bintec-admin > commplex-link [ACK] Seq=109441 Ack=1 Win=65535 Len=1460
    135 1514          2.458402    76.23.247.139         128.119.245.93        bintec-admin TCP      bintec-admin > commplex-link [ACK] Seq=110901 Ack=1 Win=65535 Len=1460
    136 1514          2.458527    76.23.247.139         128.119.245.93        bintec-admin TCP      bintec-admin > commplex-link [ACK] Seq=112361 Ack=1 Win=65535 Len=1460
    137 946           2.458604    76.23.247.139         128.119.245.93        bintec-admin TCP      bintec-admin > commplex-link [PSH, ACK] Seq=113821 Ack=1 Win=65535 Len=892
    146 1514          2.485895    76.23.247.139         128.119.245.93        bintec-admin TCP      bintec-admin > commplex-link [ACK] Seq=114713 Ack=1 Win=65535 Len=1460
    147 1514          2.486216    76.23.247.139         128.119.245.93        bintec-admin TCP      bintec-admin > commplex-link [ACK] Seq=116173 Ack=1 Win=65535 Len=1460
    148 1514          2.486339    76.23.247.139         128.119.245.93        bintec-admin TCP      bintec-admin > commplex-link [ACK] Seq=117633 Ack=1 Win=65535 Len=1460
    149 1514          2.486466    76.23.247.139         128.119.245.93        bintec-admin TCP      bintec-admin > commplex-link [ACK] Seq=119093 Ack=1 Win=65535 Len=1460
    150 1514          2.486591    76.23.247.139         128.119.245.93        bintec-admin TCP      bintec-admin > commplex-link [ACK] Seq=120553 Ack=1 Win=65535 Len=1460
    151 946           2.486668    76.23.247.139         128.119.245.93        bintec-admin TCP      bintec-admin > commplex-link [PSH, ACK] Seq=122013 Ack=1 Win=65535 Len=892
    154 1514          2.500494    76.23.247.139         128.119.245.93        bintec-admin TCP      bintec-admin > commplex-link [ACK] Seq=122905 Ack=1 Win=65535 Len=1460
    155 1514          2.500743    76.23.247.139         128.119.245.93        bintec-admin TCP      bintec-admin > commplex-link [ACK] Seq=124365 Ack=1 Win=65535 Len=1460
    156 1514          2.500866    76.23.247.139         128.119.245.93        bintec-admin TCP      bintec-admin > commplex-link [ACK] Seq=125825 Ack=1 Win=65535 Len=1460
    157 1514          2.501004    76.23.247.139         128.119.245.93        bintec-admin TCP      bintec-admin > commplex-link [ACK] Seq=127285 Ack=1 Win=65535 Len=1460
    158 1514          2.501112    76.23.247.139         128.119.245.93        bintec-admin TCP      bintec-admin > commplex-link [ACK] Seq=128745 Ack=1 Win=65535 Len=1460
    159 946           2.501190    76.23.247.139         128.119.245.93        bintec-admin TCP      bintec-admin > commplex-link [PSH, ACK] Seq=130205 Ack=1 Win=65535 Len=892
    163 1514          2.516594    76.23.247.139         128.119.245.93        bintec-admin TCP      bintec-admin > commplex-link [ACK] Seq=131097 Ack=1 Win=65535 Len=1460
    164 1514          2.516717    76.23.247.139         128.119.245.93        bintec-admin TCP      bintec-admin > commplex-link [ACK] Seq=132557 Ack=1 Win=65535 Len=1460
    165 1514          2.516840    76.23.247.139         128.119.245.93        bintec-admin TCP      bintec-admin > commplex-link [ACK] Seq=134017 Ack=1 Win=65535 Len=1460
    166 1514          2.517019    76.23.247.139         128.119.245.93        bintec-admin TCP      bintec-admin > commplex-link [ACK] Seq=135477 Ack=1 Win=65535 Len=1460
    167 1514          2.517146    76.23.247.139         128.119.245.93        bintec-admin TCP      bintec-admin > commplex-link [ACK] Seq=136937 Ack=1 Win=65535 Len=1460
    168 946           2.517225    76.23.247.139         128.119.245.93        bintec-admin TCP      bintec-admin > commplex-link [PSH, ACK] Seq=138397 Ack=1 Win=65535 Len=892
    171 1514          2.535127    76.23.247.139         128.119.245.93        bintec-admin TCP      bintec-admin > commplex-link [ACK] Seq=139289 Ack=1 Win=65535 Len=1460
    172 1514          2.535454    76.23.247.139         128.119.245.93        bintec-admin TCP      bintec-admin > commplex-link [ACK] Seq=140749 Ack=1 Win=65535 Len=1460
    173 1514          2.535588    76.23.247.139         128.119.245.93        bintec-admin TCP      bintec-admin > commplex-link [ACK] Seq=142209 Ack=1 Win=65535 Len=1460
    174 1514          2.535704    76.23.247.139         128.119.245.93        bintec-admin TCP      bintec-admin > commplex-link [ACK] Seq=143669 Ack=1 Win=65535 Len=1460
    175 1514          2.535829    76.23.247.139         128.119.245.93        bintec-admin TCP      bintec-admin > commplex-link [ACK] Seq=145129 Ack=1 Win=65535 Len=1460
    176 946           2.535905    76.23.247.139         128.119.245.93        bintec-admin TCP      bintec-admin > commplex-link [PSH, ACK] Seq=146589 Ack=1 Win=65535 Len=892
    180 1514          2.547092    76.23.247.139         128.119.245.93        bintec-admin TCP      bintec-admin > commplex-link [ACK] Seq=147481 Ack=1 Win=65535 Len=1460
    181 1514          2.547335    76.23.247.139         128.119.245.93        bintec-admin TCP      bintec-admin > commplex-link [ACK] Seq=148941 Ack=1 Win=65535 Len=1460
    182 1514          2.547458    76.23.247.139         128.119.245.93        bintec-admin TCP      bintec-admin > commplex-link [ACK] Seq=150401 Ack=1 Win=65535 Len=1460
    183 1514          2.547591    76.23.247.139         128.119.245.93        bintec-admin TCP      bintec-admin > commplex-link [ACK] Seq=151861 Ack=1 Win=65535 Len=1460
    184 1514          2.547715    76.23.247.139         128.119.245.93        bintec-admin TCP      bintec-admin > commplex-link [ACK] Seq=153321 Ack=1 Win=65535 Len=1460
    185 946           2.547795    76.23.247.139         128.119.245.93        bintec-admin TCP      bintec-admin > commplex-link [PSH, ACK] Seq=154781 Ack=1 Win=65535 Len=892
    189 1514          2.579039    76.23.247.139         128.119.245.93        bintec-admin TCP      bintec-admin > commplex-link [ACK] Seq=155673 Ack=1 Win=65535 Len=1460
    191 1514          2.579282    76.23.247.139         128.119.245.93        bintec-admin TCP      bintec-admin > commplex-link [ACK] Seq=157133 Ack=1 Win=65535 Len=1460
    192 1514          2.579405    76.23.247.139         128.119.245.93        bintec-admin TCP      bintec-admin > commplex-link [ACK] Seq=158593 Ack=1 Win=65535 Len=1460
    193 1514          2.579558    76.23.247.139         128.119.245.93        bintec-admin TCP      bintec-admin > commplex-link [ACK] Seq=160053 Ack=1 Win=65535 Len=1460
    194 1514          2.579683    76.23.247.139         128.119.245.93        bintec-admin TCP      bintec-admin > commplex-link [ACK] Seq=161513 Ack=1 Win=65535 Len=1460
    195 946           2.579760    76.23.247.139         128.119.245.93        bintec-admin TCP      bintec-admin > commplex-link [PSH, ACK] Seq=162973 Ack=1 Win=65535 Len=892
    198 1514          2.593683    76.23.247.139         128.119.245.93        bintec-admin TCP      bintec-admin > commplex-link [ACK] Seq=163865 Ack=1 Win=65535 Len=1460
    199 1514          2.593926    76.23.247.139         128.119.245.93        bintec-admin TCP      bintec-admin > commplex-link [ACK] Seq=165325 Ack=1 Win=65535 Len=1460
    200 1514          2.594049    76.23.247.139         128.119.245.93        bintec-admin TCP      bintec-admin > commplex-link [ACK] Seq=166785 Ack=1 Win=65535 Len=1460
    201 1514          2.594186    76.23.247.139         128.119.245.93        bintec-admin TCP      bintec-admin > commplex-link [ACK] Seq=168245 Ack=1 Win=65535 Len=1460
    202 1514          2.594310    76.23.247.139         128.119.245.93        bintec-admin TCP      bintec-admin > commplex-link [ACK] Seq=169705 Ack=1 Win=65535 Len=1460
    203 946           2.594385    76.23.247.139         128.119.245.93        bintec-admin TCP      bintec-admin > commplex-link [PSH, ACK] Seq=171165 Ack=1 Win=65535 Len=892
    209 1514          2.610987    76.23.247.139         128.119.245.93        bintec-admin TCP      bintec-admin > commplex-link [ACK] Seq=172057 Ack=1 Win=65535 Len=1460
    210 1514          2.611239    76.23.247.139         128.119.245.93        bintec-admin TCP      bintec-admin > commplex-link [ACK] Seq=173517 Ack=1 Win=65535 Len=1460
    211 1514          2.611375    76.23.247.139         128.119.245.93        bintec-admin TCP      bintec-admin > commplex-link [ACK] Seq=174977 Ack=1 Win=65535 Len=1460
    212 1514          2.611513    76.23.247.139         128.119.245.93        bintec-admin TCP      bintec-admin > commplex-link [ACK] Seq=176437 Ack=1 Win=65535 Len=1460
    213 1514          2.611638    76.23.247.139         128.119.245.93        bintec-admin TCP      bintec-admin > commplex-link [ACK] Seq=177897 Ack=1 Win=65535 Len=1460
    214 946           2.611709    76.23.247.139         128.119.245.93        bintec-admin TCP      bintec-admin > commplex-link [PSH, ACK] Seq=179357 Ack=1 Win=65535 Len=892
    220 1514          2.626966    76.23.247.139         128.119.245.93        bintec-admin TCP      bintec-admin > commplex-link [ACK] Seq=180249 Ack=1 Win=65535 Len=1460
    221 1514          2.627211    76.23.247.139         128.119.245.93        bintec-admin TCP      bintec-admin > commplex-link [ACK] Seq=181709 Ack=1 Win=65535 Len=1460
    222 1514          2.627333    76.23.247.139         128.119.245.93        bintec-admin TCP      bintec-admin > commplex-link [ACK] Seq=183169 Ack=1 Win=65535 Len=1460
    223 1514          2.627472    76.23.247.139         128.119.245.93        bintec-admin TCP      bintec-admin > commplex-link [ACK] Seq=184629 Ack=1 Win=65535 Len=1460
    224 1514          2.627599    76.23.247.139         128.119.245.93        bintec-admin TCP      bintec-admin > commplex-link [ACK] Seq=186089 Ack=1 Win=65535 Len=1460
    225 946           2.627679    76.23.247.139         128.119.245.93        bintec-admin TCP      bintec-admin > commplex-link [PSH, ACK] Seq=187549 Ack=1 Win=65535 Len=892
    231 1514          2.649596    76.23.247.139         128.119.245.93        bintec-admin TCP      bintec-admin > commplex-link [ACK] Seq=188441 Ack=1 Win=65535 Len=1460
    232 1514          2.649840    76.23.247.139         128.119.245.93        bintec-admin TCP      bintec-admin > commplex-link [ACK] Seq=189901 Ack=1 Win=65535 Len=1460
    233 1514          2.649965    76.23.247.139         128.119.245.93        bintec-admin TCP      bintec-admin > commplex-link [ACK] Seq=191361 Ack=1 Win=65535 Len=1460
    234 1514          2.650088    76.23.247.139         128.119.245.93        bintec-admin TCP      bintec-admin > commplex-link [ACK] Seq=192821 Ack=1 Win=65535 Len=1460
    235 1514          2.650212    76.23.247.139         128.119.245.93        bintec-admin TCP      bintec-admin > commplex-link [ACK] Seq=194281 Ack=1 Win=65535 Len=1460
    236 946           2.650300    76.23.247.139         128.119.245.93        bintec-admin TCP      bintec-admin > commplex-link [PSH, ACK] Seq=195741 Ack=1 Win=65535 Len=892
    247 1514          2.680219    76.23.247.139         128.119.245.93        bintec-admin TCP      bintec-admin > commplex-link [ACK] Seq=196633 Ack=1 Win=65535 Len=1460
    248 1514          2.680546    76.23.247.139         128.119.245.93        bintec-admin TCP      bintec-admin > commplex-link [ACK] Seq=198093 Ack=1 Win=65535 Len=1460
    249 1514          2.680669    76.23.247.139         128.119.245.93        bintec-admin TCP      bintec-admin > commplex-link [ACK] Seq=199553 Ack=1 Win=65535 Len=1460
    250 1514          2.680794    76.23.247.139         128.119.245.93        bintec-admin TCP      bintec-admin > commplex-link [ACK] Seq=201013 Ack=1 Win=65535 Len=1460
    251 1514          2.680917    76.23.247.139         128.119.245.93        bintec-admin TCP      bintec-admin > commplex-link [ACK] Seq=202473 Ack=1 Win=65535 Len=1460
    252 946           2.680994    76.23.247.139         128.119.245.93        bintec-admin TCP      bintec-admin > commplex-link [PSH, ACK] Seq=203933 Ack=1 Win=65535 Len=892
    255 1514          2.693532    76.23.247.139         128.119.245.93        bintec-admin TCP      bintec-admin > commplex-link [ACK] Seq=204825 Ack=1 Win=65535 Len=1460
    256 1514          2.693778    76.23.247.139         128.119.245.93        bintec-admin TCP      bintec-admin > commplex-link [ACK] Seq=206285 Ack=1 Win=65535 Len=1460
    257 1514          2.693922    76.23.247.139         128.119.245.93        bintec-admin TCP      bintec-admin > commplex-link [ACK] Seq=207745 Ack=1 Win=65535 Len=1460
    258 1514          2.694118    76.23.247.139         128.119.245.93        bintec-admin TCP      bintec-admin > commplex-link [ACK] Seq=209205 Ack=1 Win=65535 Len=1460
    259 1514          2.694245    76.23.247.139         128.119.245.93        bintec-admin TCP      bintec-admin > commplex-link [ACK] Seq=210665 Ack=1 Win=65535 Len=1460
    260 946           2.694320    76.23.247.139         128.119.245.93        bintec-admin TCP      bintec-admin > commplex-link [PSH, ACK] Seq=212125 Ack=1 Win=65535 Len=892
    264 1514          2.712293    76.23.247.139         128.119.245.93        bintec-admin TCP      bintec-admin > commplex-link [ACK] Seq=213017 Ack=1 Win=65535 Len=1460
    265 1514          2.712496    76.23.247.139         128.119.245.93        bintec-admin TCP      bintec-admin > commplex-link [ACK] Seq=214477 Ack=1 Win=65535 Len=1460
    266 1514          2.712619    76.23.247.139         128.119.245.93        bintec-admin TCP      bintec-admin > commplex-link [ACK] Seq=215937 Ack=1 Win=65535 Len=1460
    267 1514          2.712738    76.23.247.139         128.119.245.93        bintec-admin TCP      bintec-admin > commplex-link [ACK] Seq=217397 Ack=1 Win=65535 Len=1460
    268 1514          2.712867    76.23.247.139         128.119.245.93        bintec-admin TCP      bintec-admin > commplex-link [ACK] Seq=218857 Ack=1 Win=65535 Len=1460
    269 946           2.712941    76.23.247.139         128.119.245.93        bintec-admin TCP      bintec-admin > commplex-link [PSH, ACK] Seq=220317 Ack=1 Win=65535 Len=892
    272 1514          2.726799    76.23.247.139         128.119.245.93        bintec-admin TCP      bintec-admin > commplex-link [ACK] Seq=221209 Ack=1 Win=65535 Len=1460
    273 1514          2.727047    76.23.247.139         128.119.245.93        bintec-admin TCP      bintec-admin > commplex-link [ACK] Seq=222669 Ack=1 Win=65535 Len=1460
    274 1514          2.727170    76.23.247.139         128.119.245.93        bintec-admin TCP      bintec-admin > commplex-link [ACK] Seq=224129 Ack=1 Win=65535 Len=1460
    275 1514          2.727320    76.23.247.139         128.119.245.93        bintec-admin TCP      bintec-admin > commplex-link [ACK] Seq=225589 Ack=1 Win=65535 Len=1460
    276 1514          2.727443    76.23.247.139         128.119.245.93        bintec-admin TCP      bintec-admin > commplex-link [ACK] Seq=227049 Ack=1 Win=65535 Len=1460
    277 946           2.727522    76.23.247.139         128.119.245.93        bintec-admin TCP      bintec-admin > commplex-link [PSH, ACK] Seq=228509 Ack=1 Win=65535 Len=892
    281 1514          2.745438    76.23.247.139         128.119.245.93        bintec-admin TCP      bintec-admin > commplex-link [ACK] Seq=229401 Ack=1 Win=65535 Len=1460
    282 1514          2.745684    76.23.247.139         128.119.245.93        bintec-admin TCP      bintec-admin > commplex-link [ACK] Seq=230861 Ack=1 Win=65535 Len=1460
    283 1514          2.745806    76.23.247.139         128.119.245.93        bintec-admin TCP      bintec-admin > commplex-link [ACK] Seq=232321 Ack=1 Win=65535 Len=1460
    284 1514          2.745949    76.23.247.139         128.119.245.93        bintec-admin TCP      bintec-admin > commplex-link [ACK] Seq=233781 Ack=1 Win=65535 Len=1460
    285 1514          2.746063    76.23.247.139         128.119.245.93        bintec-admin TCP      bintec-admin > commplex-link [ACK] Seq=235241 Ack=1 Win=65535 Len=1460
    286 946           2.746145    76.23.247.139         128.119.245.93        bintec-admin TCP      bintec-admin > commplex-link [PSH, ACK] Seq=236701 Ack=1 Win=65535 Len=892
    292 1514          2.774731    76.23.247.139         128.119.245.93        bintec-admin TCP      bintec-admin > commplex-link [ACK] Seq=237593 Ack=1 Win=65535 Len=1460
    293 1514          2.774976    76.23.247.139         128.119.245.93        bintec-admin TCP      bintec-admin > commplex-link [ACK] Seq=239053 Ack=1 Win=65535 Len=1460
    294 1514          2.775099    76.23.247.139         128.119.245.93        bintec-admin TCP      bintec-admin > commplex-link [ACK] Seq=240513 Ack=1 Win=65535 Len=1460
    295 1514          2.775228    76.23.247.139         128.119.245.93        bintec-admin TCP      bintec-admin > commplex-link [ACK] Seq=241973 Ack=1 Win=65535 Len=1460
    296 1514          2.775342    76.23.247.139         128.119.245.93        bintec-admin TCP      bintec-admin > commplex-link [ACK] Seq=243433 Ack=1 Win=65535 Len=1460
    297 946           2.775442    76.23.247.139         128.119.245.93        bintec-admin TCP      bintec-admin > commplex-link [PSH, ACK] Seq=244893 Ack=1 Win=65535 Len=892
    300 1514          2.792167    76.23.247.139         128.119.245.93        bintec-admin TCP      bintec-admin > commplex-link [ACK] Seq=245785 Ack=1 Win=65535 Len=1460
    301 1514          2.792361    76.23.247.139         128.119.245.93        bintec-admin TCP      bintec-admin > commplex-link [ACK] Seq=247245 Ack=1 Win=65535 Len=1460
    302 1514          2.792485    76.23.247.139         128.119.245.93        bintec-admin TCP      bintec-admin > commplex-link [ACK] Seq=248705 Ack=1 Win=65535 Len=1460
    303 1514          2.792607    76.23.247.139         128.119.245.93        bintec-admin TCP      bintec-admin > commplex-link [ACK] Seq=250165 Ack=1 Win=65535 Len=1460
    304 1514          2.792723    76.23.247.139         128.119.245.93        bintec-admin TCP      bintec-admin > commplex-link [ACK] Seq=251625 Ack=1 Win=65535 Len=1460
    305 946           2.792809    76.23.247.139         128.119.245.93        bintec-admin TCP      bintec-admin > commplex-link [PSH, ACK] Seq=253085 Ack=1 Win=65535 Len=892
    309 1514          2.802691    76.23.247.139         128.119.245.93        bintec-admin TCP      bintec-admin > commplex-link [ACK] Seq=253977 Ack=1 Win=65535 Len=1460
    310 1514          2.802939    76.23.247.139         128.119.245.93        bintec-admin TCP      bintec-admin > commplex-link [ACK] Seq=255437 Ack=1 Win=65535 Len=1460
    311 1514          2.803075    76.23.247.139         128.119.245.93        bintec-admin TCP      bintec-admin > commplex-link [ACK] Seq=256897 Ack=1 Win=65535 Len=1460
    312 1514          2.803277    76.23.247.139         128.119.245.93        bintec-admin TCP      bintec-admin > commplex-link [ACK] Seq=258357 Ack=1 Win=65535 Len=1460
    313 1514          2.803393    76.23.247.139         128.119.245.93        bintec-admin TCP      bintec-admin > commplex-link [ACK] Seq=259817 Ack=1 Win=65535 Len=1460
    314 946           2.803477    76.23.247.139         128.119.245.93        bintec-admin TCP      bintec-admin > commplex-link [PSH, ACK] Seq=261277 Ack=1 Win=65535 Len=892
    317 1514          2.818661    76.23.247.139         128.119.245.93        bintec-admin TCP      bintec-admin > commplex-link [ACK] Seq=262169 Ack=1 Win=65535 Len=1460
    318 1514          2.818908    76.23.247.139         128.119.245.93        bintec-admin TCP      bintec-admin > commplex-link [ACK] Seq=263629 Ack=1 Win=65535 Len=1460
    319 1514          2.819031    76.23.247.139         128.119.245.93        bintec-admin TCP      bintec-admin > commplex-link [ACK] Seq=265089 Ack=1 Win=65535 Len=1460
    320 1514          2.819168    76.23.247.139         128.119.245.93        bintec-admin TCP      bintec-admin > commplex-link [ACK] Seq=266549 Ack=1 Win=65535 Len=1460
    321 1514          2.819292    76.23.247.139         128.119.245.93        bintec-admin TCP      bintec-admin > commplex-link [ACK] Seq=268009 Ack=1 Win=65535 Len=1460
    322 946           2.819382    76.23.247.139         128.119.245.93        bintec-admin TCP      bintec-admin > commplex-link [PSH, ACK] Seq=269469 Ack=1 Win=65535 Len=892
    331 1514          2.841287    76.23.247.139         128.119.245.93        bintec-admin TCP      bintec-admin > commplex-link [ACK] Seq=270361 Ack=1 Win=65535 Len=1460
    332 1514          2.841533    76.23.247.139         128.119.245.93        bintec-admin TCP      bintec-admin > commplex-link [ACK] Seq=271821 Ack=1 Win=65535 Len=1460
    333 1514          2.841671    76.23.247.139         128.119.245.93        bintec-admin TCP      bintec-admin > commplex-link [ACK] Seq=273281 Ack=1 Win=65535 Len=1460
    334 1514          2.841874    76.23.247.139         128.119.245.93        bintec-admin TCP      bintec-admin > commplex-link [ACK] Seq=274741 Ack=1 Win=65535 Len=1460
    335 1514          2.841985    76.23.247.139         128.119.245.93        bintec-admin TCP      bintec-admin > commplex-link [ACK] Seq=276201 Ack=1 Win=65535 Len=1460
    336 946           2.842072    76.23.247.139         128.119.245.93        bintec-admin TCP      bintec-admin > commplex-link [PSH, ACK] Seq=277661 Ack=1 Win=65535 Len=892
    343 1514          2.865280    76.23.247.139         128.119.245.93        bintec-admin TCP      bintec-admin > commplex-link [ACK] Seq=278553 Ack=1 Win=65535 Len=1460
    344 1514          2.865513    76.23.247.139         128.119.245.93        bintec-admin TCP      bintec-admin > commplex-link [ACK] Seq=280013 Ack=1 Win=65535 Len=1460
    345 1514          2.865656    76.23.247.139         128.119.245.93        bintec-admin TCP      bintec-admin > commplex-link [ACK] Seq=281473 Ack=1 Win=65535 Len=1460
    346 1514          2.865894    76.23.247.139         128.119.245.93        bintec-admin TCP      bintec-admin > commplex-link [ACK] Seq=282933 Ack=1 Win=65535 Len=1460
    347 1514          2.866009    76.23.247.139         128.119.245.93        bintec-admin TCP      bintec-admin > commplex-link [ACK] Seq=284393 Ack=1 Win=65535 Len=1460
    348 946           2.866095    76.23.247.139         128.119.245.93        bintec-admin TCP      bintec-admin > commplex-link [PSH, ACK] Seq=285853 Ack=1 Win=65535 Len=892
    352 1514          2.879906    76.23.247.139         128.119.245.93        bintec-admin TCP      bintec-admin > commplex-link [ACK] Seq=286745 Ack=1 Win=65535 Len=1460
    353 1514          2.880153    76.23.247.139         128.119.245.93        bintec-admin TCP      bintec-admin > commplex-link [ACK] Seq=288205 Ack=1 Win=65535 Len=1460
    354 1514          2.880293    76.23.247.139         128.119.245.93        bintec-admin TCP      bintec-admin > commplex-link [ACK] Seq=289665 Ack=1 Win=65535 Len=1460
    355 1514          2.880474    76.23.247.139         128.119.245.93        bintec-admin TCP      bintec-admin > commplex-link [ACK] Seq=291125 Ack=1 Win=65535 Len=1460
    356 1514          2.880598    76.23.247.139         128.119.245.93        bintec-admin TCP      bintec-admin > commplex-link [ACK] Seq=292585 Ack=1 Win=65535 Len=1460
    357 946           2.880673    76.23.247.139         128.119.245.93        bintec-admin TCP      bintec-admin > commplex-link [PSH, ACK] Seq=294045 Ack=1 Win=65535 Len=892
    360 1514          2.897208    76.23.247.139         128.119.245.93        bintec-admin TCP      bintec-admin > commplex-link [ACK] Seq=294937 Ack=1 Win=65535 Len=1460
    361 1514          2.897451    76.23.247.139         128.119.245.93        bintec-admin TCP      bintec-admin > commplex-link [ACK] Seq=296397 Ack=1 Win=65535 Len=1460
    362 1514          2.897574    76.23.247.139         128.119.245.93        bintec-admin TCP      bintec-admin > commplex-link [ACK] Seq=297857 Ack=1 Win=65535 Len=1460
    363 1514          2.897728    76.23.247.139         128.119.245.93        bintec-admin TCP      bintec-admin > commplex-link [ACK] Seq=299317 Ack=1 Win=65535 Len=1460
    364 1514          2.897842    76.23.247.139         128.119.245.93        bintec-admin TCP      bintec-admin > commplex-link [ACK] Seq=300777 Ack=1 Win=65535 Len=1460
    365 946           2.897929    76.23.247.139         128.119.245.93        bintec-admin TCP      bintec-admin > commplex-link [PSH, ACK] Seq=302237 Ack=1 Win=65535 Len=892
    371 1514          2.925359    76.23.247.139         128.119.245.93        bintec-admin TCP      bintec-admin > commplex-link [ACK] Seq=303129 Ack=1 Win=65535 Len=1460
    372 1514          2.925482    76.23.247.139         128.119.245.93        bintec-admin TCP      bintec-admin > commplex-link [ACK] Seq=304589 Ack=1 Win=65535 Len=1460
    373 1514          2.925605    76.23.247.139         128.119.245.93        bintec-admin TCP      bintec-admin > commplex-link [ACK] Seq=306049 Ack=1 Win=65535 Len=1460
    374 1514          2.925780    76.23.247.139         128.119.245.93        bintec-admin TCP      bintec-admin > commplex-link [ACK] Seq=307509 Ack=1 Win=65535 Len=1460
    375 1514          2.925906    76.23.247.139         128.119.245.93        bintec-admin TCP      bintec-admin > commplex-link [ACK] Seq=308969 Ack=1 Win=65535 Len=1460
    376 946           2.925992    76.23.247.139         128.119.245.93        bintec-admin TCP      bintec-admin > commplex-link [PSH, ACK] Seq=310429 Ack=1 Win=65535 Len=892
