     17 74            0.431080    76.23.247.139         128.119.245.93        48501    TCP      48501 > commplex-link [SYN] Seq=0 Win=5840 Len=0 MSS=1460 SACK_PERM=1 TSval=1449709 TSecr=0 WS=128
     19 66            0.446548    76.23.247.139         128.119.245.93        48501    TCP      48501 > commplex-link [ACK] Seq=1 Ack=1 Win=5888 Len=0 TSval=1449713 TSecr=901241421
     20 90            0.446812    76.23.247.139         128.119.245.93        48501    TCP      48501 > commplex-link [PSH, ACK] Seq=1 Ack=1 Win=5888 Len=24 TSval=1449713 TSecr=901241421
     21 1514          0.447301    76.23.247.139         128.119.245.93        48501    TCP      48501 > commplex-link [ACK] Seq=25 Ack=1 Win=5888 Len=1448 TSval=1449713 TSecr=901241421
     22 1514          0.447608    76.23.247.139         128.119.245.93        48501    TCP      48501 > commplex-link [ACK] Seq=1473 Ack=1 Win=5888 Len=1448 TSval=1449713 TSecr=901241421
     27 1514          0.467878    76.23.247.139         128.119.245.93        48501    TCP      48501 > commplex-link [PSH, ACK] Seq=2921 Ack=1 Win=5888 Len=1448 TSval=1449718 TSecr=901241441
     28 1514          0.468191    76.23.247.139         128.119.245.93        48501    TCP      48501 > commplex-link [ACK] Seq=4369 Ack=1 Win=5888 Len=1448 TSval=1449718 TSecr=901241441
     29 1514          0.468523    76.23.247.139         128.119.245.93        48501    TCP      48501 > commplex-link [ACK] Seq=5817 Ack=1 Win=5888 Len=1448 TSval=1449718 TSecr=901241441
     30 1514          0.468843    76.23.247.139         128.119.245.93        48501    TCP      48501 > commplex-link [ACK] Seq=7265 Ack=1 Win=5888 Len=1448 TSval=1449718 TSecr=901241441
     31 1514          0.469159    76.23.247.139         128.119.245.93        48501    TCP      48501 > commplex-link [PSH, ACK] Seq=8713 Ack=1 Win=5888 Len=1448 TSval=1449718 TSecr=901241442
     32 1514          0.469477    76.23.247.139         128.119.245.93        48501    TCP      48501 > commplex-link [ACK] Seq=10161 Ack=1 Win=5888 Len=1448 TSval=1449718 TSecr=901241442
     35 1514          0.485073    76.23.247.139         128.119.245.93        48501    TCP      48501 > commplex-link [ACK] Seq=11609 Ack=1 Win=5888 Len=1448 TSval=1449723 TSecr=901241459
     36 1514          0.485385    76.23.247.139         128.119.245.93        48501    TCP      48501 > commplex-link [ACK] Seq=13057 Ack=1 Win=5888 Len=1448 TSval=1449723 TSecr=901241459
     37 1514          0.485906    76.23.247.139         128.119.245.93        48501    TCP      48501 > commplex-link [ACK] Seq=14505 Ack=1 Win=5888 Len=1448 TSval=1449723 TSecr=901241460
     38 1514          0.486228    76.23.247.139         128.119.245.93        48501    TCP      48501 > commplex-link [ACK] Seq=15953 Ack=1 Win=5888 Len=1448 TSval=1449723 TSecr=901241460
     41 1514          0.489123    76.23.247.139         128.119.245.93        48501    TCP      48501 > commplex-link [ACK] Seq=17401 Ack=1 Win=5888 Len=1448 TSval=1449724 TSecr=901241463
     42 1514          0.489341    76.23.247.139         128.119.245.93        48501    TCP      48501 > commplex-link [PSH, ACK] Seq=18849 Ack=1 Win=5888 Len=1448 TSval=1449724 TSecr=901241463
     45 1514          0.489943    76.23.247.139         128.119.245.93        48501    TCP      48501 > commplex-link [ACK] Seq=20297 Ack=1 Win=5888 Len=1448 TSval=1449724 TSecr=901241464
     46 1514          0.490836    76.23.247.139         128.119.245.93        48501    TCP      48501 > commplex-link [ACK] Seq=21745 Ack=1 Win=5888 Len=1448 TSval=1449724 TSecr=901241464
     47 1514          0.491361    76.23.247.139         128.119.245.93        48501    TCP      48501 > commplex-link [ACK] Seq=23193 Ack=1 Win=5888 Len=1448 TSval=1449724 TSecr=901241465
     48 1514          0.491677    76.23.247.139         128.119.245.93        48501    TCP      48501 > commplex-link [ACK] Seq=24641 Ack=1 Win=5888 Len=1448 TSval=1449724 TSecr=901241465
     49 1514          0.492009    76.23.247.139         128.119.245.93        48501    TCP      48501 > commplex-link [ACK] Seq=26089 Ack=1 Win=5888 Len=1448 TSval=1449724 TSecr=901241465
     50 1514          0.492413    76.23.247.139         128.119.245.93        48501    TCP      48501 > commplex-link [ACK] Seq=27537 Ack=1 Win=5888 Len=1448 TSval=1449724 TSecr=901241465
     53 1514          0.501088    76.23.247.139         128.119.245.93        48501    TCP      48501 > commplex-link [ACK] Seq=28985 Ack=1 Win=5888 Len=1448 TSval=1449727 TSecr=901241475
     54 1514          0.501411    76.23.247.139         128.119.245.93        48501    TCP      48501 > commplex-link [ACK] Seq=30433 Ack=1 Win=5888 Len=1448 TSval=1449727 TSecr=901241475
     55 1514          0.501959    76.23.247.139         128.119.245.93        48501    TCP      48501 > commplex-link [ACK] Seq=31881 Ack=1 Win=5888 Len=1448 TSval=1449727 TSecr=901241476
     56 1514          0.502354    76.23.247.139         128.119.245.93        48501    TCP      48501 > commplex-link [ACK] Seq=33329 Ack=1 Win=5888 Len=1448 TSval=1449727 TSecr=901241476
     59 1514          0.506649    76.23.247.139         128.119.245.93        48501    TCP      48501 > commplex-link [PSH, ACK] Seq=34777 Ack=1 Win=5888 Len=1448 TSval=1449728 TSecr=901241481
     60 1514          0.506872    76.23.247.139         128.119.245.93        48501    TCP      48501 > commplex-link [ACK] Seq=36225 Ack=1 Win=5888 Len=1448 TSval=1449728 TSecr=901241481
     61 1514          0.507442    76.23.247.139         128.119.245.93        48501    TCP      48501 > commplex-link [ACK] Seq=37673 Ack=1 Win=5888 Len=1448 TSval=1449728 TSecr=901241482
     62 1514          0.507769    76.23.247.139         128.119.245.93        48501    TCP      48501 > commplex-link [ACK] Seq=39121 Ack=1 Win=5888 Len=1448 TSval=1449728 TSecr=901241482
     66 1514          0.511124    76.23.247.139         128.119.245.93        48501    TCP      48501 > commplex-link [ACK] Seq=40569 Ack=1 Win=5888 Len=1448 TSval=1449729 TSecr=901241485
     67 1514          0.511342    76.23.247.139         128.119.245.93        48501    TCP      48501 > commplex-link [ACK] Seq=42017 Ack=1 Win=5888 Len=1448 TSval=1449729 TSecr=901241485
     70 1514          0.512064    76.23.247.139         128.119.245.93        48501    TCP      48501 > commplex-link [ACK] Seq=43465 Ack=1 Win=5888 Len=1448 TSval=1449729 TSecr=901241486
     71 1514          0.512355    76.23.247.139         128.119.245.93        48501    TCP      48501 > commplex-link [ACK] Seq=44913 Ack=1 Win=5888 Len=1448 TSval=1449729 TSecr=901241486
     72 1514          0.513320    76.23.247.139         128.119.245.93        48501    TCP      48501 > commplex-link [ACK] Seq=46361 Ack=1 Win=5888 Len=1448 TSval=1449730 TSecr=901241487
     73 1514          0.513553    76.23.247.139         128.119.245.93        48501    TCP      48501 > commplex-link [ACK] Seq=47809 Ack=1 Win=5888 Len=1448 TSval=1449730 TSecr=901241487
     74 1514          0.513807    76.23.247.139         128.119.245.93        48501    TCP      48501 > commplex-link [ACK] Seq=49257 Ack=1 Win=5888 Len=1448 TSval=1449730 TSecr=901241487
     75 1514          0.514005    76.23.247.139         128.119.245.93        48501    TCP      48501 > commplex-link [ACK] Seq=50705 Ack=1 Win=5888 Len=1448 TSval=1449730 TSecr=901241487
     76 1514          0.514447    76.23.247.139         128.119.245.93        48501    TCP      48501 > commplex-link [ACK] Seq=52153 Ack=1 Win=5888 Len=1448 TSval=1449730 TSecr=901241487
     77 1514          0.514735    76.23.247.139         128.119.245.93        48501    TCP      48501 > commplex-link [ACK] Seq=53601 Ack=1 Win=5888 Len=1448 TSval=1449730 TSecr=901241487
     79 1514          0.527899    76.23.247.139         128.119.245.93        48501    TCP      48501 > commplex-link [PSH, ACK] Seq=55049 Ack=1 Win=5888 Len=1448 TSval=1449733 TSecr=901241502
     80 938           0.527999    76.23.247.139         128.119.245.93        48501    TCP      48501 > commplex-link [PSH, ACK] Seq=56497 Ack=1 Win=5888 Len=872 TSval=1449733 TSecr=901241502
     83 1514          0.530093    76.23.247.139         128.119.245.93        48501    TCP      48501 > commplex-link [ACK] Seq=57369 Ack=1 Win=5888 Len=1448 TSval=1449734 TSecr=901241503
     84 1514          0.530414    76.23.247.139         128.119.245.93        48501    TCP      48501 > commplex-link [ACK] Seq=58817 Ack=1 Win=5888 Len=1448 TSval=1449734 TSecr=901241503
     85 1514          0.530986    76.23.247.139         128.119.245.93        48501    TCP      48501 > commplex-link [ACK] Seq=60265 Ack=1 Win=5888 Len=1448 TSval=1449734 TSecr=901241503
     86 1514          0.531313    76.23.247.139         128.119.245.93        48501    TCP      48501 > commplex-link [ACK] Seq=61713 Ack=1 Win=5888 Len=1448 TSval=1449734 TSecr=901241503
     92 1514          0.540375    76.23.247.139         128.119.245.93        48501    TCP      48501 > commplex-link [ACK] Seq=63161 Ack=1 Win=5888 Len=1448 TSval=1449736 TSecr=901241514
     93 1514          0.540618    76.23.247.139         128.119.245.93        48501    TCP      48501 > commplex-link [ACK] Seq=64609 Ack=1 Win=5888 Len=1448 TSval=1449736 TSecr=901241514
     94 1514          0.540833    76.23.247.139         128.119.245.93        48501    TCP      48501 > commplex-link [ACK] Seq=66057 Ack=1 Win=5888 Len=1448 TSval=1449736 TSecr=901241514
     95 1514          0.541062    76.23.247.139         128.119.245.93        48501    TCP      48501 > commplex-link [ACK] Seq=67505 Ack=1 Win=5888 Len=1448 TSval=1449736 TSecr=901241514
     96 1514          0.541298    76.23.247.139         128.119.245.93        48501    TCP      48501 > commplex-link [ACK] Seq=68953 Ack=1 Win=5888 Len=1448 TSval=1449736 TSecr=901241515
     97 1514          0.541516    76.23.247.139         128.119.245.93        48501    TCP      48501 > commplex-link [ACK] Seq=70401 Ack=1 Win=5888 Len=1448 TSval=1449736 TSecr=901241515
     98 1514          0.541959    76.23.247.139         128.119.245.93        48501    TCP      48501 > commplex-link [ACK] Seq=71849 Ack=1 Win=5888 Len=1448 TSval=1449737 TSecr=901241515
     99 1514          0.542248    76.23.247.139         128.119.245.93        48501    TCP      48501 > commplex-link [ACK] Seq=73297 Ack=1 Win=5888 Len=1448 TSval=1449737 TSecr=901241515
    100 1514          0.545438    76.23.247.139         128.119.245.93        48501    TCP      48501 > commplex-link [ACK] Seq=74745 Ack=1 Win=5888 Len=1448 TSval=1449737 TSecr=901241515
    101 1514          0.545760    76.23.247.139         128.119.245.93        48501    TCP      48501 > commplex-link [ACK] Seq=76193 Ack=1 Win=5888 Len=1448 TSval=1449737 TSecr=901241515
    104 1514          0.557672    76.23.247.139         128.119.245.93        48501    TCP      48501 > commplex-link [ACK] Seq=77641 Ack=1 Win=5888 Len=1448 TSval=1449741 TSecr=901241532
    105 1514          0.558321    76.23.247.139         128.119.245.93        48501    TCP      48501 > commplex-link [ACK] Seq=79089 Ack=1 Win=5888 Len=1448 TSval=1449741 TSecr=901241532
    106 1514          0.558555    76.23.247.139         128.119.245.93        48501    TCP      48501 > commplex-link [ACK] Seq=80537 Ack=1 Win=5888 Len=1448 TSval=1449741 TSecr=901241532
    107 1514          0.558927    76.23.247.139         128.119.245.93        48501    TCP      48501 > commplex-link [ACK] Seq=81985 Ack=1 Win=5888 Len=1448 TSval=1449741 TSecr=901241533
    108 1514          0.559239    76.23.247.139         128.119.245.93        48501    TCP      48501 > commplex-link [PSH, ACK] Seq=83433 Ack=1 Win=5888 Len=1448 TSval=1449741 TSecr=901241533
    109 1514          0.559573    76.23.247.139         128.119.245.93        48501    TCP      48501 > commplex-link [ACK] Seq=84881 Ack=1 Win=5888 Len=1448 TSval=1449741 TSecr=901241533
    114 1514          0.573181    76.23.247.139         128.119.245.93        48501    TCP      48501 > commplex-link [ACK] Seq=86329 Ack=1 Win=5888 Len=1448 TSval=1449745 TSecr=901241547
    115 1514          0.574049    76.23.247.139         128.119.245.93        48501    TCP      48501 > commplex-link [ACK] Seq=87777 Ack=1 Win=5888 Len=1448 TSval=1449745 TSecr=901241547
    116 1514          0.574285    76.23.247.139         128.119.245.93        48501    TCP      48501 > commplex-link [ACK] Seq=89225 Ack=1 Win=5888 Len=1448 TSval=1449745 TSecr=901241547
    117 1514          0.574512    76.23.247.139         128.119.245.93        48501    TCP      48501 > commplex-link [ACK] Seq=90673 Ack=1 Win=5888 Len=1448 TSval=1449745 TSecr=901241549
    118 1514          0.574758    76.23.247.139         128.119.245.93        48501    TCP      48501 > commplex-link [ACK] Seq=92121 Ack=1 Win=5888 Len=1448 TSval=1449745 TSecr=901241549
    119 1514          0.574958    76.23.247.139         128.119.245.93        48501    TCP      48501 > commplex-link [ACK] Seq=93569 Ack=1 Win=5888 Len=1448 TSval=1449745 TSecr=901241549
    120 1514          0.575580    76.23.247.139         128.119.245.93        48501    TCP      48501 > commplex-link [ACK] Seq=95017 Ack=1 Win=5888 Len=1448 TSval=1449745 TSecr=901241549
    121 1514          0.575886    76.23.247.139         128.119.245.93        48501    TCP      48501 > commplex-link [ACK] Seq=96465 Ack=1 Win=5888 Len=1448 TSval=1449745 TSecr=901241549
    122 1514          0.576205    76.23.247.139         128.119.245.93        48501    TCP      48501 > commplex-link [ACK] Seq=97913 Ack=1 Win=5888 Len=1448 TSval=1449745 TSecr=901241549
    126 1514          0.588522    76.23.247.139         128.119.245.93        48501    TCP      48501 > commplex-link [ACK] Seq=99361 Ack=1 Win=5888 Len=1448 TSval=1449748 TSecr=901241562
    127 1514          0.588729    76.23.247.139         128.119.245.93        48501    TCP      48501 > commplex-link [ACK] Seq=100809 Ack=1 Win=5888 Len=1448 TSval=1449748 TSecr=901241562
    128 1514          0.588947    76.23.247.139         128.119.245.93        48501    TCP      48501 > commplex-link [ACK] Seq=102257 Ack=1 Win=5888 Len=1448 TSval=1449748 TSecr=901241562
    129 1514          0.589353    76.23.247.139         128.119.245.93        48501    TCP      48501 > commplex-link [ACK] Seq=103705 Ack=1 Win=5888 Len=1448 TSval=1449749 TSecr=901241563
    130 1514          0.589687    76.23.247.139         128.119.245.93        48501    TCP      48501 > commplex-link [ACK] Seq=105153 Ack=1 Win=5888 Len=1448 TSval=1449749 TSecr=901241563
    131 1514          0.590007    76.23.247.139         128.119.245.93        48501    TCP      48501 > commplex-link [ACK] Seq=106601 Ack=1 Win=5888 Len=1448 TSval=1449749 TSecr=901241563
    132 1514          0.590339    76.23.247.139         128.119.245.93        48501    TCP      48501 > commplex-link [ACK] Seq=108049 Ack=1 Win=5888 Len=1448 TSval=1449749 TSecr=901241563
    133 1514          0.590671    76.23.247.139         128.119.245.93        48501    TCP      48501 > commplex-link [ACK] Seq=109497 Ack=1 Win=5888 Len=1448 TSval=1449749 TSecr=901241563
    136 1514          0.600116    76.23.247.139         128.119.245.93        48501    TCP      48501 > commplex-link [ACK] Seq=110945 Ack=1 Win=5888 Len=1448 TSval=1449751 TSecr=901241574
    137 1514          0.600453    76.23.247.139         128.119.245.93        48501    TCP      48501 > commplex-link [ACK] Seq=112393 Ack=1 Win=5888 Len=1448 TSval=1449751 TSecr=901241574
    138 1514          0.600770    76.23.247.139         128.119.245.93        48501    TCP      48501 > commplex-link [ACK] Seq=113841 Ack=1 Win=5888 Len=1448 TSval=1449751 TSecr=901241574
    139 1514          0.601093    76.23.247.139         128.119.245.93        48501    TCP      48501 > commplex-link [ACK] Seq=115289 Ack=1 Win=5888 Len=1448 TSval=1449751 TSecr=901241575
    140 1514          0.601417    76.23.247.139         128.119.245.93        48501    TCP      48501 > commplex-link [ACK] Seq=116737 Ack=1 Win=5888 Len=1448 TSval=1449751 TSecr=901241575
    141 1514          0.601738    76.23.247.139         128.119.245.93        48501    TCP      48501 > commplex-link [ACK] Seq=118185 Ack=1 Win=5888 Len=1448 TSval=1449751 TSecr=901241575
    144 1514          0.614743    76.23.247.139         128.119.245.93        48501    TCP      48501 > commplex-link [ACK] Seq=119633 Ack=1 Win=5888 Len=1448 TSval=1449755 TSecr=901241589
    147 1514          0.615399    76.23.247.139         128.119.245.93        48501    TCP      48501 > commplex-link [ACK] Seq=121081 Ack=1 Win=5888 Len=1448 TSval=1449755 TSecr=901241589
    148 1514          0.615673    76.23.247.139         128.119.245.93        48501    TCP      48501 > commplex-link [PSH, ACK] Seq=122529 Ack=1 Win=5888 Len=1448 TSval=1449755 TSecr=901241589
    149 1514          0.616594    76.23.247.139         128.119.245.93        48501    TCP      48501 > commplex-link [ACK] Seq=123977 Ack=1 Win=5888 Len=1448 TSval=1449755 TSecr=901241590
    150 1514          0.616835    76.23.247.139         128.119.245.93        48501    TCP      48501 > commplex-link [ACK] Seq=125425 Ack=1 Win=5888 Len=1448 TSval=1449755 TSecr=901241590
    151 1514          0.617209    76.23.247.139         128.119.245.93        48501    TCP      48501 > commplex-link [ACK] Seq=126873 Ack=1 Win=5888 Len=1448 TSval=1449756 TSecr=901241590
    152 1514          0.617438    76.23.247.139         128.119.245.93        48501    TCP      48501 > commplex-link [ACK] Seq=128321 Ack=1 Win=5888 Len=1448 TSval=1449756 TSecr=901241590
    153 1514          0.617755    76.23.247.139         128.119.245.93        48501    TCP      48501 > commplex-link [ACK] Seq=129769 Ack=1 Win=5888 Len=1448 TSval=1449756 TSecr=901241591
    154 1514          0.618076    76.23.247.139         128.119.245.93        48501    TCP      48501 > commplex-link [ACK] Seq=131217 Ack=1 Win=5888 Len=1448 TSval=1449756 TSecr=901241591
    155 1514          0.618392    76.23.247.139         128.119.245.93        48501    TCP      48501 > commplex-link [ACK] Seq=132665 Ack=1 Win=5888 Len=1448 TSval=1449756 TSecr=901241591
    158 1514          0.631239    76.23.247.139         128.119.245.93        48501    TCP      48501 > commplex-link [ACK] Seq=134113 Ack=1 Win=5888 Len=1448 TSval=1449759 TSecr=901241606
    159 1514          0.631892    76.23.247.139         128.119.245.93        48501    TCP      48501 > commplex-link [ACK] Seq=135561 Ack=1 Win=5888 Len=1448 TSval=1449759 TSecr=901241606
    160 1514          0.632219    76.23.247.139         128.119.245.93        48501    TCP      48501 > commplex-link [ACK] Seq=137009 Ack=1 Win=5888 Len=1448 TSval=1449759 TSecr=901241606
    161 1514          0.632436    76.23.247.139         128.119.245.93        48501    TCP      48501 > commplex-link [ACK] Seq=138457 Ack=1 Win=5888 Len=1448 TSval=1449759 TSecr=901241607
    162 1514          0.632875    76.23.247.139         128.119.245.93        48501    TCP      48501 > commplex-link [ACK] Seq=139905 Ack=1 Win=5888 Len=1448 TSval=1449759 TSecr=901241607
    163 1514          0.633078    76.23.247.139         128.119.245.93        48501    TCP      48501 > commplex-link [ACK] Seq=141353 Ack=1 Win=5888 Len=1448 TSval=1449759 TSecr=901241607
    165 1514          0.648778    76.23.247.139         128.119.245.93        48501    TCP      48501 > commplex-link [ACK] Seq=142801 Ack=1 Win=5888 Len=1448 TSval=1449764 TSecr=901241623
    166 1514          0.649098    76.23.247.139         128.119.245.93        48501    TCP      48501 > commplex-link [ACK] Seq=144249 Ack=1 Win=5888 Len=1448 TSval=1449764 TSecr=901241623
    167 1514          0.649421    76.23.247.139         128.119.245.93        48501    TCP      48501 > commplex-link [ACK] Seq=145697 Ack=1 Win=5888 Len=1448 TSval=1449764 TSecr=901241623
    170 1514          0.651804    76.23.247.139         128.119.245.93        48501    TCP      48501 > commplex-link [ACK] Seq=147145 Ack=1 Win=5888 Len=1448 TSval=1449764 TSecr=901241624
    171 1514          0.652207    76.23.247.139         128.119.245.93        48501    TCP      48501 > commplex-link [ACK] Seq=148593 Ack=1 Win=5888 Len=1448 TSval=1449764 TSecr=901241624
    172 1514          0.652433    76.23.247.139         128.119.245.93        48501    TCP      48501 > commplex-link [ACK] Seq=150041 Ack=1 Win=5888 Len=1448 TSval=1449764 TSecr=901241624
    173 1514          0.652783    76.23.247.139         128.119.245.93        48501    TCP      48501 > commplex-link [ACK] Seq=151489 Ack=1 Win=5888 Len=1448 TSval=1449764 TSecr=901241625
    174 1514          0.653104    76.23.247.139         128.119.245.93        48501    TCP      48501 > commplex-link [ACK] Seq=152937 Ack=1 Win=5888 Len=1448 TSval=1449764 TSecr=901241625
    175 1514          0.653426    76.23.247.139         128.119.245.93        48501    TCP      48501 > commplex-link [ACK] Seq=154385 Ack=1 Win=5888 Len=1448 TSval=1449764 TSecr=901241625
    178 1514          0.667313    76.23.247.139         128.119.245.93        48501    TCP      48501 > commplex-link [ACK] Seq=155833 Ack=1 Win=5888 Len=1448 TSval=1449768 TSecr=901241642
    179 1514          0.667971    76.23.247.139         128.119.245.93        48501    TCP      48501 > commplex-link [ACK] Seq=157281 Ack=1 Win=5888 Len=1448 TSval=1449768 TSecr=901241642
    180 1514          0.668192    76.23.247.139         128.119.245.93        48501    TCP      48501 > commplex-link [ACK] Seq=158729 Ack=1 Win=5888 Len=1448 TSval=1449768 TSecr=901241642
    181 1514          0.668612    76.23.247.139         128.119.245.93        48501    TCP      48501 > commplex-link [ACK] Seq=160177 Ack=1 Win=5888 Len=1448 TSval=1449768 TSecr=901241643
    182 1514          0.668942    76.23.247.139         128.119.245.93        48501    TCP      48501 > commplex-link [ACK] Seq=161625 Ack=1 Win=5888 Len=1448 TSval=1449768 TSecr=901241643
    184 1514          0.682890    76.23.247.139         128.119.245.93        48501    TCP      48501 > commplex-link [ACK] Seq=163073 Ack=1 Win=5888 Len=1448 TSval=1449772 TSecr=901241657
    185 1514          0.683100    76.23.247.139         128.119.245.93        48501    TCP      48501 > commplex-link [ACK] Seq=164521 Ack=1 Win=5888 Len=1448 TSval=1449772 TSecr=901241657
    188 1514          0.684851    76.23.247.139         128.119.245.93        48501    TCP      48501 > commplex-link [ACK] Seq=165969 Ack=1 Win=5888 Len=1448 TSval=1449773 TSecr=901241658
    189 1514          0.685171    76.23.247.139         128.119.245.93        48501    TCP      48501 > commplex-link [ACK] Seq=167417 Ack=1 Win=5888 Len=1448 TSval=1449773 TSecr=901241658
    190 1514          0.685772    76.23.247.139         128.119.245.93        48501    TCP      48501 > commplex-link [ACK] Seq=168865 Ack=1 Win=5888 Len=1448 TSval=1449773 TSecr=901241659
    191 1514          0.686100    76.23.247.139         128.119.245.93        48501    TCP      48501 > commplex-link [ACK] Seq=170313 Ack=1 Win=5888 Len=1448 TSval=1449773 TSecr=901241659
    194 1514          0.698427    76.23.247.139         128.119.245.93        48501    TCP      48501 > commplex-link [ACK] Seq=171761 Ack=1 Win=5888 Len=1448 TSval=1449776 TSecr=901241673
    195 1514          0.698749    76.23.247.139         128.119.245.93        48501    TCP      48501 > commplex-link [ACK] Seq=173209 Ack=1 Win=5888 Len=1448 TSval=1449776 TSecr=901241673
    196 1514          0.699304    76.23.247.139         128.119.245.93        48501    TCP      48501 > commplex-link [ACK] Seq=174657 Ack=1 Win=5888 Len=1448 TSval=1449776 TSecr=901241674
    197 1514          0.699616    76.23.247.139         128.119.245.93        48501    TCP      48501 > commplex-link [PSH, ACK] Seq=176105 Ack=1 Win=5888 Len=1448 TSval=1449776 TSecr=901241674
    199 1514          0.710862    76.23.247.139         128.119.245.93        48501    TCP      48501 > commplex-link [ACK] Seq=177553 Ack=1 Win=5888 Len=1448 TSval=1449779 TSecr=901241686
    200 1514          0.711189    76.23.247.139         128.119.245.93        48501    TCP      48501 > commplex-link [ACK] Seq=179001 Ack=1 Win=5888 Len=1448 TSval=1449779 TSecr=901241686
    203 1514          0.712959    76.23.247.139         128.119.245.93        48501    TCP      48501 > commplex-link [ACK] Seq=180449 Ack=1 Win=5888 Len=1448 TSval=1449780 TSecr=901241687
    204 1514          0.713297    76.23.247.139         128.119.245.93        48501    TCP      48501 > commplex-link [ACK] Seq=181897 Ack=1 Win=5888 Len=1448 TSval=1449780 TSecr=901241687
    205 1514          0.714767    76.23.247.139         128.119.245.93        48501    TCP      48501 > commplex-link [ACK] Seq=183345 Ack=1 Win=5888 Len=1448 TSval=1449780 TSecr=901241687
    206 1514          0.715096    76.23.247.139         128.119.245.93        48501    TCP      48501 > commplex-link [ACK] Seq=184793 Ack=1 Win=5888 Len=1448 TSval=1449780 TSecr=901241687
    209 1514          0.733036    76.23.247.139         128.119.245.93        48501    TCP      48501 > commplex-link [ACK] Seq=186241 Ack=1 Win=5888 Len=1448 TSval=1449785 TSecr=901241708
    213 1514          0.733271    76.23.247.139         128.119.245.93        48501    TCP      48501 > commplex-link [ACK] Seq=187689 Ack=1 Win=5888 Len=1448 TSval=1449785 TSecr=901241708
    214 1514          0.734406    76.23.247.139         128.119.245.93        48501    TCP      48501 > commplex-link [ACK] Seq=189137 Ack=1 Win=5888 Len=1448 TSval=1449785 TSecr=901241708
    215 1514          0.734627    76.23.247.139         128.119.245.93        48501    TCP      48501 > commplex-link [ACK] Seq=190585 Ack=1 Win=5888 Len=1448 TSval=1449785 TSecr=901241708
    216 1514          0.735034    76.23.247.139         128.119.245.93        48501    TCP      48501 > commplex-link [ACK] Seq=192033 Ack=1 Win=5888 Len=1448 TSval=1449785 TSecr=901241709
    217 1514          0.735356    76.23.247.139         128.119.245.93        48501    TCP      48501 > commplex-link [ACK] Seq=193481 Ack=1 Win=5888 Len=1448 TSval=1449785 TSecr=901241709
    218 1514          0.735683    76.23.247.139         128.119.245.93        48501    TCP      48501 > commplex-link [ACK] Seq=194929 Ack=1 Win=5888 Len=1448 TSval=1449785 TSecr=901241709
    219 1514          0.736006    76.23.247.139         128.119.245.93        48501    TCP      48501 > commplex-link [ACK] Seq=196377 Ack=1 Win=5888 Len=1448 TSval=1449785 TSecr=901241709
    220 1514          0.736331    76.23.247.139         128.119.245.93        48501    TCP      48501 > commplex-link [ACK] Seq=197825 Ack=1 Win=5888 Len=1448 TSval=1449785 TSecr=901241709
    221 1514          0.736660    76.23.247.139         128.119.245.93        48501    TCP      48501 > commplex-link [ACK] Seq=199273 Ack=1 Win=5888 Len=1448 TSval=1449785 TSecr=901241709
    227 1514          0.743430    76.23.247.139         128.119.245.93        48501    TCP      48501 > commplex-link [ACK] Seq=200721 Ack=1 Win=5888 Len=1448 TSval=1449787 TSecr=901241717
    228 1514          0.743678    76.23.247.139         128.119.245.93        48501    TCP      48501 > commplex-link [ACK] Seq=202169 Ack=1 Win=5888 Len=1448 TSval=1449787 TSecr=901241717
    229 1514          0.743891    76.23.247.139         128.119.245.93        48501    TCP      48501 > commplex-link [ACK] Seq=203617 Ack=1 Win=5888 Len=1448 TSval=1449787 TSecr=901241718
    230 1514          0.744830    76.23.247.139         128.119.245.93        48501    TCP      48501 > commplex-link [ACK] Seq=205065 Ack=1 Win=5888 Len=1448 TSval=1449787 TSecr=901241718
    231 1514          0.745073    76.23.247.139         128.119.245.93        48501    TCP      48501 > commplex-link [ACK] Seq=206513 Ack=1 Win=5888 Len=1448 TSval=1449787 TSecr=901241718
    232 1514          0.745292    76.23.247.139         128.119.245.93        48501    TCP      48501 > commplex-link [ACK] Seq=207961 Ack=1 Win=5888 Len=1448 TSval=1449787 TSecr=901241718
    233 1514          0.745510    76.23.247.139         128.119.245.93        48501    TCP      48501 > commplex-link [ACK] Seq=209409 Ack=1 Win=5888 Len=1448 TSval=1449788 TSecr=901241719
    234 1514          0.745947    76.23.247.139         128.119.245.93        48501    TCP      48501 > commplex-link [ACK] Seq=210857 Ack=1 Win=5888 Len=1448 TSval=1449788 TSecr=901241719
    235 1514          0.746179    76.23.247.139         128.119.245.93        48501    TCP      48501 > commplex-link [ACK] Seq=212305 Ack=1 Win=5888 Len=1448 TSval=1449788 TSecr=901241719
    236 1514          0.746484    76.23.247.139         128.119.245.93        48501    TCP      48501 > commplex-link [ACK] Seq=213753 Ack=1 Win=5888 Len=1448 TSval=1449788 TSecr=901241719
    239 1514          0.758926    76.23.247.139         128.119.245.93        48501    TCP      48501 > commplex-link [ACK] Seq=215201 Ack=1 Win=5888 Len=1448 TSval=1449791 TSecr=901241733
    241 1514          0.759589    76.23.247.139         128.119.245.93        48501    TCP      48501 > commplex-link [ACK] Seq=216649 Ack=1 Win=5888 Len=1448 TSval=1449791 TSecr=901241733
    242 1514          0.760343    76.23.247.139         128.119.245.93        48501    TCP      48501 > commplex-link [ACK] Seq=218097 Ack=1 Win=5888 Len=1448 TSval=1449791 TSecr=901241734
    243 1514          0.760578    76.23.247.139         128.119.245.93        48501    TCP      48501 > commplex-link [ACK] Seq=219545 Ack=1 Win=5888 Len=1448 TSval=1449791 TSecr=901241734
    244 1514          0.760801    76.23.247.139         128.119.245.93        48501    TCP      48501 > commplex-link [ACK] Seq=220993 Ack=1 Win=5888 Len=1448 TSval=1449791 TSecr=901241734
    245 1514          0.761245    76.23.247.139         128.119.245.93        48501    TCP      48501 > commplex-link [ACK] Seq=222441 Ack=1 Win=5888 Len=1448 TSval=1449792 TSecr=901241735
    246 1514          0.761573    76.23.247.139         128.119.245.93        48501    TCP      48501 > commplex-link [PSH, ACK] Seq=223889 Ack=1 Win=5888 Len=1448 TSval=1449792 TSecr=901241735
    247 1514          0.761896    76.23.247.139         128.119.245.93        48501    TCP      48501 > commplex-link [ACK] Seq=225337 Ack=1 Win=5888 Len=1448 TSval=1449792 TSecr=901241735
    250 1514          0.771460    76.23.247.139         128.119.245.93        48501    TCP      48501 > commplex-link [ACK] Seq=226785 Ack=1 Win=5888 Len=1448 TSval=1449794 TSecr=901241746
    251 1514          0.772169    76.23.247.139         128.119.245.93        48501    TCP      48501 > commplex-link [ACK] Seq=228233 Ack=1 Win=5888 Len=1448 TSval=1449794 TSecr=901241746
    252 1514          0.772410    76.23.247.139         128.119.245.93        48501    TCP      48501 > commplex-link [ACK] Seq=229681 Ack=1 Win=5888 Len=1448 TSval=1449794 TSecr=901241746
    253 1514          0.774940    76.23.247.139         128.119.245.93        48501    TCP      48501 > commplex-link [ACK] Seq=231129 Ack=1 Win=5888 Len=1448 TSval=1449795 TSecr=901241747
    254 1514          0.775260    76.23.247.139         128.119.245.93        48501    TCP      48501 > commplex-link [ACK] Seq=232577 Ack=1 Win=5888 Len=1448 TSval=1449795 TSecr=901241747
    255 1514          0.775581    76.23.247.139         128.119.245.93        48501    TCP      48501 > commplex-link [ACK] Seq=234025 Ack=1 Win=5888 Len=1448 TSval=1449795 TSecr=901241747
    261 1514          0.790063    76.23.247.139         128.119.245.93        48501    TCP      48501 > commplex-link [ACK] Seq=235473 Ack=1 Win=5888 Len=1448 TSval=1449799 TSecr=901241764
    262 1514          0.790301    76.23.247.139         128.119.245.93        48501    TCP      48501 > commplex-link [ACK] Seq=236921 Ack=1 Win=5888 Len=1448 TSval=1449799 TSecr=901241764
    263 1514          0.790510    76.23.247.139         128.119.245.93        48501    TCP      48501 > commplex-link [ACK] Seq=238369 Ack=1 Win=5888 Len=1448 TSval=1449799 TSecr=901241764
    264 1514          0.791230    76.23.247.139         128.119.245.93        48501    TCP      48501 > commplex-link [ACK] Seq=239817 Ack=1 Win=5888 Len=1448 TSval=1449799 TSecr=901241765
    265 1514          0.791478    76.23.247.139         128.119.245.93        48501    TCP      48501 > commplex-link [ACK] Seq=241265 Ack=1 Win=5888 Len=1448 TSval=1449799 TSecr=901241765
    266 1514          0.791683    76.23.247.139         128.119.245.93        48501    TCP      48501 > commplex-link [ACK] Seq=242713 Ack=1 Win=5888 Len=1448 TSval=1449799 TSecr=901241765
    267 1514          0.792412    76.23.247.139         128.119.245.93        48501    TCP      48501 > commplex-link [ACK] Seq=244161 Ack=1 Win=5888 Len=1448 TSval=1449799 TSecr=901241766
    268 1514          0.792629    76.23.247.139         128.119.245.93        48501    TCP      48501 > commplex-link [ACK] Seq=245609 Ack=1 Win=5888 Len=1448 TSval=1449799 TSecr=901241766
    269 1514          0.792987    76.23.247.139         128.119.245.93        48501    TCP      48501 > commplex-link [ACK] Seq=247057 Ack=1 Win=5888 Len=1448 TSval=1449799 TSecr=901241766
    271 1514          0.804477    76.23.247.139         128.119.245.93        48501    TCP      48501 > commplex-link [ACK] Seq=248505 Ack=1 Win=5888 Len=1448 TSval=1449802 TSecr=901241779
    272 1514          0.804805    76.23.247.139         128.119.245.93        48501    TCP      48501 > commplex-link [ACK] Seq=249953 Ack=1 Win=5888 Len=1448 TSval=1449802 TSecr=901241779
    273 1514          0.805132    76.23.247.139         128.119.245.93        48501    TCP      48501 > commplex-link [ACK] Seq=251401 Ack=1 Win=5888 Len=1448 TSval=1449802 TSecr=901241779
    275 1514          0.806807    76.23.247.139         128.119.245.93        48501    TCP      48501 > commplex-link [ACK] Seq=252849 Ack=1 Win=5888 Len=1448 TSval=1449803 TSecr=901241780
    276 1514          0.807136    76.23.247.139         128.119.245.93        48501    TCP      48501 > commplex-link [ACK] Seq=254297 Ack=1 Win=5888 Len=1448 TSval=1449803 TSecr=901241780
    277 1514          0.807460    76.23.247.139         128.119.245.93        48501    TCP      48501 > commplex-link [ACK] Seq=255745 Ack=1 Win=5888 Len=1448 TSval=1449803 TSecr=901241780
    279 1514          0.817002    76.23.247.139         128.119.245.93        48501    TCP      48501 > commplex-link [ACK] Seq=257193 Ack=1 Win=5888 Len=1448 TSval=1449806 TSecr=901241791
    280 1514          0.817321    76.23.247.139         128.119.245.93        48501    TCP      48501 > commplex-link [ACK] Seq=258641 Ack=1 Win=5888 Len=1448 TSval=1449806 TSecr=901241791
    281 1514          0.817647    76.23.247.139         128.119.245.93        48501    TCP      48501 > commplex-link [ACK] Seq=260089 Ack=1 Win=5888 Len=1448 TSval=1449806 TSecr=901241791
    284 1514          0.819374    76.23.247.139         128.119.245.93        48501    TCP      48501 > commplex-link [ACK] Seq=261537 Ack=1 Win=5888 Len=1448 TSval=1449806 TSecr=901241793
    285 1514          0.819687    76.23.247.139         128.119.245.93        48501    TCP      48501 > commplex-link [ACK] Seq=262985 Ack=1 Win=5888 Len=1448 TSval=1449806 TSecr=901241793
    286 1514          0.820247    76.23.247.139         128.119.245.93        48501    TCP      48501 > commplex-link [ACK] Seq=264433 Ack=1 Win=5888 Len=1448 TSval=1449806 TSecr=901241793
    287 1514          0.820573    76.23.247.139         128.119.245.93        48501    TCP      48501 > commplex-link [ACK] Seq=265881 Ack=1 Win=5888 Len=1448 TSval=1449806 TSecr=901241793
    290 1514          0.831606    76.23.247.139         128.119.245.93        48501    TCP      48501 > commplex-link [ACK] Seq=267329 Ack=1 Win=5888 Len=1448 TSval=1449809 TSecr=901241806
    291 1514          0.831811    76.23.247.139         128.119.245.93        48501    TCP      48501 > commplex-link [ACK] Seq=268777 Ack=1 Win=5888 Len=1448 TSval=1449809 TSecr=901241806
    292 1514          0.832413    76.23.247.139         128.119.245.93        48501    TCP      48501 > commplex-link [ACK] Seq=270225 Ack=1 Win=5888 Len=1448 TSval=1449809 TSecr=901241807
    293 1514          0.832719    76.23.247.139         128.119.245.93        48501    TCP      48501 > commplex-link [ACK] Seq=271673 Ack=1 Win=5888 Len=1448 TSval=1449809 TSecr=901241807
    296 1514          0.847068    76.23.247.139         128.119.245.93        48501    TCP      48501 > commplex-link [ACK] Seq=273121 Ack=1 Win=5888 Len=1448 TSval=1449813 TSecr=901241821
    298 1514          0.847709    76.23.247.139         128.119.245.93        48501    TCP      48501 > commplex-link [ACK] Seq=274569 Ack=1 Win=5888 Len=1448 TSval=1449813 TSecr=901241821
    299 1514          0.848478    76.23.247.139         128.119.245.93        48501    TCP      48501 > commplex-link [ACK] Seq=276017 Ack=1 Win=5888 Len=1448 TSval=1449813 TSecr=901241822
    300 1514          0.848702    76.23.247.139         128.119.245.93        48501    TCP      48501 > commplex-link [ACK] Seq=277465 Ack=1 Win=5888 Len=1448 TSval=1449813 TSecr=901241822
    301 1514          0.849071    76.23.247.139         128.119.245.93        48501    TCP      48501 > commplex-link [ACK] Seq=278913 Ack=1 Win=5888 Len=1448 TSval=1449814 TSecr=901241823
    302 1514          0.851748    76.23.247.139         128.119.245.93        48501    TCP      48501 > commplex-link [ACK] Seq=280361 Ack=1 Win=5888 Len=1448 TSval=1449814 TSecr=901241823
    305 1514          0.863672    76.23.247.139         128.119.245.93        48501    TCP      48501 > commplex-link [ACK] Seq=281809 Ack=1 Win=5888 Len=1448 TSval=1449817 TSecr=901241838
    306 1514          0.863901    76.23.247.139         128.119.245.93        48501    TCP      48501 > commplex-link [ACK] Seq=283257 Ack=1 Win=5888 Len=1448 TSval=1449817 TSecr=901241838
    307 1514          0.864440    76.23.247.139         128.119.245.93        48501    TCP      48501 > commplex-link [ACK] Seq=284705 Ack=1 Win=5888 Len=1448 TSval=1449817 TSecr=901241839
    308 1514          0.864782    76.23.247.139         128.119.245.93        48501    TCP      48501 > commplex-link [ACK] Seq=286153 Ack=1 Win=5888 Len=1448 TSval=1449817 TSecr=901241839
    313 1514          0.879159    76.23.247.139         128.119.245.93        48501    TCP      48501 > commplex-link [ACK] Seq=287601 Ack=1 Win=5888 Len=1448 TSval=1449821 TSecr=901241853
    314 1514          0.879398    76.23.247.139         128.119.245.93        48501    TCP      48501 > commplex-link [ACK] Seq=289049 Ack=1 Win=5888 Len=1448 TSval=1449821 TSecr=901241853
    315 1514          0.879624    76.23.247.139         128.119.245.93        48501    TCP      48501 > commplex-link [ACK] Seq=290497 Ack=1 Win=5888 Len=1448 TSval=1449821 TSecr=901241853
    317 1514          0.880556    76.23.247.139         128.119.245.93        48501    TCP      48501 > commplex-link [ACK] Seq=291945 Ack=1 Win=5888 Len=1448 TSval=1449821 TSecr=901241854
    318 1514          0.880785    76.23.247.139         128.119.245.93        48501    TCP      48501 > commplex-link [ACK] Seq=293393 Ack=1 Win=5888 Len=1448 TSval=1449821 TSecr=901241854
    319 1514          0.881503    76.23.247.139         128.119.245.93        48501    TCP      48501 > commplex-link [ACK] Seq=294841 Ack=1 Win=5888 Len=1448 TSval=1449822 TSecr=901241854
    320 1514          0.881735    76.23.247.139         128.119.245.93        48501    TCP      48501 > commplex-link [ACK] Seq=296289 Ack=1 Win=5888 Len=1448 TSval=1449822 TSecr=901241854
    321 1514          0.881964    76.23.247.139         128.119.245.93        48501    TCP      48501 > commplex-link [ACK] Seq=297737 Ack=1 Win=5888 Len=1448 TSval=1449822 TSecr=901241855
