no      packet_length time        src                   dst                   srt_port protocol information
     16 74            1.042060    76.23.247.139         128.119.245.93        46457    TCP      46457 > commplex-link [SYN] Seq=0 Win=5840 Len=0 MSS=1460 SACK_PERM=1 TSval=1395312 TSecr=0 WS=128
     18 66            1.056716    76.23.247.139         128.119.245.93        46457    TCP      46457 > commplex-link [ACK] Seq=1 Ack=1 Win=5888 Len=0 TSval=1395316 TSecr=901023848
     19 90            1.056967    76.23.247.139         128.119.245.93        46457    TCP      46457 > commplex-link [PSH, ACK] Seq=1 Ack=1 Win=5888 Len=24 TSval=1395316 TSecr=901023848
     20 1514          1.057442    76.23.247.139         128.119.245.93        46457    TCP      46457 > commplex-link [ACK] Seq=25 Ack=1 Win=5888 Len=1448 TSval=1395316 TSecr=901023848
     21 1514          1.057662    76.23.247.139         128.119.245.93        46457    TCP      46457 > commplex-link [ACK] Seq=1473 Ack=1 Win=5888 Len=1448 TSval=1395316 TSecr=901023848
     25 1514          1.077232    76.23.247.139         128.119.245.93        46457    TCP      46457 > commplex-link [PSH, ACK] Seq=2921 Ack=1 Win=5888 Len=1448 TSval=1395321 TSecr=901023868
     26 1514          1.077457    76.23.247.139         128.119.245.93        46457    TCP      46457 > commplex-link [ACK] Seq=4369 Ack=1 Win=5888 Len=1448 TSval=1395321 TSecr=901023868
     27 1514          1.077937    76.23.247.139         128.119.245.93        46457    TCP      46457 > commplex-link [ACK] Seq=5817 Ack=1 Win=5888 Len=1448 TSval=1395322 TSecr=901023868
     28 1514          1.078246    76.23.247.139         128.119.245.93        46457    TCP      46457 > commplex-link [ACK] Seq=7265 Ack=1 Win=5888 Len=1448 TSval=1395322 TSecr=901023868
     29 1514          1.078578    76.23.247.139         128.119.245.93        46457    TCP      46457 > commplex-link [PSH, ACK] Seq=8713 Ack=1 Win=5888 Len=1448 TSval=1395322 TSecr=901023868
     30 1514          1.079318    76.23.247.139         128.119.245.93        46457    TCP      46457 > commplex-link [ACK] Seq=10161 Ack=1 Win=5888 Len=1448 TSval=1395322 TSecr=901023868
     33 1514          1.093037    76.23.247.139         128.119.245.93        46457    TCP      46457 > commplex-link [ACK] Seq=11609 Ack=1 Win=5888 Len=1448 TSval=1395325 TSecr=901023884
     34 1514          1.093243    76.23.247.139         128.119.245.93        46457    TCP      46457 > commplex-link [ACK] Seq=13057 Ack=1 Win=5888 Len=1448 TSval=1395325 TSecr=901023884
     35 1514          1.093893    76.23.247.139         128.119.245.93        46457    TCP      46457 > commplex-link [ACK] Seq=14505 Ack=1 Win=5888 Len=1448 TSval=1395326 TSecr=901023884
     36 1514          1.094213    76.23.247.139         128.119.245.93        46457    TCP      46457 > commplex-link [ACK] Seq=15953 Ack=1 Win=5888 Len=1448 TSval=1395326 TSecr=901023884
     39 1514          1.096907    76.23.247.139         128.119.245.93        46457    TCP      46457 > commplex-link [ACK] Seq=17401 Ack=1 Win=5888 Len=1448 TSval=1395326 TSecr=901023888
     40 1514          1.097224    76.23.247.139         128.119.245.93        46457    TCP      46457 > commplex-link [PSH, ACK] Seq=18849 Ack=1 Win=5888 Len=1448 TSval=1395326 TSecr=901023888
     43 1514          1.098788    76.23.247.139         128.119.245.93        46457    TCP      46457 > commplex-link [ACK] Seq=20297 Ack=1 Win=5888 Len=1448 TSval=1395327 TSecr=901023888
     44 1514          1.099003    76.23.247.139         128.119.245.93        46457    TCP      46457 > commplex-link [ACK] Seq=21745 Ack=1 Win=5888 Len=1448 TSval=1395327 TSecr=901023888
     45 1514          1.100260    76.23.247.139         128.119.245.93        46457    TCP      46457 > commplex-link [ACK] Seq=23193 Ack=1 Win=5888 Len=1448 TSval=1395327 TSecr=901023889
     46 1514          1.100579    76.23.247.139         128.119.245.93        46457    TCP      46457 > commplex-link [ACK] Seq=24641 Ack=1 Win=5888 Len=1448 TSval=1395327 TSecr=901023889
     47 1514          1.100902    76.23.247.139         128.119.245.93        46457    TCP      46457 > commplex-link [ACK] Seq=26089 Ack=1 Win=5888 Len=1448 TSval=1395327 TSecr=901023889
     48 1514          1.101234    76.23.247.139         128.119.245.93        46457    TCP      46457 > commplex-link [ACK] Seq=27537 Ack=1 Win=5888 Len=1448 TSval=1395327 TSecr=901023889
     51 1514          1.109457    76.23.247.139         128.119.245.93        46457    TCP      46457 > commplex-link [ACK] Seq=28985 Ack=1 Win=5888 Len=1448 TSval=1395329 TSecr=901023900
     52 1514          1.109784    76.23.247.139         128.119.245.93        46457    TCP      46457 > commplex-link [ACK] Seq=30433 Ack=1 Win=5888 Len=1448 TSval=1395329 TSecr=901023900
     53 1514          1.110296    76.23.247.139         128.119.245.93        46457    TCP      46457 > commplex-link [ACK] Seq=31881 Ack=1 Win=5888 Len=1448 TSval=1395330 TSecr=901023900
     54 1514          1.110598    76.23.247.139         128.119.245.93        46457    TCP      46457 > commplex-link [ACK] Seq=33329 Ack=1 Win=5888 Len=1448 TSval=1395330 TSecr=901023900
     57 1514          1.113011    76.23.247.139         128.119.245.93        46457    TCP      46457 > commplex-link [PSH, ACK] Seq=34777 Ack=1 Win=5888 Len=1448 TSval=1395330 TSecr=901023904
     58 1514          1.113338    76.23.247.139         128.119.245.93        46457    TCP      46457 > commplex-link [ACK] Seq=36225 Ack=1 Win=5888 Len=1448 TSval=1395330 TSecr=901023904
     59 1514          1.113901    76.23.247.139         128.119.245.93        46457    TCP      46457 > commplex-link [ACK] Seq=37673 Ack=1 Win=5888 Len=1448 TSval=1395331 TSecr=901023904
     60 1514          1.115023    76.23.247.139         128.119.245.93        46457    TCP      46457 > commplex-link [ACK] Seq=39121 Ack=1 Win=5888 Len=1448 TSval=1395331 TSecr=901023904
     65 1514          1.131592    76.23.247.139         128.119.245.93        46457    TCP      46457 > commplex-link [ACK] Seq=40569 Ack=1 Win=5888 Len=1448 TSval=1395335 TSecr=901023920
     66 1514          1.131909    76.23.247.139         128.119.245.93        46457    TCP      46457 > commplex-link [ACK] Seq=42017 Ack=1 Win=5888 Len=1448 TSval=1395335 TSecr=901023920
     67 1514          1.132209    76.23.247.139         128.119.245.93        46457    TCP      46457 > commplex-link [ACK] Seq=43465 Ack=1 Win=5888 Len=1448 TSval=1395335 TSecr=901023921
     68 1514          1.132556    76.23.247.139         128.119.245.93        46457    TCP      46457 > commplex-link [ACK] Seq=44913 Ack=1 Win=5888 Len=1448 TSval=1395335 TSecr=901023921
     69 1514          1.135006    76.23.247.139         128.119.245.93        46457    TCP      46457 > commplex-link [ACK] Seq=46361 Ack=1 Win=5888 Len=1448 TSval=1395335 TSecr=901023921
     70 1514          1.135306    76.23.247.139         128.119.245.93        46457    TCP      46457 > commplex-link [ACK] Seq=47809 Ack=1 Win=5888 Len=1448 TSval=1395335 TSecr=901023921
     71 1514          1.135633    76.23.247.139         128.119.245.93        46457    TCP      46457 > commplex-link [ACK] Seq=49257 Ack=1 Win=5888 Len=1448 TSval=1395335 TSecr=901023921
     72 1514          1.135962    76.23.247.139         128.119.245.93        46457    TCP      46457 > commplex-link [ACK] Seq=50705 Ack=1 Win=5888 Len=1448 TSval=1395335 TSecr=901023921
     75 1514          1.139034    76.23.247.139         128.119.245.93        46457    TCP      46457 > commplex-link [ACK] Seq=52153 Ack=1 Win=5888 Len=1448 TSval=1395337 TSecr=901023930
     79 1514          1.139612    76.23.247.139         128.119.245.93        46457    TCP      46457 > commplex-link [ACK] Seq=53601 Ack=1 Win=5888 Len=1448 TSval=1395337 TSecr=901023930
     80 1514          1.140896    76.23.247.139         128.119.245.93        46457    TCP      46457 > commplex-link [PSH, ACK] Seq=55049 Ack=1 Win=5888 Len=1448 TSval=1395337 TSecr=901023931
     81 938           1.141013    76.23.247.139         128.119.245.93        46457    TCP      46457 > commplex-link [PSH, ACK] Seq=56497 Ack=1 Win=5888 Len=872 TSval=1395337 TSecr=901023931
     82 1514          1.141441    76.23.247.139         128.119.245.93        46457    TCP      46457 > commplex-link [ACK] Seq=57369 Ack=1 Win=5888 Len=1448 TSval=1395337 TSecr=901023931
     83 1514          1.142194    76.23.247.139         128.119.245.93        46457    TCP      46457 > commplex-link [ACK] Seq=58817 Ack=1 Win=5888 Len=1448 TSval=1395338 TSecr=901023931
     84 1514          1.142397    76.23.247.139         128.119.245.93        46457    TCP      46457 > commplex-link [ACK] Seq=60265 Ack=1 Win=5888 Len=1448 TSval=1395338 TSecr=901023931
     85 1514          1.142747    76.23.247.139         128.119.245.93        46457    TCP      46457 > commplex-link [ACK] Seq=61713 Ack=1 Win=5888 Len=1448 TSval=1395338 TSecr=901023932
     86 1514          1.143072    76.23.247.139         128.119.245.93        46457    TCP      46457 > commplex-link [ACK] Seq=63161 Ack=1 Win=5888 Len=1448 TSval=1395338 TSecr=901023932
     91 1514          1.156938    76.23.247.139         128.119.245.93        46457    TCP      46457 > commplex-link [ACK] Seq=64609 Ack=1 Win=5888 Len=1448 TSval=1395341 TSecr=901023946
     92 1514          1.157267    76.23.247.139         128.119.245.93        46457    TCP      46457 > commplex-link [ACK] Seq=66057 Ack=1 Win=5888 Len=1448 TSval=1395341 TSecr=901023946
     93 1514          1.157592    76.23.247.139         128.119.245.93        46457    TCP      46457 > commplex-link [ACK] Seq=67505 Ack=1 Win=5888 Len=1448 TSval=1395341 TSecr=901023946
     94 1514          1.157918    76.23.247.139         128.119.245.93        46457    TCP      46457 > commplex-link [ACK] Seq=68953 Ack=1 Win=5888 Len=1448 TSval=1395341 TSecr=901023946
     95 1514          1.158243    76.23.247.139         128.119.245.93        46457    TCP      46457 > commplex-link [ACK] Seq=70401 Ack=1 Win=5888 Len=1448 TSval=1395341 TSecr=901023947
     96 1514          1.158571    76.23.247.139         128.119.245.93        46457    TCP      46457 > commplex-link [ACK] Seq=71849 Ack=1 Win=5888 Len=1448 TSval=1395341 TSecr=901023947
     97 1514          1.158895    76.23.247.139         128.119.245.93        46457    TCP      46457 > commplex-link [ACK] Seq=73297 Ack=1 Win=5888 Len=1448 TSval=1395341 TSecr=901023947
     98 1514          1.159388    76.23.247.139         128.119.245.93        46457    TCP      46457 > commplex-link [ACK] Seq=74745 Ack=1 Win=5888 Len=1448 TSval=1395341 TSecr=901023947
    100 1514          1.171027    76.23.247.139         128.119.245.93        46457    TCP      46457 > commplex-link [ACK] Seq=76193 Ack=1 Win=5888 Len=1448 TSval=1395345 TSecr=901023962
    101 1514          1.171346    76.23.247.139         128.119.245.93        46457    TCP      46457 > commplex-link [ACK] Seq=77641 Ack=1 Win=5888 Len=1448 TSval=1395345 TSecr=901023962
    102 1514          1.171669    76.23.247.139         128.119.245.93        46457    TCP      46457 > commplex-link [ACK] Seq=79089 Ack=1 Win=5888 Len=1448 TSval=1395345 TSecr=901023962
    105 1514          1.173360    76.23.247.139         128.119.245.93        46457    TCP      46457 > commplex-link [ACK] Seq=80537 Ack=1 Win=5888 Len=1448 TSval=1395345 TSecr=901023963
    106 1514          1.173679    76.23.247.139         128.119.245.93        46457    TCP      46457 > commplex-link [ACK] Seq=81985 Ack=1 Win=5888 Len=1448 TSval=1395345 TSecr=901023963
    107 1514          1.174010    76.23.247.139         128.119.245.93        46457    TCP      46457 > commplex-link [ACK] Seq=83433 Ack=1 Win=5888 Len=1448 TSval=1395345 TSecr=901023963
    108 1514          1.174622    76.23.247.139         128.119.245.93        46457    TCP      46457 > commplex-link [PSH, ACK] Seq=84881 Ack=1 Win=5888 Len=1448 TSval=1395346 TSecr=901023963
    109 1514          1.174949    76.23.247.139         128.119.245.93        46457    TCP      46457 > commplex-link [ACK] Seq=86329 Ack=1 Win=5888 Len=1448 TSval=1395346 TSecr=901023963
    110 1514          1.175305    76.23.247.139         128.119.245.93        46457    TCP      46457 > commplex-link [ACK] Seq=87777 Ack=1 Win=5888 Len=1448 TSval=1395346 TSecr=901023963
    113 1514          1.194627    76.23.247.139         128.119.245.93        46457    TCP      46457 > commplex-link [ACK] Seq=89225 Ack=1 Win=5888 Len=1448 TSval=1395351 TSecr=901023985
    114 1514          1.195436    76.23.247.139         128.119.245.93        46457    TCP      46457 > commplex-link [ACK] Seq=90673 Ack=1 Win=5888 Len=1448 TSval=1395351 TSecr=901023985
    115 1514          1.195754    76.23.247.139         128.119.245.93        46457    TCP      46457 > commplex-link [ACK] Seq=92121 Ack=1 Win=5888 Len=1448 TSval=1395351 TSecr=901023985
    116 1514          1.196078    76.23.247.139         128.119.245.93        46457    TCP      46457 > commplex-link [ACK] Seq=93569 Ack=1 Win=5888 Len=1448 TSval=1395351 TSecr=901023986
    117 1514          1.196401    76.23.247.139         128.119.245.93        46457    TCP      46457 > commplex-link [ACK] Seq=95017 Ack=1 Win=5888 Len=1448 TSval=1395351 TSecr=901023986
    118 1514          1.196753    76.23.247.139         128.119.245.93        46457    TCP      46457 > commplex-link [ACK] Seq=96465 Ack=1 Win=5888 Len=1448 TSval=1395351 TSecr=901023986
    122 1514          1.205567    76.23.247.139         128.119.245.93        46457    TCP      46457 > commplex-link [ACK] Seq=97913 Ack=1 Win=5888 Len=1448 TSval=1395353 TSecr=901023996
    123 1514          1.206447    76.23.247.139         128.119.245.93        46457    TCP      46457 > commplex-link [ACK] Seq=99361 Ack=1 Win=5888 Len=1448 TSval=1395353 TSecr=901023996
    124 1514          1.206675    76.23.247.139         128.119.245.93        46457    TCP      46457 > commplex-link [ACK] Seq=100809 Ack=1 Win=5888 Len=1448 TSval=1395353 TSecr=901023996
    125 1514          1.206898    76.23.247.139         128.119.245.93        46457    TCP      46457 > commplex-link [ACK] Seq=102257 Ack=1 Win=5888 Len=1448 TSval=1395354 TSecr=901023997
    126 1514          1.207124    76.23.247.139         128.119.245.93        46457    TCP      46457 > commplex-link [ACK] Seq=103705 Ack=1 Win=5888 Len=1448 TSval=1395354 TSecr=901023997
    127 1514          1.207536    76.23.247.139         128.119.245.93        46457    TCP      46457 > commplex-link [ACK] Seq=105153 Ack=1 Win=5888 Len=1448 TSval=1395354 TSecr=901023997
    128 1514          1.207970    76.23.247.139         128.119.245.93        46457    TCP      46457 > commplex-link [ACK] Seq=106601 Ack=1 Win=5888 Len=1448 TSval=1395354 TSecr=901023997
    129 1514          1.208725    76.23.247.139         128.119.245.93        46457    TCP      46457 > commplex-link [ACK] Seq=108049 Ack=1 Win=5888 Len=1448 TSval=1395354 TSecr=901023997
    131 1514          1.223091    76.23.247.139         128.119.245.93        46457    TCP      46457 > commplex-link [ACK] Seq=109497 Ack=1 Win=5888 Len=1448 TSval=1395358 TSecr=901024014
    132 1514          1.223418    76.23.247.139         128.119.245.93        46457    TCP      46457 > commplex-link [ACK] Seq=110945 Ack=1 Win=5888 Len=1448 TSval=1395358 TSecr=901024014
    133 1514          1.223733    76.23.247.139         128.119.245.93        46457    TCP      46457 > commplex-link [ACK] Seq=112393 Ack=1 Win=5888 Len=1448 TSval=1395358 TSecr=901024014
    136 1514          1.225434    76.23.247.139         128.119.245.93        46457    TCP      46457 > commplex-link [ACK] Seq=113841 Ack=1 Win=5888 Len=1448 TSval=1395358 TSecr=901024015
    137 1514          1.225763    76.23.247.139         128.119.245.93        46457    TCP      46457 > commplex-link [ACK] Seq=115289 Ack=1 Win=5888 Len=1448 TSval=1395358 TSecr=901024015
    138 1514          1.226087    76.23.247.139         128.119.245.93        46457    TCP      46457 > commplex-link [ACK] Seq=116737 Ack=1 Win=5888 Len=1448 TSval=1395358 TSecr=901024015
    139 1514          1.226668    76.23.247.139         128.119.245.93        46457    TCP      46457 > commplex-link [ACK] Seq=118185 Ack=1 Win=5888 Len=1448 TSval=1395359 TSecr=901024015
    140 1514          1.227002    76.23.247.139         128.119.245.93        46457    TCP      46457 > commplex-link [ACK] Seq=119633 Ack=1 Win=5888 Len=1448 TSval=1395359 TSecr=901024015
    141 1514          1.227312    76.23.247.139         128.119.245.93        46457    TCP      46457 > commplex-link [ACK] Seq=121081 Ack=1 Win=5888 Len=1448 TSval=1395359 TSecr=901024015
    144 1514          1.245640    76.23.247.139         128.119.245.93        46457    TCP      46457 > commplex-link [ACK] Seq=122529 Ack=1 Win=5888 Len=1448 TSval=1395363 TSecr=901024036
    145 1514          1.246289    76.23.247.139         128.119.245.93        46457    TCP      46457 > commplex-link [ACK] Seq=123977 Ack=1 Win=5888 Len=1448 TSval=1395363 TSecr=901024036
    146 1514          1.246522    76.23.247.139         128.119.245.93        46457    TCP      46457 > commplex-link [PSH, ACK] Seq=125425 Ack=1 Win=5888 Len=1448 TSval=1395363 TSecr=901024036
    147 1514          1.246889    76.23.247.139         128.119.245.93        46457    TCP      46457 > commplex-link [ACK] Seq=126873 Ack=1 Win=5888 Len=1448 TSval=1395364 TSecr=901024037
    148 1514          1.247237    76.23.247.139         128.119.245.93        46457    TCP      46457 > commplex-link [ACK] Seq=128321 Ack=1 Win=5888 Len=1448 TSval=1395364 TSecr=901024037
    149 1394          1.247504    76.23.247.139         128.119.245.93        46457    TCP      46457 > commplex-link [PSH, ACK] Seq=129769 Ack=1 Win=5888 Len=1328 TSval=1395364 TSecr=901024037
    151 1514          1.259152    76.23.247.139         128.119.245.93        46457    TCP      46457 > commplex-link [ACK] Seq=131097 Ack=1 Win=5888 Len=1448 TSval=1395367 TSecr=901024050
    152 1514          1.259470    76.23.247.139         128.119.245.93        46457    TCP      46457 > commplex-link [ACK] Seq=132545 Ack=1 Win=5888 Len=1448 TSval=1395367 TSecr=901024050
    153 1514          1.259800    76.23.247.139         128.119.245.93        46457    TCP      46457 > commplex-link [ACK] Seq=133993 Ack=1 Win=5888 Len=1448 TSval=1395367 TSecr=901024050
    156 1514          1.261483    76.23.247.139         128.119.245.93        46457    TCP      46457 > commplex-link [ACK] Seq=135441 Ack=1 Win=5888 Len=1448 TSval=1395367 TSecr=901024051
    157 1514          1.261808    76.23.247.139         128.119.245.93        46457    TCP      46457 > commplex-link [ACK] Seq=136889 Ack=1 Win=5888 Len=1448 TSval=1395367 TSecr=901024051
    158 1514          1.262209    76.23.247.139         128.119.245.93        46457    TCP      46457 > commplex-link [ACK] Seq=138337 Ack=1 Win=5888 Len=1448 TSval=1395367 TSecr=901024051
    159 1514          1.262711    76.23.247.139         128.119.245.93        46457    TCP      46457 > commplex-link [ACK] Seq=139785 Ack=1 Win=5888 Len=1448 TSval=1395368 TSecr=901024051
    160 1514          1.263032    76.23.247.139         128.119.245.93        46457    TCP      46457 > commplex-link [ACK] Seq=141233 Ack=1 Win=5888 Len=1448 TSval=1395368 TSecr=901024051
    161 1514          1.263360    76.23.247.139         128.119.245.93        46457    TCP      46457 > commplex-link [ACK] Seq=142681 Ack=1 Win=5888 Len=1448 TSval=1395368 TSecr=901024051
    164 1514          1.276751    76.23.247.139         128.119.245.93        46457    TCP      46457 > commplex-link [ACK] Seq=144129 Ack=1 Win=5888 Len=1448 TSval=1395371 TSecr=901024067
    165 1514          1.277321    76.23.247.139         128.119.245.93        46457    TCP      46457 > commplex-link [ACK] Seq=145577 Ack=1 Win=5888 Len=1448 TSval=1395371 TSecr=901024067
    166 1514          1.278114    76.23.247.139         128.119.245.93        46457    TCP      46457 > commplex-link [ACK] Seq=147025 Ack=1 Win=5888 Len=1448 TSval=1395372 TSecr=901024068
    167 1514          1.278442    76.23.247.139         128.119.245.93        46457    TCP      46457 > commplex-link [ACK] Seq=148473 Ack=1 Win=5888 Len=1448 TSval=1395372 TSecr=901024068
    170 1514          1.287144    76.23.247.139         128.119.245.93        46457    TCP      46457 > commplex-link [ACK] Seq=149921 Ack=1 Win=5888 Len=1448 TSval=1395374 TSecr=901024078
    172 1514          1.287783    76.23.247.139         128.119.245.93        46457    TCP      46457 > commplex-link [ACK] Seq=151369 Ack=1 Win=5888 Len=1448 TSval=1395374 TSecr=901024078
    173 1514          1.288517    76.23.247.139         128.119.245.93        46457    TCP      46457 > commplex-link [ACK] Seq=152817 Ack=1 Win=5888 Len=1448 TSval=1395374 TSecr=901024079
    174 1514          1.288745    76.23.247.139         128.119.245.93        46457    TCP      46457 > commplex-link [ACK] Seq=154265 Ack=1 Win=5888 Len=1448 TSval=1395374 TSecr=901024079
    175 1514          1.289116    76.23.247.139         128.119.245.93        46457    TCP      46457 > commplex-link [ACK] Seq=155713 Ack=1 Win=5888 Len=1448 TSval=1395374 TSecr=901024080
    176 1514          1.289435    76.23.247.139         128.119.245.93        46457    TCP      46457 > commplex-link [ACK] Seq=157161 Ack=1 Win=5888 Len=1448 TSval=1395374 TSecr=901024080
    179 1514          1.307765    76.23.247.139         128.119.245.93        46457    TCP      46457 > commplex-link [ACK] Seq=158609 Ack=1 Win=5888 Len=1448 TSval=1395379 TSecr=901024098
    180 1514          1.308408    76.23.247.139         128.119.245.93        46457    TCP      46457 > commplex-link [ACK] Seq=160057 Ack=1 Win=5888 Len=1448 TSval=1395379 TSecr=901024098
    181 1514          1.308830    76.23.247.139         128.119.245.93        46457    TCP      46457 > commplex-link [ACK] Seq=161505 Ack=1 Win=5888 Len=1448 TSval=1395379 TSecr=901024099
    182 1514          1.309165    76.23.247.139         128.119.245.93        46457    TCP      46457 > commplex-link [ACK] Seq=162953 Ack=1 Win=5888 Len=1448 TSval=1395379 TSecr=901024099
    186 1514          1.325831    76.23.247.139         128.119.245.93        46457    TCP      46457 > commplex-link [ACK] Seq=164401 Ack=1 Win=5888 Len=1448 TSval=1395384 TSecr=901024116
    187 1514          1.326421    76.23.247.139         128.119.245.93        46457    TCP      46457 > commplex-link [ACK] Seq=165849 Ack=1 Win=5888 Len=1448 TSval=1395384 TSecr=901024116
    189 1514          1.326882    76.23.247.139         128.119.245.93        46457    TCP      46457 > commplex-link [ACK] Seq=167297 Ack=1 Win=5888 Len=1448 TSval=1395384 TSecr=901024117
    190 1514          1.327229    76.23.247.139         128.119.245.93        46457    TCP      46457 > commplex-link [ACK] Seq=168745 Ack=1 Win=5888 Len=1448 TSval=1395384 TSecr=901024117
    191 1514          1.328276    76.23.247.139         128.119.245.93        46457    TCP      46457 > commplex-link [ACK] Seq=170193 Ack=1 Win=5888 Len=1448 TSval=1395384 TSecr=901024118
    192 1514          1.328606    76.23.247.139         128.119.245.93        46457    TCP      46457 > commplex-link [ACK] Seq=171641 Ack=1 Win=5888 Len=1448 TSval=1395384 TSecr=901024118
    195 1514          1.341824    76.23.247.139         128.119.245.93        46457    TCP      46457 > commplex-link [ACK] Seq=173089 Ack=1 Win=5888 Len=1448 TSval=1395388 TSecr=901024132
    196 1514          1.342548    76.23.247.139         128.119.245.93        46457    TCP      46457 > commplex-link [ACK] Seq=174537 Ack=1 Win=5888 Len=1448 TSval=1395388 TSecr=901024132
    197 1514          1.343020    76.23.247.139         128.119.245.93        46457    TCP      46457 > commplex-link [ACK] Seq=175985 Ack=1 Win=5888 Len=1448 TSval=1395388 TSecr=901024133
    198 1514          1.343333    76.23.247.139         128.119.245.93        46457    TCP      46457 > commplex-link [ACK] Seq=177433 Ack=1 Win=5888 Len=1448 TSval=1395388 TSecr=901024133
    200 1514          1.362886    76.23.247.139         128.119.245.93        46457    TCP      46457 > commplex-link [ACK] Seq=178881 Ack=1 Win=5888 Len=1448 TSval=1395393 TSecr=901024154
    201 1514          1.363227    76.23.247.139         128.119.245.93        46457    TCP      46457 > commplex-link [PSH, ACK] Seq=180329 Ack=1 Win=5888 Len=1448 TSval=1395393 TSecr=901024154
    202 1514          1.363536    76.23.247.139         128.119.245.93        46457    TCP      46457 > commplex-link [ACK] Seq=181777 Ack=1 Win=5888 Len=1448 TSval=1395393 TSecr=901024154
    207 1514          1.365587    76.23.247.139         128.119.245.93        46457    TCP      46457 > commplex-link [ACK] Seq=183225 Ack=1 Win=5888 Len=1448 TSval=1395393 TSecr=901024154
    208 1514          1.365815    76.23.247.139         128.119.245.93        46457    TCP      46457 > commplex-link [ACK] Seq=184673 Ack=1 Win=5888 Len=1448 TSval=1395393 TSecr=901024154
    209 1514          1.366353    76.23.247.139         128.119.245.93        46457    TCP      46457 > commplex-link [ACK] Seq=186121 Ack=1 Win=5888 Len=1448 TSval=1395394 TSecr=901024155
    210 1514          1.366681    76.23.247.139         128.119.245.93        46457    TCP      46457 > commplex-link [ACK] Seq=187569 Ack=1 Win=5888 Len=1448 TSval=1395394 TSecr=901024155
    211 1514          1.367001    76.23.247.139         128.119.245.93        46457    TCP      46457 > commplex-link [ACK] Seq=189017 Ack=1 Win=5888 Len=1448 TSval=1395394 TSecr=901024155
    212 1514          1.367319    76.23.247.139         128.119.245.93        46457    TCP      46457 > commplex-link [ACK] Seq=190465 Ack=1 Win=5888 Len=1448 TSval=1395394 TSecr=901024155
    213 1514          1.367652    76.23.247.139         128.119.245.93        46457    TCP      46457 > commplex-link [ACK] Seq=191913 Ack=1 Win=5888 Len=1448 TSval=1395394 TSecr=901024155
    214 1514          1.367962    76.23.247.139         128.119.245.93        46457    TCP      46457 > commplex-link [ACK] Seq=193361 Ack=1 Win=5888 Len=1448 TSval=1395394 TSecr=901024155
    218 1514          1.374866    76.23.247.139         128.119.245.93        46457    TCP      46457 > commplex-link [ACK] Seq=194809 Ack=1 Win=5888 Len=1448 TSval=1395396 TSecr=901024165
    219 1514          1.375589    76.23.247.139         128.119.245.93        46457    TCP      46457 > commplex-link [ACK] Seq=196257 Ack=1 Win=5888 Len=1448 TSval=1395396 TSecr=901024165
    222 1514          1.375835    76.23.247.139         128.119.245.93        46457    TCP      46457 > commplex-link [ACK] Seq=197705 Ack=1 Win=5888 Len=1448 TSval=1395396 TSecr=901024166
    223 1514          1.376728    76.23.247.139         128.119.245.93        46457    TCP      46457 > commplex-link [ACK] Seq=199153 Ack=1 Win=5888 Len=1448 TSval=1395396 TSecr=901024166
    224 1514          1.376928    76.23.247.139         128.119.245.93        46457    TCP      46457 > commplex-link [ACK] Seq=200601 Ack=1 Win=5888 Len=1448 TSval=1395396 TSecr=901024167
    225 1514          1.377156    76.23.247.139         128.119.245.93        46457    TCP      46457 > commplex-link [ACK] Seq=202049 Ack=1 Win=5888 Len=1448 TSval=1395396 TSecr=901024167
    226 1514          1.377653    76.23.247.139         128.119.245.93        46457    TCP      46457 > commplex-link [ACK] Seq=203497 Ack=1 Win=5888 Len=1448 TSval=1395396 TSecr=901024168
    227 1514          1.377988    76.23.247.139         128.119.245.93        46457    TCP      46457 > commplex-link [ACK] Seq=204945 Ack=1 Win=5888 Len=1448 TSval=1395396 TSecr=901024168
    228 1514          1.378301    76.23.247.139         128.119.245.93        46457    TCP      46457 > commplex-link [ACK] Seq=206393 Ack=1 Win=5888 Len=1448 TSval=1395396 TSecr=901024168
    229 1514          1.378612    76.23.247.139         128.119.245.93        46457    TCP      46457 > commplex-link [ACK] Seq=207841 Ack=1 Win=5888 Len=1448 TSval=1395396 TSecr=901024168
    233 1514          1.386462    76.23.247.139         128.119.245.93        46457    TCP      46457 > commplex-link [ACK] Seq=209289 Ack=1 Win=5888 Len=1448 TSval=1395399 TSecr=901024177
    235 1514          1.387355    76.23.247.139         128.119.245.93        46457    TCP      46457 > commplex-link [ACK] Seq=210737 Ack=1 Win=5888 Len=1448 TSval=1395399 TSecr=901024177
    236 1514          1.387555    76.23.247.139         128.119.245.93        46457    TCP      46457 > commplex-link [ACK] Seq=212185 Ack=1 Win=5888 Len=1448 TSval=1395399 TSecr=901024178
    237 1514          1.388287    76.23.247.139         128.119.245.93        46457    TCP      46457 > commplex-link [ACK] Seq=213633 Ack=1 Win=5888 Len=1448 TSval=1395399 TSecr=901024178
    238 1514          1.388511    76.23.247.139         128.119.245.93        46457    TCP      46457 > commplex-link [ACK] Seq=215081 Ack=1 Win=5888 Len=1448 TSval=1395399 TSecr=901024178
    239 1514          1.388737    76.23.247.139         128.119.245.93        46457    TCP      46457 > commplex-link [ACK] Seq=216529 Ack=1 Win=5888 Len=1448 TSval=1395399 TSecr=901024178
    240 1514          1.389315    76.23.247.139         128.119.245.93        46457    TCP      46457 > commplex-link [ACK] Seq=217977 Ack=1 Win=5888 Len=1448 TSval=1395399 TSecr=901024179
    241 1514          1.389626    76.23.247.139         128.119.245.93        46457    TCP      46457 > commplex-link [ACK] Seq=219425 Ack=1 Win=5888 Len=1448 TSval=1395399 TSecr=901024179
    242 1514          1.389966    76.23.247.139         128.119.245.93        46457    TCP      46457 > commplex-link [ACK] Seq=220873 Ack=1 Win=5888 Len=1448 TSval=1395399 TSecr=901024179
    244 1514          1.403862    76.23.247.139         128.119.245.93        46457    TCP      46457 > commplex-link [PSH, ACK] Seq=222321 Ack=1 Win=5888 Len=1448 TSval=1395403 TSecr=901024195
    245 1514          1.404189    76.23.247.139         128.119.245.93        46457    TCP      46457 > commplex-link [ACK] Seq=223769 Ack=1 Win=5888 Len=1448 TSval=1395403 TSecr=901024195
    246 1514          1.404519    76.23.247.139         128.119.245.93        46457    TCP      46457 > commplex-link [ACK] Seq=225217 Ack=1 Win=5888 Len=1448 TSval=1395403 TSecr=901024195
    248 1514          1.406792    76.23.247.139         128.119.245.93        46457    TCP      46457 > commplex-link [ACK] Seq=226665 Ack=1 Win=5888 Len=1448 TSval=1395404 TSecr=901024196
    249 1514          1.407114    76.23.247.139         128.119.245.93        46457    TCP      46457 > commplex-link [ACK] Seq=228113 Ack=1 Win=5888 Len=1448 TSval=1395404 TSecr=901024196
    250 1514          1.407445    76.23.247.139         128.119.245.93        46457    TCP      46457 > commplex-link [ACK] Seq=229561 Ack=1 Win=5888 Len=1448 TSval=1395404 TSecr=901024196
    253 1514          1.419387    76.23.247.139         128.119.245.93        46457    TCP      46457 > commplex-link [ACK] Seq=231009 Ack=1 Win=5888 Len=1448 TSval=1395407 TSecr=901024210
    254 1514          1.420037    76.23.247.139         128.119.245.93        46457    TCP      46457 > commplex-link [ACK] Seq=232457 Ack=1 Win=5888 Len=1448 TSval=1395407 TSecr=901024210
    255 1514          1.420255    76.23.247.139         128.119.245.93        46457    TCP      46457 > commplex-link [ACK] Seq=233905 Ack=1 Win=5888 Len=1448 TSval=1395407 TSecr=901024210
    256 1514          1.420655    76.23.247.139         128.119.245.93        46457    TCP      46457 > commplex-link [ACK] Seq=235353 Ack=1 Win=5888 Len=1448 TSval=1395407 TSecr=901024211
    257 1514          1.420847    76.23.247.139         128.119.245.93        46457    TCP      46457 > commplex-link [ACK] Seq=236801 Ack=1 Win=5888 Len=1448 TSval=1395407 TSecr=901024211
    258 1514          1.421229    76.23.247.139         128.119.245.93        46457    TCP      46457 > commplex-link [ACK] Seq=238249 Ack=1 Win=5888 Len=1448 TSval=1395407 TSecr=901024211
    260 1514          1.422899    76.23.247.139         128.119.245.93        46457    TCP      46457 > commplex-link [ACK] Seq=239697 Ack=1 Win=5888 Len=1448 TSval=1395408 TSecr=901024212
    261 1514          1.423225    76.23.247.139         128.119.245.93        46457    TCP      46457 > commplex-link [ACK] Seq=241145 Ack=1 Win=5888 Len=1448 TSval=1395408 TSecr=901024212
    262 1514          1.423544    76.23.247.139         128.119.245.93        46457    TCP      46457 > commplex-link [ACK] Seq=242593 Ack=1 Win=5888 Len=1448 TSval=1395408 TSecr=901024212
    265 1514          1.433997    76.23.247.139         128.119.245.93        46457    TCP      46457 > commplex-link [ACK] Seq=244041 Ack=1 Win=5888 Len=1448 TSval=1395411 TSecr=901024224
    266 1514          1.434198    76.23.247.139         128.119.245.93        46457    TCP      46457 > commplex-link [ACK] Seq=245489 Ack=1 Win=5888 Len=1448 TSval=1395411 TSecr=901024224
    267 1514          1.434556    76.23.247.139         128.119.245.93        46457    TCP      46457 > commplex-link [ACK] Seq=246937 Ack=1 Win=5888 Len=1448 TSval=1395411 TSecr=901024224
    268 1514          1.435107    76.23.247.139         128.119.245.93        46457    TCP      46457 > commplex-link [ACK] Seq=248385 Ack=1 Win=5888 Len=1448 TSval=1395411 TSecr=901024225
    269 1514          1.435424    76.23.247.139         128.119.245.93        46457    TCP      46457 > commplex-link [ACK] Seq=249833 Ack=1 Win=5888 Len=1448 TSval=1395411 TSecr=901024225
    270 1514          1.438687    76.23.247.139         128.119.245.93        46457    TCP      46457 > commplex-link [ACK] Seq=251281 Ack=1 Win=5888 Len=1448 TSval=1395411 TSecr=901024225
    273 1514          1.453464    76.23.247.139         128.119.245.93        46457    TCP      46457 > commplex-link [ACK] Seq=252729 Ack=1 Win=5888 Len=1448 TSval=1395415 TSecr=901024244
    275 1514          1.454104    76.23.247.139         128.119.245.93        46457    TCP      46457 > commplex-link [ACK] Seq=254177 Ack=1 Win=5888 Len=1448 TSval=1395415 TSecr=901024244
    276 1514          1.454362    76.23.247.139         128.119.245.93        46457    TCP      46457 > commplex-link [ACK] Seq=255625 Ack=1 Win=5888 Len=1448 TSval=1395415 TSecr=901024244
    277 1514          1.455081    76.23.247.139         128.119.245.93        46457    TCP      46457 > commplex-link [ACK] Seq=257073 Ack=1 Win=5888 Len=1448 TSval=1395416 TSecr=901024245
    278 1514          1.455280    76.23.247.139         128.119.245.93        46457    TCP      46457 > commplex-link [ACK] Seq=258521 Ack=1 Win=5888 Len=1448 TSval=1395416 TSecr=901024245
    279 1514          1.455507    76.23.247.139         128.119.245.93        46457    TCP      46457 > commplex-link [ACK] Seq=259969 Ack=1 Win=5888 Len=1448 TSval=1395416 TSecr=901024245
    280 1514          1.455877    76.23.247.139         128.119.245.93        46457    TCP      46457 > commplex-link [ACK] Seq=261417 Ack=1 Win=5888 Len=1448 TSval=1395416 TSecr=901024246
    281 1514          1.456189    76.23.247.139         128.119.245.93        46457    TCP      46457 > commplex-link [ACK] Seq=262865 Ack=1 Win=5888 Len=1448 TSval=1395416 TSecr=901024246
    282 1514          1.456513    76.23.247.139         128.119.245.93        46457    TCP      46457 > commplex-link [ACK] Seq=264313 Ack=1 Win=5888 Len=1448 TSval=1395416 TSecr=901024246
    285 1514          1.471504    76.23.247.139         128.119.245.93        46457    TCP      46457 > commplex-link [ACK] Seq=265761 Ack=1 Win=5888 Len=1448 TSval=1395420 TSecr=901024262
    286 1514          1.472195    76.23.247.139         128.119.245.93        46457    TCP      46457 > commplex-link [ACK] Seq=267209 Ack=1 Win=5888 Len=1448 TSval=1395420 TSecr=901024262
    287 1514          1.472427    76.23.247.139         128.119.245.93        46457    TCP      46457 > commplex-link [ACK] Seq=268657 Ack=1 Win=5888 Len=1448 TSval=1395420 TSecr=901024262
    288 1514          1.472652    76.23.247.139         128.119.245.93        46457    TCP      46457 > commplex-link [ACK] Seq=270105 Ack=1 Win=5888 Len=1448 TSval=1395420 TSecr=901024263
    289 1514          1.473040    76.23.247.139         128.119.245.93        46457    TCP      46457 > commplex-link [ACK] Seq=271553 Ack=1 Win=5888 Len=1448 TSval=1395420 TSecr=901024263
    290 1514          1.473271    76.23.247.139         128.119.245.93        46457    TCP      46457 > commplex-link [ACK] Seq=273001 Ack=1 Win=5888 Len=1448 TSval=1395420 TSecr=901024263
    293 1514          1.492970    76.23.247.139         128.119.245.93        46457    TCP      46457 > commplex-link [ACK] Seq=274449 Ack=1 Win=5888 Len=1448 TSval=1395425 TSecr=901024283
    294 1514          1.493289    76.23.247.139         128.119.245.93        46457    TCP      46457 > commplex-link [ACK] Seq=275897 Ack=1 Win=5888 Len=1448 TSval=1395425 TSecr=901024283
    296 1514          1.493837    76.23.247.139         128.119.245.93        46457    TCP      46457 > commplex-link [ACK] Seq=277345 Ack=1 Win=5888 Len=1448 TSval=1395426 TSecr=901024284
    297 1514          1.494178    76.23.247.139         128.119.245.93        46457    TCP      46457 > commplex-link [ACK] Seq=278793 Ack=1 Win=5888 Len=1448 TSval=1395426 TSecr=901024284
    298 1514          1.495240    76.23.247.139         128.119.245.93        46457    TCP      46457 > commplex-link [ACK] Seq=280241 Ack=1 Win=5888 Len=1448 TSval=1395426 TSecr=901024285
    299 1514          1.495570    76.23.247.139         128.119.245.93        46457    TCP      46457 > commplex-link [ACK] Seq=281689 Ack=1 Win=5888 Len=1448 TSval=1395426 TSecr=901024285
    302 1514          1.507074    76.23.247.139         128.119.245.93        46457    TCP      46457 > commplex-link [ACK] Seq=283137 Ack=1 Win=5888 Len=1448 TSval=1395429 TSecr=901024298
    303 1514          1.507307    76.23.247.139         128.119.245.93        46457    TCP      46457 > commplex-link [ACK] Seq=284585 Ack=1 Win=5888 Len=1448 TSval=1395429 TSecr=901024298
    304 1514          1.507824    76.23.247.139         128.119.245.93        46457    TCP      46457 > commplex-link [ACK] Seq=286033 Ack=1 Win=5888 Len=1448 TSval=1395429 TSecr=901024298
    308 1514          1.508158    76.23.247.139         128.119.245.93        46457    TCP      46457 > commplex-link [ACK] Seq=287481 Ack=1 Win=5888 Len=1448 TSval=1395429 TSecr=901024298
    309 1514          1.509936    76.23.247.139         128.119.245.93        46457    TCP      46457 > commplex-link [ACK] Seq=288929 Ack=1 Win=5888 Len=1448 TSval=1395429 TSecr=901024299
    310 1514          1.510252    76.23.247.139         128.119.245.93        46457    TCP      46457 > commplex-link [ACK] Seq=290377 Ack=1 Win=5888 Len=1448 TSval=1395429 TSecr=901024299
    311 1514          1.510582    76.23.247.139         128.119.245.93        46457    TCP      46457 > commplex-link [ACK] Seq=291825 Ack=1 Win=5888 Len=1448 TSval=1395430 TSecr=901024299
    312 1514          1.510909    76.23.247.139         128.119.245.93        46457    TCP      46457 > commplex-link [ACK] Seq=293273 Ack=1 Win=5888 Len=1448 TSval=1395430 TSecr=901024299
    313 1514          1.511229    76.23.247.139         128.119.245.93        46457    TCP      46457 > commplex-link [ACK] Seq=294721 Ack=1 Win=5888 Len=1448 TSval=1395430 TSecr=901024300
    314 1514          1.511546    76.23.247.139         128.119.245.93        46457    TCP      46457 > commplex-link [ACK] Seq=296169 Ack=1 Win=5888 Len=1448 TSval=1395430 TSecr=901024300
    317 1514          1.525130    76.23.247.139         128.119.245.93        46457    TCP      46457 > commplex-link [PSH, ACK] Seq=297617 Ack=1 Win=5888 Len=1448 TSval=1395433 TSecr=901024316
