     20 74            1.818191    76.23.247.139         128.119.245.93        40058    TCP      40058 > commplex-link [SYN] Seq=0 Win=5840 Len=0 MSS=1460 SACK_PERM=1 TSval=1580464 TSecr=0 WS=128
     22 66            1.835396    76.23.247.139         128.119.245.93        40058    TCP      40058 > commplex-link [ACK] Seq=1 Ack=1 Win=5888 Len=0 TSval=1580468 TSecr=901764410
     23 90            1.835656    76.23.247.139         128.119.245.93        40058    TCP      40058 > commplex-link [PSH, ACK] Seq=1 Ack=1 Win=5888 Len=24 TSval=1580468 TSecr=901764410
     24 1514          1.836130    76.23.247.139         128.119.245.93        40058    TCP      40058 > commplex-link [ACK] Seq=25 Ack=1 Win=5888 Len=1448 TSval=1580468 TSecr=901764410
     25 1514          1.836360    76.23.247.139         128.119.245.93        40058    TCP      40058 > commplex-link [ACK] Seq=1473 Ack=1 Win=5888 Len=1448 TSval=1580468 TSecr=901764410
     27 1514          1.851409    76.23.247.139         128.119.245.93        40058    TCP      40058 > commplex-link [PSH, ACK] Seq=2921 Ack=1 Win=5888 Len=1448 TSval=1580472 TSecr=901764426
     28 1514          1.851728    76.23.247.139         128.119.245.93        40058    TCP      40058 > commplex-link [ACK] Seq=4369 Ack=1 Win=5888 Len=1448 TSval=1580472 TSecr=901764426
     31 1514          1.857068    76.23.247.139         128.119.245.93        40058    TCP      40058 > commplex-link [ACK] Seq=5817 Ack=1 Win=5888 Len=1448 TSval=1580474 TSecr=901764431
     32 1514          1.857471    76.23.247.139         128.119.245.93        40058    TCP      40058 > commplex-link [ACK] Seq=7265 Ack=1 Win=5888 Len=1448 TSval=1580474 TSecr=901764431
     33 1514          1.858028    76.23.247.139         128.119.245.93        40058    TCP      40058 > commplex-link [PSH, ACK] Seq=8713 Ack=1 Win=5888 Len=1448 TSval=1580474 TSecr=901764431
     34 1514          1.858788    76.23.247.139         128.119.245.93        40058    TCP      40058 > commplex-link [ACK] Seq=10161 Ack=1 Win=5888 Len=1448 TSval=1580474 TSecr=901764431
     36 1514          1.868615    76.23.247.139         128.119.245.93        40058    TCP      40058 > commplex-link [ACK] Seq=11609 Ack=1 Win=5888 Len=1448 TSval=1580477 TSecr=901764442
     37 1514          1.868929    76.23.247.139         128.119.245.93        40058    TCP      40058 > commplex-link [ACK] Seq=13057 Ack=1 Win=5888 Len=1448 TSval=1580477 TSecr=901764442
     39 1514          1.871609    76.23.247.139         128.119.245.93        40058    TCP      40058 > commplex-link [ACK] Seq=14505 Ack=1 Win=5888 Len=1448 TSval=1580477 TSecr=901764446
     40 1514          1.871924    76.23.247.139         128.119.245.93        40058    TCP      40058 > commplex-link [ACK] Seq=15953 Ack=1 Win=5888 Len=1448 TSval=1580477 TSecr=901764446
     43 1514          1.875705    76.23.247.139         128.119.245.93        40058    TCP      40058 > commplex-link [ACK] Seq=17401 Ack=1 Win=5888 Len=1448 TSval=1580478 TSecr=901764451
     44 1514          1.875920    76.23.247.139         128.119.245.93        40058    TCP      40058 > commplex-link [PSH, ACK] Seq=18849 Ack=1 Win=5888 Len=1448 TSval=1580478 TSecr=901764451
     45 1514          1.876478    76.23.247.139         128.119.245.93        40058    TCP      40058 > commplex-link [ACK] Seq=20297 Ack=1 Win=5888 Len=1448 TSval=1580479 TSecr=901764451
     48 1514          1.876833    76.23.247.139         128.119.245.93        40058    TCP      40058 > commplex-link [ACK] Seq=21745 Ack=1 Win=5888 Len=1448 TSval=1580479 TSecr=901764451
     49 1514          1.877972    76.23.247.139         128.119.245.93        40058    TCP      40058 > commplex-link [ACK] Seq=23193 Ack=1 Win=5888 Len=1448 TSval=1580479 TSecr=901764452
     50 1514          1.879221    76.23.247.139         128.119.245.93        40058    TCP      40058 > commplex-link [ACK] Seq=24641 Ack=1 Win=5888 Len=1448 TSval=1580479 TSecr=901764452
     51 1514          1.879542    76.23.247.139         128.119.245.93        40058    TCP      40058 > commplex-link [ACK] Seq=26089 Ack=1 Win=5888 Len=1448 TSval=1580479 TSecr=901764452
     52 1514          1.879892    76.23.247.139         128.119.245.93        40058    TCP      40058 > commplex-link [ACK] Seq=27537 Ack=1 Win=5888 Len=1448 TSval=1580479 TSecr=901764452
     55 1514          1.892631    76.23.247.139         128.119.245.93        40058    TCP      40058 > commplex-link [ACK] Seq=28985 Ack=1 Win=5888 Len=1448 TSval=1580483 TSecr=901764467
     56 1514          1.892980    76.23.247.139         128.119.245.93        40058    TCP      40058 > commplex-link [ACK] Seq=30433 Ack=1 Win=5888 Len=1448 TSval=1580483 TSecr=901764467
     57 1514          1.893501    76.23.247.139         128.119.245.93        40058    TCP      40058 > commplex-link [ACK] Seq=31881 Ack=1 Win=5888 Len=1448 TSval=1580483 TSecr=901764467
     58 1514          1.893829    76.23.247.139         128.119.245.93        40058    TCP      40058 > commplex-link [ACK] Seq=33329 Ack=1 Win=5888 Len=1448 TSval=1580483 TSecr=901764467
     64 1514          1.896571    76.23.247.139         128.119.245.93        40058    TCP      40058 > commplex-link [PSH, ACK] Seq=34777 Ack=1 Win=5888 Len=1448 TSval=1580484 TSecr=901764471
     65 1514          1.896815    76.23.247.139         128.119.245.93        40058    TCP      40058 > commplex-link [ACK] Seq=36225 Ack=1 Win=5888 Len=1448 TSval=1580484 TSecr=901764471
     66 1514          1.897834    76.23.247.139         128.119.245.93        40058    TCP      40058 > commplex-link [ACK] Seq=37673 Ack=1 Win=5888 Len=1448 TSval=1580484 TSecr=901764471
     67 1514          1.898065    76.23.247.139         128.119.245.93        40058    TCP      40058 > commplex-link [ACK] Seq=39121 Ack=1 Win=5888 Len=1448 TSval=1580484 TSecr=901764471
     68 1514          1.898299    76.23.247.139         128.119.245.93        40058    TCP      40058 > commplex-link [ACK] Seq=40569 Ack=1 Win=5888 Len=1448 TSval=1580484 TSecr=901764472
     69 1514          1.898687    76.23.247.139         128.119.245.93        40058    TCP      40058 > commplex-link [ACK] Seq=42017 Ack=1 Win=5888 Len=1448 TSval=1580484 TSecr=901764472
     70 1514          1.899264    76.23.247.139         128.119.245.93        40058    TCP      40058 > commplex-link [ACK] Seq=43465 Ack=1 Win=5888 Len=1448 TSval=1580484 TSecr=901764472
     71 1514          1.899597    76.23.247.139         128.119.245.93        40058    TCP      40058 > commplex-link [ACK] Seq=44913 Ack=1 Win=5888 Len=1448 TSval=1580484 TSecr=901764472
     72 1514          1.901535    76.23.247.139         128.119.245.93        40058    TCP      40058 > commplex-link [ACK] Seq=46361 Ack=1 Win=5888 Len=1448 TSval=1580484 TSecr=901764472
     73 1514          1.901934    76.23.247.139         128.119.245.93        40058    TCP      40058 > commplex-link [ACK] Seq=47809 Ack=1 Win=5888 Len=1448 TSval=1580484 TSecr=901764472
     77 1514          1.914157    76.23.247.139         128.119.245.93        40058    TCP      40058 > commplex-link [ACK] Seq=49257 Ack=1 Win=5888 Len=1448 TSval=1580488 TSecr=901764489
     80 1514          1.915024    76.23.247.139         128.119.245.93        40058    TCP      40058 > commplex-link [ACK] Seq=50705 Ack=1 Win=5888 Len=1448 TSval=1580488 TSecr=901764489
     81 1514          1.916004    76.23.247.139         128.119.245.93        40058    TCP      40058 > commplex-link [ACK] Seq=52153 Ack=1 Win=5888 Len=1448 TSval=1580488 TSecr=901764490
     82 1514          1.916236    76.23.247.139         128.119.245.93        40058    TCP      40058 > commplex-link [ACK] Seq=53601 Ack=1 Win=5888 Len=1448 TSval=1580488 TSecr=901764490
     83 1514          1.916459    76.23.247.139         128.119.245.93        40058    TCP      40058 > commplex-link [PSH, ACK] Seq=55049 Ack=1 Win=5888 Len=1448 TSval=1580488 TSecr=901764490
     84 938           1.916574    76.23.247.139         128.119.245.93        40058    TCP      40058 > commplex-link [PSH, ACK] Seq=56497 Ack=1 Win=5888 Len=872 TSval=1580488 TSecr=901764490
     85 1514          1.917080    76.23.247.139         128.119.245.93        40058    TCP      40058 > commplex-link [ACK] Seq=57369 Ack=1 Win=5888 Len=1448 TSval=1580489 TSecr=901764491
     86 1514          1.917468    76.23.247.139         128.119.245.93        40058    TCP      40058 > commplex-link [ACK] Seq=58817 Ack=1 Win=5888 Len=1448 TSval=1580489 TSecr=901764491
     87 1514          1.917683    76.23.247.139         128.119.245.93        40058    TCP      40058 > commplex-link [ACK] Seq=60265 Ack=1 Win=5888 Len=1448 TSval=1580489 TSecr=901764491
     88 1514          1.918052    76.23.247.139         128.119.245.93        40058    TCP      40058 > commplex-link [ACK] Seq=61713 Ack=1 Win=5888 Len=1448 TSval=1580489 TSecr=901764491
     91 1514          1.931786    76.23.247.139         128.119.245.93        40058    TCP      40058 > commplex-link [ACK] Seq=63161 Ack=1 Win=5888 Len=1448 TSval=1580492 TSecr=901764507
     93 1514          1.931993    76.23.247.139         128.119.245.93        40058    TCP      40058 > commplex-link [ACK] Seq=64609 Ack=1 Win=5888 Len=1448 TSval=1580492 TSecr=901764507
     96 1514          1.932724    76.23.247.139         128.119.245.93        40058    TCP      40058 > commplex-link [ACK] Seq=66057 Ack=1 Win=5888 Len=1448 TSval=1580493 TSecr=901764507
     97 1514          1.932958    76.23.247.139         128.119.245.93        40058    TCP      40058 > commplex-link [ACK] Seq=67505 Ack=1 Win=5888 Len=1448 TSval=1580493 TSecr=901764507
     98 1514          1.933870    76.23.247.139         128.119.245.93        40058    TCP      40058 > commplex-link [ACK] Seq=68953 Ack=1 Win=5888 Len=1448 TSval=1580493 TSecr=901764508
     99 1514          1.934093    76.23.247.139         128.119.245.93        40058    TCP      40058 > commplex-link [ACK] Seq=70401 Ack=1 Win=5888 Len=1448 TSval=1580493 TSecr=901764508
    100 1514          1.934513    76.23.247.139         128.119.245.93        40058    TCP      40058 > commplex-link [ACK] Seq=71849 Ack=1 Win=5888 Len=1448 TSval=1580493 TSecr=901764508
    101 1514          1.934833    76.23.247.139         128.119.245.93        40058    TCP      40058 > commplex-link [ACK] Seq=73297 Ack=1 Win=5888 Len=1448 TSval=1580493 TSecr=901764508
    102 1514          1.935167    76.23.247.139         128.119.245.93        40058    TCP      40058 > commplex-link [ACK] Seq=74745 Ack=1 Win=5888 Len=1448 TSval=1580493 TSecr=901764508
    103 1514          1.935430    76.23.247.139         128.119.245.93        40058    TCP      40058 > commplex-link [ACK] Seq=76193 Ack=1 Win=5888 Len=1448 TSval=1580493 TSecr=901764508
    106 1514          1.951675    76.23.247.139         128.119.245.93        40058    TCP      40058 > commplex-link [ACK] Seq=77641 Ack=1 Win=5888 Len=1448 TSval=1580497 TSecr=901764523
    107 1514          1.952007    76.23.247.139         128.119.245.93        40058    TCP      40058 > commplex-link [ACK] Seq=79089 Ack=1 Win=5888 Len=1448 TSval=1580497 TSecr=901764523
    108 1514          1.952338    76.23.247.139         128.119.245.93        40058    TCP      40058 > commplex-link [ACK] Seq=80537 Ack=1 Win=5888 Len=1448 TSval=1580497 TSecr=901764523
    109 1514          1.954046    76.23.247.139         128.119.245.93        40058    TCP      40058 > commplex-link [ACK] Seq=81985 Ack=1 Win=5888 Len=1448 TSval=1580497 TSecr=901764524
    110 1514          1.954371    76.23.247.139         128.119.245.93        40058    TCP      40058 > commplex-link [PSH, ACK] Seq=83433 Ack=1 Win=5888 Len=1448 TSval=1580497 TSecr=901764524
    111 1514          1.954698    76.23.247.139         128.119.245.93        40058    TCP      40058 > commplex-link [ACK] Seq=84881 Ack=1 Win=5888 Len=1448 TSval=1580497 TSecr=901764524
    115 1514          1.969237    76.23.247.139         128.119.245.93        40058    TCP      40058 > commplex-link [ACK] Seq=86329 Ack=1 Win=5888 Len=1448 TSval=1580502 TSecr=901764543
    116 1514          1.969917    76.23.247.139         128.119.245.93        40058    TCP      40058 > commplex-link [ACK] Seq=87777 Ack=1 Win=5888 Len=1448 TSval=1580502 TSecr=901764543
    117 1514          1.970145    76.23.247.139         128.119.245.93        40058    TCP      40058 > commplex-link [ACK] Seq=89225 Ack=1 Win=5888 Len=1448 TSval=1580502 TSecr=901764543
    118 1514          1.970528    76.23.247.139         128.119.245.93        40058    TCP      40058 > commplex-link [ACK] Seq=90673 Ack=1 Win=5888 Len=1448 TSval=1580502 TSecr=901764544
    119 1514          1.970878    76.23.247.139         128.119.245.93        40058    TCP      40058 > commplex-link [ACK] Seq=92121 Ack=1 Win=5888 Len=1448 TSval=1580502 TSecr=901764544
    120 1514          1.971204    76.23.247.139         128.119.245.93        40058    TCP      40058 > commplex-link [ACK] Seq=93569 Ack=1 Win=5888 Len=1448 TSval=1580502 TSecr=901764544
    121 1514          1.971535    76.23.247.139         128.119.245.93        40058    TCP      40058 > commplex-link [ACK] Seq=95017 Ack=1 Win=5888 Len=1448 TSval=1580502 TSecr=901764545
    122 1514          1.971867    76.23.247.139         128.119.245.93        40058    TCP      40058 > commplex-link [ACK] Seq=96465 Ack=1 Win=5888 Len=1448 TSval=1580502 TSecr=901764545
    123 1514          1.972191    76.23.247.139         128.119.245.93        40058    TCP      40058 > commplex-link [ACK] Seq=97913 Ack=1 Win=5888 Len=1448 TSval=1580502 TSecr=901764545
    127 1514          1.981273    76.23.247.139         128.119.245.93        40058    TCP      40058 > commplex-link [ACK] Seq=99361 Ack=1 Win=5888 Len=1448 TSval=1580505 TSecr=901764556
    128 1514          1.982141    76.23.247.139         128.119.245.93        40058    TCP      40058 > commplex-link [ACK] Seq=100809 Ack=1 Win=5888 Len=1448 TSval=1580505 TSecr=901764556
    129 1514          1.982373    76.23.247.139         128.119.245.93        40058    TCP      40058 > commplex-link [ACK] Seq=102257 Ack=1 Win=5888 Len=1448 TSval=1580505 TSecr=901764556
    130 1514          1.982627    76.23.247.139         128.119.245.93        40058    TCP      40058 > commplex-link [ACK] Seq=103705 Ack=1 Win=5888 Len=1448 TSval=1580505 TSecr=901764557
    131 1514          1.982830    76.23.247.139         128.119.245.93        40058    TCP      40058 > commplex-link [ACK] Seq=105153 Ack=1 Win=5888 Len=1448 TSval=1580505 TSecr=901764557
    132 1514          1.983270    76.23.247.139         128.119.245.93        40058    TCP      40058 > commplex-link [ACK] Seq=106601 Ack=1 Win=5888 Len=1448 TSval=1580505 TSecr=901764557
    133 1514          1.983585    76.23.247.139         128.119.245.93        40058    TCP      40058 > commplex-link [ACK] Seq=108049 Ack=1 Win=5888 Len=1448 TSval=1580505 TSecr=901764557
    134 1514          1.983893    76.23.247.139         128.119.245.93        40058    TCP      40058 > commplex-link [ACK] Seq=109497 Ack=1 Win=5888 Len=1448 TSval=1580505 TSecr=901764557
    136 1514          1.998780    76.23.247.139         128.119.245.93        40058    TCP      40058 > commplex-link [ACK] Seq=110945 Ack=1 Win=5888 Len=1448 TSval=1580509 TSecr=901764573
    137 1514          1.999111    76.23.247.139         128.119.245.93        40058    TCP      40058 > commplex-link [ACK] Seq=112393 Ack=1 Win=5888 Len=1448 TSval=1580509 TSecr=901764573
    138 1514          1.999429    76.23.247.139         128.119.245.93        40058    TCP      40058 > commplex-link [ACK] Seq=113841 Ack=1 Win=5888 Len=1448 TSval=1580509 TSecr=901764573
    140 1514          2.001139    76.23.247.139         128.119.245.93        40058    TCP      40058 > commplex-link [ACK] Seq=115289 Ack=1 Win=5888 Len=1448 TSval=1580510 TSecr=901764574
    141 1514          2.001466    76.23.247.139         128.119.245.93        40058    TCP      40058 > commplex-link [ACK] Seq=116737 Ack=1 Win=5888 Len=1448 TSval=1580510 TSecr=901764574
    142 1514          2.001781    76.23.247.139         128.119.245.93        40058    TCP      40058 > commplex-link [ACK] Seq=118185 Ack=1 Win=5888 Len=1448 TSval=1580510 TSecr=901764574
    145 1514          2.015880    76.23.247.139         128.119.245.93        40058    TCP      40058 > commplex-link [ACK] Seq=119633 Ack=1 Win=5888 Len=1448 TSval=1580513 TSecr=901764590
    146 1514          2.016094    76.23.247.139         128.119.245.93        40058    TCP      40058 > commplex-link [ACK] Seq=121081 Ack=1 Win=5888 Len=1448 TSval=1580513 TSecr=901764590
    147 1514          2.016416    76.23.247.139         128.119.245.93        40058    TCP      40058 > commplex-link [PSH, ACK] Seq=122529 Ack=1 Win=5888 Len=1448 TSval=1580513 TSecr=901764590
    149 1514          2.017468    76.23.247.139         128.119.245.93        40058    TCP      40058 > commplex-link [ACK] Seq=123977 Ack=1 Win=5888 Len=1448 TSval=1580514 TSecr=901764591
    150 1514          2.017667    76.23.247.139         128.119.245.93        40058    TCP      40058 > commplex-link [ACK] Seq=125425 Ack=1 Win=5888 Len=1448 TSval=1580514 TSecr=901764591
    151 1514          2.017904    76.23.247.139         128.119.245.93        40058    TCP      40058 > commplex-link [ACK] Seq=126873 Ack=1 Win=5888 Len=1448 TSval=1580514 TSecr=901764591
    152 1514          2.018356    76.23.247.139         128.119.245.93        40058    TCP      40058 > commplex-link [ACK] Seq=128321 Ack=1 Win=5888 Len=1448 TSval=1580514 TSecr=901764592
    153 1514          2.018581    76.23.247.139         128.119.245.93        40058    TCP      40058 > commplex-link [ACK] Seq=129769 Ack=1 Win=5888 Len=1448 TSval=1580514 TSecr=901764592
    154 1514          2.018902    76.23.247.139         128.119.245.93        40058    TCP      40058 > commplex-link [ACK] Seq=131217 Ack=1 Win=5888 Len=1448 TSval=1580514 TSecr=901764592
    157 1514          2.028350    76.23.247.139         128.119.245.93        40058    TCP      40058 > commplex-link [ACK] Seq=132665 Ack=1 Win=5888 Len=1448 TSval=1580517 TSecr=901764603
    158 1514          2.029023    76.23.247.139         128.119.245.93        40058    TCP      40058 > commplex-link [ACK] Seq=134113 Ack=1 Win=5888 Len=1448 TSval=1580517 TSecr=901764603
    159 1514          2.029242    76.23.247.139         128.119.245.93        40058    TCP      40058 > commplex-link [ACK] Seq=135561 Ack=1 Win=5888 Len=1448 TSval=1580517 TSecr=901764603
    160 1514          2.029638    76.23.247.139         128.119.245.93        40058    TCP      40058 > commplex-link [ACK] Seq=137009 Ack=1 Win=5888 Len=1448 TSval=1580517 TSecr=901764604
    161 1514          2.029852    76.23.247.139         128.119.245.93        40058    TCP      40058 > commplex-link [ACK] Seq=138457 Ack=1 Win=5888 Len=1448 TSval=1580517 TSecr=901764604
    162 1514          2.030195    76.23.247.139         128.119.245.93        40058    TCP      40058 > commplex-link [ACK] Seq=139905 Ack=1 Win=5888 Len=1448 TSval=1580517 TSecr=901764604
    164 1514          2.043328    76.23.247.139         128.119.245.93        40058    TCP      40058 > commplex-link [ACK] Seq=141353 Ack=1 Win=5888 Len=1448 TSval=1580520 TSecr=901764618
    165 1514          2.043654    76.23.247.139         128.119.245.93        40058    TCP      40058 > commplex-link [ACK] Seq=142801 Ack=1 Win=5888 Len=1448 TSval=1580520 TSecr=901764618
    168 1514          2.045416    76.23.247.139         128.119.245.93        40058    TCP      40058 > commplex-link [ACK] Seq=144249 Ack=1 Win=5888 Len=1448 TSval=1580521 TSecr=901764620
    169 1514          2.046071    76.23.247.139         128.119.245.93        40058    TCP      40058 > commplex-link [ACK] Seq=145697 Ack=1 Win=5888 Len=1448 TSval=1580521 TSecr=901764620
    170 1514          2.046533    76.23.247.139         128.119.245.93        40058    TCP      40058 > commplex-link [ACK] Seq=147145 Ack=1 Win=5888 Len=1448 TSval=1580521 TSecr=901764620
    171 1514          2.046855    76.23.247.139         128.119.245.93        40058    TCP      40058 > commplex-link [ACK] Seq=148593 Ack=1 Win=5888 Len=1448 TSval=1580521 TSecr=901764620
    174 1514          2.056373    76.23.247.139         128.119.245.93        40058    TCP      40058 > commplex-link [ACK] Seq=150041 Ack=1 Win=5888 Len=1448 TSval=1580524 TSecr=901764631
    175 1514          2.057005    76.23.247.139         128.119.245.93        40058    TCP      40058 > commplex-link [ACK] Seq=151489 Ack=1 Win=5888 Len=1448 TSval=1580524 TSecr=901764631
    176 1514          2.057477    76.23.247.139         128.119.245.93        40058    TCP      40058 > commplex-link [ACK] Seq=152937 Ack=1 Win=5888 Len=1448 TSval=1580524 TSecr=901764632
    177 1514          2.057807    76.23.247.139         128.119.245.93        40058    TCP      40058 > commplex-link [ACK] Seq=154385 Ack=1 Win=5888 Len=1448 TSval=1580524 TSecr=901764632
    181 1514          2.072878    76.23.247.139         128.119.245.93        40058    TCP      40058 > commplex-link [ACK] Seq=155833 Ack=1 Win=5888 Len=1448 TSval=1580528 TSecr=901764647
    183 1514          2.073511    76.23.247.139         128.119.245.93        40058    TCP      40058 > commplex-link [ACK] Seq=157281 Ack=1 Win=5888 Len=1448 TSval=1580528 TSecr=901764647
    184 1514          2.074278    76.23.247.139         128.119.245.93        40058    TCP      40058 > commplex-link [ACK] Seq=158729 Ack=1 Win=5888 Len=1448 TSval=1580528 TSecr=901764649
    185 1514          2.074511    76.23.247.139         128.119.245.93        40058    TCP      40058 > commplex-link [ACK] Seq=160177 Ack=1 Win=5888 Len=1448 TSval=1580528 TSecr=901764649
    186 1514          2.074894    76.23.247.139         128.119.245.93        40058    TCP      40058 > commplex-link [ACK] Seq=161625 Ack=1 Win=5888 Len=1448 TSval=1580528 TSecr=901764649
    187 1514          2.075237    76.23.247.139         128.119.245.93        40058    TCP      40058 > commplex-link [ACK] Seq=163073 Ack=1 Win=5888 Len=1448 TSval=1580528 TSecr=901764649
    191 1514          2.095541    76.23.247.139         128.119.245.93        40058    TCP      40058 > commplex-link [ACK] Seq=164521 Ack=1 Win=5888 Len=1448 TSval=1580533 TSecr=901764670
    192 1514          2.095767    76.23.247.139         128.119.245.93        40058    TCP      40058 > commplex-link [ACK] Seq=165969 Ack=1 Win=5888 Len=1448 TSval=1580533 TSecr=901764670
    195 1514          2.096494    76.23.247.139         128.119.245.93        40058    TCP      40058 > commplex-link [ACK] Seq=167417 Ack=1 Win=5888 Len=1448 TSval=1580534 TSecr=901764671
    196 1514          2.096729    76.23.247.139         128.119.245.93        40058    TCP      40058 > commplex-link [ACK] Seq=168865 Ack=1 Win=5888 Len=1448 TSval=1580534 TSecr=901764671
    197 1514          2.097731    76.23.247.139         128.119.245.93        40058    TCP      40058 > commplex-link [ACK] Seq=170313 Ack=1 Win=5888 Len=1448 TSval=1580534 TSecr=901764671
    198 1514          2.097967    76.23.247.139         128.119.245.93        40058    TCP      40058 > commplex-link [ACK] Seq=171761 Ack=1 Win=5888 Len=1448 TSval=1580534 TSecr=901764671
    199 1514          2.099081    76.23.247.139         128.119.245.93        40058    TCP      40058 > commplex-link [ACK] Seq=173209 Ack=1 Win=5888 Len=1448 TSval=1580534 TSecr=901764672
    200 1514          2.099419    76.23.247.139         128.119.245.93        40058    TCP      40058 > commplex-link [ACK] Seq=174657 Ack=1 Win=5888 Len=1448 TSval=1580534 TSecr=901764672
    201 1514          2.099739    76.23.247.139         128.119.245.93        40058    TCP      40058 > commplex-link [ACK] Seq=176105 Ack=1 Win=5888 Len=1448 TSval=1580534 TSecr=901764672
    202 1514          2.100057    76.23.247.139         128.119.245.93        40058    TCP      40058 > commplex-link [PSH, ACK] Seq=177553 Ack=1 Win=5888 Len=1448 TSval=1580534 TSecr=901764672
    207 1514          2.107175    76.23.247.139         128.119.245.93        40058    TCP      40058 > commplex-link [ACK] Seq=179001 Ack=1 Win=5888 Len=1448 TSval=1580536 TSecr=901764681
    208 1514          2.107471    76.23.247.139         128.119.245.93        40058    TCP      40058 > commplex-link [ACK] Seq=180449 Ack=1 Win=5888 Len=1448 TSval=1580536 TSecr=901764681
    209 1514          2.107723    76.23.247.139         128.119.245.93        40058    TCP      40058 > commplex-link [ACK] Seq=181897 Ack=1 Win=5888 Len=1448 TSval=1580536 TSecr=901764681
    210 1514          2.107926    76.23.247.139         128.119.245.93        40058    TCP      40058 > commplex-link [ACK] Seq=183345 Ack=1 Win=5888 Len=1448 TSval=1580536 TSecr=901764681
    211 1514          2.108718    76.23.247.139         128.119.245.93        40058    TCP      40058 > commplex-link [ACK] Seq=184793 Ack=1 Win=5888 Len=1448 TSval=1580537 TSecr=901764682
    212 1514          2.109035    76.23.247.139         128.119.245.93        40058    TCP      40058 > commplex-link [ACK] Seq=186241 Ack=1 Win=5888 Len=1448 TSval=1580537 TSecr=901764682
    213 1514          2.109364    76.23.247.139         128.119.245.93        40058    TCP      40058 > commplex-link [ACK] Seq=187689 Ack=1 Win=5888 Len=1448 TSval=1580537 TSecr=901764682
    214 1514          2.109689    76.23.247.139         128.119.245.93        40058    TCP      40058 > commplex-link [ACK] Seq=189137 Ack=1 Win=5888 Len=1448 TSval=1580537 TSecr=901764682
    215 1514          2.110017    76.23.247.139         128.119.245.93        40058    TCP      40058 > commplex-link [ACK] Seq=190585 Ack=1 Win=5888 Len=1448 TSval=1580537 TSecr=901764682
    218 1514          2.123940    76.23.247.139         128.119.245.93        40058    TCP      40058 > commplex-link [ACK] Seq=192033 Ack=1 Win=5888 Len=1448 TSval=1580540 TSecr=901764699
    219 1514          2.124270    76.23.247.139         128.119.245.93        40058    TCP      40058 > commplex-link [ACK] Seq=193481 Ack=1 Win=5888 Len=1448 TSval=1580540 TSecr=901764699
    220 1514          2.124588    76.23.247.139         128.119.245.93        40058    TCP      40058 > commplex-link [ACK] Seq=194929 Ack=1 Win=5888 Len=1448 TSval=1580540 TSecr=901764699
    222 1514          2.126331    76.23.247.139         128.119.245.93        40058    TCP      40058 > commplex-link [ACK] Seq=196377 Ack=1 Win=5888 Len=1448 TSval=1580541 TSecr=901764700
    223 1514          2.126648    76.23.247.139         128.119.245.93        40058    TCP      40058 > commplex-link [ACK] Seq=197825 Ack=1 Win=5888 Len=1448 TSval=1580541 TSecr=901764700
    224 1514          2.126977    76.23.247.139         128.119.245.93        40058    TCP      40058 > commplex-link [ACK] Seq=199273 Ack=1 Win=5888 Len=1448 TSval=1580541 TSecr=901764700
    228 1514          2.138967    76.23.247.139         128.119.245.93        40058    TCP      40058 > commplex-link [ACK] Seq=200721 Ack=1 Win=5888 Len=1448 TSval=1580544 TSecr=901764714
    229 1514          2.139594    76.23.247.139         128.119.245.93        40058    TCP      40058 > commplex-link [ACK] Seq=202169 Ack=1 Win=5888 Len=1448 TSval=1580544 TSecr=901764714
    230 1514          2.139819    76.23.247.139         128.119.245.93        40058    TCP      40058 > commplex-link [ACK] Seq=203617 Ack=1 Win=5888 Len=1448 TSval=1580544 TSecr=901764714
    231 1514          2.140224    76.23.247.139         128.119.245.93        40058    TCP      40058 > commplex-link [ACK] Seq=205065 Ack=1 Win=5888 Len=1448 TSval=1580545 TSecr=901764715
    233 1514          2.140421    76.23.247.139         128.119.245.93        40058    TCP      40058 > commplex-link [ACK] Seq=206513 Ack=1 Win=5888 Len=1448 TSval=1580545 TSecr=901764715
    234 1514          2.141108    76.23.247.139         128.119.245.93        40058    TCP      40058 > commplex-link [ACK] Seq=207961 Ack=1 Win=5888 Len=1448 TSval=1580545 TSecr=901764715
    235 1514          2.141581    76.23.247.139         128.119.245.93        40058    TCP      40058 > commplex-link [ACK] Seq=209409 Ack=1 Win=5888 Len=1448 TSval=1580545 TSecr=901764716
    236 1514          2.141902    76.23.247.139         128.119.245.93        40058    TCP      40058 > commplex-link [ACK] Seq=210857 Ack=1 Win=5888 Len=1448 TSval=1580545 TSecr=901764716
    237 1514          2.142228    76.23.247.139         128.119.245.93        40058    TCP      40058 > commplex-link [ACK] Seq=212305 Ack=1 Win=5888 Len=1448 TSval=1580545 TSecr=901764716
    240 1514          2.156535    76.23.247.139         128.119.245.93        40058    TCP      40058 > commplex-link [ACK] Seq=213753 Ack=1 Win=5888 Len=1448 TSval=1580549 TSecr=901764731
    241 1514          2.157178    76.23.247.139         128.119.245.93        40058    TCP      40058 > commplex-link [ACK] Seq=215201 Ack=1 Win=5888 Len=1448 TSval=1580549 TSecr=901764731
    242 1514          2.157482    76.23.247.139         128.119.245.93        40058    TCP      40058 > commplex-link [ACK] Seq=216649 Ack=1 Win=5888 Len=1448 TSval=1580549 TSecr=901764731
    243 1514          2.158614    76.23.247.139         128.119.245.93        40058    TCP      40058 > commplex-link [ACK] Seq=218097 Ack=1 Win=5888 Len=1448 TSval=1580549 TSecr=901764732
    244 1514          2.158933    76.23.247.139         128.119.245.93        40058    TCP      40058 > commplex-link [PSH, ACK] Seq=219545 Ack=1 Win=5888 Len=1448 TSval=1580549 TSecr=901764732
    245 282           2.158957    76.23.247.139         128.119.245.93        40058    TCP      40058 > commplex-link [PSH, ACK] Seq=220993 Ack=1 Win=5888 Len=216 TSval=1580549 TSecr=901764732
    247 1514          2.171582    76.23.247.139         128.119.245.93        40058    TCP      40058 > commplex-link [ACK] Seq=221209 Ack=1 Win=5888 Len=1448 TSval=1580552 TSecr=901764747
    248 1514          2.171907    76.23.247.139         128.119.245.93        40058    TCP      40058 > commplex-link [ACK] Seq=222657 Ack=1 Win=5888 Len=1448 TSval=1580552 TSecr=901764747
    251 1514          2.173622    76.23.247.139         128.119.245.93        40058    TCP      40058 > commplex-link [ACK] Seq=224105 Ack=1 Win=5888 Len=1448 TSval=1580553 TSecr=901764748
    252 1514          2.173942    76.23.247.139         128.119.245.93        40058    TCP      40058 > commplex-link [ACK] Seq=225553 Ack=1 Win=5888 Len=1448 TSval=1580553 TSecr=901764748
    253 1514          2.174511    76.23.247.139         128.119.245.93        40058    TCP      40058 > commplex-link [ACK] Seq=227001 Ack=1 Win=5888 Len=1448 TSval=1580553 TSecr=901764748
    254 1514          2.174833    76.23.247.139         128.119.245.93        40058    TCP      40058 > commplex-link [ACK] Seq=228449 Ack=1 Win=5888 Len=1448 TSval=1580553 TSecr=901764748
    257 1514          2.186585    76.23.247.139         128.119.245.93        40058    TCP      40058 > commplex-link [ACK] Seq=229897 Ack=1 Win=5888 Len=1448 TSval=1580556 TSecr=901764761
    258 1514          2.187303    76.23.247.139         128.119.245.93        40058    TCP      40058 > commplex-link [ACK] Seq=231345 Ack=1 Win=5888 Len=1448 TSval=1580556 TSecr=901764761
    259 1514          2.187722    76.23.247.139         128.119.245.93        40058    TCP      40058 > commplex-link [ACK] Seq=232793 Ack=1 Win=5888 Len=1448 TSval=1580556 TSecr=901764763
    260 1514          2.188043    76.23.247.139         128.119.245.93        40058    TCP      40058 > commplex-link [ACK] Seq=234241 Ack=1 Win=5888 Len=1448 TSval=1580556 TSecr=901764763
    262 1514          2.205600    76.23.247.139         128.119.245.93        40058    TCP      40058 > commplex-link [ACK] Seq=235689 Ack=1 Win=5888 Len=1448 TSval=1580561 TSecr=901764781
    263 1514          2.205911    76.23.247.139         128.119.245.93        40058    TCP      40058 > commplex-link [ACK] Seq=237137 Ack=1 Win=5888 Len=1448 TSval=1580561 TSecr=901764781
    266 1514          2.209004    76.23.247.139         128.119.245.93        40058    TCP      40058 > commplex-link [ACK] Seq=238585 Ack=1 Win=5888 Len=1448 TSval=1580562 TSecr=901764782
    267 1514          2.209306    76.23.247.139         128.119.245.93        40058    TCP      40058 > commplex-link [ACK] Seq=240033 Ack=1 Win=5888 Len=1448 TSval=1580562 TSecr=901764782
    268 1514          2.209636    76.23.247.139         128.119.245.93        40058    TCP      40058 > commplex-link [ACK] Seq=241481 Ack=1 Win=5888 Len=1448 TSval=1580562 TSecr=901764782
    269 1514          2.209962    76.23.247.139         128.119.245.93        40058    TCP      40058 > commplex-link [ACK] Seq=242929 Ack=1 Win=5888 Len=1448 TSval=1580562 TSecr=901764782
    272 1514          2.223131    76.23.247.139         128.119.245.93        40058    TCP      40058 > commplex-link [ACK] Seq=244377 Ack=1 Win=5888 Len=1448 TSval=1580565 TSecr=901764797
    273 1514          2.223452    76.23.247.139         128.119.245.93        40058    TCP      40058 > commplex-link [ACK] Seq=245825 Ack=1 Win=5888 Len=1448 TSval=1580565 TSecr=901764797
    274 1514          2.224005    76.23.247.139         128.119.245.93        40058    TCP      40058 > commplex-link [ACK] Seq=247273 Ack=1 Win=5888 Len=1448 TSval=1580565 TSecr=901764798
    275 1514          2.224326    76.23.247.139         128.119.245.93        40058    TCP      40058 > commplex-link [ACK] Seq=248721 Ack=1 Win=5888 Len=1448 TSval=1580565 TSecr=901764798
    278 1514          2.240162    76.23.247.139         128.119.245.93        40058    TCP      40058 > commplex-link [ACK] Seq=250169 Ack=1 Win=5888 Len=1448 TSval=1580570 TSecr=901764815
    279 1514          2.240484    76.23.247.139         128.119.245.93        40058    TCP      40058 > commplex-link [ACK] Seq=251617 Ack=1 Win=5888 Len=1448 TSval=1580570 TSecr=901764815
    280 1514          2.240810    76.23.247.139         128.119.245.93        40058    TCP      40058 > commplex-link [ACK] Seq=253065 Ack=1 Win=5888 Len=1448 TSval=1580570 TSecr=901764815
    281 1514          2.241372    76.23.247.139         128.119.245.93        40058    TCP      40058 > commplex-link [ACK] Seq=254513 Ack=1 Win=5888 Len=1448 TSval=1580570 TSecr=901764815
    282 1514          2.241694    76.23.247.139         128.119.245.93        40058    TCP      40058 > commplex-link [ACK] Seq=255961 Ack=1 Win=5888 Len=1448 TSval=1580570 TSecr=901764815
    286 1514          2.243052    76.23.247.139         128.119.245.93        40058    TCP      40058 > commplex-link [ACK] Seq=257409 Ack=1 Win=5888 Len=1448 TSval=1580570 TSecr=901764817
    287 1514          2.243934    76.23.247.139         128.119.245.93        40058    TCP      40058 > commplex-link [ACK] Seq=258857 Ack=1 Win=5888 Len=1448 TSval=1580570 TSecr=901764817
    288 1514          2.244430    76.23.247.139         128.119.245.93        40058    TCP      40058 > commplex-link [ACK] Seq=260305 Ack=1 Win=5888 Len=1448 TSval=1580571 TSecr=901764818
    289 1514          2.244758    76.23.247.139         128.119.245.93        40058    TCP      40058 > commplex-link [ACK] Seq=261753 Ack=1 Win=5888 Len=1448 TSval=1580571 TSecr=901764818
    290 1514          2.245081    76.23.247.139         128.119.245.93        40058    TCP      40058 > commplex-link [ACK] Seq=263201 Ack=1 Win=5888 Len=1448 TSval=1580571 TSecr=901764818
    291 1514          2.245413    76.23.247.139         128.119.245.93        40058    TCP      40058 > commplex-link [ACK] Seq=264649 Ack=1 Win=5888 Len=1448 TSval=1580571 TSecr=901764818
    297 1514          2.255435    76.23.247.139         128.119.245.93        40058    TCP      40058 > commplex-link [ACK] Seq=266097 Ack=1 Win=5888 Len=1448 TSval=1580573 TSecr=901764829
    298 1514          2.255665    76.23.247.139         128.119.245.93        40058    TCP      40058 > commplex-link [ACK] Seq=267545 Ack=1 Win=5888 Len=1448 TSval=1580573 TSecr=901764829
    299 1514          2.258504    76.23.247.139         128.119.245.93        40058    TCP      40058 > commplex-link [ACK] Seq=268993 Ack=1 Win=5888 Len=1448 TSval=1580573 TSecr=901764829
    300 1514          2.258826    76.23.247.139         128.119.245.93        40058    TCP      40058 > commplex-link [ACK] Seq=270441 Ack=1 Win=5888 Len=1448 TSval=1580573 TSecr=901764829
    301 1514          2.259151    76.23.247.139         128.119.245.93        40058    TCP      40058 > commplex-link [ACK] Seq=271889 Ack=1 Win=5888 Len=1448 TSval=1580573 TSecr=901764830
    302 1514          2.259471    76.23.247.139         128.119.245.93        40058    TCP      40058 > commplex-link [ACK] Seq=273337 Ack=1 Win=5888 Len=1448 TSval=1580573 TSecr=901764830
    303 1514          2.259809    76.23.247.139         128.119.245.93        40058    TCP      40058 > commplex-link [ACK] Seq=274785 Ack=1 Win=5888 Len=1448 TSval=1580573 TSecr=901764831
    304 1514          2.260131    76.23.247.139         128.119.245.93        40058    TCP      40058 > commplex-link [ACK] Seq=276233 Ack=1 Win=5888 Len=1448 TSval=1580573 TSecr=901764831
    305 1514          2.260453    76.23.247.139         128.119.245.93        40058    TCP      40058 > commplex-link [ACK] Seq=277681 Ack=1 Win=5888 Len=1448 TSval=1580573 TSecr=901764831
    306 1514          2.260835    76.23.247.139         128.119.245.93        40058    TCP      40058 > commplex-link [ACK] Seq=279129 Ack=1 Win=5888 Len=1448 TSval=1580573 TSecr=901764831
    312 1514          2.273660    76.23.247.139         128.119.245.93        40058    TCP      40058 > commplex-link [ACK] Seq=280577 Ack=1 Win=5888 Len=1448 TSval=1580578 TSecr=901764846
    313 1514          2.273978    76.23.247.139         128.119.245.93        40058    TCP      40058 > commplex-link [ACK] Seq=282025 Ack=1 Win=5888 Len=1448 TSval=1580578 TSecr=901764846
    314 1514          2.274307    76.23.247.139         128.119.245.93        40058    TCP      40058 > commplex-link [ACK] Seq=283473 Ack=1 Win=5888 Len=1448 TSval=1580578 TSecr=901764847
    315 1514          2.274632    76.23.247.139         128.119.245.93        40058    TCP      40058 > commplex-link [ACK] Seq=284921 Ack=1 Win=5888 Len=1448 TSval=1580578 TSecr=901764847
    316 1514          2.274960    76.23.247.139         128.119.245.93        40058    TCP      40058 > commplex-link [ACK] Seq=286369 Ack=1 Win=5888 Len=1448 TSval=1580578 TSecr=901764847
    317 1514          2.275285    76.23.247.139         128.119.245.93        40058    TCP      40058 > commplex-link [ACK] Seq=287817 Ack=1 Win=5888 Len=1448 TSval=1580578 TSecr=901764847
    318 1514          2.275608    76.23.247.139         128.119.245.93        40058    TCP      40058 > commplex-link [ACK] Seq=289265 Ack=1 Win=5888 Len=1448 TSval=1580578 TSecr=901764848
    319 1514          2.276048    76.23.247.139         128.119.245.93        40058    TCP      40058 > commplex-link [ACK] Seq=290713 Ack=1 Win=5888 Len=1448 TSval=1580578 TSecr=901764848
    320 1514          2.276369    76.23.247.139         128.119.245.93        40058    TCP      40058 > commplex-link [ACK] Seq=292161 Ack=1 Win=5888 Len=1448 TSval=1580578 TSecr=901764848
    321 1514          2.276713    76.23.247.139         128.119.245.93        40058    TCP      40058 > commplex-link [PSH, ACK] Seq=293609 Ack=1 Win=5888 Len=1448 TSval=1580578 TSecr=901764848
    324 1514          2.282255    76.23.247.139         128.119.245.93        40058    TCP      40058 > commplex-link [ACK] Seq=295057 Ack=1 Win=5888 Len=1448 TSval=1580580 TSecr=901764857
    325 1514          2.282906    76.23.247.139         128.119.245.93        40058    TCP      40058 > commplex-link [ACK] Seq=296505 Ack=1 Win=5888 Len=1448 TSval=1580580 TSecr=901764857
